order_id,customer_id,customer_name,product_id,product_name,category,order_date,quantity,unit_price,total_price,payment_method,country,city,status,update_time
1.0,1921,Lucía Fernández,25,MacBook Pro,Tecnología,07-13-2023,5.0,755.33,3776.65,Tarjeta,IT,Valencia,Cancelado,2023-07-13 21:00:00
2.0,1940,Juan Pérez,186,Samsung Galaxy,Tecnología,2024-03-25,1.0,1901.92,1901.92,Transferencia,DE,Madrid,Pendiente,2024-03-25 07:00:00
3.0,1593,Ana Sánchez,7,iPhone 13,Tecnología,07/09/2023,2.0,1466.67,2933.34,Bizum,spain,Barcelona,Entregado,2023-09-07 13:00:00
4.0,1765,María García,86,Aspiradora Dyson,Hogar,08-02-2024,3.0,1201.33,3603.99,Tarjeta,France,Paris,Entregado,2024-08-02 02:00:00
5.0,1724,DAVID GÓMEZ,20,Bolso Gucci,Moda,03/10/2023,1.0,320.48,320.48,Transferencia,FR,Lyon,Entregado,2023-10-03 19:00:00
6.0,1856,Lucía Fernández,63,iPhone 13,tecnologia,10-08-2024,5.0,320.43,1602.15,Tarjeta,IT,Paris,Pendiente,2024-10-08 20:00:00
7.0,1710,Carlos Ruiz,32,iPhone 13,Tecnología,2024-03-10,1.0,125.59,125.59,Bizum,ES,Milán,Entregado,2024-03-10 23:00:00
8.0,1477,Juan Pérez,21,Reloj Casio,Accesorios,03/02/2023,3.0,"1733,69",,Bizum,spain,Lyon,Entregado,2023-02-03 15:00:00
9.0,1185,Carlos Ruiz,71,Reloj Casio,Accesorios,08-27-2024,4.0,"1206,22",,Transferencia,España,Hamburgo,Pendiente,2024-08-27 15:00:00
10.0,1547,Laura Torres,94,MacBook Pro,Tecnología,2024-10-05,5.0,1419.06,7095.3,Bizum,DE,Berlín,Cancelado,2024-10-05 15:00:00
11.0,1742,David Gómez,185,Camiseta Adidas,Moda,27/04/2024,3.0,50.96,152.88,PayPal,España,Barcelona,Pendiente,2024-04-27 05:00:00
12.0,1028,Pedro López,31,Bolso Gucci,HOGAR,05-17-2024,2.0,1940.12,3880.24,Tarjeta,Germany,Hamburgo,Pendiente,2024-05-17 15:00:00
13.0,1713,María García,161,Sony Headphones,Tecnología,10-11-2023,3.0,1666.56,4999.68,Transferencia,FR,Valencia,Pendiente,2023-10-11 15:00:00
14.0,1520,LUCÍA FERNÁNDEZ,84,Bolso Gucci,Moda,04-04-2024,2.0,432.55,993.8085256044186,PayPal,spain,Barcelona,Cancelado,2024-04-04 12:00:00
15.0,1099,María García,152,Teclado Logitech,Tecnología,01-02-2024,1.0,371.83,371.83,Tarjeta,ES,Barcelona,Cancelado,2024-01-02 06:00:00
16.0,1471,Laura Torres,108,iPhone 13,Tecnología,01-18-2024,1.0,374.97,374.97,PayPal,FR,Valencia,Entregado,2024-01-18 09:00:00
17.0,1767,María García,189,Camiseta Adidas,Moda,20/11/2024,5.0,615.44,3077.2,PayPal,DE,Lyon,Entregado,2024-11-20 02:00:00
18.0,1285,Pedro López,102,Sony Headphones,Tecnología,27/03/2024,5.0,"1054,27",,Bizum,España,Paris,Cancelado,2024-03-27 09:00:00
19.0,1748,Laura Torres,3,Camiseta Adidas,Moda,2023-12-16,3.0,869.57,2658.330734007271,Transferencia,España,Paris,Entregado,2023-12-16 03:00:00
20.0,1391,David Gómez,131,Aspiradora Dyson,hogar,2024-04-22,3.0,589.55,1768.65,Bizum,spain,Paris,Pendiente,2024-04-22 19:00:00
21.0,1390,JUAN PÉREZ,151,Teclado Logitech,Tecnología,14/09/2024,5.0,1227.59,6137.95,Transferencia,Italy,Paris,Entregado,2024-09-14 04:00:00
22.0,1137,maría garcía,61,Sony Headphones,Tecnología,14/04/2024,1.0,287.59,287.59,PayPal,Germany,Barcelona,Pendiente,2024-04-14 15:00:00
23.0,1960,Ana Sánchez,191,Aspiradora Dyson,Hogar,10-19-2024,1.0,"591,37",,Transferencia,DE,Paris,Entregado,2024-10-19 14:00:00
24.0,1769,David Gómez,101,Aspiradora Dyson,Hogar,2023-01-18,1.0,739.06,739.06,PayPal,Italy,Valencia,Cancelado,2023-01-18 07:00:00
25.0,1769,LAURA TORRES,163,Mochila North Face,Accesorios,2023-02-17,4.0,917.58,3171.6017183170643,Transferencia,DE,Barcelona,Pendiente,2023-02-17 21:00:00
,1501,carlos ruiz,29,Samsung Galaxy,Tecnología,03-01-2023,3.0,1572.5,5414.904940126815,Bizum,ES,Lyon,Entregado,2023-03-01 13:00:00
27.0,1234,JUAN PÉREZ,145,Samsung Galaxy,Tecnología,08-29-2023,5.0,407.35,2036.75,Bizum,France,Lyon,Pendiente,2023-08-29 10:00:00
28.0,1454,Ana Sánchez,34,AirPods,Tecnología,25/06/2024,4.0,1033.33,3346.0820880296687,Tarjeta,Germany,Barcelona,Cancelado,2024-06-25 08:00:00
29.0,1231,JUAN PÉREZ,184,Silla Gaming,Hogar,04-28-2024,4.0,1188.9,4755.6,Transferencia,España,Berlín,Cancelado,2024-04-28 07:00:00
30.0,1763,Ana Sánchez,63,Silla Gaming,Hogar,2024-04-25,1.0,102.44,102.44,PayPal,ES,Lyon,Entregado,2024-04-25 10:00:00
31.0,1676,Juan Pérez,149,Aspiradora Dyson,Hogar,29/07/2023,2.0,1219.01,2438.02,Bizum,IT,Milán,Pendiente,2023-07-29 20:00:00
32.0,1527,PEDRO LÓPEZ,13,Sony Headphones,Tecnología,01/10/2024,3.0,349.34,1048.02,PayPal,España,Berlín,Pendiente,2024-10-01 06:00:00
33.0,1265,David Gómez,186,Reloj Casio,Accesorios,2024-11-25,2.0,139.45,278.9,PayPal,IT,Lyon,Entregado,2024-11-25 00:00:00
34.0,1856,LAURA TORRES,195,iPhone 13,Tecnología,2023-07-06,2.0,1898.28,3796.56,Transferencia,France,Hamburgo,Cancelado,2023-07-06 10:00:00
35.0,1192,David Gómez,149,Mochila North Face,Accesorios,08-03-2023,3.0,1931.61,5794.83,Transferencia,FR,Lyon,Entregado,2023-08-03 01:00:00
36.0,1117,Juan Pérez,19,Monitor LG,Tecnología,19/07/2024,3.0,1618.71,4693.35148356895,Transferencia,FR,Paris,Cancelado,2024-07-19 23:00:00
37.0,1700,María García,182,Camiseta Adidas,Moda,10-02-2024,5.0,616.18,3080.9,Transferencia,spain,Valencia,Pendiente,2024-10-02 04:00:00
38.0,1755,laura torres,156,Camiseta Adidas,Moda,2024-02-24,2.0,204.37,408.74,Bizum,FR,Roma,Pendiente,2024-02-24 07:00:00
39.0,1621,Ana Sánchez,138,Cafetera Philips,Hogar,05-07-2024,5.0,1371.62,6858.1,Bizum,FR,Roma,Cancelado,2024-05-07 10:00:00
40.0,1415,David Gómez,192,Monitor LG,Tecnología,26/03/2024,1.0,885.9,885.9,Bizum,spain,Milán,Pendiente,2024-03-26 06:00:00
41.0,1260,María García,81,AirPods,Tecnología,23/05/2024,4.0,252.86,1011.44,Transferencia,ES,Berlín,Pendiente,2024-05-23 22:00:00
42.0,1932,Laura Torres,4,Bolso Gucci,Moda,02-18-2024,4.0,995.4,3981.6,Bizum,IT,Paris,Pendiente,2024-02-18 17:00:00
43.0,1728,Lucía Fernández,186,Monitor LG,Tecnología,03-17-2023,2.0,78.43,156.86,Bizum,IT,Hamburgo,Pendiente,2023-03-17 12:00:00
44.0,1964,Carlos Ruiz,153,Cafetera Philips,Hogar,2023-10-30,3.0,1819.55,5458.65,Transferencia,FR,Paris,Cancelado,2023-10-30 07:00:00
45.0,1019,David Gómez,42,Aspiradora Dyson,Hogar,2023-09-01,4.0,"524,97",,Transferencia,Italy,Valencia,Cancelado,2023-09-01 11:00:00
46.0,1074,JUAN PÉREZ,160,Cafetera Philips,Hogar,06-23-2023,4.0,1328.42,5313.68,PayPal,España,Valencia,Cancelado,2023-06-23 19:00:00
47.0,1089,Pedro López,181,Mochila North Face,Accesorios,02/10/2023,5.0,630.31,3151.55,Tarjeta,France,Lyon,Cancelado,2023-10-02 13:00:00
48.0,1786,Ana Sánchez,15,Teclado Logitech,Tecnología,09-19-2024,5.0,1044.94,5224.7,Bizum,Italy,Barcelona,Pendiente,2024-09-19 11:00:00
49.0,1232,Pedro López,193,Mochila North Face,Accesorios,2024-04-24,4.0,1097.95,4391.8,Tarjeta,France,Hamburgo,Pendiente,2024-04-24 17:00:00
50.0,1340,maría garcía,20,Zapatillas Nike,TECHNOLOGY,02-27-2023,3.0,377.86,1133.58,Tarjeta,IT,Berlín,Cancelado,2023-02-27 07:00:00
51.0,1095,María García,91,Monitor LG,Tecnología,03-25-2024,2.0,1939.47,3878.94,Tarjeta,France,Berlín,Pendiente,2024-03-25 00:00:00
52.0,1753,Lucía Fernández,185,Reloj Casio,Accesorios,12-13-2023,1.0,1552.51,1552.51,Bizum,Italy,Berlín,Pendiente,2023-12-13 14:00:00
53.0,1220,Laura Torres,69,AirPods,Tecnología,10-19-2023,2.0,1879.6,3759.2,Bizum,Germany,Valencia,Pendiente,2023-10-19 07:00:00
54.0,1646,Carlos Ruiz,103,Reloj Casio,Accesorios,2023-03-04,3.0,$1790.71,,Tarjeta,Germany,Barcelona,Cancelado,2023-03-04 08:00:00
55.0,1098,JUAN PÉREZ,61,Monitor LG,Tecnología,10-09-2023,3.0,1199.82,3599.46,Tarjeta,Italy,Milán,Pendiente,2023-10-09 00:00:00
56.0,1912,Pedro López,28,Zapatillas Nike,Moda,10/05/2024,1.0,1844.53,1752.8911277707257,Bizum,IT,Barcelona,Entregado,2024-05-10 18:00:00
57.0,1049,David Gómez,138,Samsung Galaxy,Moda,2024-09-15,1.0,186.1,186.1,Tarjeta,IT,Valencia,Pendiente,2024-09-15 14:00:00
58.0,1519,David Gómez,138,Bolso Gucci,Moda,2024-09-03,1.0,400.01,400.01,PayPal,spain,Lyon,Entregado,2024-09-03 03:00:00
59.0,1230,Pedro López,132,Cafetera Philips,hogar,2024-11-26,4.0,100.0,400.0,Bizum,DE,Berlín,Pendiente,2024-11-26 17:00:00
60.0,1666,David Gómez,111,Mochila North Face,Accesorios,09/08/2024,5.0,657.41,3287.05,Bizum,FR,Barcelona,Entregado,2024-08-09 00:00:00
61.0,1261,David Gómez,196,Reloj Casio,Accesorios,12-02-2023,1.0,783.47,783.47,Transferencia,DE,Paris,Cancelado,2023-12-02 15:00:00
62.0,1687,Ana Sánchez,99,Aspiradora Dyson,Hogar,12/07/2023,3.0,549.98,1649.94,Tarjeta,IT,Berlín,Entregado,2023-07-12 00:00:00
63.0,1633,LAURA TORRES,97,Teclado Logitech,Tecnología,06/12/2023,5.0,1659.19,8295.95,Transferencia,FR,Lyon,Cancelado,2023-12-06 04:00:00
64.0,1549,David Gómez,28,Reloj Casio,Accesorios,17/04/2023,2.0,719.94,1439.88,Transferencia,FR,Valencia,Pendiente,2023-04-17 08:00:00
65.0,1161,david gómez,134,MacBook Pro,Tecnología,03-22-2024,3.0,569.06,1707.18,Tarjeta,España,Lyon,Cancelado,2024-03-22 11:00:00
66.0,1886,David Gómez,44,AirPods,Tecnología,2024-09-12,5.0,1089.97,5449.85,Bizum,IT,Roma,Cancelado,2024-09-12 20:00:00
67.0,1223,Juan Pérez,169,Cafetera Philips,Hogar,08-06-2023,5.0,290.44,1452.2,Bizum,Italy,Roma,Entregado,2023-08-06 01:00:00
68.0,1026,Laura Torres,15,Zapatillas Nike,Moda,12/06/2023,3.0,1606.37,5435.530925050643,Bizum,spain,Valencia,Entregado,2023-06-12 09:00:00
69.0,1251,María García,38,Monitor LG,Tecnología,12/11/2023,1.0,"158,36",,Tarjeta,Germany,Berlín,Cancelado,2023-11-12 21:00:00
70.0,1388,Pedro López,178,Aspiradora Dyson,Hogar,04/05/2024,4.0,1973.91,7895.64,Transferencia,spain,Milán,Cancelado,2024-05-04 23:00:00
71.0,1746,laura torres,193,Samsung Galaxy,Tecnología,01-08-2023,2.0,1546.77,3093.54,Bizum,España,Hamburgo,Pendiente,2023-01-08 16:00:00
72.0,1063,Carlos Ruiz,171,Cafetera Philips,Hogar,2024-04-15,1.0,405.44,405.44,Transferencia,Italy,Valencia,Cancelado,2024-04-15 00:00:00
73.0,1386,Ana Sánchez,41,AirPods,Tecnología,04-22-2023,3.0,20.99,62.97,Tarjeta,FR,Barcelona,Entregado,2023-04-22 18:00:00
74.0,1248,Laura Torres,189,Monitor LG,Tecnología,2024-07-26,2.0,"1632,77",,Transferencia,España,Madrid,Pendiente,2024-07-26 04:00:00
75.0,1546,pedro lópez,153,Sony Headphones,tecnologia,04-06-2023,3.0,1416.65,4249.95,Transferencia,Germany,Barcelona,Pendiente,2023-04-06 21:00:00
76.0,1295,Carlos Ruiz,167,Monitor LG,Tecnología,2024-05-15,5.0,1460.72,6380.977911317641,Bizum,France,Valencia,Pendiente,2024-05-15 21:00:00
77.0,1285,Carlos Ruiz,55,AirPods,Tecnología,01-16-2024,4.0,1544.83,6179.32,Tarjeta,DE,Madrid,Entregado,2024-01-16 17:00:00
78.0,1379,David Gómez,173,Samsung Galaxy,Tecnología,09-06-2023,2.0,157.35,312.65615884537493,Bizum,ES,Barcelona,Pendiente,2023-09-06 19:00:00
79.0,1565,María García,131,Mochila North Face,Accesorios,08-17-2024,4.0,$723.35,,Bizum,DE,Hamburgo,Cancelado,2024-08-17 08:00:00
80.0,1548,Lucía Fernández,94,Mochila North Face,TECHNOLOGY,05/08/2024,5.0,240.58,1202.9,Tarjeta,IT,Hamburgo,Entregado,2024-08-05 18:00:00
81.0,1950,María García,33,Aspiradora Dyson,Hogar,02/02/2024,4.0,$1727.58,,Transferencia,France,Hamburgo,Entregado,2024-02-02 15:00:00
82.0,1250,Lucía Fernández,22,AirPods,Tecnología,12-18-2023,2.0,1250.36,2500.72,Transferencia,España,Barcelona,Entregado,2023-12-18 14:00:00
83.0,1625,Lucía Fernández,66,iPhone 13,Tecnología,21/04/2024,5.0,668.49,3342.45,Bizum,Germany,Hamburgo,Pendiente,2024-04-21 08:00:00
84.0,1923,MARÍA GARCÍA,186,Cafetera Philips,Hogar,01/12/2023,5.0,136.48,682.4,Bizum,ES,Paris,Cancelado,2023-12-01 03:00:00
85.0,1281,Laura Torres,140,Reloj Casio,Accesorios,04-05-2023,3.0,628.85,1886.55,Transferencia,DE,Madrid,Pendiente,2023-04-05 07:00:00
86.0,1125,Juan Pérez,75,Samsung Galaxy,Tecnología,2023-09-27,5.0,657.11,2727.096001673349,PayPal,Germany,Roma,Entregado,2023-09-27 05:00:00
87.0,1732,LAURA TORRES,72,Sony Headphones,Tecnología,26/04/2023,2.0,1461.92,2923.84,Transferencia,DE,Barcelona,Cancelado,2023-04-26 21:00:00
88.0,1916,David Gómez,25,Silla Gaming,Hogar,2023-06-24,3.0,1278.74,3836.22,Bizum,spain,Paris,Pendiente,2023-06-24 18:00:00
89.0,1102,juan pérez,181,Cafetera Philips,Hogar,24/03/2023,1.0,1775.55,1636.6520370590115,PayPal,France,Hamburgo,Pendiente,2023-03-24 21:00:00
90.0,1415,DAVID GÓMEZ,141,Zapatillas Nike,Moda,08/10/2024,2.0,949.71,1899.42,Bizum,ES,Valencia,Cancelado,2024-10-08 09:00:00
91.0,1795,María García,196,Silla Gaming,Hogar,2023-10-23,3.0,247.99,743.97,Transferencia,spain,Hamburgo,Entregado,2023-10-23 17:00:00
92.0,1579,Laura Torres,54,Mochila North Face,Accesorios,04-16-2024,5.0,1429.36,7146.8,Transferencia,Italy,Berlín,Entregado,2024-04-16 15:00:00
93.0,1221,Ana Sánchez,15,Reloj Casio,Accesorios,24/12/2023,4.0,1523.96,6095.84,Bizum,DE,Hamburgo,Entregado,2023-12-24 12:00:00
94.0,1396,david gómez,168,Monitor LG,Tecnología,05/02/2024,4.0,1126.94,4507.76,PayPal,France,Barcelona,Pendiente,2024-02-05 17:00:00
95.0,1590,María García,19,Monitor LG,Tecnología,16/07/2023,3.0,1544.22,4632.66,Transferencia,spain,Roma,Cancelado,2023-07-16 05:00:00
96.0,1906,David Gómez,14,Zapatillas Nike,Moda,06/01/2023,5.0,992.65,4963.25,Bizum,Germany,Hamburgo,Pendiente,2023-01-06 12:00:00
97.0,1405,maría garcía,113,Aspiradora Dyson,Hogar,08-14-2024,3.0,1050.24,2773.304679438566,PayPal,Italy,Berlín,Entregado,2024-08-14 23:00:00
98.0,1538,Laura Torres,72,Reloj Casio,Accesorios,10-04-2023,2.0,860.81,1721.62,Tarjeta,IT,Milán,Pendiente,2023-10-04 18:00:00
99.0,1145,Laura Torres,184,Zapatillas Nike,Moda,12/01/2024,4.0,60.58,242.32,Transferencia,España,Madrid,Pendiente,2024-01-12 11:00:00
100.0,1735,David Gómez,28,Monitor LG,Tecnología,2024-07-01,4.0,"224,7",,Bizum,FR,Roma,Cancelado,2024-07-01 17:00:00
,1330,Laura Torres,35,Reloj Casio,Accesorios,2024-05-17,1.0,$72.54,,Bizum,IT,Madrid,Cancelado,2024-05-17 21:00:00
102.0,1417,Lucía Fernández,132,Aspiradora Dyson,Hogar,04-14-2024,1.0,1276.46,1276.46,Bizum,IT,Paris,Entregado,2024-04-14 23:00:00
103.0,1752,Juan Pérez,35,Bolso Gucci,Moda,07-10-2023,3.0,635.57,1906.71,PayPal,IT,Milán,Entregado,2023-07-10 17:00:00
104.0,1495,Carlos Ruiz,144,Cafetera Philips,Hogar,2024-02-21,1.0,1022.06,1022.06,Bizum,IT,Hamburgo,Pendiente,2024-02-21 22:00:00
105.0,1575,María García,118,Mochila North Face,Accesorios,24/04/2024,4.0,1816.06,7264.24,Bizum,DE,Lyon,Cancelado,2024-04-24 21:00:00
106.0,1141,Laura Torres,79,Reloj Casio,Accesorios,03/02/2023,3.0,506.09,1518.27,Transferencia,France,Hamburgo,Pendiente,2023-02-03 06:00:00
107.0,1218,LAURA TORRES,57,Camiseta Adidas,Moda,2024-03-23,1.0,826.66,826.66,Tarjeta,spain,Lyon,Entregado,2024-03-23 21:00:00
108.0,1605,David Gómez,40,Mochila North Face,Accesorios,31/07/2024,2.0,1513.55,3027.1,Transferencia,ES,Barcelona,Pendiente,2024-07-31 07:00:00
109.0,1801,lucía fernández,188,Sony Headphones,Tecnología,2024-07-28,2.0,465.31,930.62,PayPal,spain,Barcelona,Pendiente,2024-07-28 23:00:00
110.0,1450,David Gómez,58,Bolso Gucci,Moda,2023-07-29,2.0,163.19,326.38,Transferencia,Germany,Berlín,Cancelado,2023-07-29 06:00:00
111.0,1410,David Gómez,79,AirPods,Tecnología,2023-09-29,3.0,586.61,1759.83,Bizum,France,Hamburgo,Pendiente,2023-09-29 16:00:00
112.0,1483,Carlos Ruiz,143,Teclado Logitech,Tecnología,05-01-2024,3.0,330.83,992.49,PayPal,spain,Milán,Cancelado,2024-05-01 20:00:00
113.0,1772,Pedro López,118,AirPods,Tecnología,04-26-2023,4.0,1860.1,7440.4,PayPal,FR,Roma,Pendiente,2023-04-26 17:00:00
114.0,1037,Lucía Fernández,146,AirPods,Tecnología,12-03-2023,5.0,1618.16,8090.8,Tarjeta,FR,Lyon,Cancelado,2023-12-03 11:00:00
115.0,1237,Pedro López,33,AirPods,Tecnología,05/11/2023,1.0,1270.47,1270.47,Transferencia,España,Hamburgo,Entregado,2023-11-05 15:00:00
,1169,Pedro López,178,MacBook Pro,Tecnología,05-29-2023,3.0,1744.21,5232.63,Transferencia,IT,Barcelona,Cancelado,2023-05-29 22:00:00
117.0,1817,María García,97,Sony Headphones,Tecnología,04/03/2023,1.0,1609.31,1609.31,Transferencia,FR,Milán,Cancelado,2023-03-04 09:00:00
118.0,1277,LAURA TORRES,156,Mochila North Face,Accesorios,06-21-2023,4.0,381.27,1525.08,Tarjeta,FR,Barcelona,Cancelado,2023-06-21 09:00:00
119.0,1801,David Gómez,55,Monitor LG,Tecnología,2023-08-18,4.0,1786.19,7752.857927462209,Tarjeta,FR,Berlín,Pendiente,2023-08-18 06:00:00
120.0,1294,Lucía Fernández,81,Teclado Logitech,Moda,07/03/2023,4.0,1083.29,4732.621973109033,Bizum,Germany,Barcelona,Pendiente,2023-03-07 04:00:00
121.0,1371,David Gómez,21,Cafetera Philips,Hogar,26/02/2024,1.0,1616.81,1616.81,Tarjeta,France,Berlín,Entregado,2024-02-26 02:00:00
122.0,1377,ana sánchez,61,Monitor LG,Tecnología,2023-03-04,4.0,$1793.22,,Transferencia,Italy,Paris,Cancelado,2023-03-04 08:00:00
123.0,1987,David Gómez,188,Reloj Casio,moda,04-15-2023,2.0,$642.83,,Tarjeta,France,Hamburgo,Cancelado,2023-04-15 09:00:00
124.0,1164,CARLOS RUIZ,69,Cafetera Philips,Hogar,2023-09-02,2.0,229.0,458.0,PayPal,FR,Hamburgo,Pendiente,2023-09-02 19:00:00
125.0,1092,Pedro López,137,Sony Headphones,TECHNOLOGY,06-03-2024,3.0,463.59,1390.77,Tarjeta,FR,Berlín,Cancelado,2024-06-03 04:00:00
126.0,1312,María García,127,Teclado Logitech,Tecnología,08-02-2023,5.0,859.94,4299.7,Bizum,Germany,Paris,Pendiente,2023-08-02 11:00:00
127.0,1317,Carlos Ruiz,114,Bolso Gucci,Moda,2024-05-19,1.0,1637.85,1637.85,Bizum,España,Milán,Cancelado,2024-05-19 02:00:00
128.0,1267,María García,17,Samsung Galaxy,Tecnología,02-21-2024,2.0,1722.85,3377.1904769247885,Bizum,IT,Hamburgo,Entregado,2024-02-21 03:00:00
129.0,1212,Juan Pérez,145,Zapatillas Nike,Moda,2024-02-27,1.0,23.83,23.83,Transferencia,IT,Milán,Pendiente,2024-02-27 15:00:00
130.0,1135,Laura Torres,187,iPhone 13,Tecnología,2023-07-19,4.0,1026.39,4105.56,Transferencia,ES,Hamburgo,Pendiente,2023-07-19 08:00:00
131.0,1850,David Gómez,172,Monitor LG,tech,03-02-2024,3.0,"840,65",,Tarjeta,spain,Barcelona,Cancelado,2024-03-02 23:00:00
132.0,1626,Carlos Ruiz,56,Silla Gaming,Hogar,2023-06-22,4.0,451.99,1807.96,Tarjeta,Italy,Barcelona,Entregado,2023-06-22 07:00:00
133.0,1152,Lucía Fernández,69,Samsung Galaxy,Tecnología,25/07/2023,4.0,248.53,994.12,Bizum,España,Paris,Pendiente,2023-07-25 06:00:00
134.0,1561,Laura Torres,63,Bolso Gucci,Moda,02/07/2023,3.0,681.85,2045.55,Bizum,spain,Madrid,Cancelado,2023-07-02 01:00:00
135.0,1599,Pedro López,38,AirPods,Tecnología,01-28-2024,3.0,1886.39,5659.17,Bizum,ES,Barcelona,Cancelado,2024-01-28 21:00:00
136.0,1267,María García,133,Mochila North Face,Accesorios,2024-02-07,2.0,$653.17,,Tarjeta,DE,Madrid,Pendiente,2024-02-07 02:00:00
137.0,1987,Juan Pérez,101,Sony Headphones,Tecnología,2024-09-11,4.0,"1042,39",,Bizum,spain,Lyon,Pendiente,2024-09-11 04:00:00
138.0,1061,David Gómez,70,Camiseta Adidas,Moda,02-15-2023,1.0,1409.01,1409.01,PayPal,Germany,Madrid,Entregado,2023-02-15 02:00:00
139.0,1976,Carlos Ruiz,119,Sony Headphones,Tecnología,05-17-2023,4.0,733.62,2934.48,Tarjeta,France,Madrid,Cancelado,2023-05-17 16:00:00
140.0,1787,Pedro López,71,Mochila North Face,Accesorios,2024-02-05,1.0,1943.85,1943.85,Transferencia,France,Barcelona,Entregado,2024-02-05 18:00:00
141.0,1568,Juan Pérez,175,Teclado Logitech,TECHNOLOGY,02-27-2023,4.0,1925.27,7701.08,Bizum,Italy,Barcelona,Cancelado,2023-02-27 10:00:00
142.0,1955,David Gómez,170,Sony Headphones,TECHNOLOGY,05-28-2023,4.0,511.05,2044.2,Bizum,ES,Madrid,Cancelado,2023-05-28 21:00:00
143.0,1231,Juan Pérez,133,MacBook Pro,Tecnología,16/12/2023,2.0,999.52,1999.04,Transferencia,Italy,Milán,Pendiente,2023-12-16 22:00:00
144.0,1995,Carlos Ruiz,141,Monitor LG,Tecnología,23/06/2023,1.0,608.75,608.75,Bizum,France,Madrid,Pendiente,2023-06-23 21:00:00
145.0,1119,Laura Torres,10,Bolso Gucci,Moda,14/01/2023,2.0,576.83,1153.66,Transferencia,IT,Paris,Entregado,2023-01-14 01:00:00
146.0,1309,lucía fernández,97,Camiseta Adidas,Moda,11-03-2023,2.0,83.41,166.82,PayPal,Germany,Berlín,Cancelado,2023-11-03 22:00:00
147.0,1605,Pedro López,129,Cafetera Philips,Hogar,06-04-2023,1.0,1223.03,1088.1425882625786,PayPal,ES,Lyon,Pendiente,2023-06-04 19:00:00
148.0,1071,Ana Sánchez,148,Samsung Galaxy,Tecnología,2024-08-01,2.0,1010.33,2020.66,Transferencia,France,Paris,Entregado,2024-08-01 10:00:00
149.0,1962,Ana Sánchez,22,Monitor LG,tecnologia,16/11/2024,1.0,$112.44,,Bizum,Italy,Hamburgo,Pendiente,2024-11-16 23:00:00
150.0,1898,Lucía Fernández,68,Sony Headphones,Tecnología,2024-11-21,1.0,564.51,560.1675481523106,Transferencia,DE,Roma,Pendiente,2024-11-21 21:00:00
151.0,1769,David Gómez,67,Zapatillas Nike,Moda,05/10/2023,5.0,1817.45,9087.25,Transferencia,IT,Hamburgo,Entregado,2023-10-05 10:00:00
152.0,1982,Ana Sánchez,169,Sony Headphones,Tecnología,08-29-2024,1.0,486.73,486.73,PayPal,FR,Hamburgo,Pendiente,2024-08-29 07:00:00
153.0,1744,Lucía Fernández,101,MacBook Pro,Tecnología,2024-08-08,1.0,298.34,298.34,PayPal,DE,Madrid,Pendiente,2024-08-08 10:00:00
154.0,1613,Pedro López,22,MacBook Pro,Tecnología,11-22-2023,3.0,"984,01",,Tarjeta,IT,Lyon,Cancelado,2023-11-22 16:00:00
155.0,1701,carlos ruiz,163,Teclado Logitech,Tecnología,01-28-2024,2.0,1971.44,3942.88,Bizum,ES,Lyon,Entregado,2024-01-28 21:00:00
156.0,1642,Ana Sánchez,4,iPhone 13,Tecnología,2023-12-22,5.0,491.69,2458.45,PayPal,FR,Lyon,Entregado,2023-12-22 02:00:00
157.0,1559,Pedro López,176,Zapatillas Nike,Moda,07-17-2024,,1347.55,,Tarjeta,Italy,Hamburgo,Entregado,2024-07-17 06:00:00
158.0,1968,Juan Pérez,169,AirPods,Tecnología,01-26-2023,3.0,1525.62,4228.607599507798,PayPal,Italy,Roma,Pendiente,2023-01-26 09:00:00
159.0,1692,Laura Torres,18,Aspiradora Dyson,Hogar,06/01/2024,3.0,482.9,1448.7,Transferencia,ES,Valencia,Entregado,2024-01-06 06:00:00
160.0,1380,Lucía Fernández,137,Bolso Gucci,Moda,07/05/2023,5.0,1459.15,7295.75,Transferencia,DE,Madrid,Pendiente,2023-05-07 04:00:00
161.0,1921,Laura Torres,77,MacBook Pro,Tecnología,2023-06-13,2.0,$741.89,,Tarjeta,FR,Lyon,Entregado,2023-06-13 22:00:00
162.0,1006,María García,125,Aspiradora Dyson,Hogar,09-01-2023,3.0,1268.29,3804.87,Bizum,Italy,Lyon,Entregado,2023-09-01 22:00:00
163.0,1215,Juan Pérez,91,Camiseta Adidas,Moda,2024-08-23,5.0,1270.72,6353.6,Transferencia,FR,Milán,Cancelado,2024-08-23 23:00:00
164.0,1832,Laura Torres,124,Cafetera Philips,Hogar,2024-11-15,5.0,1076.19,5380.95,Transferencia,Italy,Roma,Entregado,2024-11-15 22:00:00
165.0,1214,Juan Pérez,156,Cafetera Philips,Hogar,05/04/2023,1.0,189.68,189.68,Bizum,Germany,Paris,Entregado,2023-04-05 22:00:00
166.0,1762,Pedro López,173,Monitor LG,Tecnología,28/08/2023,3.0,1672.25,5016.75,PayPal,Germany,Paris,Entregado,2023-08-28 00:00:00
167.0,1127,LAURA TORRES,32,Bolso Gucci,Moda,02-12-2024,4.0,648.35,2137.509835388132,Tarjeta,IT,Paris,Pendiente,2024-02-12 17:00:00
168.0,1514,Lucía Fernández,113,Aspiradora Dyson,Hogar,2023-09-01,3.0,381.17,1143.51,PayPal,spain,Paris,Pendiente,2023-09-01 16:00:00
169.0,1710,Lucía Fernández,84,Reloj Casio,Accesorios,07-19-2024,4.0,91.14,417.06855223247044,PayPal,France,Madrid,Cancelado,2024-07-19 07:00:00
170.0,1505,Carlos Ruiz,12,Aspiradora Dyson,Hogar,2023-05-12,1.0,1185.88,1087.789995799769,PayPal,France,Valencia,Cancelado,2023-05-12 09:00:00
171.0,1176,Laura Torres,150,Mochila North Face,Accesorios,08/12/2023,3.0,1358.35,4075.05,PayPal,Germany,Berlín,Pendiente,2023-12-08 05:00:00
172.0,1921,Ana Sánchez,167,AirPods,Tecnología,14/11/2024,3.0,43.01,129.03,PayPal,IT,Barcelona,Cancelado,2024-11-14 17:00:00
173.0,1562,LAURA TORRES,122,AirPods,Tecnología,2024-02-05,5.0,"1029,07",,Bizum,España,Barcelona,Cancelado,2024-02-05 23:00:00
174.0,1524,Juan Pérez,167,Camiseta Adidas,Moda,19/01/2024,3.0,$460.73,,PayPal,DE,Milán,Pendiente,2024-01-19 02:00:00
175.0,1831,LUCÍA FERNÁNDEZ,96,MacBook Pro,Tecnología,12-29-2023,5.0,1293.89,6469.45,PayPal,Germany,Valencia,Entregado,2023-12-29 00:00:00
176.0,1627,Pedro López,44,Monitor LG,Tecnología,13/09/2023,2.0,356.99,713.98,Tarjeta,España,Hamburgo,Pendiente,2023-09-13 01:00:00
177.0,1180,Carlos Ruiz,86,Aspiradora Dyson,Hogar,28/12/2023,5.0,1384.97,6924.85,Transferencia,Germany,Paris,Cancelado,2023-12-28 08:00:00
178.0,1135,Pedro López,11,Samsung Galaxy,tecnologia,2024-03-24,3.0,779.6,2338.8,Bizum,Germany,Roma,Cancelado,2024-03-24 12:00:00
179.0,1063,Laura Torres,110,MacBook Pro,Tecnología,2024-05-22,4.0,1874.09,7496.36,Tarjeta,Germany,Valencia,Pendiente,2024-05-22 11:00:00
180.0,1334,Laura Torres,166,Zapatillas Nike,Moda,09-13-2023,5.0,283.67,1418.35,Tarjeta,DE,Hamburgo,Cancelado,2023-09-13 15:00:00
181.0,1942,Lucía Fernández,175,Samsung Galaxy,Tecnología,02/04/2023,4.0,688.72,2754.88,PayPal,Italy,Paris,Entregado,2023-04-02 01:00:00
182.0,1665,LAURA TORRES,185,Samsung Galaxy,Tecnología,01/01/2023,4.0,235.81,943.24,PayPal,IT,Barcelona,Pendiente,2023-01-01 17:00:00
183.0,1301,Juan Pérez,142,AirPods,Tecnología,2024-11-05,4.0,1850.14,7400.56,Transferencia,DE,Lyon,Cancelado,2024-11-05 20:00:00
184.0,1527,juan pérez,112,Monitor LG,Tecnología,06-22-2023,5.0,1755.91,8779.55,Bizum,IT,Valencia,Pendiente,2023-06-22 19:00:00
185.0,1431,María García,2,Teclado Logitech,Tecnología,16/09/2023,5.0,523.3,2616.5,Tarjeta,Italy,Paris,Pendiente,2023-09-16 00:00:00
186.0,1845,LUCÍA FERNÁNDEZ,113,Sony Headphones,Tecnología,2023-01-25,3.0,1323.37,3970.11,PayPal,DE,Roma,Entregado,2023-01-25 03:00:00
187.0,1595,Ana Sánchez,14,Camiseta Adidas,Moda,2024-05-20,2.0,1636.27,3272.54,Transferencia,ES,Barcelona,Cancelado,2024-05-20 05:00:00
188.0,1583,David Gómez,75,Mochila North Face,Accesorios,15/01/2023,4.0,1114.85,4459.4,Bizum,España,Milán,Entregado,2023-01-15 03:00:00
189.0,1329,David Gómez,167,Reloj Casio,Accesorios,08-12-2024,2.0,1064.0,2128.0,PayPal,IT,Valencia,Entregado,2024-08-12 09:00:00
190.0,1837,Pedro López,108,MacBook Pro,Tecnología,04-24-2024,2.0,491.29,982.58,PayPal,France,Lyon,Pendiente,2024-04-24 19:00:00
191.0,1052,Laura Torres,170,Samsung Galaxy,Tecnología,05-11-2024,5.0,195.27,976.35,Bizum,Germany,Berlín,Cancelado,2024-05-11 20:00:00
192.0,1278,Ana Sánchez,153,Sony Headphones,Tecnología,08-23-2024,1.0,1795.46,1795.46,Bizum,spain,Milán,Entregado,2024-08-23 07:00:00
193.0,1648,María García,110,Camiseta Adidas,Moda,02-05-2023,4.0,1801.83,7207.32,Transferencia,España,Lyon,Entregado,2023-02-05 07:00:00
194.0,1114,María García,9,Monitor LG,Tecnología,2024-06-29,4.0,1269.87,5079.48,PayPal,spain,Paris,Entregado,2024-06-29 13:00:00
195.0,1349,Laura Torres,135,iPhone 13,Tecnología,03-24-2024,2.0,684.67,1369.34,Transferencia,DE,Paris,Entregado,2024-03-24 11:00:00
196.0,1344,ana sánchez,18,Aspiradora Dyson,Hogar,2023-09-30,5.0,704.93,3524.65,Bizum,Italy,Barcelona,Cancelado,2023-09-30 12:00:00
197.0,1220,María García,46,Camiseta Adidas,Moda,05-18-2024,2.0,1454.65,2909.3,Bizum,FR,Milán,Cancelado,2024-05-18 13:00:00
198.0,1685,María García,113,Samsung Galaxy,Tecnología,23/12/2023,2.0,"1795,25",,Transferencia,Germany,Valencia,Cancelado,2023-12-23 01:00:00
199.0,1719,Laura Torres,180,Samsung Galaxy,Tecnología,02-20-2024,4.0,1775.3,7101.2,Tarjeta,France,Berlín,Entregado,2024-02-20 22:00:00
200.0,1303,pedro lópez,162,AirPods,Tecnología,09/12/2023,1.0,1561.95,1561.95,Bizum,spain,Hamburgo,Pendiente,2023-12-09 09:00:00
201.0,1567,Carlos Ruiz,137,Silla Gaming,Hogar,02/09/2023,5.0,1287.64,6438.2,Transferencia,ES,Roma,Cancelado,2023-09-02 01:00:00
202.0,1980,Lucía Fernández,105,Aspiradora Dyson,tecnologia,25/11/2023,5.0,177.44,887.2,Transferencia,France,Lyon,Cancelado,2023-11-25 08:00:00
203.0,1496,PEDRO LÓPEZ,165,MacBook Pro,Tecnología,2023-03-31,5.0,331.64,1658.2,Bizum,Italy,Lyon,Entregado,2023-03-31 13:00:00
204.0,1291,Laura Torres,134,Samsung Galaxy,Tecnología,08-09-2024,3.0,1798.12,5394.36,Bizum,Italy,Berlín,Entregado,2024-08-09 09:00:00
205.0,1470,David Gómez,92,Samsung Galaxy,Tecnología,06-26-2024,4.0,1216.79,4867.16,Tarjeta,ES,Madrid,Cancelado,2024-06-26 03:00:00
206.0,1671,Lucía Fernández,194,AirPods,Tecnología,2024-07-05,3.0,28.3,84.9,Transferencia,España,Roma,Pendiente,2024-07-05 10:00:00
207.0,1602,carlos ruiz,199,Sony Headphones,Tecnología,17/09/2024,4.0,211.93,847.72,Transferencia,Germany,Valencia,Entregado,2024-09-17 02:00:00
208.0,1291,David Gómez,102,Aspiradora Dyson,Hogar,01/03/2024,1.0,1330.37,1330.37,Tarjeta,Italy,Paris,Cancelado,2024-03-01 13:00:00
209.0,1740,Laura Torres,73,AirPods,hogar,18/09/2024,2.0,20.07,40.14,PayPal,spain,Roma,Pendiente,2024-09-18 14:00:00
210.0,1139,ana sánchez,54,Teclado Logitech,Tecnología,17/10/2024,4.0,330.01,1320.04,Bizum,Italy,Lyon,Entregado,2024-10-17 09:00:00
211.0,1099,JUAN PÉREZ,133,Monitor LG,Tecnología,31/10/2023,2.0,1101.98,2203.96,Tarjeta,España,Milán,Cancelado,2023-10-31 02:00:00
212.0,1749,María García,130,Mochila North Face,Accesorios,08-27-2024,3.0,1386.87,4160.61,Transferencia,Germany,Madrid,Cancelado,2024-08-27 02:00:00
213.0,1605,Pedro López,69,AirPods,hogar,06/01/2024,5.0,1307.4,6537.0,PayPal,France,Milán,Entregado,2024-01-06 23:00:00
214.0,1939,Ana Sánchez,120,Cafetera Philips,Hogar,2024-06-28,3.0,456.3,1368.9,Transferencia,IT,Madrid,Cancelado,2024-06-28 05:00:00
215.0,1239,Carlos Ruiz,198,Zapatillas Nike,Moda,09-18-2024,2.0,1427.24,2854.48,Bizum,Italy,Paris,Entregado,2024-09-18 13:00:00
216.0,1955,Juan Pérez,137,iPhone 13,Tecnología,14/02/2023,5.0,482.13,2410.65,Bizum,Italy,Hamburgo,Pendiente,2023-02-14 14:00:00
217.0,1964,Carlos Ruiz,59,iPhone 13,Tecnología,02-27-2023,2.0,657.55,1315.1,PayPal,DE,Lyon,Entregado,2023-02-27 09:00:00
218.0,1254,Carlos Ruiz,85,MacBook Pro,Tecnología,07/10/2024,4.0,$1495.52,,Bizum,France,Barcelona,Entregado,2024-10-07 01:00:00
219.0,1815,Juan Pérez,141,Teclado Logitech,Tecnología,03-26-2023,1.0,1302.77,1302.77,PayPal,ES,Roma,Pendiente,2023-03-26 15:00:00
220.0,1846,Carlos Ruiz,146,Samsung Galaxy,Tecnología,2023-10-12,5.0,1699.95,8499.75,Transferencia,IT,Barcelona,Entregado,2023-10-12 05:00:00
221.0,1362,Lucía Fernández,74,Reloj Casio,Accesorios,04-15-2024,1.0,1318.65,1318.65,Tarjeta,spain,Valencia,Pendiente,2024-04-15 13:00:00
222.0,1113,Carlos Ruiz,1,Bolso Gucci,tech,2024-04-03,3.0,1140.93,3422.79,Transferencia,IT,Lyon,Cancelado,2024-04-03 05:00:00
223.0,1570,Laura Torres,110,Zapatillas Nike,Moda,27/01/2023,5.0,$196.41,,Bizum,spain,Milán,Entregado,2023-01-27 12:00:00
224.0,1981,David Gómez,175,Aspiradora Dyson,Hogar,12-04-2023,3.0,741.75,2225.25,Tarjeta,FR,Berlín,Cancelado,2023-12-04 04:00:00
225.0,1095,Lucía Fernández,185,Teclado Logitech,Tecnología,01/08/2023,3.0,537.75,1613.25,Tarjeta,Germany,Madrid,Cancelado,2023-08-01 02:00:00
226.0,1844,Ana Sánchez,28,Cafetera Philips,Hogar,14/02/2023,5.0,495.54,2218.0288369108102,PayPal,spain,Barcelona,Cancelado,2023-02-14 01:00:00
227.0,1302,Lucía Fernández,152,Aspiradora Dyson,Hogar,12-05-2023,2.0,1946.29,3892.58,PayPal,FR,Barcelona,Entregado,2023-12-05 10:00:00
228.0,1930,David Gómez,108,Sony Headphones,Tecnología,10/05/2024,5.0,792.26,3961.3,PayPal,France,Lyon,Entregado,2024-05-10 22:00:00
229.0,1724,Lucía Fernández,185,iPhone 13,Tecnología,09-27-2024,5.0,1785.17,8925.85,Transferencia,España,Barcelona,Cancelado,2024-09-27 23:00:00
230.0,1297,Lucía Fernández,174,Mochila North Face,Accesorios,01-31-2024,1.0,1265.97,1265.97,PayPal,DE,Paris,Cancelado,2024-01-31 01:00:00
231.0,1728,DAVID GÓMEZ,174,Sony Headphones,Tecnología,08-13-2023,1.0,1591.67,1591.67,Bizum,DE,Hamburgo,Pendiente,2023-08-13 18:00:00
232.0,1166,David Gómez,119,Samsung Galaxy,Tecnología,2023-11-26,3.0,1010.25,3030.75,Transferencia,Germany,Hamburgo,Pendiente,2023-11-26 18:00:00
233.0,1136,María García,9,MacBook Pro,HOGAR,2024-02-26,4.0,1158.04,4632.16,Transferencia,ES,Roma,Pendiente,2024-02-26 04:00:00
234.0,1003,Ana Sánchez,181,Mochila North Face,Accesorios,2023-07-29,5.0,990.11,4295.7598399534645,Transferencia,ES,Hamburgo,Cancelado,2023-07-29 22:00:00
235.0,1176,Laura Torres,84,Cafetera Philips,Hogar,24/01/2024,4.0,398.53,1594.12,Tarjeta,FR,Berlín,Cancelado,2024-01-24 20:00:00
236.0,1972,María García,109,Cafetera Philips,Hogar,2023-10-26,3.0,1447.68,4343.04,Transferencia,FR,Hamburgo,Pendiente,2023-10-26 03:00:00
237.0,1046,Carlos Ruiz,44,Silla Gaming,Hogar,2024-08-09,1.0,568.74,568.74,Bizum,FR,Lyon,Cancelado,2024-08-09 14:00:00
238.0,1193,Lucía Fernández,119,MacBook Pro,HOGAR,2023-08-22,3.0,58.39,175.17,Tarjeta,IT,Roma,Pendiente,2023-08-22 16:00:00
239.0,1650,Laura Torres,113,AirPods,Tecnología,07/09/2023,4.0,1294.49,5177.96,Transferencia,Italy,Milán,Cancelado,2023-09-07 17:00:00
240.0,1375,María García,193,Teclado Logitech,Tecnología,30/01/2023,1.0,362.45,362.45,Tarjeta,DE,Berlín,Entregado,2023-01-30 08:00:00
241.0,1354,LAURA TORRES,122,Sony Headphones,Tecnología,2023-04-28,3.0,1881.51,5644.53,Bizum,FR,Berlín,Entregado,2023-04-28 17:00:00
242.0,1386,Carlos Ruiz,119,Zapatillas Nike,Moda,2024-07-22,2.0,1908.32,3816.64,PayPal,Italy,Barcelona,Cancelado,2024-07-22 22:00:00
243.0,1561,Lucía Fernández,9,Zapatillas Nike,Moda,2023-05-13,3.0,1830.58,5491.74,Bizum,España,Roma,Pendiente,2023-05-13 01:00:00
244.0,1126,Juan Pérez,16,Mochila North Face,Accesorios,13/04/2023,4.0,746.62,2986.48,Transferencia,France,Lyon,Cancelado,2023-04-13 06:00:00
245.0,1364,Ana Sánchez,103,Sony Headphones,Tecnología,28/04/2024,5.0,40.76,203.8,Transferencia,IT,Valencia,Cancelado,2024-04-28 03:00:00
246.0,1421,María García,70,Silla Gaming,Hogar,08-10-2024,3.0,1857.35,5572.05,PayPal,ES,Lyon,Pendiente,2024-08-10 01:00:00
247.0,1327,Juan Pérez,198,Aspiradora Dyson,Hogar,2023-12-22,5.0,862.09,4310.45,Tarjeta,España,Paris,Cancelado,2023-12-22 11:00:00
248.0,1606,Laura Torres,47,MacBook Pro,Tecnología,01-15-2024,4.0,1933.64,7734.56,PayPal,spain,Milán,Pendiente,2024-01-15 12:00:00
249.0,1561,María García,57,Silla Gaming,Hogar,2024-06-25,4.0,1927.6,7710.4,Transferencia,España,Paris,Cancelado,2024-06-25 04:00:00
,1290,Carlos Ruiz,151,iPhone 13,Tecnología,16/11/2023,5.0,1707.49,8537.45,PayPal,Italy,Hamburgo,Cancelado,2023-11-16 13:00:00
251.0,1637,Pedro López,175,iPhone 13,Tecnología,2024-04-05,3.0,"595,95",,Bizum,France,Madrid,Cancelado,2024-04-05 05:00:00
252.0,1742,David Gómez,105,Mochila North Face,Accesorios,02-08-2024,5.0,776.34,3881.7,Tarjeta,spain,Hamburgo,Pendiente,2024-02-08 12:00:00
253.0,1229,David Gómez,113,MacBook Pro,Tecnología,22/02/2024,3.0,$1703.76,,Transferencia,Germany,Valencia,Cancelado,2024-02-22 21:00:00
254.0,1159,Laura Torres,140,Silla Gaming,Hogar,01-30-2024,1.0,640.67,589.6341258914888,Tarjeta,IT,Valencia,Cancelado,2024-01-30 14:00:00
255.0,1951,Juan Pérez,194,MacBook Pro,Tecnología,19/10/2024,5.0,347.29,1736.45,Tarjeta,spain,Berlín,Cancelado,2024-10-19 07:00:00
256.0,1379,María García,2,Aspiradora Dyson,Hogar,2024-02-10,3.0,1118.03,3354.09,PayPal,Italy,Hamburgo,Pendiente,2024-02-10 21:00:00
257.0,1319,María García,79,Zapatillas Nike,Moda,2023-12-27,1.0,1872.95,1872.95,Transferencia,FR,Lyon,Pendiente,2023-12-27 21:00:00
258.0,1677,Carlos Ruiz,36,Samsung Galaxy,Tecnología,07-11-2024,5.0,1395.1,6975.5,Transferencia,Italy,Valencia,Entregado,2024-07-11 13:00:00
259.0,1903,Carlos Ruiz,54,Aspiradora Dyson,Hogar,07-05-2024,2.0,1144.42,2288.84,Transferencia,ES,Roma,Cancelado,2024-07-05 06:00:00
260.0,1533,Pedro López,135,Reloj Casio,Accesorios,14/10/2023,1.0,"203,38",,Transferencia,IT,Hamburgo,Cancelado,2023-10-14 16:00:00
261.0,1774,María García,11,Bolso Gucci,TECHNOLOGY,2024-04-03,4.0,1233.86,4935.44,PayPal,spain,Barcelona,Pendiente,2024-04-03 15:00:00
262.0,1960,Juan Pérez,112,iPhone 13,tech,31/07/2024,4.0,1980.21,7920.84,Transferencia,España,Madrid,Cancelado,2024-07-31 11:00:00
263.0,1865,Lucía Fernández,143,AirPods,Tecnología,01-23-2024,1.0,288.77,288.77,Tarjeta,DE,Berlín,Cancelado,2024-01-23 02:00:00
264.0,1601,Juan Pérez,31,Reloj Casio,Accesorios,2024-04-19,1.0,1041.48,1041.48,Transferencia,spain,Roma,Pendiente,2024-04-19 06:00:00
265.0,1591,Pedro López,42,AirPods,Tecnología,01/10/2024,2.0,1755.97,3511.94,Transferencia,Italy,Valencia,Cancelado,2024-10-01 17:00:00
266.0,1967,ana sánchez,145,AirPods,hogar,2023-05-01,1.0,1484.13,1484.13,Tarjeta,ES,Milán,Entregado,2023-05-01 10:00:00
267.0,1410,María García,112,Reloj Casio,Accesorios,15/01/2023,1.0,1397.06,1397.06,Bizum,spain,Hamburgo,Entregado,2023-01-15 14:00:00
268.0,1933,Ana Sánchez,71,Zapatillas Nike,Moda,05-01-2023,3.0,1407.94,4223.82,Bizum,Italy,Berlín,Cancelado,2023-05-01 04:00:00
269.0,1023,LUCÍA FERNÁNDEZ,3,Silla Gaming,TECHNOLOGY,01/06/2023,5.0,725.39,3626.95,PayPal,France,Berlín,Cancelado,2023-06-01 16:00:00
270.0,1184,Lucía Fernández,119,Teclado Logitech,Tecnología,10/04/2023,2.0,594.25,1022.8106699059574,Tarjeta,IT,Milán,Entregado,2023-04-10 02:00:00
271.0,1667,Laura Torres,187,AirPods,Tecnología,2024-11-07,2.0,1620.63,3495.3898141079176,Transferencia,ES,Roma,Cancelado,2024-11-07 17:00:00
272.0,1313,Ana Sánchez,62,Silla Gaming,Hogar,2024-10-16,4.0,"1622,13",0.0,Tarjeta,DE,Madrid,Entregado,2024-10-16 12:00:00
273.0,1084,Laura Torres,28,Mochila North Face,Accesorios,2023-10-27,1.0,1735.47,1735.47,Bizum,Italy,Valencia,Cancelado,2023-10-27 01:00:00
274.0,1429,Laura Torres,134,Zapatillas Nike,Moda,2023-06-20,5.0,1827.35,9136.75,Transferencia,DE,Paris,Entregado,2023-06-20 15:00:00
275.0,1513,María García,159,iPhone 13,Tecnología,2024-03-27,5.0,1027.57,5137.85,Transferencia,spain,Valencia,Cancelado,2024-03-27 17:00:00
,1066,Pedro López,12,AirPods,Tecnología,28/11/2024,4.0,1008.02,4032.08,Transferencia,España,Milán,Pendiente,2024-11-28 06:00:00
277.0,1059,Lucía Fernández,189,Teclado Logitech,Tecnología,2024-10-11,5.0,1598.61,7993.05,Bizum,FR,Valencia,Cancelado,2024-10-11 06:00:00
278.0,1343,María García,88,Zapatillas Nike,Moda,07/08/2024,3.0,1303.43,3376.4410106400037,Tarjeta,Italy,Milán,Cancelado,2024-08-07 20:00:00
279.0,1164,Pedro López,47,Cafetera Philips,Hogar,03/09/2023,1.0,1406.91,1406.91,Transferencia,España,Madrid,Pendiente,2023-09-03 09:00:00
280.0,1402,María García,174,Zapatillas Nike,Moda,31/10/2023,1.0,1593.63,1593.63,Transferencia,ES,Barcelona,Cancelado,2023-10-31 10:00:00
281.0,1384,Lucía Fernández,49,Monitor LG,Tecnología,24/08/2023,5.0,1781.11,8905.55,Transferencia,ES,Berlín,Cancelado,2023-08-24 19:00:00
282.0,1235,Carlos Ruiz,163,Monitor LG,Tecnología,07-24-2024,5.0,682.61,3413.05,Transferencia,FR,Paris,Pendiente,2024-07-24 14:00:00
283.0,1958,David Gómez,84,Teclado Logitech,Tecnología,05-08-2023,4.0,757.41,3029.64,Bizum,spain,Milán,Pendiente,2023-05-08 00:00:00
284.0,1451,lucía fernández,98,Cafetera Philips,Hogar,05/02/2023,2.0,197.02,394.04,Transferencia,spain,Hamburgo,Entregado,2023-02-05 12:00:00
285.0,1556,María García,184,Aspiradora Dyson,tech,01/05/2023,1.0,1160.78,1160.78,Tarjeta,DE,Hamburgo,Pendiente,2023-05-01 16:00:00
286.0,1962,Juan Pérez,140,iPhone 13,Tecnología,2023-11-10,3.0,81.53,244.59,Transferencia,France,Roma,Entregado,2023-11-10 10:00:00
287.0,1879,Carlos Ruiz,75,AirPods,Tecnología,02/05/2024,4.0,$936.54,0.0,PayPal,FR,Hamburgo,Cancelado,2024-05-02 03:00:00
288.0,1680,María García,14,Aspiradora Dyson,Hogar,29/08/2024,4.0,1089.86,4359.44,Transferencia,Germany,Madrid,Cancelado,2024-08-29 23:00:00
289.0,1112,María García,30,Camiseta Adidas,Moda,06-19-2023,4.0,580.22,2320.88,Transferencia,España,Berlín,Pendiente,2023-06-19 16:00:00
290.0,1811,david gómez,176,Silla Gaming,Hogar,04-04-2024,2.0,1185.76,2159.1578448641653,Tarjeta,Italy,Paris,Entregado,2024-04-04 07:00:00
291.0,1739,David Gómez,39,Aspiradora Dyson,Hogar,2024-11-25,5.0,70.7,353.5,PayPal,Germany,Valencia,Entregado,2024-11-25 21:00:00
292.0,1466,MARÍA GARCÍA,43,MacBook Pro,Tecnología,2023-10-06,5.0,$84.32,,Tarjeta,DE,Milán,Entregado,2023-10-06 00:00:00
293.0,1200,María García,3,Aspiradora Dyson,Hogar,07-17-2024,5.0,1646.98,8234.9,Tarjeta,France,Hamburgo,Pendiente,2024-07-17 06:00:00
294.0,1333,MARÍA GARCÍA,36,Zapatillas Nike,Moda,04-30-2024,2.0,726.78,1453.56,Bizum,ES,Roma,Pendiente,2024-04-30 15:00:00
295.0,1011,maría garcía,65,Camiseta Adidas,Moda,02-24-2023,5.0,"262,85",,Bizum,DE,Hamburgo,Entregado,2023-02-24 07:00:00
296.0,1384,Laura Torres,40,Cafetera Philips,Hogar,11-06-2023,2.0,1049.26,2098.52,Transferencia,DE,Roma,Pendiente,2023-11-06 20:00:00
297.0,1406,María García,1,Bolso Gucci,Moda,03-09-2023,5.0,1542.29,8763.870178998148,Transferencia,France,Valencia,Entregado,2023-03-09 02:00:00
298.0,1649,Pedro López,39,AirPods,Tecnología,10-13-2024,4.0,439.48,1757.92,Tarjeta,France,Barcelona,Cancelado,2024-10-13 12:00:00
299.0,1273,Laura Torres,100,Zapatillas Nike,Moda,2023-02-21,1.0,1249.55,1249.55,Tarjeta,DE,Paris,Entregado,2023-02-21 01:00:00
300.0,1577,david gómez,190,Sony Headphones,Tecnología,2023-09-24,4.0,179.84,719.36,Tarjeta,ES,Milán,Cancelado,2023-09-24 06:00:00
301.0,1359,Laura Torres,186,Camiseta Adidas,Moda,2023-06-16,5.0,112.85,564.25,Tarjeta,DE,Barcelona,Entregado,2023-06-16 00:00:00
302.0,1231,María García,162,Teclado Logitech,Tecnología,10-02-2023,2.0,1067.4,2134.8,PayPal,DE,Madrid,Entregado,2023-10-02 12:00:00
303.0,1751,Laura Torres,30,Zapatillas Nike,Moda,08-08-2024,3.0,1085.86,3707.0904827993036,Tarjeta,spain,Milán,Entregado,2024-08-08 04:00:00
304.0,1710,Lucía Fernández,39,Aspiradora Dyson,Hogar,2023-01-02,2.0,1278.49,2556.98,Tarjeta,Germany,Roma,Cancelado,2023-01-02 14:00:00
305.0,1910,pedro lópez,34,iPhone 13,Tecnología,2024-11-17,3.0,1454.92,4364.76,Bizum,France,Roma,Pendiente,2024-11-17 07:00:00
306.0,1310,Lucía Fernández,132,Silla Gaming,Hogar,22/04/2024,3.0,1951.95,5855.85,Bizum,DE,Paris,Entregado,2024-04-22 20:00:00
307.0,1637,María García,183,iPhone 13,Tecnología,06-22-2023,4.0,1037.44,4149.76,PayPal,FR,Roma,Entregado,2023-06-22 09:00:00
308.0,1773,CARLOS RUIZ,108,MacBook Pro,Tecnología,12-06-2023,1.0,652.68,652.68,PayPal,España,Valencia,Pendiente,2023-12-06 17:00:00
309.0,1778,Lucía Fernández,100,Zapatillas Nike,Moda,2024-05-08,3.0,1592.42,4777.26,Tarjeta,ES,Barcelona,Pendiente,2024-05-08 01:00:00
310.0,1104,Juan Pérez,176,Samsung Galaxy,Tecnología,06-14-2023,5.0,548.96,2744.8,Transferencia,IT,Berlín,Pendiente,2023-06-14 06:00:00
311.0,1124,Pedro López,178,iPhone 13,Tecnología,11/04/2024,5.0,883.55,4417.75,Bizum,España,Hamburgo,Pendiente,2024-04-11 05:00:00
312.0,1760,Ana Sánchez,47,iPhone 13,Tecnología,02-07-2024,1.0,166.13,182.62133927296065,Transferencia,España,Barcelona,Pendiente,2024-02-07 13:00:00
313.0,1523,Carlos Ruiz,8,Sony Headphones,Tecnología,12-20-2023,5.0,60.45,302.25,Bizum,FR,Milán,Cancelado,2023-12-20 21:00:00
314.0,1753,david gómez,152,Zapatillas Nike,Moda,27/01/2024,3.0,1925.67,5777.01,Bizum,Germany,Hamburgo,Cancelado,2024-01-27 22:00:00
315.0,1960,lucía fernández,57,Camiseta Adidas,Moda,2024-01-18,3.0,1673.6,5148.343358023865,PayPal,Italy,Berlín,Pendiente,2024-01-18 05:00:00
316.0,1356,Lucía Fernández,45,Monitor LG,Tecnología,2024-02-04,4.0,1394.99,5579.96,PayPal,DE,Madrid,Cancelado,2024-02-04 15:00:00
317.0,1665,Ana Sánchez,45,Sony Headphones,Tecnología,04-10-2023,5.0,823.82,4119.1,PayPal,DE,Barcelona,Cancelado,2023-04-10 12:00:00
318.0,1913,Laura Torres,16,Teclado Logitech,Tecnología,2023-12-08,4.0,354.86,1419.44,PayPal,ES,Madrid,Cancelado,2023-12-08 00:00:00
319.0,1063,Lucía Fernández,60,AirPods,Tecnología,08-18-2023,2.0,"321,31",,Transferencia,ES,Milán,Cancelado,2023-08-18 23:00:00
320.0,1266,Juan Pérez,60,AirPods,Tecnología,22/07/2023,3.0,507.98,1523.94,Transferencia,DE,Madrid,Entregado,2023-07-22 14:00:00
321.0,1867,MARÍA GARCÍA,140,Cafetera Philips,moda,2024-11-19,1.0,1102.96,1102.96,Tarjeta,France,Milán,Pendiente,2024-11-19 09:00:00
322.0,1056,PEDRO LÓPEZ,87,Reloj Casio,Accesorios,10/09/2023,5.0,1432.05,7160.25,Tarjeta,ES,Paris,Cancelado,2023-09-10 08:00:00
323.0,1469,JUAN PÉREZ,153,Aspiradora Dyson,Hogar,13/09/2024,3.0,1323.79,3971.37,Bizum,España,Valencia,Cancelado,2024-09-13 11:00:00
324.0,1871,Juan Pérez,112,Zapatillas Nike,Moda,01/06/2024,2.0,"567,07",,Bizum,Italy,Paris,Cancelado,2024-06-01 07:00:00
325.0,1607,ana sánchez,107,Silla Gaming,Hogar,2024-07-10,5.0,1910.18,9550.9,Tarjeta,IT,Lyon,Entregado,2024-07-10 20:00:00
326.0,1389,juan pérez,186,Samsung Galaxy,tech,09/10/2024,3.0,1478.41,4435.23,Bizum,spain,Milán,Cancelado,2024-10-09 04:00:00
327.0,1388,Juan Pérez,49,Reloj Casio,Accesorios,09-21-2024,1.0,1113.16,1113.16,Bizum,ES,Lyon,Pendiente,2024-09-21 11:00:00
328.0,1955,David Gómez,131,Camiseta Adidas,Moda,10-25-2023,4.0,1227.32,4909.28,Bizum,España,Madrid,Entregado,2023-10-25 15:00:00
329.0,1119,Carlos Ruiz,19,MacBook Pro,Tecnología,11-10-2024,4.0,845.0,3380.0,Transferencia,DE,Hamburgo,Cancelado,2024-11-10 08:00:00
330.0,1864,Ana Sánchez,11,Samsung Galaxy,Tecnología,2023-12-11,1.0,502.98,502.98,Transferencia,Germany,Hamburgo,Entregado,2023-12-11 11:00:00
331.0,1426,María García,8,Reloj Casio,Accesorios,29/08/2024,3.0,718.39,2506.961058789362,Tarjeta,España,Roma,Pendiente,2024-08-29 03:00:00
332.0,1819,Juan Pérez,186,MacBook Pro,Moda,2023-09-29,5.0,1518.11,8621.627541829284,Tarjeta,spain,Hamburgo,Entregado,2023-09-29 09:00:00
333.0,1251,María García,196,Sony Headphones,Tecnología,06-29-2023,2.0,38.64,77.28,Tarjeta,France,Hamburgo,Pendiente,2023-06-29 18:00:00
334.0,1133,Lucía Fernández,190,Camiseta Adidas,Moda,09-24-2024,,240.98,,Transferencia,ES,Barcelona,Entregado,2024-09-24 01:00:00
335.0,1889,Carlos Ruiz,149,MacBook Pro,Tecnología,03-02-2023,1.0,101.55,101.55,Bizum,ES,Paris,Pendiente,2023-03-02 12:00:00
336.0,1630,Carlos Ruiz,63,Silla Gaming,Hogar,14/02/2024,5.0,91.05,455.25,Transferencia,DE,Roma,Cancelado,2024-02-14 14:00:00
337.0,1735,Carlos Ruiz,48,Teclado Logitech,Tecnología,25/05/2024,1.0,1712.37,1712.37,Bizum,España,Hamburgo,Cancelado,2024-05-25 23:00:00
,1485,Carlos Ruiz,39,Bolso Gucci,Moda,06-01-2024,4.0,1410.28,5641.12,Transferencia,Italy,Berlín,Cancelado,2024-06-01 21:00:00
339.0,1361,Laura Torres,22,AirPods,Tecnología,03-09-2023,1.0,953.61,811.0932757949487,PayPal,ES,Hamburgo,Entregado,2023-03-09 02:00:00
340.0,1163,Laura Torres,93,iPhone 13,Tecnología,2023-09-22,4.0,204.69,818.76,Bizum,IT,Hamburgo,Pendiente,2023-09-22 05:00:00
341.0,1003,maría garcía,115,Sony Headphones,Tecnología,12/11/2023,3.0,988.32,2964.96,Transferencia,FR,Lyon,Entregado,2023-11-12 14:00:00
342.0,1695,CARLOS RUIZ,177,iPhone 13,Tecnología,29/08/2023,2.0,952.21,1904.42,Bizum,Germany,Lyon,Entregado,2023-08-29 10:00:00
343.0,1579,Ana Sánchez,6,MacBook Pro,Tecnología,08-17-2024,4.0,354.67,1418.68,Transferencia,France,Madrid,Cancelado,2024-08-17 11:00:00
344.0,1175,JUAN PÉREZ,164,Aspiradora Dyson,Hogar,2024-04-12,5.0,873.36,4366.8,Transferencia,FR,Hamburgo,Pendiente,2024-04-12 20:00:00
345.0,1956,Laura Torres,65,MacBook Pro,Tecnología,12/10/2024,3.0,"803,02",,Tarjeta,Germany,Madrid,Entregado,2024-10-12 07:00:00
346.0,1979,Pedro López,153,Aspiradora Dyson,Hogar,05/06/2024,1.0,1235.54,1235.54,Tarjeta,DE,Lyon,Pendiente,2024-06-05 22:00:00
347.0,1105,Ana Sánchez,18,Samsung Galaxy,Tecnología,12/08/2024,2.0,1273.84,2547.68,Tarjeta,spain,Madrid,Cancelado,2024-08-12 01:00:00
348.0,1845,Lucía Fernández,56,MacBook Pro,Tecnología,2024-09-22,2.0,100.15,200.3,Transferencia,FR,Milán,Pendiente,2024-09-22 05:00:00
349.0,1898,María García,12,Aspiradora Dyson,Hogar,28/02/2023,5.0,755.48,3777.4,Transferencia,España,Paris,Pendiente,2023-02-28 02:00:00
350.0,1081,LUCÍA FERNÁNDEZ,112,Reloj Casio,Accesorios,10-04-2023,4.0,"1255,46",,PayPal,Germany,Paris,Entregado,2023-10-04 18:00:00
351.0,1186,Laura Torres,73,Aspiradora Dyson,Hogar,24/03/2024,1.0,1011.24,1011.24,Bizum,France,Lyon,Cancelado,2024-03-24 06:00:00
352.0,1810,Carlos Ruiz,141,Reloj Casio,Accesorios,24/02/2023,2.0,1714.41,4041.276331553345,Transferencia,España,Paris,Pendiente,2023-02-24 09:00:00
353.0,1512,Lucía Fernández,155,Mochila North Face,tech,26/01/2024,2.0,1320.8,2641.6,Transferencia,spain,Milán,Cancelado,2024-01-26 13:00:00
354.0,1666,Pedro López,160,Samsung Galaxy,Tecnología,04-10-2023,5.0,334.24,1671.2,Transferencia,spain,Valencia,Cancelado,2023-04-10 15:00:00
355.0,1940,Carlos Ruiz,99,Zapatillas Nike,Moda,27/04/2023,1.0,150.43,150.43,Tarjeta,España,Madrid,Cancelado,2023-04-27 00:00:00
356.0,1490,MARÍA GARCÍA,47,Aspiradora Dyson,Hogar,01/01/2024,5.0,1288.41,6442.05,Tarjeta,Germany,Lyon,Cancelado,2024-01-01 07:00:00
357.0,1789,Ana Sánchez,3,Camiseta Adidas,Moda,03-19-2023,4.0,"62,76",,Transferencia,France,Hamburgo,Entregado,2023-03-19 09:00:00
358.0,1245,Juan Pérez,73,Silla Gaming,tech,08-09-2023,4.0,1175.69,4702.76,Transferencia,DE,Lyon,Cancelado,2023-08-09 20:00:00
359.0,1698,Lucía Fernández,5,Silla Gaming,Hogar,02/10/2023,5.0,1881.06,9405.3,PayPal,Italy,Paris,Cancelado,2023-10-02 20:00:00
360.0,1779,juan pérez,63,Monitor LG,Tecnología,18/05/2023,3.0,"1155,19",,PayPal,France,Berlín,Cancelado,2023-05-18 21:00:00
361.0,1095,David Gómez,18,Mochila North Face,Accesorios,2024-01-27,2.0,782.46,1564.92,Transferencia,ES,Roma,Pendiente,2024-01-27 06:00:00
362.0,1601,Carlos Ruiz,128,Monitor LG,Tecnología,2024-03-09,3.0,1290.14,3870.42,Transferencia,DE,Paris,Cancelado,2024-03-09 13:00:00
363.0,1634,Laura Torres,109,Monitor LG,Tecnología,10-15-2024,3.0,921.92,2765.76,Tarjeta,Germany,Barcelona,Cancelado,2024-10-15 04:00:00
364.0,1648,Juan Pérez,190,Mochila North Face,Accesorios,2024-09-23,2.0,1095.78,2191.56,PayPal,Italy,Valencia,Cancelado,2024-09-23 12:00:00
365.0,1474,María García,180,Sony Headphones,Tecnología,10/09/2024,4.0,1883.51,7534.04,PayPal,spain,Hamburgo,Pendiente,2024-09-10 09:00:00
366.0,1615,Laura Torres,144,Mochila North Face,Accesorios,03-01-2024,5.0,778.34,3891.7,Transferencia,España,Milán,Pendiente,2024-03-01 19:00:00
367.0,1932,maría garcía,186,Cafetera Philips,Hogar,01-08-2024,4.0,1922.77,7691.08,PayPal,ES,Milán,Cancelado,2024-01-08 14:00:00
368.0,1542,Lucía Fernández,184,Camiseta Adidas,Moda,10-03-2023,5.0,1811.65,9058.25,Bizum,Italy,Roma,Entregado,2023-10-03 12:00:00
369.0,1427,LUCÍA FERNÁNDEZ,126,Cafetera Philips,Hogar,06-10-2023,4.0,399.62,1598.48,PayPal,Germany,Hamburgo,Pendiente,2023-06-10 10:00:00
370.0,1052,DAVID GÓMEZ,177,Aspiradora Dyson,Hogar,05-27-2024,4.0,148.03,592.12,Bizum,España,Hamburgo,Cancelado,2024-05-27 11:00:00
371.0,1667,David Gómez,148,Teclado Logitech,Tecnología,03-08-2024,1.0,210.55,210.55,Bizum,Germany,Roma,Entregado,2024-03-08 05:00:00
372.0,1262,Ana Sánchez,134,Samsung Galaxy,Tecnología,2024-10-26,4.0,46.26,185.04,PayPal,ES,Madrid,Cancelado,2024-10-26 02:00:00
373.0,1168,David Gómez,46,Monitor LG,Tecnología,08/10/2024,5.0,197.94,989.7,Bizum,Italy,Lyon,Cancelado,2024-10-08 01:00:00
374.0,1184,Carlos Ruiz,143,Camiseta Adidas,Moda,02/02/2024,2.0,1369.18,2738.36,Bizum,Italy,Paris,Entregado,2024-02-02 07:00:00
375.0,1406,Lucía Fernández,113,AirPods,Tecnología,15/11/2024,2.0,151.67,303.34,Tarjeta,España,Lyon,Cancelado,2024-11-15 13:00:00
376.0,1636,Laura Torres,20,Mochila North Face,Accesorios,17/06/2024,4.0,644.76,2579.04,PayPal,IT,Berlín,Entregado,2024-06-17 13:00:00
377.0,1954,María García,87,Silla Gaming,Hogar,02-22-2024,3.0,$1691.3,,Transferencia,FR,Berlín,Entregado,2024-02-22 04:00:00
378.0,1972,David Gómez,151,Bolso Gucci,Moda,31/03/2024,1.0,"56,31",,PayPal,spain,Madrid,Entregado,2024-03-31 01:00:00
379.0,1070,Ana Sánchez,117,Monitor LG,Tecnología,09-17-2023,5.0,$1630.79,,PayPal,DE,Berlín,Pendiente,2023-09-17 07:00:00
380.0,1902,Ana Sánchez,68,Samsung Galaxy,Tecnología,2024-10-28,2.0,570.89,1355.643585705892,PayPal,France,Valencia,Pendiente,2024-10-28 15:00:00
381.0,1297,Pedro López,105,Silla Gaming,Hogar,21/03/2024,4.0,$245.15,,Bizum,Germany,Madrid,Pendiente,2024-03-21 01:00:00
382.0,1977,Lucía Fernández,70,Samsung Galaxy,Tecnología,08-21-2023,3.0,1396.51,4189.53,Transferencia,Germany,Berlín,Pendiente,2023-08-21 12:00:00
383.0,1362,PEDRO LÓPEZ,141,Bolso Gucci,Moda,15/06/2024,2.0,$1261.6,,Tarjeta,spain,Madrid,Entregado,2024-06-15 22:00:00
384.0,1911,María García,131,Monitor LG,HOGAR,2023-03-18,2.0,1756.17,3512.34,PayPal,IT,Barcelona,Pendiente,2023-03-18 08:00:00
,1625,Lucía Fernández,20,MacBook Pro,Tecnología,2023-01-16,5.0,1472.79,7363.95,Bizum,Italy,Milán,Cancelado,2023-01-16 09:00:00
386.0,1593,Lucía Fernández,87,Mochila North Face,Accesorios,04-06-2024,4.0,1608.93,6435.72,Transferencia,España,Berlín,Pendiente,2024-04-06 19:00:00
387.0,1927,Carlos Ruiz,38,iPhone 13,Tecnología,02-23-2024,1.0,571.25,571.25,Bizum,ES,Hamburgo,Cancelado,2024-02-23 14:00:00
388.0,1969,Pedro López,198,Samsung Galaxy,Tecnología,2023-11-05,2.0,363.1,726.2,Tarjeta,France,Paris,Pendiente,2023-11-05 21:00:00
389.0,1956,David Gómez,167,Zapatillas Nike,Moda,02/06/2023,2.0,1503.72,3443.5222881361638,Transferencia,ES,Barcelona,Pendiente,2023-06-02 21:00:00
390.0,1134,David Gómez,15,Monitor LG,Tecnología,02-03-2024,1.0,1615.6,1615.6,Tarjeta,France,Berlín,Entregado,2024-02-03 04:00:00
391.0,1989,David Gómez,143,Silla Gaming,Hogar,27/02/2023,4.0,1981.11,7924.44,Transferencia,IT,Roma,Entregado,2023-02-27 02:00:00
392.0,1156,María García,81,Teclado Logitech,Tecnología,04/10/2023,1.0,831.11,831.11,Bizum,Italy,Milán,Pendiente,2023-10-04 10:00:00
393.0,1786,Lucía Fernández,128,Camiseta Adidas,Moda,09-19-2024,1.0,750.32,750.32,Transferencia,France,Lyon,Pendiente,2024-09-19 12:00:00
394.0,1243,Ana Sánchez,150,Samsung Galaxy,Tecnología,01/09/2024,5.0,1555.06,7775.3,Bizum,IT,Berlín,Entregado,2024-09-01 11:00:00
395.0,1435,David Gómez,181,Bolso Gucci,Moda,11/07/2023,2.0,688.2,1376.4,Bizum,Germany,Paris,Entregado,2023-07-11 22:00:00
396.0,1052,Laura Torres,44,Cafetera Philips,Hogar,24/10/2024,1.0,"1862,21",,Transferencia,Italy,Barcelona,Cancelado,2024-10-24 09:00:00
397.0,1061,David Gómez,8,Bolso Gucci,Moda,12/02/2023,5.0,1718.24,8591.2,PayPal,Germany,Roma,Cancelado,2023-02-12 18:00:00
398.0,1743,Lucía Fernández,26,Cafetera Philips,Hogar,2024-10-09,1.0,863.7,776.8801074740172,Tarjeta,IT,Barcelona,Cancelado,2024-10-09 14:00:00
399.0,1571,Juan Pérez,5,Silla Gaming,Hogar,2024-09-16,3.0,1504.23,4512.69,Bizum,Italy,Milán,Pendiente,2024-09-16 12:00:00
400.0,1439,Ana Sánchez,33,Silla Gaming,Hogar,21/01/2024,5.0,1511.54,7557.7,PayPal,IT,Madrid,Entregado,2024-01-21 03:00:00
401.0,1919,Ana Sánchez,60,Silla Gaming,Hogar,07-08-2023,5.0,215.22,1076.1,Tarjeta,Germany,Roma,Entregado,2023-07-08 05:00:00
402.0,1711,Ana Sánchez,132,Bolso Gucci,Moda,28/04/2024,3.0,1806.08,5418.24,PayPal,France,Paris,Entregado,2024-04-28 04:00:00
403.0,1530,Lucía Fernández,169,Samsung Galaxy,Tecnología,10-20-2023,4.0,1015.45,4061.8,Transferencia,ES,Paris,Pendiente,2023-10-20 11:00:00
404.0,1975,ana sánchez,3,Sony Headphones,tecnologia,09-30-2023,3.0,"1654,65",,Bizum,Germany,Barcelona,Pendiente,2023-09-30 19:00:00
405.0,1030,Laura Torres,153,AirPods,Tecnología,2024-11-01,5.0,646.9,2921.2691112084613,PayPal,España,Roma,Pendiente,2024-11-01 02:00:00
406.0,1250,ANA SÁNCHEZ,191,AirPods,Tecnología,2024-10-06,5.0,1792.09,8960.45,PayPal,ES,Milán,Entregado,2024-10-06 08:00:00
407.0,1200,Laura Torres,84,AirPods,Tecnología,2024-06-03,2.0,784.51,1569.02,Transferencia,Germany,Valencia,Pendiente,2024-06-03 17:00:00
408.0,1530,carlos ruiz,111,Cafetera Philips,Hogar,07-07-2024,5.0,31.57,157.85,Transferencia,Germany,Hamburgo,Pendiente,2024-07-07 02:00:00
409.0,1277,Laura Torres,172,Monitor LG,Tecnología,2023-04-12,1.0,1811.71,1811.71,Tarjeta,DE,Madrid,Cancelado,2023-04-12 13:00:00
410.0,1104,Juan Pérez,189,Silla Gaming,Hogar,12-09-2023,4.0,191.66,634.128338809106,Tarjeta,FR,Barcelona,Cancelado,2023-12-09 00:00:00
411.0,1044,Pedro López,136,Monitor LG,Tecnología,10/01/2023,2.0,$645.43,,PayPal,France,Lyon,Cancelado,2023-01-10 03:00:00
412.0,1177,María García,47,Cafetera Philips,Hogar,14/01/2023,4.0,1900.62,7602.48,Tarjeta,FR,Barcelona,Entregado,2023-01-14 13:00:00
413.0,1055,Lucía Fernández,86,Silla Gaming,Hogar,14/11/2023,3.0,1901.71,5705.13,Bizum,FR,Lyon,Cancelado,2023-11-14 04:00:00
414.0,1332,lucía fernández,144,Silla Gaming,Hogar,2024-04-25,4.0,1151.14,4604.56,Bizum,France,Barcelona,Entregado,2024-04-25 17:00:00
415.0,1094,pedro lópez,199,Samsung Galaxy,Tecnología,09-21-2023,3.0,1267.36,3802.08,PayPal,IT,Paris,Pendiente,2023-09-21 02:00:00
416.0,1126,Juan Pérez,92,Mochila North Face,Accesorios,05-17-2023,4.0,902.41,3609.64,PayPal,Italy,Milán,Cancelado,2023-05-17 00:00:00
417.0,1595,Carlos Ruiz,70,Mochila North Face,Accesorios,11-08-2024,1.0,593.49,593.49,PayPal,DE,Barcelona,Pendiente,2024-11-08 18:00:00
418.0,1026,Pedro López,91,Reloj Casio,Accesorios,01-31-2023,5.0,664.04,3320.2,Bizum,España,Roma,Cancelado,2023-01-31 02:00:00
419.0,1632,David Gómez,104,Silla Gaming,Hogar,23/02/2023,4.0,1348.31,5393.24,Tarjeta,DE,Berlín,Pendiente,2023-02-23 10:00:00
420.0,1468,David Gómez,96,Cafetera Philips,Hogar,22/07/2024,4.0,1507.23,6028.92,Tarjeta,spain,Milán,Entregado,2024-07-22 08:00:00
421.0,1134,Carlos Ruiz,60,Bolso Gucci,Moda,01-26-2024,3.0,1585.24,4755.72,Tarjeta,FR,Roma,Cancelado,2024-01-26 20:00:00
422.0,1750,David Gómez,68,Reloj Casio,Accesorios,24/08/2024,3.0,1581.34,4744.02,Bizum,spain,Lyon,Entregado,2024-08-24 11:00:00
423.0,1452,Carlos Ruiz,107,iPhone 13,Tecnología,2023-11-16,4.0,"191,5",,Transferencia,France,Madrid,Cancelado,2023-11-16 09:00:00
424.0,1057,Carlos Ruiz,189,Monitor LG,Tecnología,10-06-2024,1.0,993.9,993.9,Tarjeta,Italy,Madrid,Cancelado,2024-10-06 22:00:00
425.0,1453,María García,117,Reloj Casio,Accesorios,25/09/2023,2.0,124.54,249.08,Bizum,Germany,Lyon,Pendiente,2023-09-25 17:00:00
426.0,1355,Ana Sánchez,188,Teclado Logitech,Tecnología,07-16-2024,3.0,1103.56,3310.68,Tarjeta,Germany,Lyon,Pendiente,2024-07-16 18:00:00
427.0,1058,juan pérez,161,Teclado Logitech,Tecnología,04-01-2023,4.0,888.65,3554.6,Tarjeta,IT,Lyon,Pendiente,2023-04-01 06:00:00
428.0,1769,Pedro López,39,Zapatillas Nike,Moda,04/02/2023,2.0,1776.53,3553.06,Bizum,spain,Lyon,Cancelado,2023-02-04 05:00:00
429.0,1571,María García,169,Monitor LG,Tecnología,2024-01-31,3.0,708.32,2124.96,PayPal,DE,Paris,Pendiente,2024-01-31 22:00:00
430.0,1727,Ana Sánchez,64,Cafetera Philips,Hogar,2023-05-21,5.0,242.96,1214.8,Tarjeta,IT,Hamburgo,Entregado,2023-05-21 03:00:00
431.0,1336,David Gómez,170,AirPods,Tecnología,25/04/2024,2.0,294.55,595.7288544350405,Tarjeta,spain,Valencia,Cancelado,2024-04-25 03:00:00
432.0,1924,lucía fernández,149,Zapatillas Nike,Moda,08-26-2024,1.0,1525.41,1352.7088038674194,PayPal,España,Paris,Cancelado,2024-08-26 12:00:00
433.0,1122,Laura Torres,94,Cafetera Philips,Hogar,2023-01-27,1.0,1240.25,1240.25,Bizum,France,Paris,Pendiente,2023-01-27 11:00:00
434.0,1712,Pedro López,46,Samsung Galaxy,Tecnología,24/10/2024,4.0,211.23,691.8064498452658,Tarjeta,IT,Berlín,Pendiente,2024-10-24 21:00:00
435.0,1521,Pedro López,16,Samsung Galaxy,Tecnología,27/07/2023,4.0,177.37,709.48,PayPal,spain,Paris,Pendiente,2023-07-27 16:00:00
436.0,1941,Pedro López,20,iPhone 13,Tecnología,2024-10-01,1.0,1404.93,1404.93,PayPal,IT,Lyon,Cancelado,2024-10-01 05:00:00
437.0,1517,Ana Sánchez,91,Aspiradora Dyson,Hogar,19/07/2023,5.0,154.8,774.0,Tarjeta,Italy,Barcelona,Pendiente,2023-07-19 02:00:00
438.0,1506,Lucía Fernández,68,Bolso Gucci,Moda,2023-02-05,4.0,1645.5,6582.0,Tarjeta,Germany,Barcelona,Entregado,2023-02-05 08:00:00
439.0,1445,Juan Pérez,136,Sony Headphones,Tecnología,07-07-2024,1.0,1415.42,1415.42,PayPal,Germany,Barcelona,Cancelado,2024-07-07 00:00:00
440.0,1646,Ana Sánchez,183,Cafetera Philips,Hogar,10-14-2023,2.0,171.88,343.76,PayPal,IT,Roma,Pendiente,2023-10-14 03:00:00
441.0,1703,Juan Pérez,198,Bolso Gucci,Moda,2024-03-20,5.0,178.83,894.15,Transferencia,Germany,Berlín,Entregado,2024-03-20 22:00:00
442.0,1370,Laura Torres,187,Aspiradora Dyson,Hogar,03-04-2024,5.0,1973.41,9867.05,Tarjeta,DE,Lyon,Cancelado,2024-03-04 01:00:00
443.0,1774,Ana Sánchez,145,Camiseta Adidas,Moda,12-17-2023,1.0,754.8,754.8,Transferencia,IT,Paris,Cancelado,2023-12-17 23:00:00
444.0,1026,David Gómez,104,Reloj Casio,Accesorios,08-11-2023,5.0,747.58,3787.205738527191,Transferencia,Italy,Valencia,Cancelado,2023-08-11 07:00:00
445.0,1045,Laura Torres,189,Monitor LG,moda,2023-01-16,4.0,1627.47,6509.88,Transferencia,spain,Lyon,Pendiente,2023-01-16 06:00:00
446.0,1287,Pedro López,116,AirPods,TECHNOLOGY,05/03/2023,3.0,1895.02,5685.06,Transferencia,IT,Roma,Pendiente,2023-03-05 07:00:00
447.0,1429,Laura Torres,152,AirPods,Tecnología,27/04/2023,2.0,1972.14,3944.28,Transferencia,Italy,Berlín,Entregado,2023-04-27 19:00:00
448.0,1251,MARÍA GARCÍA,44,Mochila North Face,Accesorios,16/01/2024,5.0,1509.22,7546.1,Tarjeta,France,Hamburgo,Pendiente,2024-01-16 08:00:00
449.0,1385,David Gómez,119,Bolso Gucci,Moda,11-19-2023,5.0,758.76,3793.8,Tarjeta,Germany,Lyon,Cancelado,2023-11-19 01:00:00
450.0,1126,María García,66,AirPods,Tecnología,11-27-2023,1.0,176.17,176.17,PayPal,DE,Roma,Entregado,2023-11-27 02:00:00
451.0,1573,Pedro López,128,MacBook Pro,Tecnología,28/11/2023,1.0,1556.52,1556.52,Bizum,IT,Barcelona,Pendiente,2023-11-28 08:00:00
452.0,1127,laura torres,160,Aspiradora Dyson,Hogar,03-08-2024,2.0,1121.22,2242.44,Bizum,FR,Paris,Entregado,2024-03-08 09:00:00
453.0,1835,Pedro López,89,Teclado Logitech,Tecnología,31/08/2023,3.0,854.2,2562.6,Transferencia,FR,Madrid,Entregado,2023-08-31 06:00:00
454.0,1484,Laura Torres,153,Cafetera Philips,Hogar,2024-02-12,5.0,1813.65,9068.25,PayPal,DE,Roma,Entregado,2024-02-12 00:00:00
455.0,1525,Ana Sánchez,128,MacBook Pro,Tecnología,2024-01-13,5.0,231.28,1156.4,Transferencia,DE,Roma,Pendiente,2024-01-13 22:00:00
456.0,1181,Lucía Fernández,170,Reloj Casio,Accesorios,2023-12-24,4.0,990.32,3961.28,PayPal,France,Hamburgo,Cancelado,2023-12-24 08:00:00
457.0,1662,CARLOS RUIZ,92,Aspiradora Dyson,hogar,24/07/2023,1.0,$32.59,,Transferencia,FR,Milán,Pendiente,2023-07-24 05:00:00
458.0,1762,David Gómez,115,Reloj Casio,Accesorios,08-28-2024,1.0,942.63,942.63,Bizum,ES,Milán,Entregado,2024-08-28 16:00:00
459.0,1783,David Gómez,81,Sony Headphones,Tecnología,07/02/2023,3.0,$122.04,,PayPal,FR,Valencia,Pendiente,2023-02-07 23:00:00
460.0,1978,Juan Pérez,151,Silla Gaming,Hogar,06/04/2023,2.0,246.45,492.9,PayPal,FR,Barcelona,Entregado,2023-04-06 21:00:00
461.0,1768,Lucía Fernández,1,Camiseta Adidas,Moda,11-22-2023,5.0,243.88,1361.816442120244,PayPal,IT,Paris,Pendiente,2023-11-22 14:00:00
462.0,1763,David Gómez,187,MacBook Pro,Tecnología,03/10/2024,1.0,1301.93,1301.93,Transferencia,FR,Milán,Pendiente,2024-10-03 18:00:00
463.0,1835,María García,146,Camiseta Adidas,Moda,25/03/2023,3.0,1494.63,4483.89,PayPal,Italy,Madrid,Cancelado,2023-03-25 17:00:00
464.0,1383,Pedro López,3,AirPods,Tecnología,07-30-2024,2.0,1170.9,2335.5624731552975,Transferencia,España,Valencia,Cancelado,2024-07-30 15:00:00
465.0,1818,Carlos Ruiz,143,Camiseta Adidas,Moda,2023-02-21,4.0,1924.72,7698.88,Bizum,Germany,Barcelona,Entregado,2023-02-21 22:00:00
466.0,1763,Laura Torres,53,iPhone 13,moda,2024-02-13,3.0,755.99,2267.97,Bizum,España,Hamburgo,Cancelado,2024-02-13 03:00:00
467.0,1113,carlos ruiz,97,Teclado Logitech,Tecnología,2023-05-11,5.0,578.57,2908.008204098907,Bizum,France,Milán,Entregado,2023-05-11 22:00:00
468.0,1233,David Gómez,154,Zapatillas Nike,Moda,2024-10-06,3.0,1738.51,5215.53,PayPal,spain,Roma,Cancelado,2024-10-06 00:00:00
469.0,1873,Carlos Ruiz,32,Monitor LG,HOGAR,01/04/2023,3.0,454.96,1364.88,Transferencia,DE,Valencia,Pendiente,2023-04-01 01:00:00
470.0,1503,LAURA TORRES,163,AirPods,Tecnología,01-23-2024,5.0,1926.81,9634.05,PayPal,France,Madrid,Cancelado,2024-01-23 07:00:00
471.0,1194,María García,190,Cafetera Philips,Hogar,08/06/2024,5.0,34.19,149.105518783191,Transferencia,IT,Berlín,Cancelado,2024-06-08 03:00:00
472.0,1554,LAURA TORRES,73,Bolso Gucci,Moda,07-23-2023,5.0,1940.06,9700.3,Transferencia,Italy,Madrid,Cancelado,2023-07-23 13:00:00
473.0,1710,Juan Pérez,109,Cafetera Philips,Hogar,2023-09-30,2.0,95.89,191.78,Tarjeta,ES,Hamburgo,Pendiente,2023-09-30 12:00:00
474.0,1351,Ana Sánchez,167,Aspiradora Dyson,hogar,07/01/2023,3.0,1783.37,5350.11,Tarjeta,spain,Valencia,Pendiente,2023-01-07 05:00:00
475.0,1745,David Gómez,13,Samsung Galaxy,Tecnología,07-30-2024,1.0,1060.13,1060.13,Tarjeta,FR,Lyon,Cancelado,2024-07-30 23:00:00
476.0,1835,Carlos Ruiz,127,Cafetera Philips,Hogar,2023-05-12,2.0,1986.0,3972.0,PayPal,France,Milán,Pendiente,2023-05-12 19:00:00
477.0,1694,María García,49,Zapatillas Nike,Moda,2023-01-11,4.0,156.86,627.44,Tarjeta,IT,Roma,Cancelado,2023-01-11 08:00:00
478.0,1136,Laura Torres,130,iPhone 13,Tecnología,2023-10-30,2.0,1112.17,2224.34,Tarjeta,España,Barcelona,Pendiente,2023-10-30 03:00:00
479.0,1850,Laura Torres,56,Monitor LG,Tecnología,07-31-2024,1.0,1938.91,1938.91,PayPal,spain,Hamburgo,Entregado,2024-07-31 22:00:00
480.0,1434,María García,153,Sony Headphones,Tecnología,2023-07-23,2.0,1050.96,2101.92,Bizum,DE,Milán,Pendiente,2023-07-23 04:00:00
481.0,1107,María García,25,Teclado Logitech,Tecnología,04/11/2024,1.0,1262.5,1262.5,PayPal,España,Paris,Pendiente,2024-11-04 05:00:00
482.0,1848,Carlos Ruiz,77,MacBook Pro,Tecnología,08-30-2023,1.0,1394.54,1394.54,Tarjeta,FR,Barcelona,Cancelado,2023-08-30 09:00:00
483.0,1827,PEDRO LÓPEZ,195,Bolso Gucci,Moda,16/07/2024,4.0,914.54,3658.16,Transferencia,Italy,Paris,Pendiente,2024-07-16 17:00:00
484.0,1456,juan pérez,176,AirPods,Tecnología,2024-08-24,3.0,1258.84,3776.52,Transferencia,spain,Roma,Entregado,2024-08-24 14:00:00
485.0,1839,Ana Sánchez,11,Cafetera Philips,Hogar,2024-08-29,4.0,1172.79,4691.16,Tarjeta,ES,Valencia,Entregado,2024-08-29 23:00:00
486.0,1314,maría garcía,137,AirPods,Tecnología,2024-04-22,5.0,1803.3,9016.5,Transferencia,FR,Madrid,Pendiente,2024-04-22 11:00:00
487.0,1177,DAVID GÓMEZ,159,Mochila North Face,Accesorios,01-09-2023,1.0,"100,44",,Tarjeta,spain,Lyon,Cancelado,2023-01-09 09:00:00
488.0,1314,María García,76,Bolso Gucci,Moda,08-18-2024,2.0,569.12,1138.24,Tarjeta,DE,Paris,Entregado,2024-08-18 12:00:00
489.0,1548,Ana Sánchez,48,Silla Gaming,Hogar,12/06/2024,3.0,1901.32,6107.359837137522,Bizum,spain,Madrid,Cancelado,2024-06-12 01:00:00
490.0,1363,David Gómez,178,Camiseta Adidas,Moda,11-03-2024,4.0,"1781,62",0.0,Transferencia,DE,Valencia,Pendiente,2024-11-03 14:00:00
491.0,1356,Juan Pérez,199,MacBook Pro,Tecnología,15/10/2023,1.0,916.76,916.76,PayPal,España,Barcelona,Pendiente,2023-10-15 22:00:00
492.0,1171,Juan Pérez,22,Teclado Logitech,Tecnología,03-24-2024,3.0,1244.06,3732.18,PayPal,DE,Milán,Pendiente,2024-03-24 05:00:00
493.0,1516,carlos ruiz,87,Silla Gaming,Hogar,03-28-2023,5.0,561.99,2809.95,PayPal,FR,Madrid,Entregado,2023-03-28 18:00:00
494.0,1437,Pedro López,5,Sony Headphones,Tecnología,04-05-2024,5.0,384.36,1921.8,Transferencia,FR,Barcelona,Entregado,2024-04-05 02:00:00
495.0,1717,Carlos Ruiz,72,Teclado Logitech,Tecnología,03-02-2023,3.0,932.76,2798.28,PayPal,spain,Lyon,Pendiente,2023-03-02 00:00:00
496.0,1778,Lucía Fernández,133,Cafetera Philips,Hogar,29/10/2023,,713.17,,Bizum,ES,Milán,Cancelado,2023-10-29 18:00:00
497.0,1584,Carlos Ruiz,60,MacBook Pro,Tecnología,08/07/2024,3.0,1171.48,3514.44,Transferencia,IT,Roma,Entregado,2024-07-08 10:00:00
498.0,1398,Carlos Ruiz,192,Samsung Galaxy,Tecnología,11-14-2023,1.0,164.69,164.69,Transferencia,spain,Roma,Cancelado,2023-11-14 01:00:00
499.0,1693,laura torres,2,Silla Gaming,Hogar,2024-04-20,5.0,1949.05,9745.25,Tarjeta,Germany,Roma,Entregado,2024-04-20 13:00:00
500.0,1320,Carlos Ruiz,31,AirPods,Tecnología,2024-11-19,3.0,$1972.56,,PayPal,FR,Valencia,Cancelado,2024-11-19 01:00:00
501.0,1569,Carlos Ruiz,182,Cafetera Philips,tech,10/06/2024,2.0,1399.34,2769.989950966943,Transferencia,España,Paris,Cancelado,2024-06-10 19:00:00
502.0,1706,laura torres,169,Sony Headphones,Tecnología,03-28-2023,3.0,$1076.83,,Bizum,France,Paris,Entregado,2023-03-28 03:00:00
503.0,1975,CARLOS RUIZ,196,Monitor LG,Tecnología,05-09-2024,2.0,625.96,1251.92,Tarjeta,France,Paris,Entregado,2024-05-09 11:00:00
504.0,1759,Ana Sánchez,83,Aspiradora Dyson,Hogar,2024-04-12,5.0,1629.45,8147.25,Transferencia,spain,Hamburgo,Pendiente,2024-04-12 20:00:00
505.0,1844,Ana Sánchez,44,Reloj Casio,Accesorios,2023-09-15,3.0,1372.62,4117.86,Bizum,Italy,Roma,Entregado,2023-09-15 07:00:00
506.0,1739,Pedro López,10,Reloj Casio,Accesorios,22/01/2024,3.0,333.61,1000.83,Tarjeta,Germany,Madrid,Cancelado,2024-01-22 16:00:00
507.0,1990,juan pérez,15,Cafetera Philips,Hogar,2023-01-23,4.0,1822.75,7291.0,Transferencia,España,Milán,Pendiente,2023-01-23 00:00:00
508.0,1756,David Gómez,166,Teclado Logitech,Tecnología,17/01/2023,3.0,1646.85,4940.55,Bizum,IT,Berlín,Entregado,2023-01-17 21:00:00
509.0,1519,David Gómez,48,Bolso Gucci,Moda,2023-03-24,1.0,1900.1,1900.1,Transferencia,France,Roma,Cancelado,2023-03-24 19:00:00
510.0,1592,LUCÍA FERNÁNDEZ,97,Cafetera Philips,Hogar,2023-10-02,1.0,1454.18,1454.18,Bizum,Italy,Hamburgo,Pendiente,2023-10-02 17:00:00
511.0,1381,maría garcía,147,Samsung Galaxy,Tecnología,24/04/2024,2.0,1230.7,2461.4,PayPal,IT,Hamburgo,Pendiente,2024-04-24 10:00:00
512.0,1526,Ana Sánchez,194,Teclado Logitech,Tecnología,07-31-2023,3.0,842.3,2526.9,Bizum,Germany,Lyon,Entregado,2023-07-31 15:00:00
513.0,1979,lucía fernández,8,iPhone 13,Tecnología,10-15-2023,1.0,"1866,13",,PayPal,Germany,Milán,Pendiente,2023-10-15 16:00:00
514.0,1349,María García,61,Silla Gaming,Hogar,09-27-2023,3.0,1733.47,5200.41,Bizum,France,Valencia,Pendiente,2023-09-27 09:00:00
515.0,1661,María García,173,Camiseta Adidas,Moda,02-28-2023,3.0,99.99,299.97,PayPal,spain,Madrid,Cancelado,2023-02-28 12:00:00
516.0,1647,Ana Sánchez,12,Mochila North Face,Accesorios,12-26-2023,1.0,$62.47,,Transferencia,ES,Hamburgo,Entregado,2023-12-26 19:00:00
517.0,1361,David Gómez,42,Monitor LG,Tecnología,03/11/2024,2.0,759.16,1518.32,Tarjeta,spain,Lyon,Cancelado,2024-11-03 17:00:00
518.0,1477,María García,122,Aspiradora Dyson,Hogar,03-09-2024,4.0,1623.0,6492.0,Transferencia,Germany,Roma,Pendiente,2024-03-09 16:00:00
519.0,1601,María García,38,AirPods,Tecnología,2023-09-24,4.0,1974.68,7898.72,Tarjeta,ES,Valencia,Pendiente,2023-09-24 12:00:00
520.0,1904,pedro lópez,178,Monitor LG,Tecnología,02-19-2023,4.0,309.33,1237.32,Bizum,DE,Berlín,Entregado,2023-02-19 07:00:00
521.0,1679,ana sánchez,89,Aspiradora Dyson,Hogar,31/05/2024,1.0,$1192.32,,PayPal,DE,Roma,Cancelado,2024-05-31 13:00:00
522.0,1495,Lucía Fernández,113,Reloj Casio,Accesorios,2023-04-06,5.0,767.97,3839.85,Bizum,Germany,Hamburgo,Cancelado,2023-04-06 12:00:00
523.0,1907,María García,21,AirPods,Tecnología,2024-01-24,3.0,1940.13,6930.521809686033,PayPal,ES,Hamburgo,Pendiente,2024-01-24 13:00:00
524.0,1982,Carlos Ruiz,49,Aspiradora Dyson,Hogar,04/11/2023,3.0,1685.82,5057.46,Tarjeta,FR,Barcelona,Pendiente,2023-11-04 04:00:00
525.0,1469,DAVID GÓMEZ,137,iPhone 13,Tecnología,09-10-2024,4.0,1678.27,6713.08,Tarjeta,France,Milán,Pendiente,2024-09-10 23:00:00
526.0,1018,carlos ruiz,117,AirPods,Tecnología,18/01/2023,2.0,942.7,1885.4,Tarjeta,Italy,Valencia,Pendiente,2023-01-18 22:00:00
527.0,1579,María García,105,Teclado Logitech,Tecnología,06/08/2024,3.0,835.49,2506.47,Bizum,España,Valencia,Entregado,2024-08-06 19:00:00
528.0,1830,María García,82,Mochila North Face,Accesorios,09-12-2024,1.0,554.08,554.08,PayPal,spain,Lyon,Entregado,2024-09-12 16:00:00
529.0,1637,Pedro López,52,AirPods,Tecnología,2024-01-27,3.0,122.19,366.57,Bizum,ES,Valencia,Pendiente,2024-01-27 11:00:00
530.0,1439,Laura Torres,30,Mochila North Face,moda,2024-03-28,5.0,1730.8,8654.0,Tarjeta,DE,Milán,Cancelado,2024-03-28 00:00:00
531.0,1374,Laura Torres,181,Reloj Casio,Accesorios,11-29-2024,5.0,1627.67,8138.35,Tarjeta,France,Barcelona,Entregado,2024-11-29 23:00:00
532.0,1399,Juan Pérez,137,AirPods,Tecnología,03/07/2023,1.0,1999.44,1999.44,PayPal,Italy,Berlín,Cancelado,2023-07-03 19:00:00
533.0,1234,María García,30,Aspiradora Dyson,Hogar,08-01-2023,2.0,1993.31,3986.62,Transferencia,Italy,Valencia,Entregado,2023-08-01 13:00:00
534.0,1912,MARÍA GARCÍA,58,Zapatillas Nike,Moda,03/07/2024,1.0,1115.31,1115.31,Bizum,Italy,Valencia,Cancelado,2024-07-03 15:00:00
535.0,1177,Pedro López,61,iPhone 13,Tecnología,23/02/2023,5.0,1540.28,7701.4,Tarjeta,ES,Valencia,Pendiente,2023-02-23 18:00:00
536.0,1579,JUAN PÉREZ,21,MacBook Pro,Tecnología,02-06-2023,5.0,1890.08,9450.4,PayPal,España,Milán,Pendiente,2023-02-06 01:00:00
537.0,1402,Ana Sánchez,89,AirPods,Tecnología,2024-07-14,1.0,1700.8,1700.8,Tarjeta,Germany,Barcelona,Entregado,2024-07-14 10:00:00
538.0,1091,Pedro López,112,AirPods,Tecnología,01-06-2023,5.0,502.22,2276.020689533129,Tarjeta,ES,Milán,Pendiente,2023-01-06 18:00:00
539.0,1403,Pedro López,172,Bolso Gucci,tecnologia,2024-09-10,2.0,906.58,1981.642700934248,Tarjeta,Germany,Madrid,Entregado,2024-09-10 16:00:00
540.0,1773,Lucía Fernández,20,AirPods,Moda,2024-04-14,4.0,267.03,1068.12,Bizum,FR,Milán,Pendiente,2024-04-14 22:00:00
541.0,1344,Juan Pérez,8,Monitor LG,TECHNOLOGY,04-19-2023,3.0,"1908,56",,Bizum,ES,Madrid,Pendiente,2023-04-19 08:00:00
542.0,1361,Juan Pérez,93,Teclado Logitech,tech,2024-11-15,4.0,1216.29,4865.16,Transferencia,France,Hamburgo,Entregado,2024-11-15 03:00:00
543.0,1971,Lucía Fernández,163,iPhone 13,Tecnología,03-28-2023,5.0,465.0,2325.0,Tarjeta,Germany,Roma,Entregado,2023-03-28 23:00:00
544.0,1899,Lucía Fernández,179,Camiseta Adidas,Moda,2024-10-19,4.0,1346.68,5386.72,Transferencia,France,Hamburgo,Cancelado,2024-10-19 08:00:00
545.0,1311,David Gómez,107,Camiseta Adidas,Moda,20/04/2023,5.0,1240.08,6200.4,PayPal,FR,Berlín,Entregado,2023-04-20 11:00:00
546.0,1912,Pedro López,81,Silla Gaming,Hogar,02-12-2024,4.0,722.74,2890.96,Tarjeta,España,Hamburgo,Cancelado,2024-02-12 09:00:00
547.0,1180,laura torres,8,Aspiradora Dyson,Hogar,21/02/2024,3.0,235.98,707.94,Transferencia,España,Hamburgo,Pendiente,2024-02-21 02:00:00
548.0,1661,LAURA TORRES,155,Samsung Galaxy,Tecnología,2023-03-17,2.0,1346.43,2692.86,Tarjeta,France,Paris,Pendiente,2023-03-17 19:00:00
549.0,1279,Juan Pérez,103,Bolso Gucci,Moda,01/02/2023,3.0,1045.41,3136.23,Transferencia,FR,Lyon,Cancelado,2023-02-01 20:00:00
550.0,1327,Laura Torres,181,Monitor LG,Tecnología,2024-06-05,4.0,1546.91,5154.156900397464,PayPal,ES,Berlín,Cancelado,2024-06-05 11:00:00
551.0,1801,Ana Sánchez,149,Zapatillas Nike,Moda,04-03-2023,1.0,1045.13,1045.13,PayPal,spain,Roma,Cancelado,2023-04-03 12:00:00
,1524,Laura Torres,165,MacBook Pro,Tecnología,09-19-2023,3.0,1705.84,5117.52,Bizum,ES,Barcelona,Cancelado,2023-09-19 12:00:00
553.0,1704,LAURA TORRES,46,Cafetera Philips,Hogar,07-14-2023,5.0,1108.29,5541.45,Transferencia,Germany,Madrid,Cancelado,2023-07-14 20:00:00
554.0,1446,Pedro López,22,Aspiradora Dyson,Hogar,25/07/2023,2.0,1126.27,2252.54,Bizum,ES,Paris,Cancelado,2023-07-25 07:00:00
555.0,1800,María García,118,Camiseta Adidas,Moda,03/11/2024,3.0,1754.54,5263.62,PayPal,Italy,Paris,Entregado,2024-11-03 13:00:00
556.0,1548,María García,129,Sony Headphones,Tecnología,26/06/2024,4.0,812.93,3251.72,PayPal,IT,Milán,Pendiente,2024-06-26 12:00:00
557.0,1907,María García,129,Teclado Logitech,Tecnología,2024-02-20,1.0,276.69,276.69,Tarjeta,Germany,Paris,Pendiente,2024-02-20 05:00:00
558.0,1484,María García,162,Reloj Casio,Accesorios,2024-09-14,4.0,67.28,269.12,Tarjeta,España,Hamburgo,Cancelado,2024-09-14 07:00:00
559.0,1034,Juan Pérez,86,Reloj Casio,Accesorios,01/04/2023,3.0,1512.72,4538.16,Tarjeta,Germany,Milán,Cancelado,2023-04-01 08:00:00
560.0,1257,ANA SÁNCHEZ,128,Sony Headphones,Tecnología,25/08/2023,1.0,1244.42,1244.42,Transferencia,DE,Barcelona,Cancelado,2023-08-25 19:00:00
561.0,1798,Laura Torres,149,AirPods,Tecnología,04-26-2023,5.0,1411.12,7055.6,PayPal,ES,Roma,Cancelado,2023-04-26 00:00:00
562.0,1290,David Gómez,67,Aspiradora Dyson,Hogar,04/08/2023,4.0,433.8,1735.2,Tarjeta,Germany,Roma,Pendiente,2023-08-04 22:00:00
563.0,1793,Lucía Fernández,101,Silla Gaming,Hogar,22/08/2024,3.0,281.38,844.14,Bizum,DE,Valencia,Pendiente,2024-08-22 08:00:00
564.0,1274,María García,160,Mochila North Face,Accesorios,2024-03-09,5.0,38.94,221.25674997740938,Tarjeta,Germany,Hamburgo,Entregado,2024-03-09 16:00:00
565.0,1365,Pedro López,182,Reloj Casio,Accesorios,11/09/2023,2.0,707.67,1415.34,Bizum,FR,Berlín,Pendiente,2023-09-11 22:00:00
566.0,1189,Juan Pérez,96,iPhone 13,Tecnología,05/08/2024,1.0,1183.94,1183.94,PayPal,France,Paris,Cancelado,2024-08-05 12:00:00
567.0,1606,Lucía Fernández,51,Teclado Logitech,Moda,03/06/2023,5.0,790.57,3952.85,PayPal,Italy,Hamburgo,Cancelado,2023-06-03 12:00:00
568.0,1374,Ana Sánchez,27,MacBook Pro,Tecnología,2023-01-04,2.0,880.58,1761.16,Transferencia,Italy,Valencia,Pendiente,2023-01-04 19:00:00
569.0,1818,Carlos Ruiz,53,Camiseta Adidas,hogar,04/09/2023,2.0,$1809.28,,Transferencia,spain,Valencia,Cancelado,2023-09-04 07:00:00
570.0,1706,Laura Torres,48,Monitor LG,Tecnología,10-14-2023,5.0,703.03,3515.15,PayPal,España,Valencia,Entregado,2023-10-14 04:00:00
571.0,1974,Lucía Fernández,133,Sony Headphones,Tecnología,28/06/2024,3.0,1032.84,3098.52,Transferencia,Italy,Milán,Entregado,2024-06-28 23:00:00
572.0,1970,Juan Pérez,60,Aspiradora Dyson,Hogar,2024-03-20,3.0,1569.47,4184.699442139484,PayPal,DE,Valencia,Pendiente,2024-03-20 14:00:00
573.0,1448,ana sánchez,198,Reloj Casio,Accesorios,17/11/2024,3.0,799.12,2397.36,PayPal,FR,Madrid,Entregado,2024-11-17 13:00:00
574.0,1986,David Gómez,16,Camiseta Adidas,Moda,09-23-2024,5.0,1247.95,6239.75,Transferencia,DE,Madrid,Cancelado,2024-09-23 01:00:00
575.0,1580,Carlos Ruiz,188,Reloj Casio,Accesorios,14/12/2023,5.0,1726.1,9191.822573038527,Tarjeta,IT,Roma,Cancelado,2023-12-14 10:00:00
576.0,1917,David Gómez,94,Mochila North Face,Accesorios,2023-08-29,5.0,1899.55,9497.75,PayPal,France,Milán,Cancelado,2023-08-29 16:00:00
577.0,1106,Carlos Ruiz,52,MacBook Pro,Tecnología,03-31-2024,1.0,302.68,302.68,Tarjeta,DE,Berlín,Entregado,2024-03-31 16:00:00
578.0,1346,carlos ruiz,175,Silla Gaming,HOGAR,2023-09-16,2.0,"1853,91",,Transferencia,Italy,Roma,Cancelado,2023-09-16 18:00:00
579.0,1514,Pedro López,24,MacBook Pro,Tecnología,2024-07-07,2.0,989.31,1978.62,Bizum,FR,Hamburgo,Entregado,2024-07-07 07:00:00
580.0,1709,Ana Sánchez,6,Silla Gaming,moda,02-14-2024,2.0,523.91,1047.82,PayPal,Italy,Madrid,Cancelado,2024-02-14 00:00:00
581.0,1830,CARLOS RUIZ,119,Aspiradora Dyson,Hogar,09-22-2024,2.0,923.68,1847.36,Tarjeta,spain,Lyon,Pendiente,2024-09-22 19:00:00
582.0,1505,DAVID GÓMEZ,64,Bolso Gucci,Moda,08-30-2024,4.0,1960.26,7841.04,Tarjeta,DE,Barcelona,Pendiente,2024-08-30 13:00:00
583.0,1440,pedro lópez,95,Reloj Casio,Accesorios,26/10/2024,5.0,990.31,4951.55,Tarjeta,IT,Barcelona,Entregado,2024-10-26 14:00:00
584.0,1675,Juan Pérez,113,Cafetera Philips,moda,21/03/2024,3.0,664.22,1992.66,PayPal,ES,Madrid,Entregado,2024-03-21 17:00:00
585.0,1152,María García,96,iPhone 13,Tecnología,2023-12-24,5.0,1270.47,6352.35,PayPal,Italy,Paris,Entregado,2023-12-24 04:00:00
586.0,1741,JUAN PÉREZ,50,MacBook Pro,Tecnología,02-28-2024,2.0,487.89,975.78,Bizum,IT,Valencia,Cancelado,2024-02-28 09:00:00
587.0,1429,carlos ruiz,118,Bolso Gucci,Moda,27/12/2023,2.0,160.97,321.94,Tarjeta,España,Roma,Pendiente,2023-12-27 12:00:00
588.0,1240,David Gómez,88,MacBook Pro,Tecnología,03-22-2023,4.0,266.47,1074.5310963485174,Tarjeta,Italy,Milán,Cancelado,2023-03-22 15:00:00
589.0,1757,Pedro López,18,MacBook Pro,Tecnología,2023-12-20,5.0,264.81,1074.3265167035597,Bizum,France,Barcelona,Entregado,2023-12-20 19:00:00
590.0,1666,Lucía Fernández,163,Teclado Logitech,Tecnología,10-11-2023,3.0,312.29,936.87,PayPal,IT,Lyon,Cancelado,2023-10-11 10:00:00
591.0,1425,Pedro López,144,Zapatillas Nike,Moda,06-21-2023,5.0,286.27,1431.35,Bizum,FR,Berlín,Entregado,2023-06-21 11:00:00
592.0,1631,ANA SÁNCHEZ,68,Camiseta Adidas,Moda,14/09/2024,1.0,1285.34,1350.8089140132026,Bizum,Germany,Berlín,Cancelado,2024-09-14 23:00:00
593.0,1830,Ana Sánchez,111,Reloj Casio,Accesorios,02/08/2023,3.0,371.94,1115.82,Tarjeta,IT,Berlín,Entregado,2023-08-02 20:00:00
594.0,1625,María García,94,Sony Headphones,Tecnología,12/07/2024,5.0,697.88,3489.4,Tarjeta,France,Paris,Entregado,2024-07-12 05:00:00
595.0,1986,María García,98,Samsung Galaxy,Tecnología,04/08/2024,5.0,$1794.61,,PayPal,España,Madrid,Pendiente,2024-08-04 20:00:00
596.0,1426,Laura Torres,37,Samsung Galaxy,Tecnología,2023-04-13,2.0,953.18,1906.36,Tarjeta,Italy,Hamburgo,Pendiente,2023-04-13 19:00:00
597.0,1746,PEDRO LÓPEZ,9,Camiseta Adidas,Moda,2023-01-04,4.0,1338.44,5909.782493573181,PayPal,DE,Madrid,Cancelado,2023-01-04 12:00:00
598.0,1509,Juan Pérez,171,Mochila North Face,Accesorios,2024-03-19,3.0,352.92,1058.76,Transferencia,ES,Hamburgo,Entregado,2024-03-19 05:00:00
599.0,1659,David Gómez,115,Samsung Galaxy,TECHNOLOGY,13/09/2024,4.0,392.66,1570.64,Transferencia,IT,Valencia,Entregado,2024-09-13 15:00:00
600.0,1551,DAVID GÓMEZ,110,Reloj Casio,Accesorios,07-09-2023,1.0,"91,33",,Transferencia,France,Valencia,Cancelado,2023-07-09 01:00:00
601.0,1011,Ana Sánchez,21,Bolso Gucci,tecnologia,10/10/2024,4.0,346.18,1384.72,PayPal,France,Hamburgo,Cancelado,2024-10-10 15:00:00
602.0,1547,David Gómez,183,Cafetera Philips,Hogar,08/09/2023,3.0,564.39,1693.17,Tarjeta,Germany,Valencia,Cancelado,2023-09-08 08:00:00
603.0,1122,Carlos Ruiz,10,Aspiradora Dyson,Hogar,06/04/2023,4.0,362.25,1449.0,Transferencia,IT,Berlín,Pendiente,2023-04-06 15:00:00
604.0,1906,María García,112,Bolso Gucci,Moda,02-06-2024,5.0,186.52,786.8862109214064,Bizum,DE,Milán,Cancelado,2024-02-06 07:00:00
605.0,1258,David Gómez,99,iPhone 13,Tecnología,2024-03-25,4.0,250.07,1000.28,Transferencia,Germany,Valencia,Entregado,2024-03-25 22:00:00
606.0,1571,LUCÍA FERNÁNDEZ,156,iPhone 13,hogar,04/09/2024,3.0,926.95,2780.85,Tarjeta,Germany,Berlín,Entregado,2024-09-04 15:00:00
607.0,1120,David Gómez,123,Silla Gaming,Hogar,24/09/2023,3.0,420.6,1261.8,PayPal,Germany,Berlín,Pendiente,2023-09-24 02:00:00
608.0,1124,MARÍA GARCÍA,166,Samsung Galaxy,Tecnología,03/07/2024,4.0,734.9,2939.6,Tarjeta,spain,Madrid,Cancelado,2024-07-03 00:00:00
609.0,1433,David Gómez,181,iPhone 13,TECHNOLOGY,03-02-2024,4.0,1011.8,4047.2,Transferencia,Germany,Paris,Pendiente,2024-03-02 09:00:00
610.0,1143,David Gómez,52,Bolso Gucci,Moda,06-29-2023,3.0,1383.89,4151.67,Tarjeta,Germany,Madrid,Pendiente,2023-06-29 09:00:00
611.0,1900,David Gómez,174,Zapatillas Nike,Moda,11-22-2023,3.0,88.23,264.69,Bizum,Germany,Roma,Entregado,2023-11-22 08:00:00
612.0,1472,ana sánchez,34,Silla Gaming,Hogar,2023-02-01,4.0,1600.83,6403.32,PayPal,spain,Lyon,Cancelado,2023-02-01 12:00:00
613.0,1437,Carlos Ruiz,177,Monitor LG,Tecnología,2024-10-20,3.0,1259.52,3778.56,PayPal,IT,Milán,Pendiente,2024-10-20 20:00:00
614.0,1294,Carlos Ruiz,110,Sony Headphones,Tecnología,2024-08-04,5.0,172.7,863.5,PayPal,FR,Hamburgo,Entregado,2024-08-04 19:00:00
615.0,1109,Juan Pérez,19,Camiseta Adidas,Moda,2023-11-23,2.0,1748.42,3496.84,PayPal,FR,Valencia,Entregado,2023-11-23 05:00:00
616.0,1932,JUAN PÉREZ,121,Bolso Gucci,HOGAR,2023-08-01,2.0,1842.54,3685.08,Bizum,FR,Madrid,Pendiente,2023-08-01 17:00:00
617.0,1228,carlos ruiz,47,iPhone 13,Tecnología,06-05-2024,4.0,131.55,526.2,PayPal,ES,Madrid,Entregado,2024-06-05 17:00:00
618.0,1341,Lucía Fernández,68,Camiseta Adidas,Moda,2023-07-17,4.0,560.99,2243.96,Tarjeta,Germany,Berlín,Cancelado,2023-07-17 12:00:00
619.0,1714,Pedro López,18,AirPods,Tecnología,26/04/2023,3.0,$1614.34,0.0,Transferencia,France,Milán,Cancelado,2023-04-26 18:00:00
620.0,1829,Carlos Ruiz,186,iPhone 13,Tecnología,2024-08-19,3.0,1499.04,4497.12,Transferencia,spain,Barcelona,Entregado,2024-08-19 20:00:00
621.0,1947,Ana Sánchez,63,Reloj Casio,Accesorios,01-28-2023,4.0,"377,2",,Transferencia,Italy,Lyon,Cancelado,2023-01-28 13:00:00
622.0,1097,CARLOS RUIZ,68,Mochila North Face,Accesorios,17/10/2023,2.0,426.61,853.22,Bizum,DE,Madrid,Pendiente,2023-10-17 22:00:00
623.0,1500,Carlos Ruiz,169,Bolso Gucci,Moda,2024-08-25,,747.24,,Tarjeta,FR,Berlín,Cancelado,2024-08-25 04:00:00
624.0,1512,Juan Pérez,132,Aspiradora Dyson,Hogar,2023-07-28,5.0,974.2,4871.0,Transferencia,Italy,Paris,Entregado,2023-07-28 04:00:00
625.0,1272,Carlos Ruiz,87,Aspiradora Dyson,Hogar,05-17-2024,1.0,1240.33,1240.33,Tarjeta,DE,Paris,Cancelado,2024-05-17 08:00:00
626.0,1404,Carlos Ruiz,191,Monitor LG,Tecnología,05-02-2024,2.0,744.14,1488.28,Transferencia,Italy,Paris,Entregado,2024-05-02 18:00:00
627.0,1190,Ana Sánchez,55,Silla Gaming,tech,09-12-2023,4.0,930.44,3721.76,Bizum,FR,Berlín,Entregado,2023-09-12 12:00:00
628.0,1996,carlos ruiz,11,Bolso Gucci,Moda,2023-12-19,3.0,1497.47,4492.41,Bizum,Germany,Lyon,Cancelado,2023-12-19 04:00:00
629.0,1682,Juan Pérez,41,Monitor LG,Tecnología,2024-05-02,3.0,83.0,249.0,Tarjeta,France,Roma,Pendiente,2024-05-02 13:00:00
630.0,1724,Laura Torres,193,Zapatillas Nike,Moda,27/05/2023,5.0,512.35,2561.75,Transferencia,Italy,Madrid,Entregado,2023-05-27 01:00:00
631.0,1519,Juan Pérez,72,Zapatillas Nike,Moda,08-12-2023,1.0,1429.57,1429.57,PayPal,Germany,Hamburgo,Pendiente,2023-08-12 02:00:00
632.0,1269,Lucía Fernández,149,Zapatillas Nike,Moda,12/01/2024,2.0,1791.46,3582.92,Tarjeta,FR,Berlín,Entregado,2024-01-12 02:00:00
633.0,1127,Juan Pérez,33,Zapatillas Nike,Moda,07/06/2024,1.0,1028.24,1028.24,Transferencia,Germany,Milán,Entregado,2024-06-07 04:00:00
634.0,1537,Carlos Ruiz,174,Zapatillas Nike,Moda,02/08/2024,3.0,1068.91,3206.73,Transferencia,France,Madrid,Entregado,2024-08-02 06:00:00
635.0,1951,Juan Pérez,146,Mochila North Face,Accesorios,23/12/2023,2.0,223.27,446.54,Bizum,España,Valencia,Entregado,2023-12-23 04:00:00
636.0,1866,lucía fernández,155,Aspiradora Dyson,Hogar,06-23-2024,1.0,900.35,900.35,Tarjeta,Italy,Lyon,Entregado,2024-06-23 04:00:00
637.0,1419,Juan Pérez,34,Silla Gaming,Hogar,2024-02-12,5.0,1069.91,5349.55,Bizum,spain,Milán,Pendiente,2024-02-12 06:00:00
638.0,1901,Juan Pérez,104,MacBook Pro,Tecnología,08-14-2023,5.0,492.52,2462.6,PayPal,Italy,Hamburgo,Entregado,2023-08-14 16:00:00
639.0,1594,ANA SÁNCHEZ,185,Camiseta Adidas,Moda,03-11-2024,4.0,545.79,2183.16,Bizum,spain,Berlín,Entregado,2024-03-11 18:00:00
640.0,1882,Pedro López,200,iPhone 13,Tecnología,13/01/2024,2.0,760.8,1521.6,Tarjeta,IT,Berlín,Pendiente,2024-01-13 02:00:00
641.0,1009,David Gómez,95,Mochila North Face,Accesorios,2024-09-06,4.0,49.94,199.76,Bizum,DE,Madrid,Pendiente,2024-09-06 19:00:00
642.0,1999,María García,17,Samsung Galaxy,Tecnología,2024-06-17,4.0,650.94,2603.76,Transferencia,ES,Paris,Pendiente,2024-06-17 17:00:00
643.0,1487,María García,6,MacBook Pro,Tecnología,05/09/2024,3.0,430.78,1292.34,Tarjeta,España,Lyon,Cancelado,2024-09-05 09:00:00
644.0,1484,ANA SÁNCHEZ,123,Samsung Galaxy,Tecnología,2024-05-09,5.0,661.72,3308.6,Transferencia,FR,Madrid,Pendiente,2024-05-09 17:00:00
645.0,1485,ANA SÁNCHEZ,132,Mochila North Face,tech,08-06-2024,5.0,$248.33,,PayPal,DE,Barcelona,Entregado,2024-08-06 12:00:00
646.0,1229,ANA SÁNCHEZ,174,Sony Headphones,Tecnología,01-04-2023,2.0,1782.15,3564.3,Transferencia,ES,Roma,Entregado,2023-01-04 19:00:00
647.0,1578,Pedro López,42,iPhone 13,Tecnología,04-21-2024,2.0,1191.25,2382.5,Tarjeta,ES,Hamburgo,Entregado,2024-04-21 06:00:00
648.0,1303,David Gómez,171,Samsung Galaxy,Tecnología,2024-11-26,4.0,1361.41,5445.64,PayPal,ES,Hamburgo,Entregado,2024-11-26 14:00:00
649.0,1570,María García,25,Sony Headphones,Tecnología,03-23-2024,3.0,1580.45,4741.35,Tarjeta,ES,Valencia,Pendiente,2024-03-23 14:00:00
650.0,1575,DAVID GÓMEZ,120,Zapatillas Nike,Moda,04-10-2024,1.0,1001.9,1164.9129485394822,Transferencia,IT,Barcelona,Entregado,2024-04-10 19:00:00
651.0,1372,Ana Sánchez,148,MacBook Pro,Tecnología,2024-07-27,2.0,182.97,365.94,Tarjeta,IT,Lyon,Pendiente,2024-07-27 14:00:00
652.0,1426,Carlos Ruiz,54,Silla Gaming,Hogar,2023-08-24,3.0,$1078.84,,PayPal,Germany,Madrid,Cancelado,2023-08-24 02:00:00
653.0,1743,Ana Sánchez,197,MacBook Pro,Tecnología,12/07/2023,1.0,1177.81,1177.81,Tarjeta,France,Roma,Entregado,2023-07-12 01:00:00
654.0,1671,Ana Sánchez,163,Aspiradora Dyson,Hogar,22/05/2024,2.0,1493.42,3380.176130092882,Bizum,France,Lyon,Cancelado,2024-05-22 05:00:00
655.0,1708,PEDRO LÓPEZ,185,Reloj Casio,Accesorios,12/07/2023,3.0,869.0,2154.479629038838,Bizum,FR,Madrid,Cancelado,2023-07-12 03:00:00
656.0,1451,Pedro López,12,Mochila North Face,Accesorios,2023-02-22,1.0,263.88,263.88,Tarjeta,IT,Berlín,Pendiente,2023-02-22 12:00:00
657.0,1344,David Gómez,126,Reloj Casio,Accesorios,12-20-2023,3.0,574.71,1724.13,PayPal,España,Barcelona,Entregado,2023-12-20 21:00:00
658.0,1175,Pedro López,164,Camiseta Adidas,Moda,26/06/2023,3.0,732.53,2197.59,PayPal,spain,Berlín,Cancelado,2023-06-26 03:00:00
659.0,1023,Juan Pérez,191,Reloj Casio,Moda,2024-10-31,2.0,1295.38,2498.9132154169806,Transferencia,France,Paris,Entregado,2024-10-31 20:00:00
660.0,1864,maría garcía,171,Reloj Casio,Accesorios,09-06-2024,4.0,1145.85,4583.4,Tarjeta,DE,Barcelona,Pendiente,2024-09-06 05:00:00
661.0,1486,Laura Torres,109,MacBook Pro,tecnologia,23/05/2024,1.0,718.63,718.63,Bizum,ES,Valencia,Entregado,2024-05-23 23:00:00
662.0,1932,maría garcía,108,MacBook Pro,Tecnología,2023-04-28,4.0,1973.17,7892.68,Tarjeta,ES,Berlín,Entregado,2023-04-28 18:00:00
663.0,1660,Pedro López,196,Camiseta Adidas,Moda,08-03-2023,2.0,1215.49,2430.98,Tarjeta,DE,Hamburgo,Cancelado,2023-08-03 07:00:00
664.0,1130,Pedro López,113,Teclado Logitech,Tecnología,07/03/2024,5.0,482.08,2408.002074471545,Tarjeta,Italy,Lyon,Entregado,2024-03-07 00:00:00
665.0,1835,Ana Sánchez,102,Teclado Logitech,Tecnología,09/08/2024,4.0,212.55,850.2,PayPal,DE,Valencia,Entregado,2024-08-09 20:00:00
,1782,Laura Torres,80,Aspiradora Dyson,Hogar,31/03/2024,5.0,314.19,1570.95,Transferencia,Germany,Madrid,Pendiente,2024-03-31 06:00:00
667.0,1829,Lucía Fernández,173,MacBook Pro,Tecnología,2024-05-03,5.0,499.46,2497.3,Bizum,IT,Milán,Entregado,2024-05-03 03:00:00
668.0,1249,Ana Sánchez,129,Monitor LG,Tecnología,19/05/2023,1.0,$329.76,,Bizum,Germany,Roma,Pendiente,2023-05-19 14:00:00
669.0,1370,Pedro López,88,Monitor LG,Tecnología,20/06/2024,3.0,381.27,1143.81,Transferencia,FR,Madrid,Pendiente,2024-06-20 02:00:00
670.0,1114,Carlos Ruiz,180,MacBook Pro,tech,2023-01-05,3.0,577.34,1732.02,Bizum,DE,Hamburgo,Pendiente,2023-01-05 14:00:00
671.0,1674,Ana Sánchez,48,Monitor LG,Tecnología,2024-08-02,4.0,355.01,1420.04,Transferencia,France,Milán,Entregado,2024-08-02 12:00:00
672.0,1989,Laura Torres,14,Monitor LG,Tecnología,01-18-2023,1.0,1794.56,1454.642449267246,Tarjeta,Germany,Roma,Entregado,2023-01-18 02:00:00
673.0,1072,Ana Sánchez,28,Mochila North Face,moda,11/11/2023,3.0,169.67,509.01,Tarjeta,España,Paris,Entregado,2023-11-11 02:00:00
674.0,1485,David Gómez,67,Cafetera Philips,Hogar,2023-07-07,5.0,1053.78,5268.9,PayPal,España,Barcelona,Cancelado,2023-07-07 08:00:00
675.0,1340,juan pérez,108,Zapatillas Nike,Moda,15/03/2024,2.0,826.69,1653.38,Bizum,IT,Madrid,Cancelado,2024-03-15 22:00:00
676.0,1853,Carlos Ruiz,107,Monitor LG,Tecnología,24/01/2024,5.0,$1964.93,,Bizum,FR,Valencia,Entregado,2024-01-24 04:00:00
677.0,1019,Lucía Fernández,157,Silla Gaming,Hogar,19/06/2024,1.0,232.96,232.96,Tarjeta,DE,Milán,Pendiente,2024-06-19 22:00:00
678.0,1400,David Gómez,18,iPhone 13,Tecnología,2024-06-06,2.0,$801.73,,Transferencia,Italy,Milán,Pendiente,2024-06-06 00:00:00
679.0,1568,María García,88,Aspiradora Dyson,Hogar,2024-11-03,2.0,1939.25,3878.5,Bizum,España,Milán,Cancelado,2024-11-03 20:00:00
680.0,1156,Ana Sánchez,133,Cafetera Philips,Hogar,01-02-2023,3.0,1732.36,5197.08,Tarjeta,ES,Valencia,Cancelado,2023-01-02 19:00:00
681.0,1963,DAVID GÓMEZ,113,Zapatillas Nike,tech,22/02/2024,2.0,"1635,97",0.0,Bizum,Germany,Milán,Entregado,2024-02-22 12:00:00
682.0,1351,Carlos Ruiz,1,MacBook Pro,Tecnología,22/10/2024,4.0,523.23,2092.92,PayPal,Italy,Valencia,Cancelado,2024-10-22 17:00:00
683.0,1397,Laura Torres,100,MacBook Pro,Tecnología,2024-03-09,1.0,350.07,350.07,Transferencia,Germany,Barcelona,Cancelado,2024-03-09 19:00:00
684.0,1102,Ana Sánchez,93,Sony Headphones,Tecnología,17/02/2024,5.0,1340.6,5666.9554901211895,PayPal,IT,Berlín,Cancelado,2024-02-17 23:00:00
685.0,1577,María García,165,Cafetera Philips,tecnologia,2023-06-12,4.0,"1859,46",,PayPal,spain,Paris,Entregado,2023-06-12 16:00:00
686.0,1355,ana sánchez,102,AirPods,Tecnología,2024-02-17,2.0,1117.96,2235.92,Transferencia,FR,Lyon,Entregado,2024-02-17 06:00:00
,1513,Juan Pérez,117,Aspiradora Dyson,Hogar,03-09-2024,5.0,1147.51,5737.55,Transferencia,spain,Hamburgo,Pendiente,2024-03-09 10:00:00
688.0,1901,Lucía Fernández,142,Bolso Gucci,Moda,30/04/2024,4.0,567.16,2268.64,Bizum,IT,Paris,Pendiente,2024-04-30 05:00:00
689.0,1391,David Gómez,200,AirPods,Tecnología,2023-05-11,5.0,1541.29,7706.45,Bizum,ES,Roma,Entregado,2023-05-11 03:00:00
690.0,1457,Laura Torres,17,AirPods,Tecnología,04/09/2023,5.0,382.22,1911.1,Bizum,Italy,Lyon,Cancelado,2023-09-04 21:00:00
691.0,1263,Pedro López,30,AirPods,Tecnología,25/11/2023,5.0,654.12,3317.360109114587,Transferencia,Italy,Lyon,Entregado,2023-11-25 08:00:00
692.0,1829,Carlos Ruiz,54,Aspiradora Dyson,Hogar,29/03/2023,3.0,856.62,2569.86,Transferencia,Germany,Valencia,Entregado,2023-03-29 19:00:00
693.0,1413,ana sánchez,119,Samsung Galaxy,Tecnología,2024-02-10,4.0,1020.14,4080.56,Tarjeta,Italy,Barcelona,Entregado,2024-02-10 11:00:00
694.0,1306,Pedro López,18,Teclado Logitech,Tecnología,04-06-2024,3.0,"492,4",0.0,PayPal,España,Berlín,Pendiente,2024-04-06 17:00:00
695.0,1065,JUAN PÉREZ,26,iPhone 13,Tecnología,09-27-2024,5.0,238.53,1192.65,Tarjeta,DE,Hamburgo,Pendiente,2024-09-27 00:00:00
696.0,1687,David Gómez,166,Aspiradora Dyson,Hogar,29/04/2024,3.0,1225.13,3675.39,Tarjeta,DE,Hamburgo,Cancelado,2024-04-29 11:00:00
697.0,1889,Pedro López,154,Teclado Logitech,Tecnología,07-01-2024,4.0,584.37,2337.48,Transferencia,Italy,Lyon,Pendiente,2024-07-01 15:00:00
698.0,1429,Laura Torres,141,iPhone 13,Tecnología,26/03/2023,5.0,1166.66,5833.3,PayPal,FR,Madrid,Cancelado,2023-03-26 17:00:00
699.0,1586,Ana Sánchez,3,Camiseta Adidas,Moda,05-11-2024,4.0,317.18,1268.72,Bizum,ES,Berlín,Pendiente,2024-05-11 13:00:00
700.0,1153,ANA SÁNCHEZ,158,Sony Headphones,Tecnología,07/07/2024,5.0,967.47,4837.35,PayPal,spain,Berlín,Pendiente,2024-07-07 12:00:00
701.0,1896,Ana Sánchez,161,Monitor LG,Tecnología,2023-04-02,4.0,1069.85,4279.4,Bizum,ES,Valencia,Entregado,2023-04-02 15:00:00
702.0,1334,Laura Torres,127,Cafetera Philips,Hogar,02-27-2023,2.0,113.13,226.26,Transferencia,DE,Paris,Cancelado,2023-02-27 06:00:00
,1019,Carlos Ruiz,136,Zapatillas Nike,TECHNOLOGY,2023-09-16,4.0,679.84,2719.36,Transferencia,FR,Roma,Pendiente,2023-09-16 18:00:00
704.0,1708,PEDRO LÓPEZ,158,Silla Gaming,Hogar,02-27-2024,2.0,277.49,554.98,Transferencia,IT,Lyon,Pendiente,2024-02-27 22:00:00
705.0,1011,Laura Torres,52,Samsung Galaxy,moda,2023-11-04,3.0,136.12,408.36,PayPal,España,Lyon,Cancelado,2023-11-04 17:00:00
706.0,1365,Laura Torres,52,AirPods,Tecnología,27/12/2023,1.0,1980.02,1980.02,Tarjeta,ES,Roma,Cancelado,2023-12-27 05:00:00
707.0,1842,Juan Pérez,179,Bolso Gucci,Moda,2024-07-08,2.0,651.48,1302.96,Transferencia,España,Paris,Pendiente,2024-07-08 08:00:00
708.0,1230,David Gómez,189,Silla Gaming,Hogar,02-28-2023,5.0,1621.65,8108.25,Tarjeta,spain,Paris,Pendiente,2023-02-28 21:00:00
709.0,1245,Laura Torres,64,Zapatillas Nike,Moda,2023-05-26,1.0,516.73,516.73,Transferencia,spain,Paris,Cancelado,2023-05-26 02:00:00
710.0,1075,Laura Torres,155,Reloj Casio,hogar,03-12-2023,4.0,1366.19,5464.76,PayPal,FR,Madrid,Cancelado,2023-03-12 02:00:00
711.0,1093,Juan Pérez,74,Bolso Gucci,Moda,03-15-2024,1.0,1522.85,1522.85,PayPal,ES,Milán,Pendiente,2024-03-15 07:00:00
712.0,1436,Laura Torres,128,Zapatillas Nike,Moda,04-09-2023,1.0,1195.32,1195.32,Bizum,FR,Hamburgo,Entregado,2023-04-09 08:00:00
713.0,1157,Ana Sánchez,176,Camiseta Adidas,Moda,10-06-2024,3.0,948.44,2845.32,PayPal,Germany,Paris,Pendiente,2024-10-06 04:00:00
714.0,1733,María García,20,Reloj Casio,TECHNOLOGY,2023-08-28,3.0,829.56,2488.68,Transferencia,DE,Valencia,Cancelado,2023-08-28 20:00:00
715.0,1080,Carlos Ruiz,49,Monitor LG,Tecnología,2024-07-01,3.0,"704,25",,PayPal,DE,Roma,Pendiente,2024-07-01 22:00:00
716.0,1118,Laura Torres,66,Cafetera Philips,Hogar,17/09/2023,1.0,1859.76,1859.76,Transferencia,Italy,Berlín,Pendiente,2023-09-17 11:00:00
717.0,1630,DAVID GÓMEZ,61,Reloj Casio,Accesorios,09-24-2024,5.0,$1662.93,,Transferencia,France,Lyon,Pendiente,2024-09-24 00:00:00
718.0,1262,Laura Torres,143,Samsung Galaxy,Tecnología,10/07/2024,1.0,1930.4,1930.4,Bizum,FR,Milán,Entregado,2024-07-10 02:00:00
719.0,1543,Lucía Fernández,120,Teclado Logitech,Tecnología,01/03/2023,3.0,257.35,772.05,PayPal,FR,Hamburgo,Cancelado,2023-03-01 17:00:00
720.0,1216,Carlos Ruiz,168,Monitor LG,Tecnología,06-24-2024,3.0,"1464,43",,PayPal,España,Roma,Entregado,2024-06-24 23:00:00
721.0,1851,Juan Pérez,47,Aspiradora Dyson,Hogar,26/11/2023,3.0,1877.3,5631.9,Tarjeta,Italy,Paris,Cancelado,2023-11-26 02:00:00
722.0,1172,Juan Pérez,19,Zapatillas Nike,Moda,03-01-2024,3.0,"370,65",,Transferencia,IT,Berlín,Pendiente,2024-03-01 15:00:00
723.0,1394,juan pérez,50,Samsung Galaxy,TECHNOLOGY,03-28-2024,5.0,142.33,711.65,Tarjeta,France,Berlín,Entregado,2024-03-28 11:00:00
724.0,1487,David Gómez,109,Aspiradora Dyson,Hogar,04-13-2023,2.0,1484.83,2969.66,Transferencia,España,Madrid,Pendiente,2023-04-13 03:00:00
725.0,1350,Lucía Fernández,97,Monitor LG,Tecnología,2023-04-08,2.0,1153.2,2306.4,PayPal,France,Madrid,Pendiente,2023-04-08 01:00:00
726.0,1414,David Gómez,65,Monitor LG,Tecnología,2024-09-19,2.0,1685.24,3370.48,Transferencia,España,Milán,Pendiente,2024-09-19 07:00:00
727.0,1869,PEDRO LÓPEZ,38,Bolso Gucci,tech,08-13-2024,5.0,288.15,1440.75,PayPal,IT,Madrid,Entregado,2024-08-13 08:00:00
728.0,1858,PEDRO LÓPEZ,17,Bolso Gucci,Moda,2024-11-16,3.0,1592.58,4777.74,PayPal,Germany,Roma,Pendiente,2024-11-16 15:00:00
729.0,1361,David Gómez,154,AirPods,Tecnología,2024-09-02,1.0,"411,24",,Tarjeta,Italy,Valencia,Cancelado,2024-09-02 01:00:00
730.0,1757,María García,61,Teclado Logitech,Tecnología,2023-07-08,5.0,335.68,1891.2434382333447,Transferencia,spain,Milán,Cancelado,2023-07-08 12:00:00
731.0,1795,María García,109,Sony Headphones,Tecnología,2024-06-18,2.0,336.89,673.78,Bizum,España,Hamburgo,Entregado,2024-06-18 16:00:00
732.0,1051,Carlos Ruiz,74,Aspiradora Dyson,Hogar,2024-07-21,2.0,1631.0,3262.0,Transferencia,Germany,Barcelona,Pendiente,2024-07-21 16:00:00
733.0,1384,lucía fernández,118,Samsung Galaxy,Tecnología,2023-08-26,3.0,1333.74,4001.22,Bizum,Italy,Barcelona,Cancelado,2023-08-26 06:00:00
734.0,1460,Carlos Ruiz,89,iPhone 13,Tecnología,07-02-2023,2.0,1050.9,2101.8,PayPal,spain,Milán,Pendiente,2023-07-02 11:00:00
735.0,1261,Carlos Ruiz,13,Zapatillas Nike,Moda,03-26-2024,4.0,724.07,2896.28,PayPal,FR,Madrid,Entregado,2024-03-26 23:00:00
736.0,1628,Laura Torres,93,Mochila North Face,Accesorios,11/02/2023,4.0,1755.63,7022.52,Bizum,France,Barcelona,Entregado,2023-02-11 23:00:00
737.0,1488,Juan Pérez,193,Cafetera Philips,moda,05-25-2024,4.0,790.97,3163.88,Tarjeta,FR,Roma,Pendiente,2024-05-25 15:00:00
738.0,1915,juan pérez,71,Reloj Casio,Accesorios,2023-08-25,5.0,1635.03,8175.15,PayPal,Germany,Madrid,Pendiente,2023-08-25 04:00:00
739.0,1166,Lucía Fernández,93,MacBook Pro,Tecnología,13/08/2023,3.0,883.88,2651.64,Transferencia,Italy,Hamburgo,Pendiente,2023-08-13 04:00:00
740.0,1028,Pedro López,5,Aspiradora Dyson,Hogar,01-18-2024,1.0,760.12,760.12,PayPal,Germany,Berlín,Pendiente,2024-01-18 21:00:00
741.0,1236,david gómez,98,Zapatillas Nike,Moda,02-23-2024,1.0,"930,73",,Bizum,ES,Barcelona,Entregado,2024-02-23 09:00:00
742.0,1285,Laura Torres,115,AirPods,Tecnología,05-11-2024,2.0,609.74,1219.48,Transferencia,DE,Valencia,Entregado,2024-05-11 23:00:00
743.0,1876,Pedro López,21,MacBook Pro,Tecnología,03/01/2024,5.0,1497.74,7488.7,Transferencia,Germany,Hamburgo,Cancelado,2024-01-03 17:00:00
744.0,1843,Laura Torres,26,Samsung Galaxy,Tecnología,03-01-2023,3.0,1010.41,3031.23,PayPal,Italy,Barcelona,Entregado,2023-03-01 07:00:00
745.0,1993,JUAN PÉREZ,192,iPhone 13,Tecnología,22/06/2024,2.0,472.1,944.2,Bizum,FR,Berlín,Pendiente,2024-06-22 02:00:00
746.0,1092,Lucía Fernández,181,Zapatillas Nike,Moda,15/05/2023,4.0,1800.15,7200.6,Bizum,España,Roma,Cancelado,2023-05-15 16:00:00
747.0,1095,Carlos Ruiz,179,Cafetera Philips,Hogar,09/06/2024,3.0,773.94,2321.82,Bizum,Germany,Milán,Pendiente,2024-06-09 06:00:00
748.0,1585,Carlos Ruiz,183,Camiseta Adidas,Moda,2024-01-25,5.0,1091.67,5458.35,Transferencia,Germany,Roma,Cancelado,2024-01-25 21:00:00
749.0,1042,Laura Torres,167,Camiseta Adidas,Moda,09-03-2023,3.0,1813.88,5441.64,Bizum,DE,Valencia,Entregado,2023-09-03 20:00:00
750.0,1730,Carlos Ruiz,47,iPhone 13,Tecnología,10-13-2023,4.0,1252.23,4982.563131854797,Bizum,Italy,Roma,Cancelado,2023-10-13 15:00:00
751.0,1138,Juan Pérez,82,Aspiradora Dyson,Hogar,15/02/2023,5.0,242.63,1213.15,PayPal,Germany,Barcelona,Cancelado,2023-02-15 03:00:00
752.0,1192,María García,72,Bolso Gucci,Moda,2023-02-21,5.0,1880.27,9401.35,Bizum,France,Hamburgo,Entregado,2023-02-21 11:00:00
753.0,1893,Carlos Ruiz,178,Monitor LG,Tecnología,2023-06-08,2.0,1259.14,2518.28,Bizum,IT,Berlín,Cancelado,2023-06-08 20:00:00
754.0,1203,Lucía Fernández,47,Teclado Logitech,Tecnología,2024-02-06,5.0,676.46,3382.3,Tarjeta,Italy,Madrid,Entregado,2024-02-06 23:00:00
755.0,1119,David Gómez,95,Cafetera Philips,Hogar,05-15-2024,5.0,$287.15,,PayPal,France,Madrid,Pendiente,2024-05-15 03:00:00
756.0,1841,Laura Torres,69,Silla Gaming,Hogar,11-28-2023,1.0,$1590.11,,PayPal,España,Valencia,Cancelado,2023-11-28 09:00:00
757.0,1388,Laura Torres,17,Camiseta Adidas,Moda,2023-11-25,2.0,1243.94,2487.88,Tarjeta,France,Roma,Entregado,2023-11-25 06:00:00
758.0,1712,Ana Sánchez,104,iPhone 13,Tecnología,02-29-2024,4.0,1071.59,4286.36,Bizum,Italy,Hamburgo,Cancelado,2024-02-29 09:00:00
759.0,1509,Pedro López,97,Silla Gaming,Hogar,2024-10-10,2.0,$1788.85,,Transferencia,IT,Milán,Pendiente,2024-10-10 10:00:00
760.0,1067,JUAN PÉREZ,113,Zapatillas Nike,Moda,30/01/2024,1.0,1579.31,1579.31,PayPal,España,Lyon,Cancelado,2024-01-30 21:00:00
761.0,1318,Ana Sánchez,161,iPhone 13,hogar,2024-08-05,3.0,311.83,765.5217254638087,PayPal,Germany,Barcelona,Cancelado,2024-08-05 18:00:00
762.0,1698,Pedro López,170,Aspiradora Dyson,Hogar,2024-01-27,3.0,630.33,1890.99,Transferencia,France,Roma,Entregado,2024-01-27 15:00:00
763.0,1741,Pedro López,49,Cafetera Philips,Hogar,2023-12-14,4.0,504.49,2411.8994463501613,Bizum,IT,Valencia,Pendiente,2023-12-14 09:00:00
764.0,1878,María García,5,Zapatillas Nike,Moda,2023-11-09,1.0,1490.45,1490.45,Bizum,spain,Hamburgo,Entregado,2023-11-09 14:00:00
765.0,1579,Juan Pérez,150,Cafetera Philips,Hogar,2023-09-24,3.0,76.73,230.19,PayPal,Germany,Paris,Cancelado,2023-09-24 07:00:00
766.0,1239,Lucía Fernández,52,Monitor LG,Tecnología,02-16-2023,3.0,1144.08,3432.24,Tarjeta,DE,Roma,Pendiente,2023-02-16 15:00:00
767.0,1849,Pedro López,137,MacBook Pro,Tecnología,2024-01-05,5.0,1527.29,7636.45,Bizum,France,Berlín,Cancelado,2024-01-05 09:00:00
768.0,1008,David Gómez,45,Reloj Casio,Accesorios,02/01/2023,5.0,1754.76,8773.8,Transferencia,Italy,Milán,Cancelado,2023-01-02 17:00:00
769.0,1411,Pedro López,191,AirPods,Tecnología,10-04-2023,5.0,690.74,3453.7,Tarjeta,ES,Paris,Entregado,2023-10-04 23:00:00
770.0,1276,Carlos Ruiz,173,Silla Gaming,Hogar,04-01-2024,5.0,1644.3,8714.174133388655,PayPal,spain,Hamburgo,Cancelado,2024-04-01 03:00:00
771.0,1531,Carlos Ruiz,146,Monitor LG,Tecnología,20/07/2024,2.0,230.16,460.32,PayPal,France,Valencia,Entregado,2024-07-20 20:00:00
772.0,1529,Ana Sánchez,1,Zapatillas Nike,Moda,2024-03-22,2.0,1694.44,3388.88,Tarjeta,Germany,Milán,Cancelado,2024-03-22 18:00:00
773.0,1828,Pedro López,192,Aspiradora Dyson,Hogar,19/12/2023,1.0,263.7,263.7,Tarjeta,IT,Hamburgo,Entregado,2023-12-19 09:00:00
774.0,1338,LAURA TORRES,108,Samsung Galaxy,Tecnología,2024-02-13,2.0,800.6,1601.2,Transferencia,Italy,Valencia,Pendiente,2024-02-13 09:00:00
775.0,1987,María García,73,Silla Gaming,Hogar,2023-01-15,5.0,"1596,62",,PayPal,spain,Lyon,Cancelado,2023-01-15 01:00:00
776.0,1593,Pedro López,149,Zapatillas Nike,Moda,05/03/2024,4.0,$308.34,,PayPal,Italy,Roma,Entregado,2024-03-05 03:00:00
777.0,1194,Pedro López,82,Sony Headphones,Tecnología,2023-03-20,4.0,466.21,1864.84,Tarjeta,Germany,Hamburgo,Cancelado,2023-03-20 17:00:00
778.0,1237,María García,50,MacBook Pro,Tecnología,2023-03-24,,1447.28,,Bizum,España,Valencia,Cancelado,2023-03-24 17:00:00
779.0,1252,Ana Sánchez,189,MacBook Pro,Tecnología,2023-10-18,2.0,1442.87,2885.74,PayPal,spain,Berlín,Entregado,2023-10-18 15:00:00
780.0,1625,ana sánchez,4,Cafetera Philips,Hogar,2023-05-26,1.0,1285.88,1285.88,Bizum,DE,Roma,Entregado,2023-05-26 07:00:00
781.0,1732,David Gómez,1,Cafetera Philips,tech,2024-05-21,2.0,1390.96,2781.92,Bizum,Germany,Hamburgo,Pendiente,2024-05-21 01:00:00
782.0,1686,Pedro López,25,iPhone 13,TECHNOLOGY,2023-02-14,1.0,1090.02,1090.02,Bizum,DE,Milán,Entregado,2023-02-14 08:00:00
783.0,1200,David Gómez,33,Monitor LG,Tecnología,23/03/2023,4.0,511.08,2044.32,Bizum,spain,Valencia,Cancelado,2023-03-23 01:00:00
784.0,1903,Juan Pérez,159,AirPods,Moda,08-22-2024,4.0,697.94,2791.76,Transferencia,spain,Berlín,Entregado,2024-08-22 11:00:00
785.0,1464,laura torres,8,Teclado Logitech,Tecnología,18/03/2023,1.0,"371,38",0.0,Tarjeta,DE,Berlín,Cancelado,2023-03-18 08:00:00
786.0,1404,CARLOS RUIZ,69,Camiseta Adidas,Moda,05-01-2024,4.0,1817.82,7271.28,Transferencia,FR,Valencia,Entregado,2024-05-01 10:00:00
787.0,1619,María García,113,Mochila North Face,Accesorios,06-16-2024,5.0,1170.95,5854.75,Tarjeta,FR,Madrid,Entregado,2024-06-16 04:00:00
788.0,1783,laura torres,3,Teclado Logitech,Tecnología,27/11/2024,5.0,807.69,4038.45,PayPal,ES,Berlín,Entregado,2024-11-27 06:00:00
789.0,1404,Ana Sánchez,37,Silla Gaming,Hogar,21/05/2024,2.0,$929.39,,PayPal,spain,Milán,Pendiente,2024-05-21 00:00:00
790.0,1985,laura torres,54,MacBook Pro,Tecnología,2024-07-25,3.0,1895.09,5685.27,Bizum,France,Lyon,Entregado,2024-07-25 14:00:00
791.0,1252,Ana Sánchez,44,AirPods,Tecnología,2023-03-08,3.0,315.17,945.51,Bizum,Italy,Milán,Pendiente,2023-03-08 18:00:00
792.0,1121,Pedro López,21,Zapatillas Nike,Moda,05-15-2024,5.0,1176.6,5883.0,Transferencia,IT,Lyon,Cancelado,2024-05-15 12:00:00
793.0,1153,Juan Pérez,171,Cafetera Philips,Hogar,19/05/2023,2.0,1016.72,1878.5397446224033,Bizum,Italy,Lyon,Pendiente,2023-05-19 05:00:00
794.0,1495,María García,130,Camiseta Adidas,Moda,2024-09-25,4.0,1226.79,4907.16,Transferencia,France,Milán,Entregado,2024-09-25 07:00:00
795.0,1162,Juan Pérez,137,Bolso Gucci,Moda,05/01/2023,3.0,46.04,138.12,Tarjeta,España,Roma,Entregado,2023-01-05 12:00:00
796.0,1685,Juan Pérez,11,Aspiradora Dyson,Hogar,2023-02-10,4.0,1745.53,6982.12,PayPal,DE,Hamburgo,Cancelado,2023-02-10 03:00:00
797.0,1586,David Gómez,123,Reloj Casio,Accesorios,2024-10-14,5.0,1864.92,9324.6,Tarjeta,IT,Valencia,Pendiente,2024-10-14 13:00:00
798.0,1481,Lucía Fernández,200,MacBook Pro,Tecnología,07-07-2024,1.0,1134.62,1134.62,Transferencia,France,Barcelona,Pendiente,2024-07-07 06:00:00
799.0,1399,Laura Torres,130,Monitor LG,Tecnología,2024-10-07,3.0,1396.34,4189.02,Transferencia,Germany,Madrid,Cancelado,2024-10-07 06:00:00
800.0,1737,Laura Torres,75,Sony Headphones,Tecnología,12-04-2023,4.0,1845.77,7383.08,PayPal,spain,Madrid,Cancelado,2023-12-04 04:00:00
801.0,1000,Lucía Fernández,58,Zapatillas Nike,Moda,2023-04-17,2.0,1417.4,2834.8,Transferencia,IT,Berlín,Entregado,2023-04-17 02:00:00
802.0,1964,María García,125,Aspiradora Dyson,Hogar,2024-03-05,4.0,313.55,1254.2,Transferencia,DE,Valencia,Entregado,2024-03-05 10:00:00
803.0,1368,PEDRO LÓPEZ,76,Sony Headphones,Tecnología,2023-11-15,4.0,1156.81,4627.24,PayPal,Germany,Roma,Entregado,2023-11-15 12:00:00
804.0,1003,Lucía Fernández,93,Monitor LG,Tecnología,19/08/2024,1.0,1217.36,1217.36,Transferencia,Italy,Valencia,Entregado,2024-08-19 02:00:00
805.0,1867,María García,158,Aspiradora Dyson,Hogar,28/06/2023,1.0,854.02,854.02,Bizum,France,Valencia,Entregado,2023-06-28 17:00:00
806.0,1542,maría garcía,89,Mochila North Face,Accesorios,2024-11-22,3.0,1475.52,4426.56,PayPal,FR,Barcelona,Cancelado,2024-11-22 04:00:00
807.0,1604,Laura Torres,167,AirPods,Tecnología,2023-05-08,5.0,1869.39,9346.95,PayPal,France,Hamburgo,Cancelado,2023-05-08 05:00:00
808.0,1015,CARLOS RUIZ,140,Silla Gaming,Hogar,23/07/2024,2.0,1851.88,3703.76,Transferencia,Germany,Barcelona,Pendiente,2024-07-23 08:00:00
809.0,1031,Juan Pérez,107,Silla Gaming,Hogar,2024-07-02,1.0,907.17,907.17,Tarjeta,France,Roma,Pendiente,2024-07-02 04:00:00
810.0,1107,LUCÍA FERNÁNDEZ,114,iPhone 13,Tecnología,2023-11-04,4.0,$235.34,,Transferencia,France,Roma,Pendiente,2023-11-04 07:00:00
811.0,1908,Laura Torres,45,Teclado Logitech,hogar,03-24-2023,3.0,1969.83,5909.49,PayPal,Germany,Valencia,Cancelado,2023-03-24 11:00:00
812.0,1196,Carlos Ruiz,140,Silla Gaming,Hogar,2023-03-02,1.0,1679.41,1679.41,Tarjeta,France,Milán,Pendiente,2023-03-02 05:00:00
813.0,1098,Juan Pérez,65,Silla Gaming,Hogar,2023-02-19,3.0,258.08,774.24,Transferencia,DE,Valencia,Pendiente,2023-02-19 23:00:00
814.0,1093,Pedro López,143,AirPods,Tecnología,03-30-2024,3.0,$1842.48,,PayPal,Germany,Lyon,Entregado,2024-03-30 11:00:00
815.0,1818,Pedro López,198,Sony Headphones,Moda,05-27-2024,1.0,"1741,09",,Transferencia,France,Barcelona,Entregado,2024-05-27 04:00:00
816.0,1622,María García,160,Cafetera Philips,Hogar,22/09/2024,2.0,"1042,49",,Bizum,España,Hamburgo,Entregado,2024-09-22 02:00:00
817.0,1221,Pedro López,85,Mochila North Face,Accesorios,01-20-2024,4.0,1186.64,4746.56,Bizum,ES,Barcelona,Entregado,2024-01-20 20:00:00
818.0,1856,María García,162,Mochila North Face,Accesorios,2024-11-08,1.0,804.02,703.0373232631857,Tarjeta,IT,Roma,Pendiente,2024-11-08 22:00:00
819.0,1810,Pedro López,23,Samsung Galaxy,Tecnología,2023-04-03,5.0,118.98,594.9,Tarjeta,spain,Hamburgo,Pendiente,2023-04-03 23:00:00
820.0,1219,David Gómez,66,Zapatillas Nike,Moda,23/09/2023,2.0,677.04,1354.08,Bizum,spain,Madrid,Pendiente,2023-09-23 11:00:00
821.0,1368,María García,198,Aspiradora Dyson,Hogar,03-22-2024,3.0,$1607.68,,Tarjeta,FR,Milán,Cancelado,2024-03-22 17:00:00
822.0,1293,Carlos Ruiz,180,iPhone 13,Tecnología,07-12-2024,1.0,19.22,21.375030819919893,Bizum,ES,Valencia,Entregado,2024-07-12 18:00:00
823.0,1224,María García,145,Mochila North Face,Accesorios,06/07/2023,1.0,673.66,673.66,Bizum,spain,Madrid,Entregado,2023-07-06 23:00:00
824.0,1478,Pedro López,39,AirPods,Tecnología,12/10/2024,4.0,"802,36",0.0,Bizum,France,Roma,Cancelado,2024-10-12 13:00:00
825.0,1595,David Gómez,174,Aspiradora Dyson,Hogar,14/08/2023,4.0,1079.42,4317.68,Transferencia,spain,Lyon,Entregado,2023-08-14 21:00:00
826.0,1578,Juan Pérez,22,MacBook Pro,moda,09/03/2023,3.0,1840.51,5521.53,Tarjeta,FR,Valencia,Pendiente,2023-03-09 08:00:00
827.0,1855,Lucía Fernández,51,Reloj Casio,Accesorios,04-01-2024,,$699.23,,Transferencia,Germany,Roma,Cancelado,2024-04-01 13:00:00
828.0,1602,Pedro López,71,Mochila North Face,Accesorios,2023-06-23,1.0,700.44,700.44,Transferencia,DE,Lyon,Pendiente,2023-06-23 22:00:00
829.0,1466,Ana Sánchez,58,Camiseta Adidas,Moda,2024-02-25,5.0,1477.63,7388.15,Tarjeta,IT,Milán,Pendiente,2024-02-25 18:00:00
830.0,1734,Ana Sánchez,124,Aspiradora Dyson,Hogar,2023-12-03,3.0,909.91,2729.73,PayPal,ES,Hamburgo,Pendiente,2023-12-03 15:00:00
831.0,1674,Juan Pérez,151,Monitor LG,Tecnología,09/02/2023,1.0,456.96,456.96,Tarjeta,DE,Hamburgo,Cancelado,2023-02-09 11:00:00
832.0,1515,Carlos Ruiz,50,Teclado Logitech,Tecnología,29/03/2024,5.0,910.35,4551.75,PayPal,IT,Madrid,Cancelado,2024-03-29 05:00:00
833.0,1547,Laura Torres,15,Teclado Logitech,tech,14/02/2024,1.0,"290,31",,PayPal,spain,Lyon,Entregado,2024-02-14 11:00:00
834.0,1935,Lucía Fernández,44,Samsung Galaxy,Tecnología,05-27-2023,3.0,361.01,1083.03,Transferencia,Germany,Barcelona,Pendiente,2023-05-27 17:00:00
835.0,1355,Ana Sánchez,24,Bolso Gucci,Moda,09-25-2023,4.0,1001.75,4053.808592748,Bizum,Italy,Hamburgo,Entregado,2023-09-25 00:00:00
836.0,1045,Ana Sánchez,151,AirPods,Tecnología,06/03/2024,1.0,$843.66,,Transferencia,ES,Hamburgo,Cancelado,2024-03-06 16:00:00
837.0,1062,Ana Sánchez,22,Reloj Casio,Accesorios,30/07/2024,2.0,1830.54,3661.08,Transferencia,France,Berlín,Cancelado,2024-07-30 00:00:00
838.0,1882,María García,198,Reloj Casio,Accesorios,11-07-2023,1.0,731.16,731.16,Bizum,IT,Milán,Pendiente,2023-11-07 18:00:00
839.0,1297,Pedro López,149,Bolso Gucci,Moda,08/10/2024,3.0,1165.37,3496.11,Transferencia,IT,Valencia,Cancelado,2024-10-08 17:00:00
840.0,1324,Carlos Ruiz,131,AirPods,Tecnología,28/04/2023,3.0,1268.21,3804.63,Transferencia,FR,Milán,Entregado,2023-04-28 07:00:00
,1386,María García,85,Samsung Galaxy,Tecnología,03-12-2023,1.0,36.06,36.06,Bizum,España,Roma,Pendiente,2023-03-12 04:00:00
842.0,1379,Ana Sánchez,85,Reloj Casio,Accesorios,12/07/2024,3.0,1330.44,3991.32,PayPal,DE,Roma,Pendiente,2024-07-12 01:00:00
,1421,Ana Sánchez,197,Monitor LG,Tecnología,2024-07-01,2.0,364.29,728.58,Tarjeta,spain,Paris,Entregado,2024-07-01 18:00:00
844.0,1132,pedro lópez,114,MacBook Pro,Tecnología,2023-05-29,1.0,$1922.53,,Transferencia,DE,Paris,Pendiente,2023-05-29 02:00:00
845.0,1388,Pedro López,118,Aspiradora Dyson,moda,2024-05-22,5.0,305.84,1529.2,Transferencia,Italy,Paris,Entregado,2024-05-22 04:00:00
846.0,1889,maría garcía,180,Sony Headphones,Tecnología,2023-04-13,5.0,835.1,4175.5,Transferencia,France,Barcelona,Entregado,2023-04-13 21:00:00
847.0,1891,María García,157,iPhone 13,Tecnología,12-24-2023,3.0,179.85,477.47108366165935,Transferencia,Italy,Lyon,Entregado,2023-12-24 00:00:00
848.0,1350,Carlos Ruiz,84,Teclado Logitech,Tecnología,2023-06-29,2.0,1993.78,3987.56,PayPal,spain,Milán,Pendiente,2023-06-29 06:00:00
849.0,1090,Ana Sánchez,148,Reloj Casio,Accesorios,2024-10-24,1.0,1009.37,1009.37,PayPal,Germany,Berlín,Pendiente,2024-10-24 11:00:00
850.0,1814,PEDRO LÓPEZ,65,MacBook Pro,Moda,2024-06-30,3.0,1194.82,3584.46,PayPal,spain,Barcelona,Entregado,2024-06-30 11:00:00
851.0,1221,Juan Pérez,112,Teclado Logitech,Tecnología,01/04/2023,3.0,143.48,430.44,Transferencia,FR,Roma,Pendiente,2023-04-01 15:00:00
852.0,1757,Juan Pérez,84,Aspiradora Dyson,Hogar,2024-08-11,5.0,1502.42,7512.1,Transferencia,España,Madrid,Entregado,2024-08-11 07:00:00
853.0,1117,DAVID GÓMEZ,193,iPhone 13,Tecnología,19/05/2023,2.0,427.71,855.42,Bizum,IT,Lyon,Entregado,2023-05-19 04:00:00
854.0,1137,Lucía Fernández,8,Cafetera Philips,Hogar,12-10-2023,2.0,$1797.13,,Tarjeta,DE,Hamburgo,Pendiente,2023-12-10 16:00:00
855.0,1507,Laura Torres,86,Reloj Casio,Accesorios,08-20-2023,5.0,418.23,2091.15,Tarjeta,FR,Lyon,Cancelado,2023-08-20 05:00:00
856.0,1243,Lucía Fernández,184,Cafetera Philips,Hogar,17/03/2024,2.0,389.47,778.94,Tarjeta,ES,Roma,Pendiente,2024-03-17 21:00:00
857.0,1068,María García,186,AirPods,Tecnología,2023-08-13,1.0,82.73,82.73,Bizum,España,Milán,Cancelado,2023-08-13 03:00:00
858.0,1199,Laura Torres,153,Silla Gaming,Hogar,17/05/2023,4.0,949.41,3797.64,Bizum,España,Roma,Entregado,2023-05-17 06:00:00
859.0,1681,María García,89,Teclado Logitech,Tecnología,2023-02-23,2.0,1134.03,2268.06,Transferencia,IT,Barcelona,Entregado,2023-02-23 21:00:00
860.0,1427,Pedro López,118,Monitor LG,Tecnología,23/11/2023,4.0,$140.76,,Tarjeta,DE,Milán,Entregado,2023-11-23 13:00:00
861.0,1446,Lucía Fernández,22,Samsung Galaxy,Tecnología,11-21-2024,4.0,$1553.3,,Transferencia,FR,Barcelona,Cancelado,2024-11-21 13:00:00
862.0,1865,Ana Sánchez,113,AirPods,Tecnología,01-16-2024,4.0,912.04,3648.16,Transferencia,DE,Valencia,Cancelado,2024-01-16 22:00:00
863.0,1221,María García,58,Cafetera Philips,Hogar,10-16-2023,3.0,1053.54,3160.62,Bizum,IT,Hamburgo,Pendiente,2023-10-16 20:00:00
864.0,1607,maría garcía,71,Samsung Galaxy,Tecnología,2023-05-16,4.0,887.12,3991.858169803405,Transferencia,spain,Valencia,Entregado,2023-05-16 02:00:00
865.0,1792,Lucía Fernández,105,AirPods,Tecnología,09-16-2024,5.0,807.52,4037.6,Transferencia,España,Lyon,Entregado,2024-09-16 11:00:00
866.0,1802,ANA SÁNCHEZ,168,Samsung Galaxy,hogar,2023-01-14,5.0,1123.68,5618.4,Bizum,spain,Valencia,Pendiente,2023-01-14 18:00:00
867.0,1768,Ana Sánchez,110,Silla Gaming,Hogar,2023-06-10,2.0,318.93,521.3691112779636,Tarjeta,ES,Lyon,Pendiente,2023-06-10 07:00:00
868.0,1161,Lucía Fernández,136,Mochila North Face,Accesorios,04-03-2023,2.0,"372,04",,Tarjeta,IT,Milán,Cancelado,2023-04-03 11:00:00
869.0,1867,JUAN PÉREZ,1,Camiseta Adidas,Moda,30/12/2023,2.0,1724.95,3449.9,Tarjeta,Italy,Roma,Entregado,2023-12-30 18:00:00
870.0,1712,María García,9,Samsung Galaxy,Tecnología,11/01/2024,5.0,1892.77,9463.85,PayPal,IT,Roma,Pendiente,2024-01-11 17:00:00
871.0,1277,Lucía Fernández,149,Bolso Gucci,Moda,2024-05-21,2.0,752.89,1505.78,Tarjeta,France,Barcelona,Pendiente,2024-05-21 12:00:00
872.0,1578,juan pérez,57,Aspiradora Dyson,Hogar,09/06/2024,1.0,548.78,548.78,Bizum,Italy,Madrid,Pendiente,2024-06-09 23:00:00
873.0,1565,maría garcía,172,Samsung Galaxy,Tecnología,2023-06-22,4.0,1291.56,5166.24,PayPal,spain,Berlín,Cancelado,2023-06-22 21:00:00
874.0,1784,Ana Sánchez,132,Sony Headphones,Tecnología,2024-02-06,3.0,823.38,2470.14,PayPal,spain,Lyon,Pendiente,2024-02-06 08:00:00
875.0,1892,pedro lópez,168,Teclado Logitech,Tecnología,19/07/2024,5.0,60.52,302.6,Bizum,DE,Madrid,Pendiente,2024-07-19 18:00:00
876.0,1707,PEDRO LÓPEZ,52,Cafetera Philips,Hogar,06-07-2023,2.0,320.74,641.48,Tarjeta,España,Milán,Pendiente,2023-06-07 01:00:00
877.0,1374,Carlos Ruiz,2,Zapatillas Nike,Moda,14/02/2023,1.0,1434.78,1571.979377068683,Transferencia,España,Berlín,Cancelado,2023-02-14 20:00:00
878.0,1399,María García,105,MacBook Pro,Tecnología,10/04/2024,5.0,1321.26,6606.3,PayPal,Italy,Valencia,Entregado,2024-04-10 06:00:00
879.0,1240,Laura Torres,85,MacBook Pro,Tecnología,2023-02-05,5.0,63.92,375.74957130249965,Tarjeta,Italy,Madrid,Entregado,2023-02-05 16:00:00
880.0,1427,Carlos Ruiz,51,Sony Headphones,Tecnología,11-15-2024,5.0,451.72,2258.6,Tarjeta,ES,Madrid,Pendiente,2024-11-15 12:00:00
881.0,1418,María García,10,Silla Gaming,Hogar,05/06/2024,3.0,469.84,1409.52,PayPal,ES,Berlín,Pendiente,2024-06-05 12:00:00
882.0,1846,Juan Pérez,117,Teclado Logitech,Tecnología,12-17-2023,2.0,1347.07,2694.14,Transferencia,Italy,Madrid,Cancelado,2023-12-17 12:00:00
883.0,1697,Pedro López,112,Sony Headphones,Tecnología,2023-11-06,5.0,49.22,246.1,Tarjeta,FR,Milán,Cancelado,2023-11-06 18:00:00
884.0,1006,Carlos Ruiz,118,Camiseta Adidas,tech,2023-09-27,2.0,217.18,434.36,Tarjeta,DE,Milán,Cancelado,2023-09-27 22:00:00
885.0,1559,Juan Pérez,87,Zapatillas Nike,Moda,2024-09-10,,"1601,83",,Tarjeta,IT,Roma,Cancelado,2024-09-10 23:00:00
886.0,1429,Ana Sánchez,80,Bolso Gucci,Moda,2023-12-07,3.0,365.3,1095.9,PayPal,ES,Lyon,Cancelado,2023-12-07 08:00:00
887.0,1860,Juan Pérez,150,Zapatillas Nike,Moda,20/04/2023,1.0,1308.96,1308.96,Bizum,España,Barcelona,Cancelado,2023-04-20 01:00:00
888.0,1815,Pedro López,1,iPhone 13,Tecnología,11-30-2023,4.0,483.98,1935.92,Tarjeta,France,Paris,Pendiente,2023-11-30 00:00:00
889.0,1789,Ana Sánchez,149,Zapatillas Nike,Moda,12-30-2023,5.0,207.89,1039.45,Transferencia,Italy,Hamburgo,Cancelado,2023-12-30 10:00:00
890.0,1861,Carlos Ruiz,156,Mochila North Face,Accesorios,2023-01-06,4.0,493.91,1975.64,Tarjeta,ES,Lyon,Cancelado,2023-01-06 23:00:00
891.0,1489,David Gómez,62,iPhone 13,Tecnología,06-18-2024,1.0,1447.31,1447.31,PayPal,spain,Paris,Pendiente,2024-06-18 00:00:00
892.0,1048,Pedro López,161,Cafetera Philips,Hogar,2023-04-15,2.0,1712.84,3425.68,Bizum,FR,Milán,Entregado,2023-04-15 23:00:00
893.0,1556,Carlos Ruiz,30,Samsung Galaxy,Tecnología,09/04/2024,3.0,1662.14,4986.42,Bizum,spain,Paris,Entregado,2024-04-09 18:00:00
894.0,1434,María García,94,Teclado Logitech,Tecnología,10-15-2024,2.0,800.4,1600.8,Tarjeta,España,Berlín,Entregado,2024-10-15 20:00:00
895.0,1548,Laura Torres,84,Bolso Gucci,Moda,06-19-2024,1.0,1339.49,1339.49,Bizum,Germany,Berlín,Cancelado,2024-06-19 04:00:00
896.0,1716,Ana Sánchez,135,iPhone 13,Tecnología,27/09/2024,3.0,417.92,1253.76,Transferencia,spain,Berlín,Entregado,2024-09-27 04:00:00
897.0,1428,David Gómez,150,Zapatillas Nike,Moda,16/04/2023,2.0,593.36,1186.72,Transferencia,IT,Madrid,Cancelado,2023-04-16 23:00:00
898.0,1289,Laura Torres,138,Bolso Gucci,Moda,17/05/2023,4.0,1793.71,7174.84,Bizum,Germany,Paris,Pendiente,2023-05-17 13:00:00
899.0,1750,JUAN PÉREZ,104,Mochila North Face,moda,02/06/2023,5.0,35.87,179.35,Tarjeta,Italy,Valencia,Cancelado,2023-06-02 02:00:00
900.0,1973,Carlos Ruiz,71,MacBook Pro,Tecnología,2024-01-14,1.0,180.16,180.16,Bizum,ES,Madrid,Entregado,2024-01-14 12:00:00
901.0,1210,Pedro López,194,Monitor LG,Tecnología,08-24-2024,1.0,$423.69,,Bizum,Italy,Lyon,Pendiente,2024-08-24 14:00:00
902.0,1865,Lucía Fernández,117,Camiseta Adidas,Moda,20/09/2024,4.0,"62,8",0.0,Transferencia,IT,Berlín,Entregado,2024-09-20 18:00:00
903.0,1427,PEDRO LÓPEZ,89,Aspiradora Dyson,Hogar,2024-08-02,5.0,371.06,2122.760548351779,Transferencia,FR,Hamburgo,Pendiente,2024-08-02 22:00:00
904.0,1779,Pedro López,93,Zapatillas Nike,Moda,2024-01-12,2.0,1170.25,2340.5,Tarjeta,España,Paris,Pendiente,2024-01-12 08:00:00
905.0,1063,Juan Pérez,172,Mochila North Face,Accesorios,2023-11-24,2.0,848.63,1697.26,Bizum,France,Madrid,Entregado,2023-11-24 09:00:00
906.0,1967,Carlos Ruiz,80,Reloj Casio,Accesorios,2024-05-06,1.0,1786.42,1786.42,Bizum,France,Lyon,Entregado,2024-05-06 06:00:00
907.0,1314,Carlos Ruiz,94,Zapatillas Nike,Moda,24/03/2023,5.0,1636.71,9323.879567298653,PayPal,ES,Hamburgo,Cancelado,2023-03-24 13:00:00
908.0,1401,PEDRO LÓPEZ,41,AirPods,Tecnología,03/05/2023,1.0,690.22,690.22,Tarjeta,spain,Milán,Pendiente,2023-05-03 15:00:00
909.0,1829,David Gómez,6,Cafetera Philips,Hogar,08-19-2023,1.0,526.25,526.25,Tarjeta,France,Valencia,Cancelado,2023-08-19 16:00:00
910.0,1725,María García,103,Samsung Galaxy,moda,09-20-2024,4.0,765.59,3062.36,Bizum,Italy,Berlín,Pendiente,2024-09-20 05:00:00
911.0,1611,Pedro López,131,Sony Headphones,Tecnología,05-09-2024,5.0,1184.69,4776.182656780081,Bizum,spain,Barcelona,Pendiente,2024-05-09 13:00:00
912.0,1629,Pedro López,69,AirPods,Tecnología,06-16-2024,3.0,543.45,1630.35,Transferencia,France,Roma,Entregado,2024-06-16 17:00:00
913.0,1855,Laura Torres,59,iPhone 13,Tecnología,23/08/2024,4.0,1252.06,5008.24,PayPal,España,Milán,Pendiente,2024-08-23 06:00:00
914.0,1202,Lucía Fernández,4,Silla Gaming,Hogar,2023-07-04,2.0,824.73,1649.46,Transferencia,FR,Milán,Entregado,2023-07-04 05:00:00
915.0,1980,Juan Pérez,33,Mochila North Face,Accesorios,02-05-2024,4.0,1108.57,5135.634973048458,Bizum,ES,Paris,Pendiente,2024-02-05 05:00:00
916.0,1115,Ana Sánchez,131,Samsung Galaxy,Tecnología,10-25-2023,5.0,"877,89",,PayPal,Germany,Barcelona,Pendiente,2023-10-25 04:00:00
917.0,1550,María García,159,Reloj Casio,Accesorios,08-10-2024,2.0,595.99,1191.98,Transferencia,DE,Milán,Pendiente,2024-08-10 23:00:00
918.0,1408,María García,71,Aspiradora Dyson,Hogar,09/04/2023,5.0,1897.42,9487.1,PayPal,ES,Paris,Cancelado,2023-04-09 00:00:00
919.0,1489,PEDRO LÓPEZ,194,Zapatillas Nike,Moda,14/08/2023,1.0,$1529.58,0.0,PayPal,DE,Paris,Entregado,2023-08-14 16:00:00
920.0,1759,Pedro López,13,Bolso Gucci,Moda,10-30-2023,1.0,288.83,288.83,PayPal,Italy,Madrid,Cancelado,2023-10-30 19:00:00
921.0,1725,LAURA TORRES,126,Mochila North Face,Accesorios,07/10/2024,2.0,1738.25,3476.5,Tarjeta,Germany,Roma,Entregado,2024-10-07 08:00:00
922.0,1568,ANA SÁNCHEZ,140,Mochila North Face,Accesorios,08/07/2023,5.0,979.99,4899.95,Transferencia,IT,Berlín,Pendiente,2023-07-08 22:00:00
923.0,1492,Ana Sánchez,41,Aspiradora Dyson,Hogar,04-06-2024,2.0,1790.16,3580.32,PayPal,IT,Paris,Cancelado,2024-04-06 18:00:00
924.0,1726,María García,179,Sony Headphones,Tecnología,10-17-2023,1.0,1601.71,1601.71,Bizum,FR,Lyon,Pendiente,2023-10-17 21:00:00
925.0,1487,Juan Pérez,5,iPhone 13,Tecnología,20/03/2023,4.0,856.17,3424.68,Bizum,spain,Lyon,Entregado,2023-03-20 10:00:00
926.0,1823,Pedro López,150,MacBook Pro,Tecnología,25/09/2024,2.0,54.71,109.42,Transferencia,Germany,Paris,Cancelado,2024-09-25 14:00:00
927.0,1972,lucía fernández,118,Reloj Casio,Accesorios,08-01-2024,5.0,544.67,2723.35,Bizum,España,Madrid,Pendiente,2024-08-01 16:00:00
928.0,1638,María García,162,Aspiradora Dyson,Hogar,06-18-2023,4.0,1087.85,4351.4,Tarjeta,IT,Hamburgo,Pendiente,2023-06-18 07:00:00
929.0,1783,PEDRO LÓPEZ,162,Mochila North Face,Accesorios,11-07-2024,2.0,1270.62,2541.24,PayPal,France,Madrid,Cancelado,2024-11-07 00:00:00
930.0,1351,Pedro López,1,Monitor LG,Tecnología,21/10/2023,3.0,523.2,1569.6,Bizum,France,Roma,Entregado,2023-10-21 12:00:00
931.0,1307,Ana Sánchez,60,Cafetera Philips,Hogar,2024-04-05,5.0,287.32,1436.6,Transferencia,spain,Lyon,Pendiente,2024-04-05 14:00:00
932.0,1869,Ana Sánchez,88,Teclado Logitech,Tecnología,08-22-2024,2.0,1671.51,3343.02,Bizum,Italy,Valencia,Entregado,2024-08-22 11:00:00
933.0,1698,Lucía Fernández,56,Silla Gaming,Hogar,2024-08-07,2.0,1968.96,3937.92,PayPal,Germany,Berlín,Cancelado,2024-08-07 05:00:00
934.0,1179,Juan Pérez,20,Cafetera Philips,tech,07/02/2023,2.0,1056.12,2112.24,Bizum,Germany,Madrid,Cancelado,2023-02-07 00:00:00
935.0,1452,Laura Torres,83,Teclado Logitech,Tecnología,06-27-2023,2.0,351.64,703.28,Tarjeta,ES,Roma,Pendiente,2023-06-27 19:00:00
936.0,1219,carlos ruiz,15,Teclado Logitech,Tecnología,21/03/2023,3.0,551.89,1655.67,Tarjeta,France,Lyon,Pendiente,2023-03-21 14:00:00
937.0,1652,Juan Pérez,148,Bolso Gucci,Moda,07-16-2024,2.0,$46.6,,PayPal,Italy,Madrid,Pendiente,2024-07-16 23:00:00
938.0,1282,Ana Sánchez,41,Zapatillas Nike,Moda,04-13-2024,5.0,1829.45,10065.557925402301,Bizum,España,Paris,Pendiente,2024-04-13 08:00:00
939.0,1542,Carlos Ruiz,63,Samsung Galaxy,Tecnología,05-04-2024,5.0,244.32,1221.6,Bizum,Germany,Madrid,Entregado,2024-05-04 06:00:00
940.0,1572,Laura Torres,200,Samsung Galaxy,Tecnología,10-06-2024,1.0,1157.27,1157.27,Bizum,Italy,Barcelona,Entregado,2024-10-06 06:00:00
941.0,1701,Ana Sánchez,71,Camiseta Adidas,Moda,11-24-2023,3.0,555.37,1666.11,PayPal,IT,Paris,Entregado,2023-11-24 15:00:00
942.0,1736,Laura Torres,144,Mochila North Face,Accesorios,22/04/2024,2.0,1112.81,2225.62,Bizum,spain,Hamburgo,Entregado,2024-04-22 00:00:00
943.0,1358,Ana Sánchez,138,Mochila North Face,Accesorios,2024-02-03,2.0,1306.33,2612.66,Bizum,spain,Lyon,Entregado,2024-02-03 03:00:00
944.0,1426,Laura Torres,6,iPhone 13,Tecnología,13/11/2024,2.0,$1661.19,,PayPal,France,Berlín,Pendiente,2024-11-13 23:00:00
945.0,1652,Pedro López,105,Sony Headphones,Tecnología,10-16-2023,3.0,420.78,1262.34,Bizum,spain,Hamburgo,Pendiente,2023-10-16 21:00:00
946.0,1081,Laura Torres,89,Aspiradora Dyson,Hogar,2024-06-17,4.0,31.88,102.10219104086318,Tarjeta,DE,Milán,Cancelado,2024-06-17 09:00:00
947.0,1400,Lucía Fernández,10,Mochila North Face,tech,30/09/2023,1.0,282.4,282.4,Transferencia,ES,Berlín,Pendiente,2023-09-30 11:00:00
948.0,1733,Juan Pérez,56,Monitor LG,Tecnología,16/08/2024,4.0,1801.04,7204.16,Tarjeta,spain,Hamburgo,Cancelado,2024-08-16 08:00:00
949.0,1150,CARLOS RUIZ,134,iPhone 13,Tecnología,11/07/2024,2.0,1749.04,3498.08,Bizum,spain,Valencia,Cancelado,2024-07-11 20:00:00
950.0,1236,Pedro López,98,Cafetera Philips,Hogar,09-02-2023,5.0,1198.85,5994.25,PayPal,DE,Madrid,Entregado,2023-09-02 00:00:00
951.0,1905,David Gómez,102,Bolso Gucci,Moda,01-05-2023,5.0,1205.03,6025.15,Bizum,ES,Roma,Entregado,2023-01-05 15:00:00
952.0,1473,Lucía Fernández,116,Reloj Casio,Accesorios,05/03/2023,1.0,1333.42,1333.42,Bizum,FR,Milán,Pendiente,2023-03-05 02:00:00
953.0,1898,lucía fernández,51,AirPods,Tecnología,2023-07-04,3.0,358.99,1076.97,Tarjeta,ES,Lyon,Entregado,2023-07-04 16:00:00
954.0,1167,LAURA TORRES,105,Aspiradora Dyson,Hogar,04/02/2024,1.0,1829.68,2006.9664270517715,Bizum,France,Roma,Entregado,2024-02-04 04:00:00
955.0,1184,Carlos Ruiz,145,Samsung Galaxy,Tecnología,23/08/2023,3.0,843.35,2530.05,Bizum,DE,Hamburgo,Entregado,2023-08-23 01:00:00
956.0,1969,Ana Sánchez,100,AirPods,Tecnología,03-04-2023,5.0,772.45,3862.25,Transferencia,IT,Madrid,Entregado,2023-03-04 22:00:00
957.0,1265,Pedro López,87,Aspiradora Dyson,Hogar,05-15-2023,5.0,1042.65,5213.25,PayPal,IT,Milán,Pendiente,2023-05-15 15:00:00
958.0,1966,CARLOS RUIZ,132,Aspiradora Dyson,Hogar,04-20-2023,4.0,$103.46,,Tarjeta,France,Hamburgo,Pendiente,2023-04-20 23:00:00
959.0,1466,carlos ruiz,40,MacBook Pro,Tecnología,2024-01-29,5.0,340.9,1557.6802206823381,PayPal,FR,Paris,Cancelado,2024-01-29 22:00:00
960.0,1794,Lucía Fernández,46,Zapatillas Nike,Moda,03-16-2024,5.0,1478.69,7393.45,Transferencia,ES,Berlín,Pendiente,2024-03-16 08:00:00
961.0,1659,Carlos Ruiz,31,Monitor LG,Tecnología,16/01/2024,1.0,174.77,174.77,PayPal,ES,Lyon,Pendiente,2024-01-16 10:00:00
962.0,1239,Carlos Ruiz,172,Aspiradora Dyson,Hogar,21/02/2024,1.0,1210.27,1210.27,Tarjeta,Italy,Milán,Pendiente,2024-02-21 05:00:00
963.0,1312,María García,103,Cafetera Philips,Hogar,2024-11-27,2.0,498.24,996.48,Tarjeta,spain,Roma,Entregado,2024-11-27 16:00:00
964.0,1107,Ana Sánchez,129,Monitor LG,Tecnología,26/03/2024,2.0,784.7,1437.1162866025174,Transferencia,Italy,Roma,Entregado,2024-03-26 13:00:00
965.0,1609,Pedro López,196,AirPods,Tecnología,2023-08-08,3.0,584.5,1753.5,Bizum,spain,Valencia,Pendiente,2023-08-08 09:00:00
966.0,1853,Laura Torres,170,Sony Headphones,Tecnología,2023-01-14,3.0,717.79,2153.37,PayPal,Italy,Paris,Entregado,2023-01-14 15:00:00
967.0,1599,Carlos Ruiz,37,iPhone 13,Tecnología,12/01/2023,2.0,1440.9,2881.8,PayPal,Germany,Lyon,Pendiente,2023-01-12 08:00:00
968.0,1687,Carlos Ruiz,55,Cafetera Philips,tecnologia,04-15-2023,5.0,601.27,3006.35,Transferencia,spain,Lyon,Pendiente,2023-04-15 09:00:00
969.0,1629,laura torres,81,Zapatillas Nike,Moda,10-12-2024,5.0,1137.15,5206.252492371585,Tarjeta,spain,Madrid,Cancelado,2024-10-12 21:00:00
970.0,1808,Ana Sánchez,62,Sony Headphones,Tecnología,23/12/2023,5.0,957.34,4786.7,Bizum,IT,Hamburgo,Cancelado,2023-12-23 05:00:00
971.0,1539,Carlos Ruiz,91,Teclado Logitech,Tecnología,09/09/2023,2.0,1330.71,2661.42,PayPal,Germany,Barcelona,Pendiente,2023-09-09 10:00:00
972.0,1305,Pedro López,198,Sony Headphones,Tecnología,14/11/2023,4.0,1874.29,7497.16,Transferencia,DE,Roma,Entregado,2023-11-14 08:00:00
973.0,1515,Ana Sánchez,154,Teclado Logitech,Tecnología,2023-06-02,5.0,1467.82,7339.1,Transferencia,spain,Berlín,Cancelado,2023-06-02 00:00:00
974.0,1852,Lucía Fernández,59,iPhone 13,Tecnología,2023-08-05,3.0,437.73,1313.19,PayPal,IT,Lyon,Pendiente,2023-08-05 16:00:00
975.0,1435,CARLOS RUIZ,61,AirPods,Tecnología,2024-03-18,4.0,72.05,288.2,Tarjeta,Germany,Milán,Cancelado,2024-03-18 08:00:00
976.0,1647,Ana Sánchez,3,Teclado Logitech,Tecnología,2023-07-21,4.0,531.91,2127.64,PayPal,DE,Milán,Entregado,2023-07-21 09:00:00
977.0,1984,María García,4,Samsung Galaxy,Tecnología,11-14-2023,4.0,1194.21,4776.84,Bizum,ES,Berlín,Cancelado,2023-11-14 17:00:00
978.0,1746,María García,50,Camiseta Adidas,Moda,28/07/2023,5.0,112.34,561.7,Bizum,Italy,Lyon,Pendiente,2023-07-28 21:00:00
979.0,1217,PEDRO LÓPEZ,93,Samsung Galaxy,Tecnología,21/05/2023,2.0,997.77,1995.54,Tarjeta,France,Valencia,Pendiente,2023-05-21 00:00:00
980.0,1818,JUAN PÉREZ,157,AirPods,Tecnología,19/02/2023,5.0,1197.72,5988.6,Tarjeta,DE,Lyon,Entregado,2023-02-19 14:00:00
981.0,1755,Pedro López,77,Samsung Galaxy,Tecnología,2023-09-25,2.0,"675,15",,Transferencia,ES,Hamburgo,Pendiente,2023-09-25 10:00:00
982.0,1489,María García,107,AirPods,Tecnología,2023-01-27,1.0,1544.12,1544.12,Tarjeta,Germany,Valencia,Cancelado,2023-01-27 11:00:00
983.0,1453,David Gómez,53,Samsung Galaxy,Tecnología,2024-08-21,4.0,222.13,888.52,PayPal,España,Berlín,Cancelado,2024-08-21 04:00:00
984.0,1329,PEDRO LÓPEZ,45,Samsung Galaxy,Tecnología,04-26-2024,2.0,159.52,272.34307949495695,Tarjeta,Germany,Valencia,Cancelado,2024-04-26 07:00:00
985.0,1617,Laura Torres,28,MacBook Pro,Tecnología,18/08/2023,3.0,1459.1,4377.3,Transferencia,spain,Barcelona,Entregado,2023-08-18 04:00:00
986.0,1425,JUAN PÉREZ,64,Sony Headphones,Tecnología,02-22-2024,2.0,996.03,1992.06,Bizum,ES,Paris,Cancelado,2024-02-22 13:00:00
987.0,1515,María García,85,Camiseta Adidas,Moda,06-27-2024,4.0,1379.92,5519.68,PayPal,spain,Hamburgo,Pendiente,2024-06-27 19:00:00
,1278,David Gómez,103,Cafetera Philips,Hogar,16/03/2024,1.0,875.31,875.31,Transferencia,FR,Valencia,Cancelado,2024-03-16 16:00:00
989.0,1370,David Gómez,1,Mochila North Face,Accesorios,27/02/2023,5.0,"500,34",,PayPal,spain,Berlín,Entregado,2023-02-27 05:00:00
990.0,1867,Juan Pérez,199,Aspiradora Dyson,Hogar,11-06-2023,,1640.01,,Bizum,spain,Madrid,Pendiente,2023-11-06 16:00:00
991.0,1035,Carlos Ruiz,77,Samsung Galaxy,Tecnología,2023-02-17,4.0,1600.84,6403.36,PayPal,ES,Paris,Cancelado,2023-02-17 13:00:00
992.0,1195,María García,184,Samsung Galaxy,Tecnología,21/07/2023,3.0,1392.45,4578.776928269602,Bizum,España,Madrid,Entregado,2023-07-21 00:00:00
993.0,1408,LAURA TORRES,46,Teclado Logitech,Tecnología,10/04/2024,5.0,551.57,2757.85,Tarjeta,Italy,Roma,Entregado,2024-04-10 21:00:00
994.0,1027,LAURA TORRES,5,Reloj Casio,Accesorios,06-05-2024,2.0,1184.56,2369.12,Transferencia,spain,Milán,Cancelado,2024-06-05 10:00:00
995.0,1303,MARÍA GARCÍA,95,Sony Headphones,tecnologia,05-06-2024,4.0,728.34,2913.36,PayPal,IT,Barcelona,Pendiente,2024-05-06 12:00:00
996.0,1967,ANA SÁNCHEZ,28,iPhone 13,Tecnología,2024-08-30,2.0,"192,25",,Bizum,France,Barcelona,Pendiente,2024-08-30 03:00:00
997.0,1216,Lucía Fernández,70,Samsung Galaxy,Tecnología,04-28-2024,5.0,1835.45,9177.25,PayPal,Italy,Berlín,Pendiente,2024-04-28 20:00:00
998.0,1803,Ana Sánchez,47,Zapatillas Nike,Moda,05-18-2023,2.0,282.27,564.54,Transferencia,Germany,Hamburgo,Cancelado,2023-05-18 06:00:00
999.0,1882,David Gómez,194,Silla Gaming,hogar,01/02/2024,2.0,1900.97,3801.94,Bizum,Germany,Lyon,Entregado,2024-02-01 11:00:00
1000.0,1947,laura torres,47,Bolso Gucci,Moda,19/08/2023,2.0,897.55,1795.1,PayPal,Italy,Paris,Entregado,2023-08-19 16:00:00
1001.0,1532,Ana Sánchez,160,AirPods,Tecnología,2024-01-08,2.0,378.41,689.2570178707803,PayPal,IT,Paris,Pendiente,2024-01-08 23:00:00
1002.0,1402,Laura Torres,177,Reloj Casio,Accesorios,11-11-2024,3.0,1088.38,3265.14,Transferencia,DE,Valencia,Cancelado,2024-11-11 18:00:00
1003.0,1394,María García,5,Mochila North Face,Accesorios,11-25-2023,4.0,1747.16,6229.430273888371,PayPal,Germany,Madrid,Cancelado,2023-11-25 16:00:00
1004.0,1320,María García,49,Sony Headphones,Tecnología,2023-12-30,1.0,1467.13,1467.13,Bizum,IT,Hamburgo,Entregado,2023-12-30 14:00:00
1005.0,1844,pedro lópez,103,MacBook Pro,Tecnología,08-18-2023,3.0,1615.06,5039.759403653657,PayPal,IT,Berlín,Entregado,2023-08-18 07:00:00
1006.0,1482,Juan Pérez,173,Cafetera Philips,Hogar,09-20-2023,4.0,1320.98,5283.92,PayPal,FR,Madrid,Pendiente,2023-09-20 17:00:00
1007.0,1752,Juan Pérez,10,Mochila North Face,Accesorios,12-19-2023,4.0,1387.63,5550.52,PayPal,DE,Milán,Pendiente,2023-12-19 22:00:00
1008.0,1981,María García,14,Monitor LG,Tecnología,12-12-2023,5.0,1699.9,8499.5,PayPal,ES,Hamburgo,Entregado,2023-12-12 10:00:00
1009.0,1694,Juan Pérez,40,Sony Headphones,Tecnología,27/08/2023,1.0,$506.84,,Tarjeta,FR,Berlín,Cancelado,2023-08-27 19:00:00
1010.0,1559,Carlos Ruiz,151,Silla Gaming,Hogar,04/04/2024,2.0,983.96,1967.92,Bizum,DE,Roma,Entregado,2024-04-04 12:00:00
1011.0,1538,Laura Torres,89,Silla Gaming,Hogar,04-08-2024,4.0,"450,21",,Bizum,Italy,Milán,Cancelado,2024-04-08 23:00:00
1012.0,1683,Juan Pérez,133,Camiseta Adidas,Moda,2024-03-01,4.0,1975.46,7901.84,Transferencia,France,Hamburgo,Pendiente,2024-03-01 00:00:00
1013.0,1905,pedro lópez,170,Camiseta Adidas,Moda,05/12/2023,1.0,1888.68,1888.68,Transferencia,France,Milán,Pendiente,2023-12-05 00:00:00
1014.0,1171,Laura Torres,194,Aspiradora Dyson,Hogar,19/03/2024,2.0,88.46,176.92,Tarjeta,IT,Roma,Entregado,2024-03-19 17:00:00
1015.0,1812,DAVID GÓMEZ,35,Reloj Casio,Accesorios,21/05/2023,2.0,1414.09,2828.18,PayPal,FR,Berlín,Pendiente,2023-05-21 09:00:00
1016.0,1805,Juan Pérez,34,Cafetera Philips,Hogar,03/11/2024,4.0,1851.24,7404.96,PayPal,spain,Milán,Cancelado,2024-11-03 13:00:00
1017.0,1774,Pedro López,32,Mochila North Face,Accesorios,2024-11-23,5.0,369.34,1846.7,Bizum,spain,Barcelona,Pendiente,2024-11-23 18:00:00
1018.0,1924,David Gómez,170,Teclado Logitech,hogar,06-01-2024,4.0,1140.21,5414.866768572781,Bizum,Germany,Paris,Entregado,2024-06-01 19:00:00
1019.0,1582,Carlos Ruiz,87,Silla Gaming,Hogar,2023-03-30,3.0,1831.82,5495.46,Tarjeta,Germany,Valencia,Cancelado,2023-03-30 17:00:00
1020.0,1650,David Gómez,137,Teclado Logitech,Tecnología,2024-08-13,2.0,77.55,155.1,Bizum,Germany,Paris,Entregado,2024-08-13 12:00:00
1021.0,1546,JUAN PÉREZ,125,Aspiradora Dyson,Hogar,2023-11-27,5.0,1397.87,6989.35,Bizum,spain,Berlín,Pendiente,2023-11-27 19:00:00
1022.0,1541,María García,10,Sony Headphones,Tecnología,06-30-2023,5.0,601.72,3008.6,Bizum,Germany,Hamburgo,Pendiente,2023-06-30 23:00:00
1023.0,1740,Laura Torres,94,Reloj Casio,Accesorios,05-08-2024,1.0,1849.55,1849.55,Tarjeta,spain,Milán,Entregado,2024-05-08 15:00:00
1024.0,1229,Juan Pérez,17,Mochila North Face,Accesorios,11-20-2024,1.0,1942.41,1942.41,Bizum,DE,Berlín,Pendiente,2024-11-20 09:00:00
1025.0,1290,Lucía Fernández,78,iPhone 13,Tecnología,2024-11-30,2.0,1889.09,3778.18,Bizum,IT,Roma,Cancelado,2024-11-30 12:00:00
1026.0,1168,Juan Pérez,95,Aspiradora Dyson,Hogar,2023-06-01,3.0,953.69,2861.07,Tarjeta,DE,Madrid,Cancelado,2023-06-01 14:00:00
1027.0,1716,María García,35,AirPods,Tecnología,01-24-2023,3.0,1725.46,5176.38,PayPal,Germany,Lyon,Cancelado,2023-01-24 11:00:00
1028.0,1784,David Gómez,153,Bolso Gucci,Moda,16/07/2023,3.0,1690.65,5071.95,Bizum,Germany,Roma,Cancelado,2023-07-16 16:00:00
1029.0,1111,David Gómez,174,iPhone 13,Tecnología,2023-06-13,5.0,645.01,3225.05,PayPal,Italy,Madrid,Pendiente,2023-06-13 11:00:00
1030.0,1425,Ana Sánchez,172,Sony Headphones,TECHNOLOGY,2024-10-22,3.0,1659.54,4978.62,Tarjeta,España,Milán,Cancelado,2024-10-22 15:00:00
1031.0,1183,Pedro López,179,Reloj Casio,Accesorios,2023-12-17,4.0,83.65,334.6,PayPal,Italy,Lyon,Cancelado,2023-12-17 00:00:00
1032.0,1746,Pedro López,47,Silla Gaming,Hogar,2023-03-20,3.0,1196.58,3589.74,Bizum,FR,Roma,Entregado,2023-03-20 05:00:00
1033.0,1041,Ana Sánchez,166,Reloj Casio,Accesorios,03-18-2023,4.0,467.72,1870.88,PayPal,Italy,Madrid,Pendiente,2023-03-18 03:00:00
1034.0,1609,Juan Pérez,67,Teclado Logitech,Tecnología,2023-07-04,2.0,249.93,499.86,Bizum,France,Madrid,Cancelado,2023-07-04 16:00:00
1035.0,1532,Lucía Fernández,159,Sony Headphones,Tecnología,2024-04-07,2.0,163.14,326.28,PayPal,España,Berlín,Pendiente,2024-04-07 23:00:00
1036.0,1955,Carlos Ruiz,169,Zapatillas Nike,Moda,08/04/2024,5.0,"1395,61",,PayPal,spain,Barcelona,Pendiente,2024-04-08 08:00:00
1037.0,1766,Juan Pérez,176,Sony Headphones,Tecnología,2023-04-02,4.0,686.35,2745.4,Bizum,IT,Milán,Pendiente,2023-04-02 09:00:00
1038.0,1718,LAURA TORRES,22,iPhone 13,moda,18/06/2023,5.0,1452.29,7261.45,PayPal,DE,Valencia,Entregado,2023-06-18 21:00:00
1039.0,1460,Pedro López,70,Sony Headphones,Tecnología,24/07/2023,1.0,140.06,140.06,Bizum,France,Hamburgo,Entregado,2023-07-24 20:00:00
1040.0,1227,Carlos Ruiz,49,Silla Gaming,Hogar,07-20-2023,1.0,637.43,637.43,Tarjeta,France,Roma,Entregado,2023-07-20 07:00:00
1041.0,1375,David Gómez,55,Camiseta Adidas,Moda,10-12-2023,5.0,1083.59,5417.95,PayPal,FR,Milán,Entregado,2023-10-12 11:00:00
1042.0,1382,Carlos Ruiz,131,Zapatillas Nike,Moda,2023-02-05,4.0,"1583,54",,Bizum,France,Barcelona,Cancelado,2023-02-05 18:00:00
1043.0,1325,Pedro López,81,Reloj Casio,Accesorios,2023-04-02,1.0,644.32,644.32,PayPal,ES,Milán,Pendiente,2023-04-02 02:00:00
1044.0,1038,Carlos Ruiz,42,Monitor LG,Tecnología,11/04/2024,3.0,1255.52,3766.56,Transferencia,spain,Lyon,Cancelado,2024-04-11 04:00:00
1045.0,1662,Ana Sánchez,40,Cafetera Philips,Hogar,10-26-2024,3.0,1773.1,5319.3,Bizum,FR,Lyon,Cancelado,2024-10-26 12:00:00
1046.0,1921,Ana Sánchez,28,AirPods,Tecnología,14/05/2023,4.0,1235.57,4942.28,Tarjeta,ES,Milán,Cancelado,2023-05-14 03:00:00
1047.0,1735,Laura Torres,4,Samsung Galaxy,Tecnología,2023-10-03,5.0,$473.59,,Tarjeta,Italy,Barcelona,Entregado,2023-10-03 11:00:00
1048.0,1228,Juan Pérez,133,Aspiradora Dyson,Hogar,08-31-2024,5.0,58.56,292.8,Bizum,Germany,Madrid,Pendiente,2024-08-31 03:00:00
1049.0,1070,david gómez,72,Aspiradora Dyson,Hogar,14/05/2024,2.0,1741.5,3483.0,Bizum,FR,Roma,Pendiente,2024-05-14 19:00:00
1050.0,1181,David Gómez,142,MacBook Pro,Tecnología,26/04/2024,3.0,52.33,156.99,Transferencia,FR,Hamburgo,Cancelado,2024-04-26 11:00:00
1051.0,1448,Laura Torres,6,MacBook Pro,Tecnología,08/09/2024,3.0,1750.66,5251.98,PayPal,France,Roma,Entregado,2024-09-08 08:00:00
1052.0,1520,Pedro López,3,Reloj Casio,Accesorios,2024-04-01,2.0,1062.58,2125.16,Bizum,spain,Madrid,Entregado,2024-04-01 05:00:00
1053.0,1382,Juan Pérez,174,Aspiradora Dyson,Hogar,2024-11-05,5.0,1878.74,9393.7,Tarjeta,spain,Berlín,Cancelado,2024-11-05 13:00:00
1054.0,1779,ana sánchez,190,Samsung Galaxy,Tecnología,2023-06-07,2.0,1599.58,3199.16,Tarjeta,Germany,Milán,Cancelado,2023-06-07 07:00:00
1055.0,1142,Lucía Fernández,88,Sony Headphones,Tecnología,2024-10-24,2.0,1995.89,3991.78,Bizum,DE,Barcelona,Pendiente,2024-10-24 12:00:00
1056.0,1894,Juan Pérez,176,Bolso Gucci,Moda,11-10-2023,2.0,707.92,1415.84,Bizum,IT,Hamburgo,Entregado,2023-11-10 16:00:00
1057.0,1654,Pedro López,20,Silla Gaming,Hogar,02-26-2024,2.0,1536.7,3073.4,Tarjeta,Italy,Madrid,Cancelado,2024-02-26 17:00:00
1058.0,1676,Laura Torres,62,Silla Gaming,Hogar,22/01/2023,1.0,809.84,851.5074824588274,Bizum,FR,Milán,Cancelado,2023-01-22 19:00:00
1059.0,1858,Ana Sánchez,93,Sony Headphones,Tecnología,14/09/2024,2.0,964.95,1929.9,Transferencia,España,Roma,Entregado,2024-09-14 19:00:00
,1158,Lucía Fernández,44,Teclado Logitech,Tecnología,04/02/2023,4.0,1258.74,5034.96,Transferencia,Germany,Madrid,Cancelado,2023-02-04 12:00:00
1061.0,1970,Ana Sánchez,166,AirPods,Tecnología,05-03-2024,5.0,1748.62,8743.1,Bizum,Italy,Berlín,Entregado,2024-05-03 23:00:00
1062.0,1604,Laura Torres,115,iPhone 13,Tecnología,2023-09-04,2.0,1968.33,3936.66,PayPal,IT,Hamburgo,Cancelado,2023-09-04 07:00:00
1063.0,1602,Ana Sánchez,17,Camiseta Adidas,Moda,2023-08-20,4.0,$1538.86,,Tarjeta,Germany,Valencia,Pendiente,2023-08-20 16:00:00
1064.0,1557,Pedro López,152,Zapatillas Nike,TECHNOLOGY,29/09/2023,2.0,841.36,1682.72,Transferencia,spain,Barcelona,Cancelado,2023-09-29 15:00:00
1065.0,1060,Juan Pérez,87,Monitor LG,Tecnología,11/09/2024,3.0,848.5,2545.5,Bizum,ES,Hamburgo,Pendiente,2024-09-11 01:00:00
1066.0,1579,Laura Torres,68,Samsung Galaxy,Tecnología,08-01-2023,2.0,1477.79,2955.58,Tarjeta,IT,Valencia,Cancelado,2023-08-01 00:00:00
1067.0,1212,David Gómez,45,Zapatillas Nike,Moda,08-28-2023,2.0,485.17,970.34,Tarjeta,spain,Valencia,Entregado,2023-08-28 21:00:00
1068.0,1716,David Gómez,81,Monitor LG,Tecnología,2023-03-20,5.0,229.84,1149.2,Transferencia,FR,Roma,Pendiente,2023-03-20 06:00:00
1069.0,1542,Carlos Ruiz,18,Monitor LG,Tecnología,03/05/2024,3.0,715.7,2147.1,Tarjeta,DE,Milán,Entregado,2024-05-03 05:00:00
1070.0,1479,Juan Pérez,185,Camiseta Adidas,Moda,06-10-2024,4.0,581.61,2326.44,PayPal,France,Hamburgo,Entregado,2024-06-10 06:00:00
1071.0,1758,Pedro López,10,Aspiradora Dyson,Hogar,17/11/2023,2.0,599.65,1114.0881887609344,Transferencia,Italy,Lyon,Entregado,2023-11-17 13:00:00
1072.0,1286,María García,142,MacBook Pro,Tecnología,03-20-2024,3.0,474.88,1424.64,PayPal,spain,Valencia,Entregado,2024-03-20 20:00:00
1073.0,1237,Ana Sánchez,146,Samsung Galaxy,Tecnología,04-27-2024,1.0,93.77,93.77,Bizum,France,Milán,Cancelado,2024-04-27 13:00:00
1074.0,1545,Carlos Ruiz,140,Aspiradora Dyson,Hogar,03-22-2023,5.0,45.57,227.85,PayPal,España,Madrid,Cancelado,2023-03-22 06:00:00
1075.0,1001,DAVID GÓMEZ,12,Cafetera Philips,Hogar,05-07-2024,3.0,1975.57,5926.71,Tarjeta,España,Barcelona,Entregado,2024-05-07 19:00:00
1076.0,1243,Laura Torres,6,Camiseta Adidas,Moda,28/04/2024,5.0,861.27,4306.35,Bizum,España,Valencia,Entregado,2024-04-28 13:00:00
1077.0,1525,María García,154,Reloj Casio,tech,09-24-2023,1.0,774.81,774.81,Bizum,España,Valencia,Cancelado,2023-09-24 07:00:00
1078.0,1492,Pedro López,51,Aspiradora Dyson,Hogar,2024-09-15,4.0,1362.5,5450.0,Bizum,Germany,Lyon,Cancelado,2024-09-15 21:00:00
1079.0,1477,María García,141,Cafetera Philips,Hogar,2023-06-02,3.0,444.33,1332.99,PayPal,IT,Milán,Pendiente,2023-06-02 15:00:00
1080.0,1962,maría garcía,168,Monitor LG,Tecnología,12/04/2024,3.0,1900.42,5701.26,Transferencia,IT,Barcelona,Entregado,2024-04-12 09:00:00
1081.0,1893,Ana Sánchez,86,Mochila North Face,Accesorios,01-24-2023,3.0,1574.83,4724.49,Transferencia,spain,Berlín,Entregado,2023-01-24 15:00:00
1082.0,1960,Lucía Fernández,194,Aspiradora Dyson,Hogar,05/06/2024,3.0,187.93,563.79,Tarjeta,spain,Roma,Entregado,2024-06-05 20:00:00
1083.0,1547,Juan Pérez,181,Cafetera Philips,Hogar,13/09/2024,1.0,840.99,840.99,Tarjeta,España,Barcelona,Pendiente,2024-09-13 08:00:00
1084.0,1216,David Gómez,97,Sony Headphones,Tecnología,08/06/2023,4.0,1759.45,7037.8,Transferencia,FR,Lyon,Entregado,2023-06-08 21:00:00
1085.0,1929,María García,194,AirPods,tecnologia,24/03/2024,4.0,1890.02,7560.08,PayPal,Italy,Lyon,Pendiente,2024-03-24 20:00:00
1086.0,1441,María García,34,Bolso Gucci,Moda,05/03/2024,3.0,940.13,2820.39,Tarjeta,FR,Roma,Pendiente,2024-03-05 02:00:00
1087.0,1532,JUAN PÉREZ,146,Zapatillas Nike,Moda,2023-10-30,1.0,1230.69,1230.69,Bizum,DE,Paris,Pendiente,2023-10-30 18:00:00
1088.0,1635,Pedro López,6,Mochila North Face,Accesorios,2023-10-29,1.0,342.4,342.4,Bizum,FR,Roma,Pendiente,2023-10-29 19:00:00
1089.0,1429,Laura Torres,39,Silla Gaming,Hogar,03-12-2023,4.0,1982.43,7929.72,Tarjeta,ES,Lyon,Cancelado,2023-03-12 00:00:00
1090.0,1437,María García,19,Samsung Galaxy,Tecnología,06-23-2024,1.0,471.03,471.03,Bizum,ES,Lyon,Cancelado,2024-06-23 22:00:00
1091.0,1699,PEDRO LÓPEZ,166,Mochila North Face,Accesorios,10-29-2024,3.0,1886.04,5081.784292331093,Bizum,ES,Valencia,Cancelado,2024-10-29 05:00:00
1092.0,1884,Carlos Ruiz,100,Samsung Galaxy,Tecnología,2024-05-24,4.0,1302.8,5211.2,Tarjeta,IT,Hamburgo,Pendiente,2024-05-24 10:00:00
1093.0,1963,Ana Sánchez,27,AirPods,Tecnología,20/07/2024,3.0,1219.4,3658.2,Transferencia,IT,Roma,Cancelado,2024-07-20 16:00:00
1094.0,1203,Laura Torres,197,Camiseta Adidas,Moda,12/05/2023,1.0,1030.25,1030.25,Transferencia,ES,Valencia,Cancelado,2023-05-12 15:00:00
1095.0,1728,David Gómez,168,Mochila North Face,Accesorios,04-16-2024,1.0,469.03,469.03,Bizum,Germany,Madrid,Entregado,2024-04-16 07:00:00
1096.0,1123,Carlos Ruiz,27,Camiseta Adidas,Moda,07-06-2023,4.0,361.29,1445.16,Bizum,spain,Barcelona,Pendiente,2023-07-06 14:00:00
1097.0,1226,Lucía Fernández,12,Aspiradora Dyson,Hogar,05/03/2023,1.0,448.77,448.77,Bizum,DE,Paris,Cancelado,2023-03-05 18:00:00
1098.0,1052,Pedro López,176,Silla Gaming,Hogar,16/09/2023,2.0,381.01,762.02,Transferencia,IT,Milán,Pendiente,2023-09-16 02:00:00
1099.0,1260,Juan Pérez,87,Zapatillas Nike,Moda,01-15-2023,2.0,1561.37,3122.74,Transferencia,DE,Barcelona,Entregado,2023-01-15 10:00:00
1100.0,1281,Juan Pérez,33,Reloj Casio,Accesorios,10-17-2024,3.0,706.75,2120.25,PayPal,spain,Paris,Pendiente,2024-10-17 05:00:00
1101.0,1403,Juan Pérez,1,Aspiradora Dyson,Hogar,2024-01-16,1.0,125.11,125.11,PayPal,ES,Hamburgo,Entregado,2024-01-16 23:00:00
1102.0,1996,carlos ruiz,9,Aspiradora Dyson,Hogar,2023-11-30,3.0,1938.51,5815.53,Transferencia,FR,Madrid,Pendiente,2023-11-30 07:00:00
1103.0,1908,Ana Sánchez,115,Mochila North Face,Accesorios,09/01/2024,2.0,1768.73,3537.46,PayPal,spain,Milán,Pendiente,2024-01-09 22:00:00
1104.0,1564,MARÍA GARCÍA,101,Camiseta Adidas,Moda,04/01/2024,3.0,1856.23,5568.69,PayPal,spain,Paris,Cancelado,2024-01-04 18:00:00
1105.0,1032,Lucía Fernández,101,Zapatillas Nike,Moda,2023-04-19,4.0,$1989.87,,Tarjeta,Germany,Lyon,Pendiente,2023-04-19 06:00:00
1106.0,1789,Laura Torres,115,Monitor LG,Tecnología,2024-11-15,5.0,356.05,1780.25,Transferencia,DE,Valencia,Cancelado,2024-11-15 15:00:00
1107.0,1666,Ana Sánchez,132,Bolso Gucci,Moda,04-22-2024,3.0,798.52,2395.56,Bizum,France,Barcelona,Cancelado,2024-04-22 01:00:00
1108.0,1621,Lucía Fernández,175,Cafetera Philips,Hogar,09-11-2024,4.0,1518.89,6075.56,Transferencia,Germany,Milán,Pendiente,2024-09-11 20:00:00
1109.0,1879,carlos ruiz,69,Silla Gaming,Hogar,15/10/2023,5.0,1395.08,6975.4,Tarjeta,DE,Hamburgo,Entregado,2023-10-15 17:00:00
1110.0,1735,Carlos Ruiz,168,Samsung Galaxy,Tecnología,2024-04-16,2.0,316.25,632.5,PayPal,DE,Berlín,Pendiente,2024-04-16 07:00:00
1111.0,1141,LUCÍA FERNÁNDEZ,111,Samsung Galaxy,Tecnología,03-14-2024,,1633.51,,Transferencia,FR,Roma,Entregado,2024-03-14 20:00:00
1112.0,1453,ana sánchez,97,Mochila North Face,Accesorios,11-15-2023,1.0,456.64,456.64,Bizum,DE,Hamburgo,Entregado,2023-11-15 01:00:00
1113.0,1255,Lucía Fernández,82,Samsung Galaxy,Tecnología,2024-06-21,4.0,455.4,1821.6,Transferencia,Germany,Valencia,Entregado,2024-06-21 14:00:00
1114.0,1724,María García,150,Aspiradora Dyson,Hogar,10-10-2023,1.0,1078.58,1078.58,Tarjeta,spain,Valencia,Entregado,2023-10-10 17:00:00
1115.0,1897,María García,37,iPhone 13,Tecnología,21/01/2024,2.0,1189.95,2379.9,Bizum,Italy,Berlín,Cancelado,2024-01-21 15:00:00
1116.0,1704,Lucía Fernández,200,Camiseta Adidas,Moda,08-24-2023,4.0,1164.37,4657.48,Transferencia,DE,Valencia,Pendiente,2023-08-24 08:00:00
1117.0,1382,ana sánchez,176,Aspiradora Dyson,Hogar,09-10-2024,4.0,192.06,768.24,Bizum,IT,Barcelona,Entregado,2024-09-10 03:00:00
1118.0,1172,Lucía Fernández,155,AirPods,Tecnología,16/12/2023,2.0,1756.15,3615.3638315107387,PayPal,Italy,Barcelona,Entregado,2023-12-16 07:00:00
1119.0,1702,Ana Sánchez,32,Reloj Casio,Accesorios,2023-08-27,2.0,538.54,1009.0736725486396,PayPal,España,Lyon,Pendiente,2023-08-27 03:00:00
1120.0,1008,Carlos Ruiz,54,Teclado Logitech,Tecnología,06-11-2023,2.0,$267.73,,Transferencia,IT,Hamburgo,Entregado,2023-06-11 07:00:00
1121.0,1810,carlos ruiz,190,Aspiradora Dyson,Hogar,05-04-2023,2.0,1778.61,3557.22,PayPal,spain,Barcelona,Pendiente,2023-05-04 11:00:00
1122.0,1295,david gómez,49,Cafetera Philips,Hogar,2024-08-02,1.0,1911.75,1911.75,PayPal,France,Lyon,Cancelado,2024-08-02 01:00:00
1123.0,1379,María García,3,Mochila North Face,Accesorios,29/01/2024,3.0,1725.63,5176.89,Transferencia,France,Madrid,Entregado,2024-01-29 12:00:00
1124.0,1507,Carlos Ruiz,131,Sony Headphones,Tecnología,02-17-2024,3.0,1620.94,4862.82,Tarjeta,France,Valencia,Pendiente,2024-02-17 02:00:00
1125.0,1996,Lucía Fernández,88,Sony Headphones,Tecnología,2023-09-16,5.0,1313.93,6569.65,Transferencia,IT,Paris,Entregado,2023-09-16 14:00:00
1126.0,1912,Juan Pérez,157,Reloj Casio,Accesorios,2024-08-30,2.0,$1106.21,,Transferencia,DE,Lyon,Entregado,2024-08-30 09:00:00
1127.0,1111,María García,80,Zapatillas Nike,Moda,2023-07-17,5.0,183.1,915.5,Tarjeta,FR,Madrid,Cancelado,2023-07-17 22:00:00
1128.0,1867,Carlos Ruiz,148,Samsung Galaxy,Tecnología,2023-05-06,3.0,822.82,2468.46,Transferencia,France,Valencia,Pendiente,2023-05-06 12:00:00
1129.0,1511,Carlos Ruiz,85,Samsung Galaxy,moda,2023-07-17,2.0,751.65,1503.3,PayPal,France,Milán,Pendiente,2023-07-17 07:00:00
1130.0,1524,Laura Torres,73,Silla Gaming,Hogar,12-24-2023,5.0,526.91,2634.55,PayPal,DE,Madrid,Cancelado,2023-12-24 07:00:00
1131.0,1212,Pedro López,195,Aspiradora Dyson,Hogar,02/06/2024,3.0,1449.61,4348.83,Tarjeta,IT,Roma,Entregado,2024-06-02 12:00:00
1132.0,1360,ana sánchez,105,AirPods,Tecnología,2024-04-04,5.0,996.79,4983.95,Tarjeta,ES,Lyon,Pendiente,2024-04-04 08:00:00
1133.0,1533,Ana Sánchez,166,Zapatillas Nike,Moda,10-10-2024,4.0,171.28,685.12,Tarjeta,FR,Roma,Pendiente,2024-10-10 13:00:00
1134.0,1002,laura torres,155,iPhone 13,Tecnología,07-26-2023,5.0,448.16,2240.8,Tarjeta,France,Paris,Cancelado,2023-07-26 12:00:00
1135.0,1448,David Gómez,144,Sony Headphones,Tecnología,12-10-2023,3.0,1369.68,4109.04,PayPal,IT,Barcelona,Cancelado,2023-12-10 18:00:00
1136.0,1206,Lucía Fernández,90,AirPods,Tecnología,2024-07-01,1.0,"161,5",,Tarjeta,ES,Valencia,Cancelado,2024-07-01 14:00:00
1137.0,1278,Laura Torres,116,MacBook Pro,Tecnología,23/03/2024,2.0,1703.9,3407.8,Tarjeta,DE,Barcelona,Pendiente,2024-03-23 01:00:00
1138.0,1122,María García,157,Monitor LG,Tecnología,08-17-2023,4.0,995.34,3981.36,PayPal,IT,Paris,Cancelado,2023-08-17 01:00:00
1139.0,1036,Ana Sánchez,55,AirPods,Tecnología,01-10-2023,4.0,"966,37",,Bizum,IT,Madrid,Cancelado,2023-01-10 05:00:00
1140.0,1470,DAVID GÓMEZ,193,Bolso Gucci,Moda,2024-08-12,1.0,"1188,89",,Transferencia,España,Lyon,Pendiente,2024-08-12 11:00:00
1141.0,1059,CARLOS RUIZ,63,Reloj Casio,Accesorios,18/07/2023,1.0,1651.12,1443.1406970020878,Transferencia,Italy,Lyon,Pendiente,2023-07-18 06:00:00
1142.0,1822,JUAN PÉREZ,11,Silla Gaming,Hogar,07-22-2024,3.0,702.14,2106.42,Tarjeta,España,Valencia,Cancelado,2024-07-22 10:00:00
1143.0,1425,Ana Sánchez,106,Teclado Logitech,Tecnología,08/07/2023,2.0,1359.25,2718.5,Tarjeta,FR,Roma,Pendiente,2023-07-08 20:00:00
1144.0,1532,Juan Pérez,129,Aspiradora Dyson,Hogar,03/04/2023,1.0,1135.81,1135.81,Tarjeta,España,Lyon,Entregado,2023-04-03 16:00:00
1145.0,1048,Juan Pérez,112,iPhone 13,Tecnología,08-22-2024,5.0,541.39,2972.2241547196863,Transferencia,España,Madrid,Cancelado,2024-08-22 04:00:00
1146.0,1862,Pedro López,169,Aspiradora Dyson,Hogar,02-18-2024,4.0,"1758,47",,PayPal,Italy,Roma,Entregado,2024-02-18 18:00:00
1147.0,1233,Carlos Ruiz,149,Sony Headphones,Tecnología,03-26-2024,4.0,1596.88,6387.52,Tarjeta,IT,Hamburgo,Entregado,2024-03-26 22:00:00
1148.0,1158,ana sánchez,149,Zapatillas Nike,Moda,21/03/2023,4.0,$1320.32,,Tarjeta,Germany,Milán,Entregado,2023-03-21 08:00:00
1149.0,1723,Carlos Ruiz,169,MacBook Pro,Tecnología,11-20-2023,2.0,1702.66,3405.32,Transferencia,ES,Milán,Entregado,2023-11-20 13:00:00
1150.0,1560,Laura Torres,165,Monitor LG,Tecnología,18/08/2024,1.0,1735.92,1735.92,PayPal,France,Valencia,Entregado,2024-08-18 13:00:00
1151.0,1642,Juan Pérez,56,Camiseta Adidas,hogar,09-17-2023,1.0,1419.64,1419.64,Tarjeta,spain,Hamburgo,Entregado,2023-09-17 00:00:00
1152.0,1681,Lucía Fernández,27,Aspiradora Dyson,Hogar,06/02/2023,1.0,$1675.66,,PayPal,spain,Lyon,Entregado,2023-02-06 10:00:00
1153.0,1750,Juan Pérez,21,Teclado Logitech,Tecnología,07-05-2023,2.0,1397.97,2795.94,Tarjeta,DE,Madrid,Pendiente,2023-07-05 23:00:00
1154.0,1617,David Gómez,66,Sony Headphones,Tecnología,01-03-2023,1.0,1363.48,1363.48,Tarjeta,España,Madrid,Cancelado,2023-01-03 12:00:00
1155.0,1110,Juan Pérez,3,Camiseta Adidas,Moda,2023-10-07,5.0,$1241.04,,Tarjeta,FR,Berlín,Pendiente,2023-10-07 20:00:00
1156.0,1076,Laura Torres,159,Aspiradora Dyson,Hogar,05-25-2024,2.0,$1507.91,,PayPal,Italy,Lyon,Pendiente,2024-05-25 13:00:00
1157.0,1074,DAVID GÓMEZ,53,Aspiradora Dyson,Hogar,06-11-2024,4.0,325.62,1302.48,Transferencia,España,Berlín,Entregado,2024-06-11 16:00:00
1158.0,1733,Laura Torres,5,AirPods,Tecnología,11-19-2024,1.0,1762.93,1762.93,Transferencia,DE,Hamburgo,Pendiente,2024-11-19 15:00:00
1159.0,1302,Carlos Ruiz,100,AirPods,tecnologia,09/06/2024,4.0,1744.97,6979.88,Tarjeta,France,Hamburgo,Pendiente,2024-06-09 10:00:00
1160.0,1720,Lucía Fernández,51,Sony Headphones,Tecnología,2024-08-09,3.0,68.2,204.6,Transferencia,IT,Barcelona,Entregado,2024-08-09 04:00:00
1161.0,1965,Pedro López,104,Camiseta Adidas,Moda,06-20-2024,3.0,1653.38,4960.14,Bizum,France,Madrid,Cancelado,2024-06-20 07:00:00
1162.0,1417,Carlos Ruiz,144,iPhone 13,Tecnología,14/11/2024,3.0,266.45,799.35,Transferencia,France,Roma,Pendiente,2024-11-14 00:00:00
1163.0,1218,LAURA TORRES,3,Bolso Gucci,Moda,2024-08-11,3.0,676.89,2030.67,Bizum,DE,Valencia,Cancelado,2024-08-11 02:00:00
1164.0,1097,Ana Sánchez,161,Silla Gaming,Hogar,11-30-2023,4.0,1489.58,5958.32,PayPal,spain,Roma,Cancelado,2023-11-30 19:00:00
,1559,Lucía Fernández,171,Aspiradora Dyson,Hogar,2023-11-10,3.0,329.91,989.73,PayPal,Italy,Madrid,Entregado,2023-11-10 00:00:00
1166.0,1338,Lucía Fernández,115,Monitor LG,moda,29/08/2024,4.0,1637.75,6551.0,PayPal,France,Milán,Pendiente,2024-08-29 12:00:00
1167.0,1623,lucía fernández,170,Bolso Gucci,Moda,2024-04-16,1.0,1665.95,1665.95,Transferencia,IT,Hamburgo,Entregado,2024-04-16 22:00:00
1168.0,1297,Carlos Ruiz,12,Bolso Gucci,Moda,10/10/2023,3.0,1019.86,3059.58,Tarjeta,España,Madrid,Pendiente,2023-10-10 11:00:00
1169.0,1029,Lucía Fernández,134,Camiseta Adidas,tecnologia,03-12-2023,3.0,$22.71,,PayPal,Italy,Barcelona,Cancelado,2023-03-12 03:00:00
1170.0,1963,Pedro López,196,iPhone 13,Tecnología,2023-04-04,2.0,581.21,1162.42,Transferencia,ES,Roma,Cancelado,2023-04-04 22:00:00
1171.0,1069,david gómez,120,MacBook Pro,Tecnología,2023-10-11,2.0,1237.68,2475.36,Bizum,IT,Lyon,Entregado,2023-10-11 18:00:00
1172.0,1872,Juan Pérez,160,Aspiradora Dyson,Hogar,01-15-2024,3.0,1962.56,5887.68,PayPal,España,Berlín,Entregado,2024-01-15 22:00:00
1173.0,1266,Lucía Fernández,45,Zapatillas Nike,Moda,11/05/2023,2.0,1267.31,2534.62,PayPal,DE,Barcelona,Cancelado,2023-05-11 05:00:00
1174.0,1178,María García,52,Sony Headphones,Tecnología,30/09/2023,2.0,527.01,1054.02,PayPal,ES,Lyon,Pendiente,2023-09-30 19:00:00
1175.0,1480,Ana Sánchez,50,Teclado Logitech,Tecnología,12/01/2024,1.0,1271.67,1271.67,Tarjeta,DE,Barcelona,Pendiente,2024-01-12 09:00:00
1176.0,1067,Lucía Fernández,100,AirPods,Tecnología,11/10/2024,5.0,1084.57,5422.85,Tarjeta,France,Lyon,Pendiente,2024-10-11 07:00:00
1177.0,1798,Pedro López,104,Monitor LG,Tecnología,09-12-2024,1.0,1561.89,1561.89,PayPal,IT,Valencia,Cancelado,2024-09-12 15:00:00
1178.0,1020,ANA SÁNCHEZ,90,Samsung Galaxy,Tecnología,2024-06-14,5.0,222.89,1114.45,PayPal,DE,Barcelona,Entregado,2024-06-14 04:00:00
1179.0,1583,Carlos Ruiz,71,iPhone 13,Tecnología,27/02/2024,5.0,1524.45,7622.25,Bizum,Italy,Berlín,Pendiente,2024-02-27 07:00:00
1180.0,1845,MARÍA GARCÍA,42,Cafetera Philips,Hogar,2023-12-17,2.0,1087.12,2174.24,Transferencia,DE,Hamburgo,Cancelado,2023-12-17 19:00:00
1181.0,1678,Juan Pérez,10,MacBook Pro,Tecnología,21/04/2024,2.0,1926.35,3852.7,Transferencia,DE,Berlín,Cancelado,2024-04-21 09:00:00
1182.0,1975,lucía fernández,141,AirPods,Tecnología,2024-03-14,4.0,690.33,2761.32,Transferencia,España,Hamburgo,Pendiente,2024-03-14 10:00:00
1183.0,1435,David Gómez,54,Mochila North Face,Accesorios,2023-09-02,1.0,1268.92,1268.92,Transferencia,España,Milán,Cancelado,2023-09-02 02:00:00
1184.0,1733,ana sánchez,79,Camiseta Adidas,Moda,23/05/2024,1.0,1864.74,1864.74,Tarjeta,Italy,Hamburgo,Cancelado,2024-05-23 13:00:00
1185.0,1735,MARÍA GARCÍA,88,Zapatillas Nike,Moda,06-25-2024,1.0,213.99,213.99,Transferencia,France,Paris,Entregado,2024-06-25 20:00:00
1186.0,1619,ANA SÁNCHEZ,86,MacBook Pro,Tecnología,06-26-2024,2.0,1875.08,3750.16,Tarjeta,Italy,Berlín,Entregado,2024-06-26 04:00:00
1187.0,1788,Pedro López,49,Reloj Casio,Accesorios,08/12/2023,4.0,1378.89,5515.56,PayPal,DE,Paris,Pendiente,2023-12-08 19:00:00
1188.0,1429,David Gómez,7,iPhone 13,Tecnología,2024-08-27,3.0,"145,0",,Bizum,spain,Roma,Entregado,2024-08-27 02:00:00
1189.0,1306,Pedro López,162,Zapatillas Nike,Moda,2024-01-30,4.0,608.92,2435.68,PayPal,France,Roma,Cancelado,2024-01-30 20:00:00
1190.0,1002,laura torres,19,iPhone 13,Tecnología,04-19-2024,2.0,1419.26,2838.52,Bizum,España,Milán,Cancelado,2024-04-19 12:00:00
1191.0,1491,Lucía Fernández,53,Teclado Logitech,Tecnología,24/04/2023,5.0,"144,03",,Transferencia,France,Valencia,Entregado,2023-04-24 09:00:00
1192.0,1474,LUCÍA FERNÁNDEZ,136,Monitor LG,Tecnología,2023-06-17,5.0,1168.52,5842.6,Tarjeta,IT,Milán,Pendiente,2023-06-17 22:00:00
1193.0,1574,Laura Torres,119,Silla Gaming,Hogar,30/08/2024,2.0,698.31,1396.62,Tarjeta,España,Barcelona,Cancelado,2024-08-30 02:00:00
1194.0,1847,Lucía Fernández,91,Aspiradora Dyson,Hogar,30/10/2023,1.0,1245.62,1245.62,PayPal,France,Lyon,Cancelado,2023-10-30 13:00:00
1195.0,1929,Carlos Ruiz,47,Aspiradora Dyson,Hogar,2023-07-12,4.0,101.03,404.12,Tarjeta,FR,Lyon,Cancelado,2023-07-12 02:00:00
1196.0,1909,María García,78,Bolso Gucci,Moda,2023-02-19,1.0,1744.36,1744.36,Transferencia,Germany,Lyon,Cancelado,2023-02-19 19:00:00
1197.0,1442,Ana Sánchez,156,Silla Gaming,Hogar,07-29-2023,2.0,1947.24,3894.48,PayPal,France,Berlín,Cancelado,2023-07-29 18:00:00
1198.0,1768,Ana Sánchez,36,Sony Headphones,Tecnología,01-16-2023,2.0,1938.07,3876.14,Tarjeta,España,Berlín,Pendiente,2023-01-16 11:00:00
1199.0,1057,Juan Pérez,152,Mochila North Face,Accesorios,18/09/2024,5.0,1501.81,7509.05,Bizum,FR,Hamburgo,Cancelado,2024-09-18 01:00:00
1200.0,1690,ana sánchez,193,Samsung Galaxy,Tecnología,18/11/2024,5.0,268.87,1344.35,Bizum,FR,Milán,Cancelado,2024-11-18 03:00:00
1201.0,1973,Ana Sánchez,94,Cafetera Philips,Hogar,12/04/2024,2.0,1518.94,3037.88,Bizum,spain,Berlín,Entregado,2024-04-12 09:00:00
1202.0,1346,David Gómez,57,Mochila North Face,Accesorios,2024-11-10,2.0,58.93,117.86,Bizum,FR,Madrid,Cancelado,2024-11-10 01:00:00
1203.0,1230,Pedro López,30,Aspiradora Dyson,Hogar,11-03-2023,2.0,54.03,108.06,Tarjeta,Germany,Milán,Entregado,2023-11-03 22:00:00
1204.0,1538,Ana Sánchez,5,Monitor LG,tech,2024-11-02,1.0,653.98,653.98,Bizum,FR,Roma,Entregado,2024-11-02 15:00:00
1205.0,1527,Pedro López,10,Cafetera Philips,Hogar,2024-01-19,3.0,982.4,2947.2,Transferencia,ES,Madrid,Pendiente,2024-01-19 20:00:00
1206.0,1164,David Gómez,8,Monitor LG,Tecnología,2023-02-01,5.0,1543.11,7715.55,Bizum,spain,Milán,Cancelado,2023-02-01 05:00:00
1207.0,1627,Lucía Fernández,78,Cafetera Philips,Hogar,2023-04-20,5.0,1369.76,6057.946985861134,PayPal,FR,Paris,Entregado,2023-04-20 18:00:00
1208.0,1395,MARÍA GARCÍA,58,Reloj Casio,Accesorios,03-28-2023,5.0,897.35,3883.5654780226064,PayPal,ES,Madrid,Pendiente,2023-03-28 15:00:00
1209.0,1094,Lucía Fernández,172,Bolso Gucci,Moda,09/06/2024,4.0,$554.52,,Bizum,FR,Valencia,Pendiente,2024-06-09 21:00:00
1210.0,1087,Lucía Fernández,57,Samsung Galaxy,Tecnología,2024-06-20,1.0,1994.28,1994.28,Transferencia,FR,Barcelona,Entregado,2024-06-20 20:00:00
1211.0,1661,maría garcía,64,Aspiradora Dyson,Hogar,04-06-2023,5.0,858.1,4290.5,Bizum,España,Barcelona,Pendiente,2023-04-06 10:00:00
1212.0,1245,María García,136,Bolso Gucci,Moda,10/01/2023,1.0,908.26,908.26,Transferencia,DE,Barcelona,Cancelado,2023-01-10 10:00:00
1213.0,1395,María García,183,Aspiradora Dyson,Hogar,2024-05-06,3.0,335.61,1006.83,Transferencia,Germany,Milán,Pendiente,2024-05-06 02:00:00
1214.0,1025,Pedro López,156,Zapatillas Nike,Moda,11-29-2023,1.0,1591.67,1768.4370871896133,PayPal,Germany,Valencia,Cancelado,2023-11-29 11:00:00
1215.0,1663,María García,170,Aspiradora Dyson,Hogar,2023-01-31,1.0,1390.43,1390.43,PayPal,France,Valencia,Pendiente,2023-01-31 20:00:00
1216.0,1987,maría garcía,41,Aspiradora Dyson,Hogar,2023-07-29,5.0,449.33,2246.65,Tarjeta,ES,Hamburgo,Cancelado,2023-07-29 05:00:00
1217.0,1219,María García,148,Mochila North Face,Accesorios,03-05-2024,3.0,$173.94,,Bizum,FR,Milán,Pendiente,2024-03-05 14:00:00
1218.0,1379,Carlos Ruiz,122,Aspiradora Dyson,Hogar,10/05/2023,4.0,1364.19,5456.76,Transferencia,FR,Milán,Pendiente,2023-05-10 03:00:00
1219.0,1920,CARLOS RUIZ,154,iPhone 13,Moda,26/04/2024,2.0,1312.48,2624.96,Tarjeta,FR,Berlín,Pendiente,2024-04-26 16:00:00
1220.0,1481,Laura Torres,80,Samsung Galaxy,Tecnología,27/12/2023,2.0,553.79,1107.58,Tarjeta,FR,Barcelona,Pendiente,2023-12-27 12:00:00
1221.0,1058,Laura Torres,111,Bolso Gucci,moda,2024-09-28,2.0,1902.22,3804.44,Tarjeta,IT,Barcelona,Cancelado,2024-09-28 00:00:00
1222.0,1273,Ana Sánchez,178,Sony Headphones,Tecnología,2024-05-26,1.0,310.61,310.61,Bizum,France,Berlín,Cancelado,2024-05-26 12:00:00
1223.0,1739,María García,112,Camiseta Adidas,Moda,03/10/2023,4.0,870.35,3481.4,Transferencia,France,Barcelona,Entregado,2023-10-03 14:00:00
1224.0,1951,Juan Pérez,46,Sony Headphones,Tecnología,17/03/2023,1.0,1887.8,1887.8,Bizum,ES,Valencia,Entregado,2023-03-17 11:00:00
1225.0,1797,Juan Pérez,4,Samsung Galaxy,Tecnología,11-20-2024,1.0,845.26,845.26,PayPal,IT,Roma,Pendiente,2024-11-20 20:00:00
1226.0,1405,lucía fernández,121,Bolso Gucci,Moda,04-06-2024,3.0,1280.67,3842.01,PayPal,France,Madrid,Pendiente,2024-04-06 09:00:00
1227.0,1424,Laura Torres,158,Reloj Casio,Accesorios,2023-06-06,5.0,801.21,4006.05,Tarjeta,Italy,Paris,Cancelado,2023-06-06 01:00:00
1228.0,1883,Lucía Fernández,188,Cafetera Philips,Hogar,2024-08-03,3.0,555.69,1667.07,Tarjeta,France,Milán,Pendiente,2024-08-03 18:00:00
1229.0,1755,Carlos Ruiz,159,Zapatillas Nike,Moda,06-12-2023,4.0,1968.12,6872.724039286866,Bizum,España,Valencia,Entregado,2023-06-12 20:00:00
1230.0,1900,Lucía Fernández,43,Monitor LG,Tecnología,2023-09-22,3.0,824.57,2473.71,PayPal,IT,Paris,Pendiente,2023-09-22 10:00:00
1231.0,1556,María García,103,MacBook Pro,tech,05-20-2023,5.0,1789.26,8946.3,Bizum,spain,Barcelona,Pendiente,2023-05-20 04:00:00
1232.0,1635,DAVID GÓMEZ,178,MacBook Pro,Tecnología,11-10-2024,5.0,467.61,2338.05,Tarjeta,spain,Lyon,Entregado,2024-11-10 10:00:00
1233.0,1625,Carlos Ruiz,25,Silla Gaming,Hogar,01-22-2023,1.0,434.08,434.08,Tarjeta,España,Berlín,Cancelado,2023-01-22 11:00:00
1234.0,1132,Juan Pérez,9,Reloj Casio,Accesorios,07/09/2023,4.0,71.96,287.84,Bizum,IT,Paris,Entregado,2023-09-07 03:00:00
1235.0,1774,Lucía Fernández,108,MacBook Pro,Tecnología,10/08/2024,4.0,1306.82,5227.28,Transferencia,DE,Milán,Cancelado,2024-08-10 11:00:00
1236.0,1620,María García,31,Mochila North Face,Accesorios,11/07/2024,3.0,743.37,2230.11,Tarjeta,France,Valencia,Pendiente,2024-07-11 22:00:00
1237.0,1975,David Gómez,110,Cafetera Philips,Hogar,02-08-2024,3.0,1730.07,5190.21,Bizum,ES,Paris,Cancelado,2024-02-08 23:00:00
1238.0,1325,María García,49,Monitor LG,Tecnología,2023-01-02,4.0,951.69,3806.76,Transferencia,DE,Berlín,Entregado,2023-01-02 12:00:00
1239.0,1044,Laura Torres,199,Samsung Galaxy,Tecnología,02-28-2023,5.0,1936.7,9683.5,Tarjeta,Italy,Paris,Pendiente,2023-02-28 00:00:00
1240.0,1137,Laura Torres,134,Monitor LG,Tecnología,02/03/2023,4.0,379.2,1516.8,Bizum,France,Lyon,Entregado,2023-03-02 17:00:00
1241.0,1954,David Gómez,70,Reloj Casio,Accesorios,03-13-2023,1.0,"1738,56",,Bizum,spain,Barcelona,Cancelado,2023-03-13 04:00:00
1242.0,1925,Juan Pérez,185,AirPods,Tecnología,04-09-2023,4.0,$1555.43,0.0,Bizum,Germany,Madrid,Cancelado,2023-04-09 12:00:00
1243.0,1798,Pedro López,120,Silla Gaming,Hogar,2024-10-12,2.0,"1544,13",,Tarjeta,FR,Lyon,Cancelado,2024-10-12 03:00:00
1244.0,1353,Juan Pérez,181,Silla Gaming,Hogar,13/08/2023,3.0,1691.12,5073.36,Bizum,España,Berlín,Entregado,2023-08-13 08:00:00
1245.0,1353,Lucía Fernández,73,Zapatillas Nike,Moda,06-08-2023,1.0,1524.44,1524.44,Transferencia,FR,Valencia,Cancelado,2023-06-08 05:00:00
1246.0,1738,Carlos Ruiz,101,Zapatillas Nike,Moda,12-08-2023,3.0,1256.18,3768.54,PayPal,España,Berlín,Pendiente,2023-12-08 20:00:00
1247.0,1873,Pedro López,30,Teclado Logitech,Tecnología,2024-10-12,2.0,271.18,542.36,Tarjeta,ES,Hamburgo,Pendiente,2024-10-12 21:00:00
1248.0,1703,David Gómez,191,Sony Headphones,moda,2024-04-22,2.0,74.73,149.46,PayPal,Germany,Hamburgo,Pendiente,2024-04-22 10:00:00
1249.0,1912,Lucía Fernández,5,Bolso Gucci,Moda,2023-06-06,3.0,"1842,49",,PayPal,España,Milán,Entregado,2023-06-06 20:00:00
1250.0,1935,Carlos Ruiz,111,Mochila North Face,Accesorios,2024-11-16,4.0,1237.13,5222.219895871679,Transferencia,España,Hamburgo,Cancelado,2024-11-16 16:00:00
1251.0,1672,ana sánchez,150,Reloj Casio,Accesorios,06-07-2023,3.0,1595.11,4785.33,PayPal,DE,Milán,Entregado,2023-06-07 05:00:00
1252.0,1623,Lucía Fernández,176,iPhone 13,tech,02-27-2023,5.0,968.23,4841.15,Tarjeta,IT,Milán,Entregado,2023-02-27 06:00:00
1253.0,1932,DAVID GÓMEZ,28,Silla Gaming,TECHNOLOGY,08-22-2023,4.0,243.44,973.76,PayPal,DE,Barcelona,Entregado,2023-08-22 20:00:00
1254.0,1353,Carlos Ruiz,41,Camiseta Adidas,Moda,09-03-2024,1.0,259.12,259.12,Bizum,DE,Berlín,Entregado,2024-09-03 00:00:00
1255.0,1257,MARÍA GARCÍA,149,Samsung Galaxy,Tecnología,2023-11-09,1.0,1374.27,1374.27,Transferencia,España,Roma,Pendiente,2023-11-09 04:00:00
1256.0,1396,Pedro López,172,Mochila North Face,Accesorios,09/03/2023,5.0,866.31,4331.55,PayPal,France,Paris,Pendiente,2023-03-09 03:00:00
1257.0,1878,David Gómez,116,Silla Gaming,Hogar,27/03/2023,3.0,409.04,1227.12,PayPal,Germany,Milán,Entregado,2023-03-27 17:00:00
1258.0,1751,María García,11,MacBook Pro,Tecnología,2023-04-09,5.0,988.27,4941.35,Bizum,spain,Madrid,Pendiente,2023-04-09 18:00:00
1259.0,1241,ana sánchez,102,Aspiradora Dyson,Hogar,04-22-2024,1.0,137.78,137.78,Transferencia,DE,Paris,Pendiente,2024-04-22 22:00:00
1260.0,1597,David Gómez,136,Cafetera Philips,Hogar,09/07/2023,3.0,1168.12,3504.36,Tarjeta,France,Madrid,Pendiente,2023-07-09 17:00:00
1261.0,1507,pedro lópez,166,Bolso Gucci,Moda,2023-05-18,3.0,545.3,1635.9,Transferencia,FR,Madrid,Cancelado,2023-05-18 04:00:00
1262.0,1279,David Gómez,129,MacBook Pro,Tecnología,04/01/2023,1.0,1597.14,1597.14,Tarjeta,IT,Valencia,Cancelado,2023-01-04 22:00:00
1263.0,1422,Pedro López,56,Monitor LG,Tecnología,2023-03-07,2.0,627.62,1255.24,Bizum,ES,Madrid,Pendiente,2023-03-07 04:00:00
1264.0,1745,David Gómez,84,Camiseta Adidas,Moda,04-13-2023,4.0,915.89,3663.56,Transferencia,IT,Lyon,Cancelado,2023-04-13 17:00:00
1265.0,1481,Pedro López,77,Silla Gaming,TECHNOLOGY,2023-02-28,1.0,33.12,33.12,Bizum,France,Lyon,Entregado,2023-02-28 15:00:00
1266.0,1724,Juan Pérez,4,Camiseta Adidas,TECHNOLOGY,14/09/2023,3.0,154.17,462.51,Tarjeta,Germany,Hamburgo,Cancelado,2023-09-14 08:00:00
1267.0,1207,Lucía Fernández,196,Silla Gaming,Hogar,19/06/2023,4.0,"791,06",,PayPal,IT,Barcelona,Pendiente,2023-06-19 06:00:00
1268.0,1827,Lucía Fernández,67,Samsung Galaxy,hogar,2024-08-07,1.0,"965,08",,Tarjeta,DE,Paris,Entregado,2024-08-07 00:00:00
1269.0,1145,Carlos Ruiz,60,Zapatillas Nike,Moda,2023-07-28,1.0,1204.04,1204.04,Bizum,Germany,Hamburgo,Entregado,2023-07-28 22:00:00
1270.0,1776,Laura Torres,146,Camiseta Adidas,Moda,2024-05-18,3.0,$590.41,,Tarjeta,ES,Berlín,Pendiente,2024-05-18 04:00:00
1271.0,1606,MARÍA GARCÍA,46,iPhone 13,tecnologia,2024-09-06,5.0,1393.01,6965.05,Bizum,Italy,Hamburgo,Cancelado,2024-09-06 01:00:00
1272.0,1476,Laura Torres,84,Monitor LG,Tecnología,01-16-2024,4.0,$1721.64,,PayPal,DE,Madrid,Cancelado,2024-01-16 15:00:00
1273.0,1054,Lucía Fernández,12,Silla Gaming,Hogar,02-08-2024,4.0,1561.9,5060.254346683719,Tarjeta,France,Barcelona,Entregado,2024-02-08 22:00:00
1274.0,1947,María García,173,Teclado Logitech,Tecnología,23/07/2024,5.0,88.84,444.2,PayPal,Germany,Hamburgo,Pendiente,2024-07-23 04:00:00
1275.0,1747,Laura Torres,48,Aspiradora Dyson,HOGAR,14/11/2023,5.0,966.21,4831.05,Tarjeta,Italy,Milán,Entregado,2023-11-14 14:00:00
1276.0,1667,Pedro López,65,Reloj Casio,Accesorios,22/11/2023,3.0,218.81,656.43,Transferencia,España,Lyon,Pendiente,2023-11-22 02:00:00
1277.0,1287,Ana Sánchez,76,iPhone 13,Tecnología,10-25-2023,1.0,491.67,491.67,Tarjeta,FR,Hamburgo,Pendiente,2023-10-25 20:00:00
1278.0,1458,Lucía Fernández,41,Aspiradora Dyson,Moda,02-27-2024,4.0,1973.46,7893.84,PayPal,Italy,Valencia,Pendiente,2024-02-27 15:00:00
1279.0,1097,David Gómez,127,Camiseta Adidas,Moda,10/03/2024,3.0,293.57,880.71,PayPal,spain,Milán,Cancelado,2024-03-10 06:00:00
1280.0,1508,maría garcía,93,Silla Gaming,Hogar,09-22-2024,2.0,1002.79,2005.58,Transferencia,IT,Berlín,Cancelado,2024-09-22 09:00:00
1281.0,1921,Lucía Fernández,45,Mochila North Face,Accesorios,06-19-2024,5.0,1240.13,6200.65,Transferencia,IT,Barcelona,Cancelado,2024-06-19 08:00:00
1282.0,1634,Carlos Ruiz,16,Monitor LG,Tecnología,29/04/2024,3.0,1407.91,4223.73,Transferencia,ES,Roma,Entregado,2024-04-29 14:00:00
1283.0,1268,David Gómez,19,Bolso Gucci,Moda,2023-06-15,4.0,1123.7,4494.8,Transferencia,France,Valencia,Cancelado,2023-06-15 21:00:00
1284.0,1353,Juan Pérez,172,MacBook Pro,moda,24/11/2023,2.0,29.44,58.88,Transferencia,DE,Berlín,Cancelado,2023-11-24 22:00:00
1285.0,1694,LUCÍA FERNÁNDEZ,165,Sony Headphones,Tecnología,2023-01-25,2.0,659.66,1319.32,Transferencia,IT,Roma,Cancelado,2023-01-25 03:00:00
1286.0,1485,Ana Sánchez,67,Cafetera Philips,Hogar,2023-12-27,1.0,1040.25,1040.25,PayPal,DE,Milán,Cancelado,2023-12-27 13:00:00
1287.0,1578,Carlos Ruiz,7,Camiseta Adidas,Moda,22/11/2023,5.0,"184,85",,Bizum,IT,Barcelona,Entregado,2023-11-22 03:00:00
1288.0,1610,Pedro López,76,iPhone 13,hogar,03-14-2023,5.0,707.75,3538.75,Bizum,spain,Hamburgo,Entregado,2023-03-14 00:00:00
1289.0,1863,maría garcía,94,Zapatillas Nike,Moda,2024-08-11,4.0,76.07,304.28,Transferencia,France,Barcelona,Cancelado,2024-08-11 04:00:00
1290.0,1689,Juan Pérez,196,Mochila North Face,tecnologia,05-06-2024,4.0,166.37,644.7938499434382,Bizum,Germany,Madrid,Pendiente,2024-05-06 10:00:00
1291.0,1662,Pedro López,18,MacBook Pro,TECHNOLOGY,2023-07-16,5.0,799.88,3999.4,Transferencia,ES,Roma,Pendiente,2023-07-16 23:00:00
1292.0,1147,David Gómez,47,Silla Gaming,Hogar,19/01/2024,1.0,274.1,320.7160998719267,Tarjeta,Germany,Valencia,Entregado,2024-01-19 23:00:00
1293.0,1418,Juan Pérez,141,Mochila North Face,Accesorios,12/08/2023,4.0,$1139.41,,PayPal,spain,Berlín,Pendiente,2023-08-12 23:00:00
1294.0,1064,Lucía Fernández,186,Aspiradora Dyson,Hogar,2024-07-09,3.0,1382.04,4146.12,Bizum,FR,Paris,Pendiente,2024-07-09 13:00:00
1295.0,1281,Ana Sánchez,61,Teclado Logitech,Tecnología,20/01/2023,1.0,1603.17,1603.17,Tarjeta,Germany,Roma,Cancelado,2023-01-20 00:00:00
1296.0,1943,Lucía Fernández,138,AirPods,Tecnología,06-09-2023,3.0,408.3,1224.9,Tarjeta,España,Paris,Pendiente,2023-06-09 20:00:00
1297.0,1939,Carlos Ruiz,16,Aspiradora Dyson,Hogar,2024-07-20,1.0,343.29,395.5058570140097,Bizum,Italy,Hamburgo,Cancelado,2024-07-20 05:00:00
1298.0,1750,David Gómez,148,Mochila North Face,Accesorios,2023-12-26,3.0,218.09,654.27,PayPal,FR,Barcelona,Cancelado,2023-12-26 03:00:00
1299.0,1617,Carlos Ruiz,137,MacBook Pro,Tecnología,19/06/2023,4.0,1276.5,5994.0936154303245,Tarjeta,FR,Paris,Entregado,2023-06-19 23:00:00
1300.0,1317,PEDRO LÓPEZ,26,Teclado Logitech,Moda,2023-01-04,4.0,1415.89,5663.56,Bizum,España,Paris,Cancelado,2023-01-04 16:00:00
1301.0,1160,DAVID GÓMEZ,67,Zapatillas Nike,Moda,01-11-2023,1.0,72.86,72.86,Bizum,spain,Lyon,Pendiente,2023-01-11 20:00:00
1302.0,1057,carlos ruiz,92,Teclado Logitech,Tecnología,07-17-2024,1.0,1873.06,1873.06,Transferencia,IT,Valencia,Cancelado,2024-07-17 09:00:00
1303.0,1940,David Gómez,97,Sony Headphones,Tecnología,10-09-2024,2.0,113.42,226.84,Bizum,ES,Berlín,Entregado,2024-10-09 13:00:00
1304.0,1692,Ana Sánchez,93,Reloj Casio,Accesorios,01-04-2024,4.0,1087.18,4348.72,Bizum,spain,Madrid,Pendiente,2024-01-04 16:00:00
1305.0,1054,Laura Torres,91,Reloj Casio,tech,2024-08-07,1.0,1421.03,1421.03,Transferencia,spain,Hamburgo,Entregado,2024-08-07 20:00:00
1306.0,1959,Laura Torres,115,AirPods,Tecnología,2023-11-28,4.0,"1743,23",,Bizum,France,Valencia,Entregado,2023-11-28 15:00:00
1307.0,1095,ana sánchez,14,Mochila North Face,Accesorios,11-17-2023,1.0,1431.03,1503.6475785431494,PayPal,ES,Hamburgo,Entregado,2023-11-17 22:00:00
1308.0,1365,Ana Sánchez,107,MacBook Pro,Tecnología,02-05-2023,2.0,1605.44,3703.7247002437352,PayPal,France,Milán,Pendiente,2023-02-05 06:00:00
1309.0,1871,Ana Sánchez,173,Bolso Gucci,Moda,21/12/2023,3.0,685.51,2056.53,Tarjeta,Italy,Berlín,Cancelado,2023-12-21 02:00:00
1310.0,1545,Juan Pérez,80,Cafetera Philips,HOGAR,19/01/2024,3.0,"1631,5",0.0,Tarjeta,France,Roma,Pendiente,2024-01-19 00:00:00
1311.0,1420,Carlos Ruiz,135,Monitor LG,Tecnología,05-21-2024,3.0,"169,43",,Tarjeta,Germany,Valencia,Cancelado,2024-05-21 08:00:00
1312.0,1673,David Gómez,153,MacBook Pro,hogar,15/02/2024,2.0,1790.69,3800.744585537298,Transferencia,France,Barcelona,Pendiente,2024-02-15 04:00:00
1313.0,1194,Pedro López,56,Teclado Logitech,Tecnología,2023-03-18,3.0,$1099.71,,Transferencia,España,Milán,Pendiente,2023-03-18 20:00:00
1314.0,1057,ANA SÁNCHEZ,173,Camiseta Adidas,Moda,05/09/2023,2.0,1636.42,3272.84,Tarjeta,Germany,Paris,Entregado,2023-09-05 21:00:00
1315.0,1528,JUAN PÉREZ,122,Teclado Logitech,Tecnología,05-09-2024,4.0,910.11,3640.44,PayPal,España,Valencia,Pendiente,2024-05-09 20:00:00
1316.0,1502,David Gómez,183,Zapatillas Nike,Moda,2024-01-05,2.0,1290.72,2581.44,Transferencia,DE,Paris,Cancelado,2024-01-05 15:00:00
1317.0,1132,María García,98,Zapatillas Nike,Moda,02-11-2024,5.0,1057.54,5287.7,Bizum,Italy,Berlín,Entregado,2024-02-11 19:00:00
1318.0,1729,ANA SÁNCHEZ,20,Silla Gaming,Hogar,12-17-2023,3.0,1465.86,4397.58,Tarjeta,Italy,Berlín,Entregado,2023-12-17 11:00:00
1319.0,1215,Pedro López,10,Bolso Gucci,Moda,09/03/2023,2.0,172.44,344.88,PayPal,IT,Hamburgo,Entregado,2023-03-09 16:00:00
1320.0,1483,Carlos Ruiz,159,Cafetera Philips,Hogar,06/01/2023,5.0,130.1,650.5,Tarjeta,IT,Berlín,Cancelado,2023-01-06 00:00:00
1321.0,1466,Ana Sánchez,113,Teclado Logitech,Tecnología,2024-10-31,5.0,501.74,2508.7,Bizum,IT,Roma,Cancelado,2024-10-31 19:00:00
1322.0,1620,David Gómez,81,Sony Headphones,Tecnología,14/11/2024,4.0,327.49,1309.96,Tarjeta,ES,Lyon,Pendiente,2024-11-14 09:00:00
1323.0,1474,Juan Pérez,186,MacBook Pro,Tecnología,2023-11-12,3.0,1744.85,5234.55,PayPal,ES,Berlín,Cancelado,2023-11-12 20:00:00
1324.0,1621,David Gómez,153,Camiseta Adidas,Moda,27/05/2024,5.0,$446.24,0.0,PayPal,Italy,Madrid,Cancelado,2024-05-27 02:00:00
1325.0,1669,DAVID GÓMEZ,3,Reloj Casio,Accesorios,30/08/2024,1.0,1951.97,1951.97,Transferencia,FR,Berlín,Entregado,2024-08-30 18:00:00
1326.0,1571,Carlos Ruiz,30,Bolso Gucci,Moda,06/04/2023,4.0,680.42,2721.68,PayPal,ES,Roma,Pendiente,2023-04-06 04:00:00
1327.0,1364,DAVID GÓMEZ,169,MacBook Pro,Tecnología,04/12/2023,2.0,372.41,744.82,Transferencia,España,Roma,Pendiente,2023-12-04 00:00:00
1328.0,1483,JUAN PÉREZ,79,Samsung Galaxy,Tecnología,2024-11-19,4.0,1581.5,6326.0,Tarjeta,España,Paris,Pendiente,2024-11-19 21:00:00
1329.0,1399,Laura Torres,164,iPhone 13,Tecnología,13/07/2023,2.0,1320.83,2664.9909942298623,Tarjeta,spain,Berlín,Entregado,2023-07-13 18:00:00
1330.0,1656,David Gómez,120,Silla Gaming,Hogar,08-16-2024,5.0,1001.41,5007.05,PayPal,Germany,Lyon,Pendiente,2024-08-16 07:00:00
1331.0,1155,Pedro López,167,Silla Gaming,HOGAR,11-20-2023,3.0,1115.17,3345.51,PayPal,DE,Barcelona,Cancelado,2023-11-20 15:00:00
1332.0,1741,ana sánchez,114,MacBook Pro,Tecnología,2023-05-01,5.0,1441.21,7206.05,Bizum,España,Valencia,Entregado,2023-05-01 00:00:00
1333.0,1236,lucía fernández,12,Sony Headphones,Tecnología,07-02-2024,2.0,464.62,929.24,Transferencia,España,Barcelona,Entregado,2024-07-02 20:00:00
1334.0,1909,Carlos Ruiz,46,Teclado Logitech,Tecnología,06-14-2023,5.0,1992.7,9963.5,Transferencia,IT,Lyon,Pendiente,2023-06-14 03:00:00
1335.0,1893,Laura Torres,154,Cafetera Philips,Hogar,17/03/2023,4.0,1949.84,7799.36,PayPal,DE,Paris,Pendiente,2023-03-17 10:00:00
1336.0,1952,María García,1,Sony Headphones,Tecnología,03-19-2023,2.0,1304.15,2608.3,Transferencia,DE,Madrid,Entregado,2023-03-19 21:00:00
1337.0,1426,Laura Torres,151,Teclado Logitech,Tecnología,03-29-2024,2.0,407.09,814.18,Bizum,España,Paris,Entregado,2024-03-29 19:00:00
1338.0,1314,Laura Torres,73,Samsung Galaxy,Tecnología,2023-10-06,3.0,1363.65,4090.95,Transferencia,spain,Valencia,Pendiente,2023-10-06 05:00:00
1339.0,1834,Pedro López,123,Camiseta Adidas,Moda,12-23-2023,5.0,153.67,768.35,Transferencia,DE,Valencia,Cancelado,2023-12-23 11:00:00
1340.0,1624,Juan Pérez,192,Zapatillas Nike,Moda,11-12-2023,3.0,71.0,186.97340882460037,Bizum,IT,Milán,Entregado,2023-11-12 06:00:00
1341.0,1316,Carlos Ruiz,66,Sony Headphones,Tecnología,2023-10-11,2.0,"522,79",,Tarjeta,España,Milán,Cancelado,2023-10-11 20:00:00
1342.0,1771,Juan Pérez,108,Bolso Gucci,Moda,2024-11-14,1.0,930.62,930.62,PayPal,ES,Milán,Cancelado,2024-11-14 08:00:00
1343.0,1827,Ana Sánchez,19,Monitor LG,Tecnología,2023-07-26,5.0,1737.86,8689.3,PayPal,FR,Barcelona,Cancelado,2023-07-26 20:00:00
1344.0,1027,Lucía Fernández,140,Aspiradora Dyson,Hogar,16/06/2023,5.0,1457.07,7285.35,Tarjeta,DE,Madrid,Pendiente,2023-06-16 11:00:00
1345.0,1904,Carlos Ruiz,130,Aspiradora Dyson,Hogar,09-12-2024,1.0,$1487.99,,PayPal,FR,Hamburgo,Cancelado,2024-09-12 22:00:00
1346.0,1052,Pedro López,20,Zapatillas Nike,Moda,12/07/2023,1.0,856.73,856.73,Tarjeta,ES,Hamburgo,Cancelado,2023-07-12 13:00:00
1347.0,1688,Carlos Ruiz,141,Reloj Casio,Accesorios,11-24-2023,5.0,698.41,3492.05,PayPal,IT,Lyon,Pendiente,2023-11-24 17:00:00
1348.0,1723,LAURA TORRES,64,Silla Gaming,Hogar,06-16-2024,4.0,748.37,2993.48,Tarjeta,Germany,Berlín,Cancelado,2024-06-16 12:00:00
1349.0,1938,María García,78,Bolso Gucci,Moda,02-21-2024,4.0,1975.42,7901.68,Tarjeta,Germany,Barcelona,Cancelado,2024-02-21 01:00:00
1350.0,1583,María García,69,Cafetera Philips,tecnologia,01-02-2024,5.0,89.82,449.1,PayPal,España,Valencia,Pendiente,2024-01-02 20:00:00
1351.0,1449,David Gómez,145,Aspiradora Dyson,Hogar,2024-09-06,3.0,1735.39,5206.17,PayPal,France,Berlín,Entregado,2024-09-06 07:00:00
1352.0,1404,Lucía Fernández,25,Mochila North Face,Accesorios,2023-04-30,1.0,$1161.56,,Bizum,France,Milán,Entregado,2023-04-30 14:00:00
1353.0,1527,Pedro López,55,MacBook Pro,Tecnología,2023-12-13,4.0,882.84,3531.36,Bizum,IT,Valencia,Entregado,2023-12-13 03:00:00
1354.0,1850,Pedro López,99,Mochila North Face,Accesorios,2024-11-22,5.0,1453.26,7266.3,PayPal,France,Madrid,Pendiente,2024-11-22 14:00:00
1355.0,1158,LUCÍA FERNÁNDEZ,148,Silla Gaming,Hogar,28/02/2023,1.0,978.47,978.47,Transferencia,Italy,Madrid,Pendiente,2023-02-28 10:00:00
1356.0,1124,Laura Torres,176,Reloj Casio,Accesorios,2023-01-06,2.0,1748.11,3496.22,PayPal,Italy,Paris,Entregado,2023-01-06 16:00:00
1357.0,1995,Laura Torres,47,Camiseta Adidas,Moda,2023-10-18,2.0,1802.4,3604.8,PayPal,España,Paris,Cancelado,2023-10-18 20:00:00
1358.0,1688,Carlos Ruiz,56,AirPods,Tecnología,2023-01-13,1.0,"849,22",,Bizum,Germany,Milán,Pendiente,2023-01-13 07:00:00
1359.0,1164,Pedro López,174,Zapatillas Nike,Moda,03-03-2023,1.0,560.89,555.7329461450721,Tarjeta,IT,Hamburgo,Pendiente,2023-03-03 21:00:00
1360.0,1326,María García,81,iPhone 13,Tecnología,01-20-2024,5.0,1188.78,5943.9,Transferencia,ES,Madrid,Pendiente,2024-01-20 10:00:00
1361.0,1370,David Gómez,74,Cafetera Philips,Hogar,01/11/2024,2.0,1825.6,3651.2,Tarjeta,Italy,Lyon,Cancelado,2024-11-01 03:00:00
1362.0,1018,Juan Pérez,163,iPhone 13,Tecnología,01-19-2024,1.0,429.22,429.22,Bizum,France,Barcelona,Cancelado,2024-01-19 23:00:00
1363.0,1678,CARLOS RUIZ,83,Samsung Galaxy,Moda,06/06/2023,3.0,1249.7,3749.1,Bizum,France,Barcelona,Entregado,2023-06-06 04:00:00
1364.0,1244,David Gómez,28,Cafetera Philips,Hogar,05/07/2023,2.0,1266.8,2533.6,Tarjeta,IT,Milán,Cancelado,2023-07-05 08:00:00
1365.0,1884,Laura Torres,157,Aspiradora Dyson,Hogar,27/02/2024,1.0,$1468.89,,Transferencia,France,Valencia,Entregado,2024-02-27 00:00:00
1366.0,1563,juan pérez,12,Zapatillas Nike,Moda,2023-06-24,5.0,271.82,1359.1,PayPal,France,Berlín,Cancelado,2023-06-24 16:00:00
1367.0,1868,david gómez,66,Cafetera Philips,Hogar,13/01/2023,2.0,1434.49,2868.98,PayPal,spain,Milán,Cancelado,2023-01-13 15:00:00
1368.0,1296,ANA SÁNCHEZ,114,Cafetera Philips,Hogar,16/10/2023,2.0,1818.97,3637.94,Bizum,FR,Milán,Entregado,2023-10-16 08:00:00
1369.0,1626,Carlos Ruiz,137,Zapatillas Nike,Moda,05-29-2024,3.0,367.57,1102.71,Transferencia,DE,Lyon,Cancelado,2024-05-29 01:00:00
1370.0,1287,Laura Torres,39,Bolso Gucci,Moda,07-26-2023,2.0,482.71,965.42,Bizum,Italy,Madrid,Cancelado,2023-07-26 12:00:00
1371.0,1168,María García,30,Cafetera Philips,Hogar,08/12/2023,3.0,1943.08,5829.24,Transferencia,Italy,Berlín,Cancelado,2023-12-08 12:00:00
1372.0,1074,David Gómez,156,Samsung Galaxy,Tecnología,2023-01-21,4.0,370.14,1480.56,PayPal,FR,Madrid,Pendiente,2023-01-21 21:00:00
1373.0,1610,Pedro López,40,Cafetera Philips,Hogar,03-19-2024,1.0,1710.23,1710.23,PayPal,IT,Berlín,Entregado,2024-03-19 09:00:00
1374.0,1303,Pedro López,52,MacBook Pro,Tecnología,11-04-2024,1.0,989.63,989.63,Bizum,Germany,Paris,Entregado,2024-11-04 23:00:00
1375.0,1447,Pedro López,61,Reloj Casio,Accesorios,24/06/2024,1.0,501.99,501.99,Tarjeta,France,Lyon,Cancelado,2024-06-24 01:00:00
1376.0,1749,María García,154,Teclado Logitech,Tecnología,06-07-2024,4.0,1742.79,6971.16,PayPal,Italy,Hamburgo,Cancelado,2024-06-07 01:00:00
1377.0,1947,Ana Sánchez,23,Monitor LG,Tecnología,07-11-2023,5.0,896.16,4304.044234766395,PayPal,DE,Milán,Pendiente,2023-07-11 06:00:00
1378.0,1122,Laura Torres,166,Aspiradora Dyson,Hogar,08-14-2023,4.0,1034.49,4137.96,Tarjeta,spain,Paris,Cancelado,2023-08-14 20:00:00
1379.0,1986,Lucía Fernández,87,Aspiradora Dyson,Hogar,05-26-2023,3.0,724.87,2174.61,Tarjeta,Germany,Valencia,Cancelado,2023-05-26 03:00:00
1380.0,1579,Carlos Ruiz,193,Samsung Galaxy,TECHNOLOGY,2024-09-23,5.0,1189.97,5949.85,Transferencia,Italy,Madrid,Cancelado,2024-09-23 06:00:00
1381.0,1137,JUAN PÉREZ,5,Silla Gaming,Hogar,18/11/2024,4.0,335.41,1093.8247256495827,Tarjeta,Italy,Barcelona,Entregado,2024-11-18 17:00:00
1382.0,1845,pedro lópez,179,Aspiradora Dyson,Hogar,01-26-2024,3.0,788.25,2364.75,PayPal,Germany,Milán,Entregado,2024-01-26 06:00:00
1383.0,1962,Ana Sánchez,166,Samsung Galaxy,Tecnología,2023-03-16,3.0,1939.13,5817.39,Transferencia,España,Barcelona,Pendiente,2023-03-16 00:00:00
1384.0,1706,Carlos Ruiz,130,Samsung Galaxy,Tecnología,11-24-2024,3.0,523.69,1571.07,Bizum,España,Milán,Pendiente,2024-11-24 06:00:00
1385.0,1056,david gómez,121,Reloj Casio,Accesorios,08-22-2023,3.0,1316.91,3950.73,Tarjeta,DE,Roma,Cancelado,2023-08-22 23:00:00
1386.0,1085,María García,125,iPhone 13,Tecnología,01-20-2024,4.0,657.13,2628.52,Tarjeta,France,Roma,Entregado,2024-01-20 06:00:00
1387.0,1656,Laura Torres,151,Camiseta Adidas,Moda,2024-05-22,3.0,1549.21,4647.63,Tarjeta,Germany,Valencia,Entregado,2024-05-22 13:00:00
1388.0,1034,Carlos Ruiz,147,Silla Gaming,Hogar,01/01/2024,2.0,270.44,580.6425924101754,Transferencia,France,Milán,Pendiente,2024-01-01 08:00:00
1389.0,1932,Laura Torres,45,Monitor LG,tecnologia,15/03/2023,3.0,1939.94,5819.82,Transferencia,DE,Lyon,Pendiente,2023-03-15 12:00:00
1390.0,1602,LUCÍA FERNÁNDEZ,64,Monitor LG,Tecnología,13/04/2024,4.0,913.04,3652.16,Tarjeta,ES,Hamburgo,Pendiente,2024-04-13 04:00:00
1391.0,1039,laura torres,164,Reloj Casio,Accesorios,05-06-2024,1.0,479.74,479.74,Tarjeta,Italy,Madrid,Pendiente,2024-05-06 11:00:00
1392.0,1362,María García,108,Cafetera Philips,TECHNOLOGY,25/06/2024,4.0,156.26,625.04,Transferencia,DE,Milán,Entregado,2024-06-25 19:00:00
1393.0,1629,Ana Sánchez,89,Teclado Logitech,Tecnología,28/07/2024,5.0,347.82,1739.1,Tarjeta,Italy,Milán,Entregado,2024-07-28 10:00:00
1394.0,1835,Ana Sánchez,135,Mochila North Face,Accesorios,2023-02-03,5.0,1044.35,5221.75,PayPal,spain,Hamburgo,Pendiente,2023-02-03 06:00:00
1395.0,1126,Carlos Ruiz,27,Reloj Casio,Accesorios,12/05/2023,1.0,680.64,680.64,Tarjeta,IT,Roma,Entregado,2023-05-12 08:00:00
1396.0,1907,Laura Torres,25,Camiseta Adidas,Moda,2024-08-16,2.0,1659.48,3318.96,PayPal,IT,Roma,Cancelado,2024-08-16 16:00:00
1397.0,1884,Lucía Fernández,129,Teclado Logitech,Tecnología,2024-10-13,3.0,$867.47,,Transferencia,FR,Madrid,Entregado,2024-10-13 18:00:00
1398.0,1334,DAVID GÓMEZ,125,iPhone 13,Tecnología,2023-04-27,3.0,504.94,1514.82,Tarjeta,spain,Barcelona,Pendiente,2023-04-27 12:00:00
1399.0,1749,Lucía Fernández,130,MacBook Pro,Tecnología,11-13-2024,4.0,$1238.12,,PayPal,Germany,Roma,Pendiente,2024-11-13 05:00:00
1400.0,1311,María García,94,Zapatillas Nike,Moda,07-09-2023,4.0,$1416.49,,Transferencia,France,Milán,Pendiente,2023-07-09 15:00:00
1401.0,1838,David Gómez,171,Sony Headphones,Tecnología,2023-06-06,5.0,342.41,1712.05,Transferencia,spain,Milán,Pendiente,2023-06-06 05:00:00
1402.0,1234,David Gómez,85,Sony Headphones,Tecnología,10-22-2023,1.0,343.56,343.56,Bizum,IT,Milán,Pendiente,2023-10-22 23:00:00
1403.0,1982,Laura Torres,2,Teclado Logitech,Tecnología,2023-07-24,4.0,82.98,331.92,Transferencia,spain,Berlín,Cancelado,2023-07-24 16:00:00
1404.0,1347,Juan Pérez,24,Silla Gaming,Hogar,20/03/2024,4.0,1475.44,6863.485414264764,Bizum,France,Madrid,Entregado,2024-03-20 17:00:00
1405.0,1080,Pedro López,146,Zapatillas Nike,Moda,12-01-2023,3.0,1330.97,3992.91,PayPal,IT,Valencia,Cancelado,2023-12-01 05:00:00
1406.0,1003,Carlos Ruiz,31,Monitor LG,Tecnología,2024-11-25,4.0,954.52,3818.08,PayPal,FR,Milán,Pendiente,2024-11-25 03:00:00
1407.0,1213,Ana Sánchez,106,iPhone 13,Tecnología,05-14-2024,4.0,1689.9,6759.6,Bizum,DE,Madrid,Cancelado,2024-05-14 00:00:00
1408.0,1486,Carlos Ruiz,7,Silla Gaming,moda,2024-10-26,5.0,"1613,28",,PayPal,spain,Roma,Cancelado,2024-10-26 18:00:00
1409.0,1141,Juan Pérez,91,iPhone 13,Tecnología,2024-04-04,2.0,1174.86,2349.72,Bizum,IT,Milán,Pendiente,2024-04-04 17:00:00
1410.0,1656,Carlos Ruiz,173,Bolso Gucci,Moda,05-31-2024,2.0,1737.86,3475.72,Bizum,FR,Paris,Entregado,2024-05-31 08:00:00
1411.0,1719,Carlos Ruiz,162,Sony Headphones,Tecnología,05/06/2024,5.0,419.62,2098.1,Bizum,ES,Madrid,Cancelado,2024-06-05 08:00:00
1412.0,1484,Pedro López,122,Mochila North Face,Accesorios,18/10/2024,2.0,$232.72,,PayPal,spain,Barcelona,Cancelado,2024-10-18 23:00:00
1413.0,1406,David Gómez,81,Cafetera Philips,Hogar,2023-07-15,1.0,546.8,615.4413514050451,Transferencia,España,Roma,Cancelado,2023-07-15 22:00:00
1414.0,1736,Ana Sánchez,181,Teclado Logitech,Tecnología,2023-04-22,4.0,123.6,495.8190103729243,Tarjeta,IT,Berlín,Pendiente,2023-04-22 17:00:00
1415.0,1014,Juan Pérez,95,Sony Headphones,Tecnología,2023-01-09,2.0,1067.03,2134.06,Tarjeta,DE,Roma,Entregado,2023-01-09 01:00:00
1416.0,1726,María García,172,Monitor LG,Tecnología,2023-07-24,2.0,1873.85,3747.7,Tarjeta,Italy,Madrid,Cancelado,2023-07-24 11:00:00
1417.0,1101,María García,45,iPhone 13,Tecnología,29/02/2024,4.0,88.29,353.16,PayPal,Italy,Lyon,Entregado,2024-02-29 18:00:00
1418.0,1478,maría garcía,40,Camiseta Adidas,Moda,18/05/2023,3.0,253.0,759.0,PayPal,France,Valencia,Cancelado,2023-05-18 23:00:00
1419.0,1938,Lucía Fernández,89,iPhone 13,Moda,2024-04-16,3.0,909.88,2729.64,Tarjeta,France,Hamburgo,Cancelado,2024-04-16 12:00:00
1420.0,1007,Carlos Ruiz,189,Bolso Gucci,Moda,2023-08-25,5.0,1868.41,10224.65035140395,Bizum,France,Valencia,Cancelado,2023-08-25 01:00:00
1421.0,1242,Laura Torres,188,Mochila North Face,Accesorios,2024-11-15,2.0,"639,15",,Tarjeta,Italy,Berlín,Entregado,2024-11-15 14:00:00
1422.0,1058,LAURA TORRES,173,Monitor LG,Tecnología,03-11-2023,5.0,1019.4,5097.0,Bizum,spain,Berlín,Cancelado,2023-03-11 05:00:00
1423.0,1119,Carlos Ruiz,168,Reloj Casio,Accesorios,2024-01-23,3.0,92.73,278.19,PayPal,FR,Berlín,Entregado,2024-01-23 03:00:00
1424.0,1390,David Gómez,2,Camiseta Adidas,moda,03/11/2023,2.0,305.2,610.4,PayPal,IT,Madrid,Entregado,2023-11-03 04:00:00
1425.0,1914,Carlos Ruiz,158,Zapatillas Nike,Moda,14/08/2024,1.0,1973.39,1973.39,Transferencia,IT,Hamburgo,Pendiente,2024-08-14 14:00:00
1426.0,1309,David Gómez,138,Reloj Casio,Accesorios,30/07/2024,5.0,"1930,59",,PayPal,Italy,Milán,Pendiente,2024-07-30 08:00:00
1427.0,1202,DAVID GÓMEZ,192,Reloj Casio,Accesorios,19/09/2024,2.0,$19.83,,Bizum,spain,Milán,Cancelado,2024-09-19 22:00:00
1428.0,1794,Juan Pérez,182,Reloj Casio,hogar,07/10/2024,4.0,1904.11,7616.44,Bizum,IT,Paris,Entregado,2024-10-07 15:00:00
1429.0,1092,Pedro López,77,Teclado Logitech,Tecnología,06-28-2023,1.0,1281.85,1281.85,PayPal,spain,Barcelona,Entregado,2023-06-28 03:00:00
1430.0,1426,Pedro López,165,Sony Headphones,Tecnología,09-17-2024,2.0,1737.16,3474.32,Tarjeta,Germany,Milán,Cancelado,2024-09-17 04:00:00
1431.0,1935,Ana Sánchez,26,Zapatillas Nike,Moda,08/05/2024,4.0,914.93,3659.72,PayPal,Germany,Lyon,Pendiente,2024-05-08 22:00:00
1432.0,1711,Pedro López,64,Mochila North Face,Accesorios,2023-08-09,5.0,1036.04,5180.2,PayPal,FR,Lyon,Entregado,2023-08-09 09:00:00
1433.0,1719,MARÍA GARCÍA,195,iPhone 13,Moda,10/08/2024,2.0,982.8,1965.6,Bizum,France,Hamburgo,Cancelado,2024-08-10 19:00:00
1434.0,1936,ANA SÁNCHEZ,46,iPhone 13,Tecnología,2023-03-20,3.0,1337.06,4011.18,Transferencia,IT,Berlín,Entregado,2023-03-20 13:00:00
1435.0,1271,Ana Sánchez,100,Samsung Galaxy,Tecnología,2023-11-21,1.0,287.91,287.91,PayPal,DE,Barcelona,Entregado,2023-11-21 10:00:00
1436.0,1880,Lucía Fernández,173,Zapatillas Nike,Moda,06-09-2024,3.0,69.65,208.95,Tarjeta,France,Madrid,Entregado,2024-06-09 02:00:00
1437.0,1354,David Gómez,95,Aspiradora Dyson,Hogar,03-15-2024,4.0,622.78,2491.12,Tarjeta,DE,Valencia,Entregado,2024-03-15 10:00:00
1438.0,1748,maría garcía,174,Bolso Gucci,Moda,04/05/2024,5.0,1412.31,7061.55,Transferencia,spain,Paris,Entregado,2024-05-04 03:00:00
1439.0,1219,Juan Pérez,67,Silla Gaming,Hogar,21/07/2024,5.0,411.69,2347.5061167463823,Tarjeta,Germany,Roma,Cancelado,2024-07-21 08:00:00
1440.0,1344,María García,197,Mochila North Face,Accesorios,10-03-2023,1.0,1350.13,1350.13,Transferencia,DE,Valencia,Entregado,2023-10-03 08:00:00
1441.0,1237,LUCÍA FERNÁNDEZ,30,Mochila North Face,Accesorios,02-18-2024,3.0,1940.12,5820.36,PayPal,Germany,Paris,Entregado,2024-02-18 12:00:00
1442.0,1743,Pedro López,107,Samsung Galaxy,Tecnología,17/09/2023,2.0,$196.86,,Transferencia,IT,Lyon,Cancelado,2023-09-17 18:00:00
,1166,pedro lópez,62,iPhone 13,Tecnología,06-27-2024,5.0,"1348,48",,Tarjeta,IT,Madrid,Cancelado,2024-06-27 10:00:00
1444.0,1199,Juan Pérez,190,Samsung Galaxy,Tecnología,02/09/2023,3.0,893.06,2679.18,Transferencia,France,Madrid,Entregado,2023-09-02 11:00:00
1445.0,1253,María García,22,Monitor LG,Tecnología,2024-06-16,1.0,1737.6,1737.6,Bizum,DE,Roma,Pendiente,2024-06-16 16:00:00
1446.0,1187,JUAN PÉREZ,151,Reloj Casio,Accesorios,06-29-2024,5.0,362.53,1812.65,Transferencia,DE,Valencia,Entregado,2024-06-29 03:00:00
1447.0,1017,Ana Sánchez,48,Reloj Casio,Accesorios,03-28-2023,2.0,1388.33,2776.66,PayPal,spain,Paris,Pendiente,2023-03-28 16:00:00
1448.0,1512,Ana Sánchez,118,Teclado Logitech,Tecnología,2024-11-16,2.0,1677.85,3355.7,PayPal,ES,Valencia,Entregado,2024-11-16 18:00:00
1449.0,1335,Pedro López,30,iPhone 13,Tecnología,30/05/2023,3.0,1889.78,5669.34,Transferencia,FR,Hamburgo,Pendiente,2023-05-30 06:00:00
1450.0,1923,Laura Torres,177,Mochila North Face,Accesorios,20/07/2024,4.0,1369.66,5478.64,Tarjeta,FR,Hamburgo,Pendiente,2024-07-20 22:00:00
1451.0,1771,Pedro López,50,Camiseta Adidas,Moda,04/04/2024,1.0,999.38,999.38,Tarjeta,spain,Lyon,Cancelado,2024-04-04 16:00:00
1452.0,1218,Ana Sánchez,32,Teclado Logitech,Tecnología,19/08/2023,5.0,1239.52,6197.6,Bizum,France,Paris,Entregado,2023-08-19 12:00:00
1453.0,1842,Lucía Fernández,88,Mochila North Face,Accesorios,2024-01-22,4.0,1739.12,5987.162126520887,PayPal,Italy,Berlín,Cancelado,2024-01-22 00:00:00
1454.0,1618,María García,130,Silla Gaming,Hogar,2024-03-19,1.0,$1145.51,,Bizum,FR,Lyon,Pendiente,2024-03-19 01:00:00
1455.0,1414,Juan Pérez,149,Teclado Logitech,Tecnología,27/05/2023,4.0,70.47,281.88,Bizum,Germany,Barcelona,Pendiente,2023-05-27 12:00:00
1456.0,1821,Laura Torres,149,Sony Headphones,Tecnología,26/04/2023,1.0,1862.59,1862.59,Tarjeta,ES,Milán,Cancelado,2023-04-26 11:00:00
1457.0,1910,Carlos Ruiz,170,Reloj Casio,Accesorios,09-19-2024,5.0,1382.16,6910.8,Transferencia,Germany,Paris,Pendiente,2024-09-19 05:00:00
1458.0,1195,David Gómez,41,Silla Gaming,Hogar,26/01/2023,1.0,1356.26,1356.26,Transferencia,IT,Paris,Cancelado,2023-01-26 08:00:00
1459.0,1642,Carlos Ruiz,97,Bolso Gucci,Moda,2024-10-04,3.0,439.19,1317.57,Tarjeta,España,Berlín,Entregado,2024-10-04 22:00:00
1460.0,1684,Laura Torres,72,Silla Gaming,Hogar,11-22-2023,4.0,1321.18,5284.72,Bizum,France,Milán,Cancelado,2023-11-22 05:00:00
1461.0,1018,Lucía Fernández,28,Teclado Logitech,Tecnología,11-07-2024,2.0,793.79,1587.58,Transferencia,ES,Hamburgo,Entregado,2024-11-07 15:00:00
1462.0,1545,ana sánchez,188,AirPods,Tecnología,2023-01-30,1.0,1305.95,1305.95,PayPal,España,Milán,Pendiente,2023-01-30 20:00:00
1463.0,1064,Juan Pérez,10,MacBook Pro,Tecnología,07-11-2024,1.0,222.12,222.12,PayPal,France,Lyon,Cancelado,2024-07-11 21:00:00
1464.0,1800,Juan Pérez,174,AirPods,Tecnología,12/11/2024,1.0,"1319,11",0.0,Tarjeta,Italy,Valencia,Cancelado,2024-11-12 09:00:00
1465.0,1707,laura torres,8,iPhone 13,Tecnología,23/05/2024,4.0,"1998,83",0.0,Tarjeta,España,Lyon,Cancelado,2024-05-23 20:00:00
1466.0,1298,Lucía Fernández,122,Teclado Logitech,Tecnología,11-15-2023,1.0,105.94,105.94,Bizum,France,Barcelona,Cancelado,2023-11-15 00:00:00
1467.0,1065,Lucía Fernández,58,Cafetera Philips,Hogar,10-04-2024,5.0,1954.58,9772.9,Transferencia,FR,Valencia,Pendiente,2024-10-04 01:00:00
1468.0,1619,Carlos Ruiz,114,Samsung Galaxy,Tecnología,20/05/2023,3.0,"819,75",,Transferencia,Italy,Roma,Entregado,2023-05-20 05:00:00
,1531,pedro lópez,162,Samsung Galaxy,Tecnología,2023-06-25,4.0,1742.8,6971.2,Bizum,spain,Milán,Cancelado,2023-06-25 07:00:00
1470.0,1795,Laura Torres,175,Silla Gaming,Hogar,09-13-2023,2.0,1566.95,3133.9,Tarjeta,Germany,Madrid,Pendiente,2023-09-13 21:00:00
1471.0,1503,CARLOS RUIZ,26,iPhone 13,Tecnología,10-06-2023,4.0,$1138.36,,Tarjeta,spain,Barcelona,Entregado,2023-10-06 01:00:00
1472.0,1402,Ana Sánchez,129,Mochila North Face,Accesorios,2023-07-25,1.0,1479.51,1713.221679689656,Bizum,ES,Barcelona,Cancelado,2023-07-25 08:00:00
1473.0,1232,Pedro López,62,Cafetera Philips,HOGAR,10-06-2023,1.0,1758.25,1758.25,Transferencia,DE,Madrid,Pendiente,2023-10-06 05:00:00
1474.0,1888,Lucía Fernández,79,Mochila North Face,Accesorios,02/09/2024,,"814,24",,Bizum,ES,Barcelona,Cancelado,2024-09-02 04:00:00
1475.0,1699,María García,150,MacBook Pro,Tecnología,2024-07-25,2.0,660.8,1321.6,Bizum,ES,Hamburgo,Pendiente,2024-07-25 19:00:00
1476.0,1904,ANA SÁNCHEZ,99,Reloj Casio,Accesorios,19/02/2024,2.0,1338.51,2677.02,Transferencia,Germany,Milán,Cancelado,2024-02-19 07:00:00
1477.0,1632,Lucía Fernández,62,Silla Gaming,Hogar,2024-02-23,5.0,1617.61,8088.05,Tarjeta,France,Berlín,Cancelado,2024-02-23 23:00:00
1478.0,1794,ana sánchez,142,Zapatillas Nike,Moda,03-10-2024,1.0,1526.95,1526.95,PayPal,España,Barcelona,Cancelado,2024-03-10 13:00:00
1479.0,1383,Carlos Ruiz,67,Reloj Casio,Accesorios,2023-09-02,3.0,1597.65,4792.95,Bizum,IT,Hamburgo,Cancelado,2023-09-02 20:00:00
1480.0,1139,Carlos Ruiz,5,Bolso Gucci,TECHNOLOGY,10-10-2023,4.0,876.81,3507.24,Tarjeta,Germany,Barcelona,Entregado,2023-10-10 12:00:00
1481.0,1450,Lucía Fernández,5,Silla Gaming,Hogar,2023-05-25,4.0,1637.49,6549.96,Bizum,Italy,Lyon,Cancelado,2023-05-25 10:00:00
1482.0,1021,Pedro López,107,Camiseta Adidas,Moda,02-17-2024,1.0,249.22,249.22,Bizum,Italy,Roma,Entregado,2024-02-17 03:00:00
1483.0,1930,Pedro López,32,Reloj Casio,Accesorios,19/08/2023,3.0,1093.53,3280.59,PayPal,Germany,Madrid,Entregado,2023-08-19 08:00:00
1484.0,1807,Laura Torres,73,Monitor LG,Tecnología,25/08/2024,2.0,21.46,42.92,Bizum,DE,Valencia,Entregado,2024-08-25 21:00:00
1485.0,1809,María García,30,Reloj Casio,Accesorios,24/07/2023,3.0,655.93,1967.79,Bizum,IT,Roma,Pendiente,2023-07-24 19:00:00
1486.0,1833,Ana Sánchez,37,Camiseta Adidas,Moda,22/04/2024,3.0,739.26,2217.78,Tarjeta,Italy,Valencia,Cancelado,2024-04-22 12:00:00
1487.0,1701,Ana Sánchez,176,Zapatillas Nike,Moda,2024-05-30,1.0,$798.38,,Transferencia,España,Roma,Cancelado,2024-05-30 01:00:00
1488.0,1741,Ana Sánchez,63,MacBook Pro,Tecnología,07/10/2024,1.0,"1393,98",,Tarjeta,ES,Berlín,Entregado,2024-10-07 14:00:00
1489.0,1491,Laura Torres,19,iPhone 13,Tecnología,2023-02-19,5.0,783.23,3916.15,PayPal,Italy,Milán,Entregado,2023-02-19 15:00:00
1490.0,1978,Laura Torres,146,iPhone 13,Tecnología,10-09-2023,4.0,902.9,3611.6,PayPal,FR,Lyon,Entregado,2023-10-09 15:00:00
1491.0,1543,CARLOS RUIZ,12,Camiseta Adidas,Moda,08/10/2024,5.0,482.71,2413.55,Bizum,DE,Barcelona,Cancelado,2024-10-08 10:00:00
1492.0,1526,Lucía Fernández,178,Mochila North Face,Accesorios,01-04-2024,4.0,$752.77,,Bizum,IT,Milán,Entregado,2024-01-04 20:00:00
1493.0,1569,Lucía Fernández,150,Cafetera Philips,Hogar,2023-09-09,1.0,462.27,462.27,PayPal,IT,Lyon,Cancelado,2023-09-09 18:00:00
1494.0,1219,Carlos Ruiz,85,AirPods,Moda,09-06-2024,1.0,155.66,155.66,Tarjeta,DE,Roma,Pendiente,2024-09-06 10:00:00
1495.0,1992,Laura Torres,145,Bolso Gucci,Moda,2023-10-10,1.0,1210.86,1210.86,Transferencia,Germany,Hamburgo,Cancelado,2023-10-10 15:00:00
1496.0,1613,LUCÍA FERNÁNDEZ,76,AirPods,Tecnología,2023-07-22,2.0,1339.74,2679.48,PayPal,spain,Lyon,Entregado,2023-07-22 06:00:00
1497.0,1884,David Gómez,113,AirPods,Tecnología,08-19-2023,4.0,1242.79,4971.16,Transferencia,IT,Milán,Cancelado,2023-08-19 20:00:00
1498.0,1198,Ana Sánchez,3,Cafetera Philips,Hogar,08-03-2023,5.0,932.35,4661.75,Transferencia,IT,Lyon,Entregado,2023-08-03 11:00:00
1499.0,1485,Carlos Ruiz,198,Monitor LG,Tecnología,2024-02-26,5.0,765.77,3828.85,Tarjeta,spain,Paris,Cancelado,2024-02-26 23:00:00
1500.0,1987,Laura Torres,80,Mochila North Face,Accesorios,2023-10-20,5.0,1728.03,8640.15,Tarjeta,FR,Madrid,Cancelado,2023-10-20 12:00:00
1501.0,1376,María García,106,Bolso Gucci,Moda,2023-06-02,5.0,1042.97,5214.85,PayPal,France,Hamburgo,Cancelado,2023-06-02 04:00:00
1502.0,1202,María García,160,Mochila North Face,TECHNOLOGY,04-23-2023,2.0,963.57,1940.6791740112074,Tarjeta,France,Valencia,Pendiente,2023-04-23 23:00:00
1503.0,1938,ANA SÁNCHEZ,138,Sony Headphones,Tecnología,2023-04-23,3.0,61.03,183.09,Tarjeta,IT,Lyon,Pendiente,2023-04-23 19:00:00
1504.0,1564,Ana Sánchez,54,Silla Gaming,Hogar,2024-09-19,4.0,689.08,2457.4679891378937,Bizum,ES,Berlín,Cancelado,2024-09-19 15:00:00
1505.0,1313,María García,130,Teclado Logitech,Tecnología,01-14-2024,2.0,766.59,1533.18,Transferencia,France,Hamburgo,Pendiente,2024-01-14 15:00:00
1506.0,1589,Pedro López,158,Reloj Casio,Accesorios,02-27-2024,3.0,803.66,2410.98,Tarjeta,IT,Milán,Entregado,2024-02-27 12:00:00
1507.0,1622,Carlos Ruiz,186,Aspiradora Dyson,Hogar,26/03/2024,1.0,1164.54,1164.54,PayPal,FR,Berlín,Cancelado,2024-03-26 10:00:00
1508.0,1097,Juan Pérez,134,Reloj Casio,Accesorios,04-04-2023,3.0,1071.87,3215.61,Bizum,spain,Madrid,Entregado,2023-04-04 21:00:00
1509.0,1923,María García,39,Bolso Gucci,Moda,05-06-2023,3.0,1219.73,3659.19,Tarjeta,DE,Valencia,Cancelado,2023-05-06 05:00:00
1510.0,1885,Juan Pérez,126,MacBook Pro,Tecnología,09/08/2024,1.0,1532.12,1532.12,PayPal,Germany,Hamburgo,Cancelado,2024-08-09 08:00:00
1511.0,1332,Ana Sánchez,140,Camiseta Adidas,Moda,14/01/2024,5.0,1627.84,8139.2,Transferencia,IT,Roma,Pendiente,2024-01-14 09:00:00
1512.0,1588,Pedro López,16,Mochila North Face,Accesorios,13/12/2023,5.0,1439.06,7195.3,Tarjeta,Italy,Lyon,Entregado,2023-12-13 13:00:00
1513.0,1088,pedro lópez,58,Sony Headphones,Tecnología,10/03/2023,1.0,1911.49,1911.49,Bizum,Germany,Lyon,Cancelado,2023-03-10 09:00:00
1514.0,1295,Juan Pérez,46,Samsung Galaxy,Tecnología,2023-01-30,5.0,46.28,231.4,PayPal,Italy,Valencia,Entregado,2023-01-30 17:00:00
1515.0,1443,David Gómez,4,Bolso Gucci,Moda,2023-07-10,5.0,399.6,1998.0,Transferencia,DE,Paris,Cancelado,2023-07-10 21:00:00
1516.0,1933,David Gómez,84,Samsung Galaxy,Tecnología,05-03-2023,1.0,25.05,25.05,Tarjeta,FR,Paris,Cancelado,2023-05-03 04:00:00
1517.0,1519,JUAN PÉREZ,30,iPhone 13,Tecnología,25/11/2023,4.0,1298.47,4900.383525509891,Transferencia,FR,Madrid,Cancelado,2023-11-25 14:00:00
1518.0,1968,JUAN PÉREZ,57,Camiseta Adidas,Moda,07/11/2024,5.0,1797.08,8985.4,Transferencia,spain,Roma,Pendiente,2024-11-07 18:00:00
1519.0,1015,Laura Torres,5,Bolso Gucci,Moda,2023-10-03,5.0,494.53,2472.65,Bizum,IT,Lyon,Cancelado,2023-10-03 10:00:00
1520.0,1247,CARLOS RUIZ,123,Monitor LG,Tecnología,2023-07-31,1.0,1854.8,1854.8,Tarjeta,IT,Milán,Cancelado,2023-07-31 03:00:00
1521.0,1074,Ana Sánchez,82,AirPods,Tecnología,05/06/2024,1.0,129.93,129.93,Bizum,Italy,Milán,Cancelado,2024-06-05 22:00:00
1522.0,1845,Juan Pérez,5,Zapatillas Nike,Moda,2023-05-16,3.0,1869.53,5608.59,Tarjeta,spain,Berlín,Pendiente,2023-05-16 04:00:00
1523.0,1443,Juan Pérez,42,Monitor LG,Tecnología,04-02-2024,1.0,709.73,709.73,Bizum,ES,Barcelona,Cancelado,2024-04-02 13:00:00
1524.0,1073,María García,12,iPhone 13,Tecnología,01/05/2024,,$211.83,,PayPal,España,Madrid,Cancelado,2024-05-01 16:00:00
1525.0,1833,Lucía Fernández,70,MacBook Pro,tech,07-16-2023,1.0,"976,88",,Bizum,France,Barcelona,Cancelado,2023-07-16 16:00:00
1526.0,1093,MARÍA GARCÍA,155,Mochila North Face,Accesorios,11-29-2024,1.0,$520.99,,Bizum,Italy,Valencia,Cancelado,2024-11-29 22:00:00
1527.0,1834,Pedro López,73,Bolso Gucci,Moda,2024-05-26,2.0,576.9,1153.8,PayPal,France,Roma,Pendiente,2024-05-26 04:00:00
1528.0,1118,Juan Pérez,183,Zapatillas Nike,Moda,2023-05-08,1.0,621.51,621.51,Bizum,ES,Barcelona,Pendiente,2023-05-08 16:00:00
1529.0,1486,Pedro López,178,Bolso Gucci,Moda,2024-07-16,5.0,1608.02,8040.1,Bizum,FR,Milán,Pendiente,2024-07-16 19:00:00
1530.0,1046,David Gómez,100,Cafetera Philips,Hogar,05-18-2024,1.0,1082.93,1082.93,Transferencia,FR,Paris,Pendiente,2024-05-18 00:00:00
1531.0,1271,carlos ruiz,94,Bolso Gucci,Moda,2023-11-07,2.0,"629,5",,Tarjeta,FR,Milán,Entregado,2023-11-07 10:00:00
1532.0,1477,Pedro López,146,MacBook Pro,Tecnología,11-04-2024,5.0,1224.56,6122.8,Bizum,France,Berlín,Pendiente,2024-11-04 12:00:00
1533.0,1969,David Gómez,111,Aspiradora Dyson,Hogar,2024-09-04,5.0,1435.14,7175.7,PayPal,DE,Paris,Entregado,2024-09-04 01:00:00
1534.0,1366,Juan Pérez,61,AirPods,tecnologia,04-23-2023,5.0,552.52,2762.6,Transferencia,España,Barcelona,Entregado,2023-04-23 01:00:00
1535.0,1573,Pedro López,93,Bolso Gucci,Moda,07-04-2024,5.0,832.96,4164.8,PayPal,IT,Madrid,Entregado,2024-07-04 12:00:00
1536.0,1539,Ana Sánchez,95,MacBook Pro,Tecnología,21/11/2024,5.0,252.55,1262.75,Bizum,DE,Valencia,Cancelado,2024-11-21 19:00:00
1537.0,1714,Laura Torres,176,Zapatillas Nike,tecnologia,2023-03-26,5.0,370.49,1852.45,Transferencia,España,Berlín,Cancelado,2023-03-26 18:00:00
1538.0,1952,Lucía Fernández,143,Aspiradora Dyson,Hogar,06/02/2024,5.0,1365.42,6827.1,PayPal,FR,Barcelona,Entregado,2024-02-06 11:00:00
1539.0,1036,María García,31,Aspiradora Dyson,Hogar,2024-06-14,1.0,371.06,371.06,Transferencia,France,Barcelona,Entregado,2024-06-14 23:00:00
1540.0,1754,Carlos Ruiz,113,Camiseta Adidas,Moda,2023-11-24,1.0,1055.08,1055.08,Transferencia,DE,Roma,Cancelado,2023-11-24 03:00:00
1541.0,1897,María García,100,Camiseta Adidas,Moda,07-29-2024,1.0,1421.0,1421.0,Transferencia,España,Berlín,Cancelado,2024-07-29 00:00:00
1542.0,1882,Pedro López,118,MacBook Pro,Tecnología,2023-07-20,5.0,222.69,1113.45,Transferencia,FR,Lyon,Entregado,2023-07-20 00:00:00
1543.0,1605,Carlos Ruiz,170,Zapatillas Nike,Moda,03/03/2024,3.0,1138.95,3416.85,Bizum,DE,Roma,Entregado,2024-03-03 07:00:00
1544.0,1707,María García,24,Monitor LG,Tecnología,02/06/2023,5.0,520.56,2602.8,PayPal,France,Valencia,Pendiente,2023-06-02 09:00:00
1545.0,1957,Lucía Fernández,195,AirPods,Tecnología,10-08-2024,1.0,1926.22,1926.22,Tarjeta,España,Paris,Cancelado,2024-10-08 18:00:00
1546.0,1447,Juan Pérez,8,Camiseta Adidas,Moda,10-11-2024,4.0,"972,26",,Transferencia,ES,Milán,Cancelado,2024-10-11 04:00:00
1547.0,1103,ANA SÁNCHEZ,163,Bolso Gucci,Moda,27/06/2024,2.0,1613.93,3279.531569625043,Bizum,DE,Berlín,Entregado,2024-06-27 03:00:00
1548.0,1808,David Gómez,160,Samsung Galaxy,hogar,01-19-2024,5.0,1104.95,5524.75,PayPal,Germany,Roma,Pendiente,2024-01-19 16:00:00
1549.0,1061,Juan Pérez,43,MacBook Pro,Tecnología,2023-10-30,5.0,96.39,481.95,Transferencia,Germany,Madrid,Cancelado,2023-10-30 16:00:00
1550.0,1555,Laura Torres,79,Camiseta Adidas,Moda,05-30-2024,5.0,1269.97,6349.85,Transferencia,IT,Madrid,Cancelado,2024-05-30 21:00:00
1551.0,1808,PEDRO LÓPEZ,167,Aspiradora Dyson,TECHNOLOGY,2023-11-23,5.0,1903.29,9516.45,Transferencia,ES,Hamburgo,Pendiente,2023-11-23 09:00:00
1552.0,1771,Laura Torres,78,Reloj Casio,Accesorios,18/10/2024,5.0,$1207.21,,Tarjeta,FR,Roma,Pendiente,2024-10-18 11:00:00
1553.0,1968,Juan Pérez,128,MacBook Pro,Tecnología,10-11-2023,3.0,1640.19,4920.57,Tarjeta,FR,Lyon,Pendiente,2023-10-11 20:00:00
1554.0,1421,Lucía Fernández,99,Zapatillas Nike,tech,2023-03-05,5.0,1769.57,8847.85,Transferencia,Germany,Milán,Pendiente,2023-03-05 13:00:00
1555.0,1491,Ana Sánchez,3,Reloj Casio,Accesorios,25/10/2023,1.0,463.88,405.3457114733668,PayPal,spain,Milán,Cancelado,2023-10-25 22:00:00
1556.0,1023,laura torres,170,Samsung Galaxy,Tecnología,05/10/2024,5.0,431.97,2159.85,PayPal,Italy,Roma,Pendiente,2024-10-05 15:00:00
1557.0,1059,Carlos Ruiz,154,Silla Gaming,Hogar,05-07-2024,2.0,1225.85,2451.7,Bizum,France,Berlín,Cancelado,2024-05-07 22:00:00
1558.0,1368,Pedro López,40,MacBook Pro,Moda,08-29-2023,5.0,827.95,4139.75,Bizum,IT,Milán,Pendiente,2023-08-29 01:00:00
1559.0,1273,David Gómez,2,Samsung Galaxy,Tecnología,28/01/2023,4.0,1681.32,6725.28,PayPal,spain,Lyon,Cancelado,2023-01-28 08:00:00
1560.0,1303,MARÍA GARCÍA,62,Aspiradora Dyson,Hogar,11/08/2023,3.0,1801.05,5403.15,Bizum,DE,Lyon,Entregado,2023-08-11 05:00:00
1561.0,1384,LAURA TORRES,134,MacBook Pro,Tecnología,2024-11-19,3.0,713.31,2139.93,PayPal,ES,Milán,Cancelado,2024-11-19 18:00:00
1562.0,1991,pedro lópez,170,Camiseta Adidas,Moda,20/11/2023,3.0,481.37,1444.11,Tarjeta,FR,Milán,Cancelado,2023-11-20 23:00:00
1563.0,1600,LUCÍA FERNÁNDEZ,37,Monitor LG,Tecnología,31/10/2024,1.0,1563.25,1563.25,Transferencia,Italy,Milán,Cancelado,2024-10-31 14:00:00
1564.0,1283,DAVID GÓMEZ,65,Bolso Gucci,Moda,2023-02-20,1.0,556.86,639.8102179899371,PayPal,Germany,Milán,Entregado,2023-02-20 10:00:00
1565.0,1159,María García,70,Bolso Gucci,Moda,12-05-2023,3.0,1647.0,4941.0,PayPal,France,Paris,Entregado,2023-12-05 17:00:00
1566.0,1657,David Gómez,115,Aspiradora Dyson,Hogar,2023-03-07,2.0,853.24,1706.48,Bizum,Germany,Berlín,Pendiente,2023-03-07 23:00:00
1567.0,1016,Juan Pérez,9,Bolso Gucci,Moda,2024-11-06,2.0,1338.42,2676.84,Bizum,IT,Berlín,Cancelado,2024-11-06 09:00:00
1568.0,1993,MARÍA GARCÍA,41,Teclado Logitech,Tecnología,2024-03-06,2.0,200.12,400.24,Tarjeta,Germany,Hamburgo,Entregado,2024-03-06 17:00:00
1569.0,1150,Laura Torres,11,Sony Headphones,Tecnología,08-24-2024,2.0,1251.48,2502.96,PayPal,Germany,Hamburgo,Cancelado,2024-08-24 02:00:00
1570.0,1857,laura torres,123,Mochila North Face,hogar,21/03/2023,1.0,909.02,909.02,Tarjeta,FR,Barcelona,Pendiente,2023-03-21 14:00:00
1571.0,1977,maría garcía,11,Samsung Galaxy,Tecnología,24/10/2023,1.0,1177.35,1177.35,Transferencia,DE,Milán,Pendiente,2023-10-24 01:00:00
1572.0,1522,Carlos Ruiz,97,Samsung Galaxy,Tecnología,2024-09-09,5.0,344.35,1721.75,PayPal,spain,Hamburgo,Entregado,2024-09-09 17:00:00
1573.0,1114,Laura Torres,112,MacBook Pro,Tecnología,08/05/2023,3.0,1476.38,4429.14,Transferencia,FR,Paris,Cancelado,2023-05-08 20:00:00
1574.0,1166,Juan Pérez,1,Camiseta Adidas,Moda,08/10/2023,5.0,1726.97,8634.85,Bizum,spain,Lyon,Entregado,2023-10-08 12:00:00
1575.0,1476,María García,55,AirPods,Tecnología,2024-05-12,3.0,441.31,1323.93,Bizum,DE,Milán,Pendiente,2024-05-12 11:00:00
1576.0,1709,carlos ruiz,140,Bolso Gucci,Moda,10-20-2024,1.0,200.47,200.47,Transferencia,DE,Valencia,Entregado,2024-10-20 17:00:00
1577.0,1384,Ana Sánchez,47,Zapatillas Nike,Moda,01-24-2023,4.0,57.04,228.16,PayPal,spain,Hamburgo,Pendiente,2023-01-24 09:00:00
1578.0,1289,Ana Sánchez,130,Aspiradora Dyson,moda,2023-09-05,2.0,1287.52,2575.04,Transferencia,France,Barcelona,Entregado,2023-09-05 10:00:00
1579.0,1519,Juan Pérez,146,Zapatillas Nike,Moda,2023-11-19,3.0,1218.12,3654.36,Tarjeta,ES,Berlín,Pendiente,2023-11-19 00:00:00
1580.0,1626,Lucía Fernández,7,Bolso Gucci,Moda,26/03/2023,3.0,1097.93,3293.79,Transferencia,ES,Barcelona,Entregado,2023-03-26 10:00:00
1581.0,1136,Lucía Fernández,34,Teclado Logitech,Tecnología,2024-01-17,4.0,471.57,1886.28,Tarjeta,Italy,Roma,Entregado,2024-01-17 00:00:00
1582.0,1383,María García,187,Sony Headphones,Tecnología,05-21-2023,3.0,787.9,2363.7,Bizum,France,Milán,Pendiente,2023-05-21 11:00:00
1583.0,1020,Juan Pérez,42,Bolso Gucci,Moda,2023-03-25,2.0,1193.01,2386.02,Tarjeta,IT,Barcelona,Pendiente,2023-03-25 06:00:00
1584.0,1067,Laura Torres,8,Zapatillas Nike,Moda,03-25-2023,3.0,998.57,2995.71,Transferencia,FR,Valencia,Cancelado,2023-03-25 19:00:00
1585.0,1824,Laura Torres,194,Zapatillas Nike,Moda,2023-12-21,2.0,1975.69,3951.38,Tarjeta,Germany,Milán,Pendiente,2023-12-21 14:00:00
1586.0,1635,Lucía Fernández,151,Mochila North Face,Accesorios,07-11-2023,5.0,281.52,1407.6,Transferencia,Italy,Valencia,Pendiente,2023-07-11 00:00:00
1587.0,1049,Lucía Fernández,182,Zapatillas Nike,Moda,2023-11-12,5.0,1393.34,6499.768059695552,Bizum,IT,Lyon,Cancelado,2023-11-12 12:00:00
1588.0,1721,David Gómez,169,Aspiradora Dyson,Hogar,2023-01-07,3.0,814.59,2443.77,Tarjeta,FR,Hamburgo,Pendiente,2023-01-07 02:00:00
1589.0,1040,David Gómez,81,Silla Gaming,Hogar,20/10/2024,4.0,"862,12",0.0,Tarjeta,FR,Valencia,Cancelado,2024-10-20 08:00:00
1590.0,1735,María García,11,Mochila North Face,Accesorios,12-31-2023,1.0,1438.02,1438.02,Bizum,FR,Barcelona,Pendiente,2023-12-31 07:00:00
1591.0,1706,Lucía Fernández,102,Mochila North Face,Accesorios,12/01/2024,1.0,1387.95,1387.95,Transferencia,France,Berlín,Cancelado,2024-01-12 22:00:00
1592.0,1580,ANA SÁNCHEZ,19,Cafetera Philips,Hogar,27/11/2023,5.0,1982.6,9913.0,Bizum,Germany,Madrid,Pendiente,2023-11-27 20:00:00
1593.0,1353,Ana Sánchez,9,MacBook Pro,Tecnología,2023-07-16,5.0,265.5,1327.5,Bizum,Germany,Berlín,Pendiente,2023-07-16 09:00:00
1594.0,1587,Pedro López,163,Cafetera Philips,Hogar,06-26-2024,5.0,"217,18",,Transferencia,IT,Paris,Cancelado,2024-06-26 19:00:00
1595.0,1059,CARLOS RUIZ,153,Silla Gaming,Hogar,23/06/2023,5.0,1451.43,7257.15,Transferencia,France,Milán,Cancelado,2023-06-23 00:00:00
1596.0,1884,Ana Sánchez,129,Silla Gaming,Hogar,26/02/2023,2.0,1160.99,2321.98,Tarjeta,ES,Roma,Pendiente,2023-02-26 07:00:00
1597.0,1520,Laura Torres,179,Sony Headphones,Tecnología,07-28-2023,4.0,"555,58",,Transferencia,España,Valencia,Cancelado,2023-07-28 11:00:00
1598.0,1679,Ana Sánchez,44,Zapatillas Nike,Moda,04-26-2023,1.0,168.04,168.04,Transferencia,IT,Berlín,Pendiente,2023-04-26 10:00:00
1599.0,1709,Laura Torres,121,iPhone 13,Tecnología,11/03/2023,2.0,180.46,360.92,Tarjeta,France,Valencia,Cancelado,2023-03-11 17:00:00
1600.0,1203,David Gómez,23,MacBook Pro,Tecnología,11/02/2024,5.0,1789.44,8947.2,Transferencia,spain,Barcelona,Cancelado,2024-02-11 15:00:00
1601.0,1508,CARLOS RUIZ,141,Silla Gaming,Hogar,06-22-2023,4.0,391.82,1567.28,PayPal,Italy,Roma,Pendiente,2023-06-22 04:00:00
1602.0,1918,Carlos Ruiz,143,Monitor LG,Moda,2024-08-04,4.0,653.51,2614.04,Bizum,spain,Berlín,Pendiente,2024-08-04 00:00:00
1603.0,1125,CARLOS RUIZ,185,MacBook Pro,Tecnología,01-06-2023,2.0,461.05,922.1,Transferencia,spain,Roma,Pendiente,2023-01-06 04:00:00
1604.0,1529,María García,107,Cafetera Philips,Hogar,22/09/2023,1.0,716.44,716.44,Bizum,ES,Berlín,Pendiente,2023-09-22 00:00:00
1605.0,1375,María García,20,Zapatillas Nike,Moda,07-20-2023,5.0,148.15,740.75,PayPal,spain,Madrid,Entregado,2023-07-20 18:00:00
1606.0,1426,Ana Sánchez,44,Teclado Logitech,Tecnología,2023-06-11,5.0,1042.93,5214.65,PayPal,Italy,Madrid,Pendiente,2023-06-11 19:00:00
1607.0,1873,Ana Sánchez,13,Samsung Galaxy,Tecnología,19/04/2024,5.0,144.55,760.188149198822,Bizum,IT,Lyon,Entregado,2024-04-19 01:00:00
1608.0,1293,David Gómez,8,Teclado Logitech,Tecnología,11-17-2024,2.0,1602.71,3205.42,Bizum,Germany,Lyon,Pendiente,2024-11-17 08:00:00
1609.0,1249,Juan Pérez,49,iPhone 13,Tecnología,13/05/2024,2.0,475.09,1010.5528994643062,Bizum,ES,Barcelona,Cancelado,2024-05-13 03:00:00
1610.0,1445,LAURA TORRES,109,Samsung Galaxy,TECHNOLOGY,2023-05-22,2.0,1084.62,1786.3581833497606,Transferencia,España,Hamburgo,Entregado,2023-05-22 14:00:00
1611.0,1257,María García,61,Reloj Casio,Accesorios,02/03/2023,5.0,1761.36,8806.8,PayPal,España,Madrid,Entregado,2023-03-02 18:00:00
1612.0,1848,Ana Sánchez,53,Silla Gaming,Hogar,2024-07-10,2.0,1305.25,2610.5,Transferencia,FR,Barcelona,Cancelado,2024-07-10 02:00:00
1613.0,1789,Laura Torres,127,Teclado Logitech,Tecnología,11-09-2024,3.0,1070.59,3211.77,PayPal,Italy,Barcelona,Entregado,2024-11-09 15:00:00
1614.0,1976,PEDRO LÓPEZ,185,Bolso Gucci,Moda,04-12-2023,2.0,655.42,1310.84,Tarjeta,France,Lyon,Cancelado,2023-04-12 11:00:00
1615.0,1038,Carlos Ruiz,190,Cafetera Philips,Hogar,05/09/2023,5.0,$672.67,,Bizum,DE,Madrid,Entregado,2023-09-05 07:00:00
1616.0,1574,ana sánchez,76,Cafetera Philips,Hogar,09/05/2023,1.0,1342.28,1342.28,Tarjeta,spain,Hamburgo,Cancelado,2023-05-09 21:00:00
1617.0,1980,David Gómez,117,Zapatillas Nike,Moda,05-27-2023,3.0,1988.34,5965.02,Bizum,Italy,Lyon,Pendiente,2023-05-27 13:00:00
1618.0,1546,Ana Sánchez,63,Teclado Logitech,Tecnología,07-16-2024,1.0,1327.06,1327.06,Transferencia,DE,Barcelona,Cancelado,2024-07-16 06:00:00
1619.0,1796,Carlos Ruiz,173,Aspiradora Dyson,TECHNOLOGY,04/03/2023,1.0,1119.99,1119.99,Tarjeta,España,Hamburgo,Pendiente,2023-03-04 04:00:00
1620.0,1851,María García,99,Aspiradora Dyson,Hogar,01-02-2024,2.0,1463.99,2927.98,PayPal,Italy,Hamburgo,Pendiente,2024-01-02 04:00:00
1621.0,1622,LUCÍA FERNÁNDEZ,163,Sony Headphones,HOGAR,07-28-2024,2.0,935.76,1871.52,Bizum,DE,Milán,Pendiente,2024-07-28 21:00:00
1622.0,1090,Pedro López,53,Silla Gaming,Hogar,2023-01-27,2.0,129.68,259.36,PayPal,ES,Milán,Cancelado,2023-01-27 19:00:00
1623.0,1485,lucía fernández,124,Zapatillas Nike,Moda,2024-04-15,5.0,1128.97,5644.85,Tarjeta,spain,Valencia,Pendiente,2024-04-15 20:00:00
1624.0,1433,Laura Torres,77,Mochila North Face,Accesorios,17/11/2024,4.0,"1915,67",,Bizum,France,Lyon,Pendiente,2024-11-17 08:00:00
1625.0,1604,David Gómez,83,Reloj Casio,Accesorios,11-18-2024,1.0,358.85,358.85,Transferencia,spain,Valencia,Pendiente,2024-11-18 18:00:00
1626.0,1065,Lucía Fernández,80,Teclado Logitech,TECHNOLOGY,22/11/2024,5.0,1383.11,6915.55,PayPal,IT,Hamburgo,Cancelado,2024-11-22 03:00:00
1627.0,1521,María García,162,Zapatillas Nike,Moda,2024-10-28,5.0,409.86,2049.3,Bizum,ES,Madrid,Pendiente,2024-10-28 15:00:00
1628.0,1266,David Gómez,136,Aspiradora Dyson,Hogar,03-27-2024,4.0,1076.3,4305.2,Tarjeta,DE,Paris,Cancelado,2024-03-27 11:00:00
1629.0,1833,ana sánchez,142,Cafetera Philips,Hogar,04/01/2024,2.0,202.39,404.78,Transferencia,ES,Roma,Cancelado,2024-01-04 00:00:00
1630.0,1459,Lucía Fernández,191,Mochila North Face,tecnologia,04-16-2024,2.0,906.24,1812.48,Transferencia,España,Lyon,Entregado,2024-04-16 19:00:00
1631.0,1094,Carlos Ruiz,134,Cafetera Philips,Hogar,08-15-2023,1.0,1514.77,1514.77,Tarjeta,France,Hamburgo,Cancelado,2023-08-15 20:00:00
1632.0,1113,Lucía Fernández,34,Cafetera Philips,Hogar,04-22-2023,2.0,701.67,1403.34,Tarjeta,Italy,Madrid,Cancelado,2023-04-22 10:00:00
1633.0,1269,David Gómez,120,Silla Gaming,Hogar,08-11-2024,4.0,1333.17,5332.68,Bizum,DE,Barcelona,Pendiente,2024-08-11 02:00:00
1634.0,1733,JUAN PÉREZ,33,MacBook Pro,Tecnología,2024-09-23,3.0,1592.95,4778.85,Transferencia,ES,Milán,Entregado,2024-09-23 18:00:00
1635.0,1206,Carlos Ruiz,5,MacBook Pro,Tecnología,08/12/2023,2.0,1855.08,3671.8702211892255,Tarjeta,ES,Berlín,Cancelado,2023-12-08 00:00:00
1636.0,1102,Juan Pérez,148,Reloj Casio,Accesorios,20/09/2024,5.0,476.94,2384.7,Tarjeta,spain,Madrid,Pendiente,2024-09-20 02:00:00
1637.0,1366,Ana Sánchez,82,Bolso Gucci,Moda,10-24-2024,2.0,804.64,1609.28,Tarjeta,España,Lyon,Entregado,2024-10-24 14:00:00
1638.0,1438,Pedro López,34,Mochila North Face,HOGAR,08-16-2023,1.0,313.31,347.45148562904143,Transferencia,spain,Paris,Pendiente,2023-08-16 15:00:00
1639.0,1018,JUAN PÉREZ,152,Reloj Casio,Accesorios,10-29-2023,1.0,1985.04,1985.04,Transferencia,DE,Berlín,Entregado,2023-10-29 01:00:00
1640.0,1172,Carlos Ruiz,193,Aspiradora Dyson,Hogar,09-26-2023,2.0,$1854.73,,Tarjeta,France,Barcelona,Cancelado,2023-09-26 03:00:00
1641.0,1810,David Gómez,166,Samsung Galaxy,Tecnología,09-29-2023,3.0,1084.51,3805.8622293743874,Bizum,Germany,Lyon,Cancelado,2023-09-29 08:00:00
1642.0,1758,Lucía Fernández,105,Bolso Gucci,Moda,2024-07-17,3.0,1685.65,4750.750838588526,Tarjeta,ES,Roma,Pendiente,2024-07-17 22:00:00
1643.0,1239,Laura Torres,81,Reloj Casio,Accesorios,29/09/2023,1.0,1046.71,1208.6534618668813,PayPal,ES,Paris,Cancelado,2023-09-29 19:00:00
1644.0,1580,Pedro López,191,Camiseta Adidas,Moda,16/10/2023,2.0,1250.94,2183.2980224865096,Tarjeta,España,Berlín,Entregado,2023-10-16 05:00:00
1645.0,1555,María García,22,Sony Headphones,Tecnología,03-03-2023,1.0,187.36,198.9081233885696,Tarjeta,ES,Milán,Cancelado,2023-03-03 01:00:00
1646.0,1083,Juan Pérez,1,Samsung Galaxy,Tecnología,2023-07-02,5.0,1512.99,7564.95,Bizum,IT,Barcelona,Cancelado,2023-07-02 06:00:00
1647.0,1429,Lucía Fernández,127,Samsung Galaxy,Tecnología,2024-02-14,5.0,264.15,1320.75,Bizum,Germany,Milán,Entregado,2024-02-14 11:00:00
1648.0,1294,Pedro López,136,Teclado Logitech,tech,10/08/2024,2.0,1653.87,3307.74,Transferencia,DE,Madrid,Pendiente,2024-08-10 22:00:00
1649.0,1454,Juan Pérez,145,Zapatillas Nike,Moda,2024-09-21,2.0,1566.24,3132.48,Tarjeta,Italy,Roma,Entregado,2024-09-21 02:00:00
1650.0,1407,Laura Torres,193,Reloj Casio,Accesorios,10-19-2023,1.0,1420.4,1420.4,Tarjeta,España,Paris,Cancelado,2023-10-19 19:00:00
1651.0,1307,Juan Pérez,188,Aspiradora Dyson,Hogar,10/03/2023,2.0,81.96,189.3321909427974,Tarjeta,spain,Milán,Cancelado,2023-03-10 04:00:00
1652.0,1055,maría garcía,111,Mochila North Face,Accesorios,04/06/2024,5.0,613.23,3066.15,Transferencia,spain,Paris,Cancelado,2024-06-04 12:00:00
1653.0,1011,Pedro López,179,iPhone 13,Tecnología,12/02/2023,5.0,533.59,2667.95,PayPal,Italy,Milán,Entregado,2023-02-12 04:00:00
1654.0,1198,Pedro López,86,Silla Gaming,Moda,2024-02-01,5.0,726.67,3633.35,Bizum,FR,Valencia,Entregado,2024-02-01 20:00:00
1655.0,1061,Laura Torres,174,Samsung Galaxy,Tecnología,07-19-2024,3.0,184.41,555.7041740253799,Transferencia,France,Madrid,Cancelado,2024-07-19 00:00:00
1656.0,1749,maría garcía,169,Samsung Galaxy,Tecnología,10-20-2023,2.0,1874.55,3749.1,Tarjeta,España,Hamburgo,Entregado,2023-10-20 14:00:00
1657.0,1414,Lucía Fernández,137,Sony Headphones,Tecnología,03/07/2024,2.0,1112.07,2224.14,Transferencia,FR,Barcelona,Pendiente,2024-07-03 17:00:00
1658.0,1328,Juan Pérez,153,Sony Headphones,Tecnología,05/02/2024,3.0,617.99,1853.97,Transferencia,Italy,Valencia,Entregado,2024-02-05 04:00:00
1659.0,1811,Juan Pérez,75,iPhone 13,Tecnología,07-14-2023,4.0,799.99,3199.96,PayPal,ES,Madrid,Cancelado,2023-07-14 02:00:00
1660.0,1592,Carlos Ruiz,193,Samsung Galaxy,Tecnología,01-15-2023,3.0,$899.93,,Transferencia,France,Madrid,Entregado,2023-01-15 23:00:00
1661.0,1328,Juan Pérez,134,Mochila North Face,Accesorios,07-13-2024,5.0,1205.18,6025.9,Tarjeta,France,Roma,Pendiente,2024-07-13 22:00:00
1662.0,1771,David Gómez,20,Sony Headphones,Tecnología,05-17-2023,4.0,1036.2,4144.8,Tarjeta,DE,Hamburgo,Entregado,2023-05-17 19:00:00
1663.0,1472,Lucía Fernández,52,Cafetera Philips,Hogar,06-16-2024,5.0,1839.59,7587.874940902089,Bizum,spain,Hamburgo,Pendiente,2024-06-16 00:00:00
1664.0,1964,Juan Pérez,151,Teclado Logitech,Tecnología,02-15-2023,4.0,998.96,3995.84,Bizum,Italy,Hamburgo,Pendiente,2023-02-15 21:00:00
1665.0,1199,Juan Pérez,29,Sony Headphones,Tecnología,08-02-2023,3.0,1984.39,6770.889835453998,Tarjeta,IT,Madrid,Entregado,2023-08-02 17:00:00
1666.0,1337,María García,9,Reloj Casio,Accesorios,11/05/2023,1.0,1704.34,1759.0452075362734,Transferencia,ES,Paris,Entregado,2023-05-11 13:00:00
1667.0,1748,Lucía Fernández,64,Bolso Gucci,Moda,11-01-2024,4.0,424.94,1699.76,Tarjeta,Germany,Barcelona,Cancelado,2024-11-01 17:00:00
1668.0,1549,Laura Torres,54,Bolso Gucci,Moda,27/11/2023,4.0,"1861,88",,Bizum,Italy,Barcelona,Cancelado,2023-11-27 12:00:00
1669.0,1138,pedro lópez,15,Reloj Casio,Accesorios,2024-01-17,1.0,241.57,241.57,Bizum,Italy,Barcelona,Cancelado,2024-01-17 09:00:00
1670.0,1002,DAVID GÓMEZ,118,Monitor LG,Tecnología,2023-08-19,3.0,1636.72,4910.16,Tarjeta,ES,Hamburgo,Entregado,2023-08-19 21:00:00
1671.0,1787,Pedro López,98,Cafetera Philips,Hogar,2023-05-29,3.0,767.44,2005.8406963403613,Tarjeta,France,Milán,Entregado,2023-05-29 17:00:00
1672.0,1543,juan pérez,88,AirPods,Tecnología,19/05/2023,2.0,1757.17,3514.34,Transferencia,Germany,Milán,Cancelado,2023-05-19 19:00:00
1673.0,1310,Laura Torres,14,Teclado Logitech,Tecnología,2023-05-16,4.0,1737.43,7335.868326827854,Transferencia,spain,Roma,Pendiente,2023-05-16 10:00:00
1674.0,1233,LUCÍA FERNÁNDEZ,172,Mochila North Face,Accesorios,28/01/2024,4.0,1613.79,6455.16,Tarjeta,Italy,Roma,Cancelado,2024-01-28 05:00:00
1675.0,1215,Pedro López,50,Silla Gaming,Hogar,07-01-2024,3.0,1582.16,4746.48,Tarjeta,spain,Barcelona,Entregado,2024-07-01 20:00:00
1676.0,1040,Juan Pérez,56,AirPods,Tecnología,2023-11-14,3.0,616.31,1848.93,Tarjeta,FR,Barcelona,Pendiente,2023-11-14 22:00:00
1677.0,1641,David Gómez,120,Camiseta Adidas,Moda,2023-10-04,3.0,171.03,513.09,Tarjeta,France,Berlín,Cancelado,2023-10-04 19:00:00
1678.0,1677,Pedro López,200,Cafetera Philips,Hogar,16/03/2024,5.0,811.93,4059.65,Transferencia,IT,Milán,Pendiente,2024-03-16 06:00:00
1679.0,1620,Juan Pérez,172,Silla Gaming,Hogar,02-23-2024,5.0,355.31,1776.55,Tarjeta,DE,Valencia,Pendiente,2024-02-23 02:00:00
1680.0,1721,Laura Torres,154,Camiseta Adidas,Moda,07-21-2023,3.0,1392.95,4178.85,Transferencia,IT,Barcelona,Cancelado,2023-07-21 06:00:00
1681.0,1983,Juan Pérez,184,Camiseta Adidas,Moda,07-10-2024,4.0,698.74,2794.96,Bizum,FR,Barcelona,Cancelado,2024-07-10 15:00:00
1682.0,1380,David Gómez,46,Reloj Casio,moda,2023-08-08,3.0,$1951.46,,Transferencia,spain,Lyon,Cancelado,2023-08-08 03:00:00
1683.0,1031,Juan Pérez,10,Reloj Casio,Accesorios,02-10-2024,2.0,$1285.53,,Tarjeta,ES,Paris,Entregado,2024-02-10 22:00:00
,1229,Pedro López,94,AirPods,Tecnología,2024-12-01,5.0,1646.74,8233.7,PayPal,IT,Madrid,Pendiente,2024-12-01 07:00:00
1685.0,1079,Pedro López,17,AirPods,Tecnología,01/08/2023,1.0,273.72,273.72,Tarjeta,IT,Berlín,Pendiente,2023-08-01 01:00:00
1686.0,1946,ANA SÁNCHEZ,178,Mochila North Face,Accesorios,2023-04-19,5.0,1725.41,8627.05,PayPal,FR,Paris,Cancelado,2023-04-19 12:00:00
1687.0,1805,Ana Sánchez,99,Mochila North Face,Accesorios,27/11/2023,3.0,1846.29,5538.87,Bizum,IT,Paris,Entregado,2023-11-27 08:00:00
1688.0,1076,Carlos Ruiz,138,Silla Gaming,Hogar,01-30-2024,3.0,979.25,2937.75,Transferencia,DE,Berlín,Cancelado,2024-01-30 23:00:00
1689.0,1665,Laura Torres,111,Sony Headphones,Tecnología,07-03-2023,1.0,1216.44,1216.44,Tarjeta,ES,Barcelona,Entregado,2023-07-03 07:00:00
1690.0,1024,pedro lópez,29,Aspiradora Dyson,Hogar,04-06-2024,4.0,1531.97,6127.88,Tarjeta,Germany,Lyon,Entregado,2024-04-06 02:00:00
1691.0,1370,María García,4,Samsung Galaxy,hogar,07-25-2024,4.0,357.93,1431.72,Tarjeta,Italy,Barcelona,Entregado,2024-07-25 05:00:00
1692.0,1574,María García,132,Cafetera Philips,Hogar,05-24-2024,3.0,1010.11,3030.33,Tarjeta,France,Madrid,Entregado,2024-05-24 23:00:00
1693.0,1620,David Gómez,191,Cafetera Philips,Hogar,12/08/2023,1.0,803.34,803.34,Tarjeta,Italy,Hamburgo,Entregado,2023-08-12 11:00:00
1694.0,1307,Laura Torres,39,Cafetera Philips,Hogar,05-16-2024,,301.28,,Transferencia,ES,Lyon,Entregado,2024-05-16 21:00:00
1695.0,1981,david gómez,116,Sony Headphones,Tecnología,2024-09-28,2.0,741.39,1325.5325206476252,Tarjeta,FR,Roma,Entregado,2024-09-28 21:00:00
1696.0,1739,Ana Sánchez,72,Reloj Casio,Accesorios,2023-08-16,1.0,145.66,145.66,Transferencia,ES,Paris,Pendiente,2023-08-16 19:00:00
1697.0,1493,lucía fernández,175,Zapatillas Nike,TECHNOLOGY,10-13-2024,4.0,61.37,245.48,Tarjeta,Germany,Barcelona,Pendiente,2024-10-13 07:00:00
1698.0,1786,David Gómez,189,AirPods,Tecnología,03-17-2023,3.0,278.98,836.94,Tarjeta,DE,Madrid,Cancelado,2023-03-17 22:00:00
1699.0,1774,Laura Torres,5,Silla Gaming,Hogar,07/11/2023,5.0,1926.6,9633.0,Bizum,Germany,Barcelona,Cancelado,2023-11-07 08:00:00
1700.0,1166,Laura Torres,121,iPhone 13,tecnologia,2023-05-21,4.0,1103.56,4414.24,Bizum,FR,Madrid,Entregado,2023-05-21 19:00:00
1701.0,1932,pedro lópez,103,Silla Gaming,Hogar,11-14-2023,2.0,1931.99,3863.98,Bizum,ES,Lyon,Cancelado,2023-11-14 01:00:00
1702.0,1591,María García,157,iPhone 13,Tecnología,16/11/2023,2.0,870.67,1741.34,PayPal,IT,Lyon,Pendiente,2023-11-16 22:00:00
1703.0,1055,ANA SÁNCHEZ,161,Cafetera Philips,Hogar,02/07/2024,2.0,630.51,1261.02,Transferencia,España,Hamburgo,Entregado,2024-07-02 02:00:00
1704.0,1155,Pedro López,70,Sony Headphones,Tecnología,2023-05-25,2.0,1017.22,2034.44,Bizum,France,Barcelona,Pendiente,2023-05-25 08:00:00
1705.0,1716,Juan Pérez,8,iPhone 13,Tecnología,17/08/2024,4.0,884.63,3538.52,Tarjeta,FR,Hamburgo,Cancelado,2024-08-17 11:00:00
1706.0,1472,María García,145,Mochila North Face,Accesorios,12-30-2023,5.0,220.27,1101.35,PayPal,Germany,Roma,Cancelado,2023-12-30 14:00:00
1707.0,1141,Pedro López,29,Cafetera Philips,Hogar,2023-12-27,3.0,1285.24,3855.72,Bizum,IT,Barcelona,Cancelado,2023-12-27 08:00:00
1708.0,1330,DAVID GÓMEZ,10,Mochila North Face,Accesorios,11/07/2024,5.0,$439.92,,PayPal,España,Madrid,Cancelado,2024-07-11 03:00:00
1709.0,1729,David Gómez,59,Aspiradora Dyson,Hogar,2024-05-09,,1242.98,,PayPal,FR,Paris,Entregado,2024-05-09 06:00:00
1710.0,1980,Laura Torres,164,Teclado Logitech,Tecnología,06/09/2024,3.0,1303.9,3911.7,Bizum,France,Valencia,Pendiente,2024-09-06 02:00:00
1711.0,1863,Ana Sánchez,116,iPhone 13,Tecnología,09/10/2024,2.0,312.53,625.06,Tarjeta,Germany,Milán,Pendiente,2024-10-09 15:00:00
1712.0,1171,Juan Pérez,56,Camiseta Adidas,Moda,11/01/2024,4.0,132.09,609.0473499797789,Tarjeta,España,Valencia,Pendiente,2024-01-11 10:00:00
1713.0,1103,Pedro López,16,MacBook Pro,Tecnología,08-23-2023,4.0,1563.72,6254.88,Transferencia,España,Berlín,Pendiente,2023-08-23 23:00:00
1714.0,1860,Laura Torres,14,Mochila North Face,Accesorios,04-07-2023,2.0,$925.0,,Tarjeta,France,Berlín,Cancelado,2023-04-07 09:00:00
1715.0,1643,LUCÍA FERNÁNDEZ,27,Samsung Galaxy,Tecnología,2024-09-06,4.0,125.75,503.0,PayPal,Italy,Madrid,Pendiente,2024-09-06 14:00:00
1716.0,1452,Lucía Fernández,151,iPhone 13,Tecnología,30/09/2024,2.0,1989.78,3979.56,Transferencia,France,Roma,Cancelado,2024-09-30 07:00:00
1717.0,1496,David Gómez,59,Silla Gaming,tech,12-19-2023,4.0,$124.98,,Transferencia,ES,Hamburgo,Cancelado,2023-12-19 17:00:00
1718.0,1392,Ana Sánchez,168,Cafetera Philips,Hogar,2023-12-26,3.0,$1393.12,,Bizum,France,Lyon,Cancelado,2023-12-26 20:00:00
1719.0,1155,Juan Pérez,12,Zapatillas Nike,Moda,2023-05-19,3.0,$1967.52,,Bizum,España,Hamburgo,Entregado,2023-05-19 18:00:00
1720.0,1596,Laura Torres,87,Bolso Gucci,Moda,24/11/2023,1.0,485.97,485.97,Transferencia,FR,Berlín,Entregado,2023-11-24 00:00:00
1721.0,1167,Lucía Fernández,151,Reloj Casio,Accesorios,31/05/2023,3.0,293.08,879.24,Bizum,Italy,Hamburgo,Pendiente,2023-05-31 04:00:00
1722.0,1651,María García,14,iPhone 13,Tecnología,2024-11-21,2.0,251.56,420.07120660566187,Tarjeta,France,Berlín,Cancelado,2024-11-21 05:00:00
1723.0,1451,Laura Torres,119,Sony Headphones,Tecnología,2024-05-07,3.0,613.52,1840.56,Transferencia,España,Milán,Cancelado,2024-05-07 09:00:00
1724.0,1513,Pedro López,89,iPhone 13,tech,15/04/2023,1.0,211.08,211.08,Bizum,Italy,Valencia,Entregado,2023-04-15 05:00:00
1725.0,1993,Lucía Fernández,99,Reloj Casio,Moda,24/03/2023,3.0,1387.4,4162.2,Tarjeta,España,Barcelona,Pendiente,2023-03-24 23:00:00
1726.0,1765,Ana Sánchez,179,Aspiradora Dyson,Hogar,2024-11-03,1.0,133.96,133.96,Bizum,FR,Valencia,Pendiente,2024-11-03 19:00:00
1727.0,1873,Carlos Ruiz,179,Bolso Gucci,Moda,2024-07-30,1.0,1023.75,989.2256254541048,Bizum,Italy,Roma,Pendiente,2024-07-30 14:00:00
1728.0,1443,Ana Sánchez,28,Zapatillas Nike,Moda,30/09/2023,2.0,1993.43,3986.86,PayPal,spain,Roma,Pendiente,2023-09-30 02:00:00
1729.0,1194,David Gómez,30,MacBook Pro,Tecnología,2023-03-25,5.0,1629.8,8149.0,PayPal,DE,Paris,Pendiente,2023-03-25 09:00:00
1730.0,1857,carlos ruiz,46,iPhone 13,Tecnología,06-26-2023,5.0,1234.29,6171.45,Bizum,spain,Roma,Cancelado,2023-06-26 09:00:00
1731.0,1169,Carlos Ruiz,101,Bolso Gucci,Moda,29/06/2024,5.0,"619,44",,PayPal,España,Hamburgo,Entregado,2024-06-29 00:00:00
1732.0,1482,Lucía Fernández,154,Cafetera Philips,Hogar,2023-11-14,2.0,"1251,55",,Tarjeta,España,Lyon,Pendiente,2023-11-14 05:00:00
1733.0,1608,Laura Torres,187,Silla Gaming,Hogar,2023-07-28,5.0,1058.81,5294.05,PayPal,DE,Hamburgo,Entregado,2023-07-28 02:00:00
1734.0,1691,María García,198,Samsung Galaxy,Tecnología,29/05/2024,1.0,857.91,857.91,PayPal,FR,Madrid,Cancelado,2024-05-29 21:00:00
1735.0,1768,Laura Torres,90,Sony Headphones,Tecnología,2024-08-24,4.0,270.11,864.4530559142131,Tarjeta,FR,Valencia,Pendiente,2024-08-24 14:00:00
1736.0,1071,carlos ruiz,67,Bolso Gucci,Moda,21/10/2023,2.0,1774.34,3548.68,PayPal,ES,Madrid,Cancelado,2023-10-21 19:00:00
1737.0,1005,ana sánchez,44,Cafetera Philips,Hogar,05/09/2023,4.0,905.07,3620.28,Bizum,France,Roma,Cancelado,2023-09-05 09:00:00
1738.0,1760,María García,170,Mochila North Face,Accesorios,09/08/2024,4.0,397.3,1589.2,Transferencia,ES,Roma,Pendiente,2024-08-09 11:00:00
1739.0,1800,lucía fernández,185,Sony Headphones,Tecnología,2024-04-01,1.0,741.84,741.84,Bizum,France,Paris,Pendiente,2024-04-01 10:00:00
1740.0,1477,juan pérez,10,Silla Gaming,Hogar,17/01/2023,1.0,834.12,834.12,Bizum,IT,Roma,Cancelado,2023-01-17 07:00:00
1741.0,1595,LAURA TORRES,135,Bolso Gucci,Moda,30/09/2023,1.0,1656.8,1836.2146056368765,Tarjeta,spain,Paris,Pendiente,2023-09-30 17:00:00
1742.0,1009,CARLOS RUIZ,125,iPhone 13,Moda,08-27-2023,3.0,1469.89,4409.67,PayPal,ES,Paris,Cancelado,2023-08-27 21:00:00
1743.0,1412,LUCÍA FERNÁNDEZ,198,Teclado Logitech,Tecnología,05/11/2023,4.0,1540.92,6163.68,Transferencia,spain,Lyon,Cancelado,2023-11-05 15:00:00
1744.0,1552,Laura Torres,35,Reloj Casio,Accesorios,2024-06-17,3.0,31.95,95.85,PayPal,FR,Milán,Pendiente,2024-06-17 15:00:00
1745.0,1536,pedro lópez,190,Camiseta Adidas,tecnologia,2023-08-17,3.0,838.15,2514.45,PayPal,DE,Valencia,Entregado,2023-08-17 17:00:00
1746.0,1216,JUAN PÉREZ,58,MacBook Pro,Tecnología,10-03-2023,3.0,967.87,2903.61,Transferencia,Germany,Berlín,Cancelado,2023-10-03 13:00:00
1747.0,1186,Lucía Fernández,98,Silla Gaming,Hogar,13/05/2024,3.0,48.19,144.57,Bizum,spain,Berlín,Pendiente,2024-05-13 03:00:00
1748.0,1090,pedro lópez,155,MacBook Pro,tech,2024-01-28,4.0,527.03,2108.12,Tarjeta,ES,Hamburgo,Entregado,2024-01-28 10:00:00
1749.0,1371,Ana Sánchez,15,Samsung Galaxy,Tecnología,16/12/2023,5.0,1522.98,7614.9,PayPal,ES,Barcelona,Cancelado,2023-12-16 06:00:00
1750.0,1084,María García,180,Cafetera Philips,Hogar,10-29-2023,1.0,282.85,282.85,Bizum,FR,Hamburgo,Cancelado,2023-10-29 20:00:00
1751.0,1565,Carlos Ruiz,131,Samsung Galaxy,Tecnología,2023-02-12,4.0,1075.27,4301.08,Bizum,Germany,Roma,Cancelado,2023-02-12 05:00:00
1752.0,1244,Pedro López,101,iPhone 13,Tecnología,08-23-2023,2.0,438.25,876.5,PayPal,DE,Valencia,Pendiente,2023-08-23 17:00:00
1753.0,1674,David Gómez,193,Sony Headphones,Tecnología,03-03-2024,2.0,34.12,68.24,Bizum,FR,Hamburgo,Entregado,2024-03-03 16:00:00
1754.0,1925,Pedro López,192,Sony Headphones,hogar,18/11/2023,5.0,489.99,2449.95,PayPal,Italy,Lyon,Cancelado,2023-11-18 08:00:00
1755.0,1432,laura torres,3,Reloj Casio,Accesorios,21/10/2023,5.0,1951.99,9744.96463289457,PayPal,Italy,Paris,Entregado,2023-10-21 00:00:00
1756.0,1662,david gómez,94,Samsung Galaxy,Tecnología,2023-09-25,3.0,1605.06,4815.18,Transferencia,France,Madrid,Cancelado,2023-09-25 13:00:00
1757.0,1364,Lucía Fernández,39,iPhone 13,Tecnología,18/08/2024,3.0,1919.56,5758.68,Transferencia,Germany,Milán,Entregado,2024-08-18 23:00:00
1758.0,1199,david gómez,78,Aspiradora Dyson,Hogar,20/02/2024,1.0,980.83,980.83,Tarjeta,DE,Madrid,Cancelado,2024-02-20 22:00:00
1759.0,1501,Pedro López,192,Zapatillas Nike,hogar,09-01-2024,1.0,228.38,228.38,Transferencia,FR,Valencia,Cancelado,2024-09-01 19:00:00
1760.0,1888,David Gómez,7,MacBook Pro,Tecnología,12/09/2024,1.0,$1100.44,,Transferencia,spain,Barcelona,Pendiente,2024-09-12 21:00:00
1761.0,1156,Carlos Ruiz,132,Bolso Gucci,Moda,2023-09-20,3.0,914.21,2742.63,Tarjeta,ES,Barcelona,Cancelado,2023-09-20 19:00:00
1762.0,1438,Lucía Fernández,77,Sony Headphones,Tecnología,2023-07-08,3.0,1690.27,4123.475674650526,Transferencia,FR,Madrid,Pendiente,2023-07-08 19:00:00
1763.0,1044,David Gómez,170,Reloj Casio,Accesorios,06-17-2023,1.0,$205.18,,Transferencia,Germany,Milán,Cancelado,2023-06-17 10:00:00
1764.0,1279,Pedro López,62,AirPods,Tecnología,2024-03-27,5.0,981.6,4908.0,Transferencia,ES,Valencia,Entregado,2024-03-27 11:00:00
1765.0,1260,carlos ruiz,90,Zapatillas Nike,Moda,2023-03-30,1.0,308.6,308.6,PayPal,FR,Roma,Entregado,2023-03-30 20:00:00
1766.0,1055,María García,123,Zapatillas Nike,Moda,27/05/2024,4.0,656.11,2624.44,Tarjeta,IT,Paris,Entregado,2024-05-27 18:00:00
1767.0,1629,carlos ruiz,142,Mochila North Face,Accesorios,2023-05-22,5.0,"1477,34",,PayPal,FR,Berlín,Pendiente,2023-05-22 12:00:00
1768.0,1782,lucía fernández,195,Bolso Gucci,Moda,05-12-2023,5.0,957.28,5228.950721883932,Bizum,España,Hamburgo,Entregado,2023-05-12 19:00:00
1769.0,1884,lucía fernández,139,Camiseta Adidas,moda,06/01/2023,1.0,758.02,758.02,Transferencia,DE,Madrid,Entregado,2023-01-06 06:00:00
1770.0,1163,Pedro López,26,Aspiradora Dyson,moda,30/03/2023,2.0,795.01,1590.02,Bizum,spain,Hamburgo,Entregado,2023-03-30 21:00:00
1771.0,1353,Pedro López,6,Bolso Gucci,Moda,2023-06-22,4.0,924.3,3697.2,Tarjeta,spain,Madrid,Entregado,2023-06-22 22:00:00
1772.0,1866,Laura Torres,163,Samsung Galaxy,Tecnología,2023-11-09,4.0,1572.18,6288.72,Transferencia,España,Berlín,Cancelado,2023-11-09 04:00:00
1773.0,1188,Juan Pérez,14,Cafetera Philips,Hogar,29/03/2023,4.0,$1785.25,,PayPal,España,Valencia,Pendiente,2023-03-29 16:00:00
1774.0,1551,Ana Sánchez,126,Aspiradora Dyson,Hogar,02-19-2023,1.0,1911.12,1911.12,Transferencia,Italy,Paris,Cancelado,2023-02-19 20:00:00
1775.0,1425,Lucía Fernández,181,MacBook Pro,Tecnología,11-28-2024,1.0,1575.94,1635.6657356526473,Tarjeta,ES,Madrid,Pendiente,2024-11-28 09:00:00
1776.0,1736,Carlos Ruiz,106,Bolso Gucci,Moda,2023-10-07,4.0,637.66,2550.64,Tarjeta,FR,Berlín,Entregado,2023-10-07 07:00:00
1777.0,1409,David Gómez,122,Teclado Logitech,Tecnología,02-10-2023,3.0,1379.39,4138.17,Bizum,Germany,Madrid,Cancelado,2023-02-10 21:00:00
1778.0,1115,María García,142,Zapatillas Nike,Moda,07-03-2024,5.0,880.83,4003.6434653674373,PayPal,Italy,Barcelona,Cancelado,2024-07-03 11:00:00
1779.0,1326,Pedro López,138,Zapatillas Nike,hogar,13/05/2023,5.0,516.79,2132.9525648972776,Tarjeta,Germany,Madrid,Cancelado,2023-05-13 05:00:00
1780.0,1686,Laura Torres,104,Samsung Galaxy,Tecnología,11-15-2024,2.0,1683.33,3065.5673112822647,PayPal,Italy,Milán,Entregado,2024-11-15 13:00:00
1781.0,1484,Laura Torres,191,AirPods,Tecnología,2024-03-06,2.0,86.47,172.94,Bizum,España,Roma,Entregado,2024-03-06 04:00:00
1782.0,1726,Pedro López,34,AirPods,hogar,04-09-2023,5.0,1804.51,9022.55,Bizum,España,Roma,Pendiente,2023-04-09 09:00:00
1783.0,1423,JUAN PÉREZ,30,Teclado Logitech,Tecnología,12-01-2023,2.0,928.34,1856.68,Transferencia,España,Lyon,Pendiente,2023-12-01 17:00:00
1784.0,1101,Lucía Fernández,179,Sony Headphones,Tecnología,10-31-2024,3.0,1278.03,3834.09,Transferencia,Italy,Madrid,Pendiente,2024-10-31 06:00:00
1785.0,1043,David Gómez,20,Cafetera Philips,Hogar,28/04/2023,3.0,1322.11,3966.33,PayPal,ES,Roma,Pendiente,2023-04-28 21:00:00
1786.0,1131,María García,67,Silla Gaming,Hogar,29/03/2023,4.0,1791.28,7165.12,PayPal,Germany,Valencia,Cancelado,2023-03-29 14:00:00
1787.0,1610,JUAN PÉREZ,53,Zapatillas Nike,Moda,2023-05-16,2.0,1276.97,2453.5335772623826,Transferencia,ES,Madrid,Entregado,2023-05-16 15:00:00
1788.0,1699,Pedro López,55,Cafetera Philips,Hogar,07/06/2024,3.0,1231.73,3695.19,PayPal,Germany,Hamburgo,Pendiente,2024-06-07 02:00:00
1789.0,1399,Carlos Ruiz,158,Monitor LG,Tecnología,25/09/2023,3.0,142.64,427.92,Bizum,DE,Madrid,Cancelado,2023-09-25 23:00:00
1790.0,1862,María García,22,Teclado Logitech,Tecnología,2024-01-11,4.0,"1041,63",,Tarjeta,spain,Lyon,Pendiente,2024-01-11 23:00:00
1791.0,1974,Carlos Ruiz,92,MacBook Pro,HOGAR,2024-02-26,5.0,308.84,1544.2,PayPal,Italy,Valencia,Cancelado,2024-02-26 12:00:00
1792.0,1967,Pedro López,63,Zapatillas Nike,Moda,02/11/2023,5.0,1477.49,7387.45,Bizum,France,Madrid,Cancelado,2023-11-02 00:00:00
1793.0,1799,Ana Sánchez,162,Cafetera Philips,Hogar,11-17-2023,5.0,1029.32,4847.211997080342,PayPal,spain,Paris,Pendiente,2023-11-17 10:00:00
1794.0,1281,Lucía Fernández,169,Mochila North Face,Accesorios,2023-04-17,5.0,1363.65,6818.25,Tarjeta,France,Milán,Pendiente,2023-04-17 16:00:00
1795.0,1121,Lucía Fernández,152,Monitor LG,Tecnología,06-27-2023,4.0,92.93,371.72,Transferencia,France,Barcelona,Cancelado,2023-06-27 13:00:00
1796.0,1463,Juan Pérez,159,Zapatillas Nike,Moda,2024-03-28,5.0,178.74,1060.5608479843372,Transferencia,ES,Madrid,Pendiente,2024-03-28 06:00:00
1797.0,1160,carlos ruiz,10,Aspiradora Dyson,Hogar,11-16-2023,5.0,$1435.48,,Tarjeta,France,Milán,Entregado,2023-11-16 05:00:00
1798.0,1246,Laura Torres,114,Sony Headphones,Tecnología,2024-04-20,2.0,153.45,306.9,Transferencia,España,Lyon,Entregado,2024-04-20 17:00:00
1799.0,1122,Lucía Fernández,110,Camiseta Adidas,Moda,2024-03-05,1.0,151.8,151.8,Tarjeta,España,Valencia,Entregado,2024-03-05 12:00:00
1800.0,1275,Carlos Ruiz,66,Teclado Logitech,Tecnología,04-20-2023,2.0,34.1,76.98772854285778,Transferencia,spain,Paris,Cancelado,2023-04-20 05:00:00
1801.0,1830,David Gómez,126,Monitor LG,Tecnología,19/09/2024,4.0,1913.44,7653.76,Transferencia,ES,Paris,Pendiente,2024-09-19 07:00:00
1802.0,1779,Laura Torres,120,Samsung Galaxy,Tecnología,25/05/2024,4.0,1477.64,5910.56,PayPal,DE,Valencia,Cancelado,2024-05-25 11:00:00
1803.0,1148,Ana Sánchez,128,Bolso Gucci,Moda,04-06-2024,2.0,712.97,1425.94,Tarjeta,Italy,Lyon,Pendiente,2024-04-06 21:00:00
1804.0,1299,laura torres,18,Monitor LG,Tecnología,06/08/2024,3.0,600.11,1800.33,Transferencia,DE,Milán,Cancelado,2024-08-06 01:00:00
1805.0,1044,David Gómez,58,Bolso Gucci,Moda,11-17-2024,1.0,705.91,705.91,Tarjeta,DE,Valencia,Cancelado,2024-11-17 02:00:00
1806.0,1198,Carlos Ruiz,155,iPhone 13,Tecnología,2024-04-16,5.0,1551.56,7757.8,PayPal,Germany,Valencia,Pendiente,2024-04-16 20:00:00
1807.0,1172,María García,147,Reloj Casio,Accesorios,08-17-2024,4.0,1326.13,5304.52,Transferencia,FR,Madrid,Cancelado,2024-08-17 18:00:00
1808.0,1133,Juan Pérez,85,iPhone 13,Tecnología,2024-10-04,1.0,378.54,378.54,PayPal,France,Hamburgo,Pendiente,2024-10-04 07:00:00
1809.0,1767,Pedro López,57,MacBook Pro,Tecnología,31/05/2023,2.0,356.48,712.96,Transferencia,spain,Valencia,Pendiente,2023-05-31 20:00:00
1810.0,1760,Lucía Fernández,103,Mochila North Face,Accesorios,03-28-2023,3.0,205.81,617.43,PayPal,Germany,Berlín,Entregado,2023-03-28 17:00:00
1811.0,1239,Carlos Ruiz,99,Bolso Gucci,Moda,2023-06-02,1.0,1324.0,1324.0,Bizum,FR,Madrid,Pendiente,2023-06-02 13:00:00
1812.0,1925,carlos ruiz,30,Mochila North Face,Accesorios,11/01/2023,3.0,"1531,1",,PayPal,Germany,Milán,Cancelado,2023-01-11 20:00:00
1813.0,1996,Lucía Fernández,128,Samsung Galaxy,Tecnología,2023-07-12,5.0,537.44,2687.2,Tarjeta,ES,Lyon,Entregado,2023-07-12 23:00:00
1814.0,1135,María García,36,Sony Headphones,Tecnología,01/05/2024,3.0,51.68,155.04,Transferencia,France,Madrid,Cancelado,2024-05-01 17:00:00
1815.0,1269,Laura Torres,160,Teclado Logitech,Tecnología,2023-11-18,3.0,173.52,520.56,Transferencia,Italy,Roma,Cancelado,2023-11-18 12:00:00
1816.0,1377,María García,189,Zapatillas Nike,Moda,2023-10-06,2.0,"1936,04",,Bizum,spain,Roma,Entregado,2023-10-06 05:00:00
1817.0,1742,Ana Sánchez,145,Silla Gaming,Hogar,14/06/2023,2.0,597.94,1195.88,Transferencia,FR,Milán,Cancelado,2023-06-14 04:00:00
1818.0,1186,Ana Sánchez,63,AirPods,Tecnología,2024-04-01,4.0,1540.75,6163.0,Bizum,France,Hamburgo,Pendiente,2024-04-01 21:00:00
1819.0,1596,Pedro López,83,Reloj Casio,Accesorios,2023-05-18,1.0,1253.08,1331.4958278264921,Transferencia,FR,Roma,Cancelado,2023-05-18 11:00:00
1820.0,1506,Lucía Fernández,10,Bolso Gucci,Moda,10-14-2024,5.0,770.06,3850.3,Bizum,Italy,Paris,Pendiente,2024-10-14 19:00:00
1821.0,1376,Laura Torres,54,Cafetera Philips,Hogar,10/11/2024,4.0,"419,32",,PayPal,Germany,Madrid,Cancelado,2024-11-10 02:00:00
1822.0,1871,LAURA TORRES,160,Camiseta Adidas,Moda,2024-05-30,1.0,251.56,251.56,PayPal,ES,Milán,Cancelado,2024-05-30 11:00:00
1823.0,1708,Carlos Ruiz,15,Zapatillas Nike,Moda,10/09/2023,5.0,1233.88,6169.4,PayPal,IT,Roma,Entregado,2023-09-10 23:00:00
1824.0,1785,David Gómez,120,Mochila North Face,Accesorios,2023-12-26,2.0,1551.52,3103.04,Transferencia,spain,Valencia,Pendiente,2023-12-26 17:00:00
1825.0,1797,Pedro López,7,Camiseta Adidas,Moda,08/04/2023,3.0,1291.37,3874.11,PayPal,DE,Roma,Entregado,2023-04-08 03:00:00
1826.0,1361,Pedro López,49,Aspiradora Dyson,Hogar,2023-10-25,2.0,1065.3,2011.427888241427,Tarjeta,ES,Roma,Entregado,2023-10-25 17:00:00
1827.0,1501,Carlos Ruiz,105,Bolso Gucci,Moda,06-04-2023,2.0,93.48,186.96,Transferencia,ES,Roma,Pendiente,2023-06-04 17:00:00
1828.0,1537,Lucía Fernández,16,Reloj Casio,Accesorios,28/10/2023,1.0,$1937.29,0.0,Tarjeta,Germany,Lyon,Entregado,2023-10-28 04:00:00
1829.0,1146,Lucía Fernández,86,Teclado Logitech,Tecnología,04-14-2023,2.0,1599.44,3114.7483496786863,Transferencia,France,Paris,Cancelado,2023-04-14 15:00:00
1830.0,1969,María García,133,MacBook Pro,Tecnología,08/08/2024,3.0,592.72,1778.16,Transferencia,ES,Lyon,Pendiente,2024-08-08 05:00:00
1831.0,1686,David Gómez,109,Mochila North Face,Accesorios,08/11/2024,5.0,1960.14,9800.7,Tarjeta,spain,Valencia,Pendiente,2024-11-08 19:00:00
1832.0,1494,Ana Sánchez,180,Camiseta Adidas,Moda,2024-05-24,5.0,1207.74,6038.7,Tarjeta,España,Lyon,Cancelado,2024-05-24 21:00:00
,1816,david gómez,173,Cafetera Philips,Hogar,11-27-2024,2.0,1169.02,2338.04,Bizum,France,Berlín,Pendiente,2024-11-27 17:00:00
1834.0,1028,david gómez,88,Sony Headphones,Tecnología,2023-04-08,1.0,1498.67,1498.67,PayPal,spain,Roma,Pendiente,2023-04-08 21:00:00
1835.0,1255,Juan Pérez,115,Sony Headphones,Tecnología,06/02/2023,5.0,1625.42,8127.1,PayPal,FR,Roma,Pendiente,2023-02-06 14:00:00
1836.0,1781,Carlos Ruiz,53,Camiseta Adidas,Moda,27/06/2024,1.0,1316.39,1316.39,Tarjeta,France,Lyon,Cancelado,2024-06-27 07:00:00
1837.0,1954,María García,165,MacBook Pro,Tecnología,05-31-2023,5.0,"264,91",,PayPal,FR,Berlín,Pendiente,2023-05-31 12:00:00
1838.0,1118,CARLOS RUIZ,20,MacBook Pro,Tecnología,2024-02-19,5.0,683.15,3415.75,Bizum,España,Barcelona,Cancelado,2024-02-19 05:00:00
1839.0,1316,Juan Pérez,139,Samsung Galaxy,Tecnología,07-23-2023,2.0,1856.89,3713.78,PayPal,Italy,Hamburgo,Pendiente,2023-07-23 18:00:00
1840.0,1629,Pedro López,158,Camiseta Adidas,Moda,2024-04-10,1.0,456.99,456.99,PayPal,Italy,Paris,Pendiente,2024-04-10 07:00:00
1841.0,1824,DAVID GÓMEZ,122,Mochila North Face,Accesorios,2023-03-07,1.0,750.61,750.61,Tarjeta,Italy,Roma,Cancelado,2023-03-07 20:00:00
1842.0,1597,Carlos Ruiz,93,Mochila North Face,Accesorios,07-07-2024,5.0,869.83,4349.15,Tarjeta,DE,Valencia,Entregado,2024-07-07 08:00:00
1843.0,1658,Juan Pérez,57,Bolso Gucci,Moda,2023-05-24,5.0,"884,42",0.0,Bizum,IT,Berlín,Pendiente,2023-05-24 18:00:00
1844.0,1783,Lucía Fernández,86,Reloj Casio,Accesorios,10/01/2023,3.0,1229.75,3689.25,Bizum,France,Madrid,Entregado,2023-01-10 17:00:00
1845.0,1726,Juan Pérez,183,Camiseta Adidas,Moda,03-17-2024,5.0,1886.72,9433.6,PayPal,ES,Milán,Pendiente,2024-03-17 06:00:00
1846.0,1601,David Gómez,14,Camiseta Adidas,moda,2023-08-25,3.0,488.98,1466.94,Transferencia,FR,Barcelona,Pendiente,2023-08-25 11:00:00
1847.0,1569,David Gómez,30,Aspiradora Dyson,Hogar,03-10-2024,4.0,251.79,1118.700024976408,Transferencia,IT,Valencia,Pendiente,2024-03-10 20:00:00
1848.0,1007,David Gómez,169,Sony Headphones,HOGAR,2023-06-12,3.0,402.97,1208.91,Tarjeta,spain,Madrid,Entregado,2023-06-12 01:00:00
1849.0,1605,ANA SÁNCHEZ,98,Reloj Casio,Accesorios,05-30-2023,5.0,1774.98,8874.9,PayPal,spain,Paris,Pendiente,2023-05-30 23:00:00
1850.0,1219,Ana Sánchez,31,iPhone 13,Tecnología,2024-06-23,4.0,1295.16,5180.64,PayPal,España,Barcelona,Entregado,2024-06-23 03:00:00
1851.0,1531,Pedro López,105,Camiseta Adidas,Moda,2024-06-23,3.0,578.95,1736.85,PayPal,DE,Valencia,Entregado,2024-06-23 07:00:00
1852.0,1823,David Gómez,123,Camiseta Adidas,Moda,07/02/2024,4.0,1633.73,6534.92,Transferencia,España,Lyon,Pendiente,2024-02-07 19:00:00
1853.0,1356,Juan Pérez,34,Bolso Gucci,Moda,11-23-2023,4.0,1724.13,6896.52,Transferencia,España,Paris,Entregado,2023-11-23 00:00:00
1854.0,1843,Laura Torres,106,Bolso Gucci,Moda,2023-03-28,3.0,1694.56,5083.68,Tarjeta,ES,Lyon,Entregado,2023-03-28 22:00:00
1855.0,1530,JUAN PÉREZ,154,AirPods,Tecnología,2023-11-09,4.0,1838.66,7354.64,Tarjeta,Italy,Roma,Pendiente,2023-11-09 18:00:00
1856.0,1195,María García,68,Bolso Gucci,Moda,24/01/2024,3.0,511.96,1535.88,Tarjeta,Italy,Barcelona,Cancelado,2024-01-24 17:00:00
1857.0,1746,Ana Sánchez,13,Sony Headphones,Tecnología,01-01-2023,5.0,"1512,53",0.0,Transferencia,ES,Madrid,Cancelado,2023-01-01 05:00:00
1858.0,1017,Ana Sánchez,171,Mochila North Face,Accesorios,04-29-2023,4.0,926.47,3705.88,Tarjeta,spain,Paris,Entregado,2023-04-29 05:00:00
1859.0,1043,Juan Pérez,190,MacBook Pro,TECHNOLOGY,06/08/2023,3.0,1685.58,5056.74,Tarjeta,DE,Madrid,Entregado,2023-08-06 16:00:00
1860.0,1091,María García,95,Silla Gaming,Hogar,04-15-2024,1.0,1459.7,1459.7,Bizum,IT,Barcelona,Cancelado,2024-04-15 00:00:00
1861.0,1685,María García,192,Silla Gaming,Hogar,21/12/2023,3.0,1555.13,4665.39,PayPal,ES,Valencia,Pendiente,2023-12-21 00:00:00
1862.0,1660,Ana Sánchez,26,Aspiradora Dyson,Hogar,2024-06-06,4.0,$1315.76,,Transferencia,Italy,Barcelona,Entregado,2024-06-06 11:00:00
1863.0,1091,CARLOS RUIZ,55,Teclado Logitech,Tecnología,05-07-2024,3.0,363.08,1089.24,Transferencia,IT,Hamburgo,Entregado,2024-05-07 14:00:00
1864.0,1428,maría garcía,46,Silla Gaming,Hogar,2024-06-06,2.0,1094.6,2189.2,Transferencia,spain,Hamburgo,Pendiente,2024-06-06 10:00:00
1865.0,1589,Pedro López,10,Reloj Casio,Accesorios,18/07/2024,1.0,1969.49,1969.49,Bizum,IT,Valencia,Pendiente,2024-07-18 03:00:00
1866.0,1412,David Gómez,194,Camiseta Adidas,Moda,2024-11-27,2.0,1875.4,3750.8,PayPal,spain,Berlín,Pendiente,2024-11-27 14:00:00
1867.0,1656,Carlos Ruiz,137,iPhone 13,Tecnología,2023-06-26,1.0,95.92,95.92,PayPal,spain,Valencia,Pendiente,2023-06-26 10:00:00
1868.0,1213,María García,165,Sony Headphones,Tecnología,01/05/2023,2.0,337.98,675.96,Bizum,FR,Roma,Cancelado,2023-05-01 13:00:00
1869.0,1153,Pedro López,182,Monitor LG,Tecnología,04-23-2023,3.0,272.14,816.42,Transferencia,España,Barcelona,Cancelado,2023-04-23 23:00:00
1870.0,1367,Lucía Fernández,123,Bolso Gucci,Moda,2024-09-24,2.0,1454.7,3381.7271353680467,Tarjeta,España,Valencia,Cancelado,2024-09-24 18:00:00
1871.0,1503,María García,109,Camiseta Adidas,Moda,18/11/2023,4.0,1637.39,6549.56,Transferencia,spain,Berlín,Entregado,2023-11-18 00:00:00
1872.0,1946,Ana Sánchez,105,Reloj Casio,Accesorios,2023-01-11,5.0,434.89,2174.45,Transferencia,IT,Paris,Cancelado,2023-01-11 05:00:00
1873.0,1598,María García,54,Monitor LG,Tecnología,05/04/2024,5.0,1016.65,5083.25,Transferencia,DE,Lyon,Entregado,2024-04-05 20:00:00
1874.0,1768,David Gómez,151,AirPods,Tecnología,10-28-2023,1.0,1683.0,1683.0,Transferencia,ES,Paris,Entregado,2023-10-28 12:00:00
1875.0,1692,Pedro López,14,Mochila North Face,Accesorios,01-08-2023,5.0,1468.28,7341.4,PayPal,IT,Berlín,Entregado,2023-01-08 06:00:00
,1233,Ana Sánchez,105,Sony Headphones,Tecnología,2023-03-09,1.0,1089.05,1089.05,Tarjeta,spain,Lyon,Pendiente,2023-03-09 09:00:00
1877.0,1352,Laura Torres,2,Samsung Galaxy,Tecnología,05-29-2023,2.0,1184.79,2369.58,Transferencia,FR,Madrid,Pendiente,2023-05-29 18:00:00
1878.0,1104,María García,121,AirPods,Tecnología,08-06-2024,2.0,1021.64,2043.28,Transferencia,Germany,Lyon,Cancelado,2024-08-06 15:00:00
1879.0,1780,Ana Sánchez,167,Bolso Gucci,Moda,05-11-2024,2.0,602.12,1204.24,PayPal,Italy,Berlín,Pendiente,2024-05-11 05:00:00
1880.0,1312,juan pérez,22,Cafetera Philips,hogar,09-01-2024,4.0,1134.39,4537.56,Transferencia,FR,Paris,Pendiente,2024-09-01 08:00:00
1881.0,1148,Carlos Ruiz,46,MacBook Pro,Tecnología,2023-06-02,3.0,1380.88,4142.64,Tarjeta,España,Roma,Entregado,2023-06-02 17:00:00
1882.0,1693,Carlos Ruiz,114,Aspiradora Dyson,Hogar,06/06/2023,5.0,1747.91,8739.55,PayPal,spain,Valencia,Entregado,2023-06-06 03:00:00
1883.0,1289,PEDRO LÓPEZ,21,Camiseta Adidas,Moda,11-05-2024,1.0,1276.22,1276.22,Transferencia,France,Roma,Entregado,2024-11-05 20:00:00
1884.0,1611,Laura Torres,156,Teclado Logitech,Tecnología,2024-01-30,1.0,1524.63,1524.63,PayPal,spain,Valencia,Pendiente,2024-01-30 22:00:00
1885.0,1112,lucía fernández,71,iPhone 13,Tecnología,2024-02-28,1.0,328.54,328.54,PayPal,FR,Madrid,Cancelado,2024-02-28 23:00:00
1886.0,1281,Laura Torres,126,Aspiradora Dyson,Hogar,27/12/2023,5.0,928.5,4642.5,PayPal,France,Roma,Pendiente,2023-12-27 17:00:00
1887.0,1107,David Gómez,173,Cafetera Philips,Hogar,2024-07-22,1.0,28.57,28.57,PayPal,ES,Madrid,Cancelado,2024-07-22 14:00:00
1888.0,1881,carlos ruiz,170,Aspiradora Dyson,Hogar,11/08/2024,4.0,"500,89",,PayPal,spain,Berlín,Pendiente,2024-08-11 10:00:00
1889.0,1695,Pedro López,152,MacBook Pro,hogar,11-08-2024,3.0,1455.66,4366.98,Transferencia,FR,Roma,Pendiente,2024-11-08 02:00:00
1890.0,1009,Carlos Ruiz,130,Camiseta Adidas,Moda,2023-05-28,1.0,1983.7,1983.7,PayPal,IT,Berlín,Pendiente,2023-05-28 07:00:00
1891.0,1348,Ana Sánchez,7,Samsung Galaxy,Moda,2024-04-06,5.0,207.36,1036.8,Tarjeta,Germany,Madrid,Pendiente,2024-04-06 23:00:00
,1308,María García,30,Aspiradora Dyson,hogar,31/10/2023,5.0,808.97,4044.85,PayPal,France,Berlín,Cancelado,2023-10-31 23:00:00
1893.0,1248,Carlos Ruiz,135,MacBook Pro,Tecnología,11-03-2024,3.0,1602.14,4806.42,PayPal,DE,Barcelona,Pendiente,2024-11-03 06:00:00
1894.0,1859,María García,180,Aspiradora Dyson,Hogar,2024-04-24,3.0,416.03,1248.09,PayPal,España,Milán,Entregado,2024-04-24 21:00:00
1895.0,1151,María García,81,Bolso Gucci,Moda,2023-12-20,3.0,1114.62,3343.86,PayPal,ES,Hamburgo,Entregado,2023-12-20 07:00:00
1896.0,1244,Laura Torres,113,AirPods,Tecnología,2023-12-19,2.0,1468.81,2937.62,Transferencia,France,Lyon,Cancelado,2023-12-19 01:00:00
1897.0,1239,María García,86,Sony Headphones,Tecnología,06/04/2024,2.0,1235.81,2471.62,Bizum,Italy,Barcelona,Pendiente,2024-04-06 13:00:00
1898.0,1286,Laura Torres,80,Camiseta Adidas,Moda,03-24-2024,3.0,384.17,1152.51,Transferencia,IT,Lyon,Pendiente,2024-03-24 07:00:00
1899.0,1718,David Gómez,12,Silla Gaming,Hogar,2023-01-18,3.0,717.22,2407.2015966186577,PayPal,Italy,Hamburgo,Cancelado,2023-01-18 00:00:00
1900.0,1206,Pedro López,152,Bolso Gucci,Moda,12/09/2024,4.0,1569.75,6279.0,PayPal,spain,Hamburgo,Entregado,2024-09-12 08:00:00
1901.0,1008,María García,100,Samsung Galaxy,Moda,2023-05-04,5.0,1112.91,5564.55,Tarjeta,España,Lyon,Cancelado,2023-05-04 20:00:00
1902.0,1472,Ana Sánchez,104,MacBook Pro,Tecnología,23/08/2023,1.0,20.41,20.41,Tarjeta,Germany,Berlín,Pendiente,2023-08-23 17:00:00
1903.0,1577,Pedro López,143,Mochila North Face,Accesorios,04-01-2024,2.0,1524.37,3048.74,Tarjeta,DE,Valencia,Entregado,2024-04-01 15:00:00
1904.0,1975,Pedro López,93,AirPods,Tecnología,04-23-2024,2.0,80.27,137.59086218995145,Transferencia,DE,Hamburgo,Entregado,2024-04-23 19:00:00
1905.0,1703,Juan Pérez,3,Zapatillas Nike,Moda,2024-10-29,1.0,1494.01,1494.01,Tarjeta,IT,Hamburgo,Cancelado,2024-10-29 22:00:00
1906.0,1705,Carlos Ruiz,49,AirPods,Tecnología,12-23-2023,3.0,412.94,1238.82,PayPal,DE,Valencia,Entregado,2023-12-23 08:00:00
1907.0,1759,Juan Pérez,2,Silla Gaming,Hogar,22/05/2024,3.0,1916.57,5749.71,Transferencia,DE,Madrid,Pendiente,2024-05-22 08:00:00
1908.0,1002,Lucía Fernández,163,AirPods,Tecnología,13/01/2024,1.0,742.2,742.2,PayPal,España,Valencia,Pendiente,2024-01-13 07:00:00
1909.0,1291,Carlos Ruiz,87,Monitor LG,Tecnología,03-16-2024,1.0,660.59,660.59,Transferencia,IT,Paris,Entregado,2024-03-16 04:00:00
1910.0,1982,Laura Torres,16,Samsung Galaxy,Tecnología,11/05/2024,2.0,306.29,612.58,Transferencia,España,Paris,Entregado,2024-05-11 23:00:00
1911.0,1703,Carlos Ruiz,166,Camiseta Adidas,HOGAR,13/07/2024,4.0,"618,15",,PayPal,France,Berlín,Entregado,2024-07-13 00:00:00
1912.0,1873,Lucía Fernández,18,iPhone 13,tech,01/11/2023,2.0,1754.54,3509.08,Transferencia,France,Berlín,Entregado,2023-11-01 19:00:00
1913.0,1568,Laura Torres,71,Sony Headphones,Tecnología,2023-11-11,2.0,1992.71,3985.42,Tarjeta,ES,Barcelona,Cancelado,2023-11-11 20:00:00
1914.0,1989,Pedro López,32,Camiseta Adidas,Moda,02-01-2024,1.0,"742,94",,PayPal,DE,Paris,Cancelado,2024-02-01 18:00:00
1915.0,1479,Juan Pérez,178,AirPods,Tecnología,17/10/2024,5.0,902.74,4513.7,PayPal,ES,Milán,Pendiente,2024-10-17 16:00:00
1916.0,1729,María García,127,iPhone 13,Tecnología,12/05/2024,2.0,1446.92,2893.84,Bizum,France,Valencia,Cancelado,2024-05-12 05:00:00
1917.0,1667,Pedro López,27,Mochila North Face,Accesorios,2023-04-23,4.0,1773.53,7094.12,Tarjeta,IT,Valencia,Entregado,2023-04-23 22:00:00
1918.0,1857,maría garcía,44,Aspiradora Dyson,Hogar,07-29-2023,2.0,1190.16,2380.32,PayPal,Germany,Roma,Cancelado,2023-07-29 20:00:00
1919.0,1421,Lucía Fernández,18,Samsung Galaxy,Tecnología,2024-07-09,4.0,789.14,3156.56,Transferencia,FR,Madrid,Pendiente,2024-07-09 02:00:00
1920.0,1981,David Gómez,9,Aspiradora Dyson,Hogar,12/03/2024,1.0,$831.12,,PayPal,France,Valencia,Pendiente,2024-03-12 13:00:00
1921.0,1139,Carlos Ruiz,36,Camiseta Adidas,Moda,2023-08-26,3.0,1394.28,4182.84,Tarjeta,Italy,Lyon,Cancelado,2023-08-26 12:00:00
1922.0,1204,María García,86,Reloj Casio,Accesorios,04/09/2024,5.0,16.4,82.0,Bizum,spain,Paris,Pendiente,2024-09-04 20:00:00
1923.0,1073,María García,156,Bolso Gucci,Moda,08-17-2024,5.0,1242.98,6214.9,Transferencia,Italy,Valencia,Pendiente,2024-08-17 13:00:00
1924.0,1280,Laura Torres,18,Aspiradora Dyson,Hogar,23/05/2024,5.0,717.43,3587.15,Transferencia,IT,Hamburgo,Cancelado,2024-05-23 03:00:00
1925.0,1964,carlos ruiz,198,iPhone 13,Tecnología,04-14-2023,3.0,1590.45,4771.35,Bizum,France,Roma,Entregado,2023-04-14 15:00:00
1926.0,1666,Lucía Fernández,23,Aspiradora Dyson,Hogar,2023-05-17,2.0,195.05,390.1,Bizum,FR,Berlín,Entregado,2023-05-17 05:00:00
1927.0,1355,Ana Sánchez,23,Aspiradora Dyson,Hogar,19/06/2024,2.0,1180.52,2361.04,Transferencia,France,Madrid,Cancelado,2024-06-19 19:00:00
1928.0,1628,Laura Torres,11,Reloj Casio,Accesorios,19/11/2023,1.0,967.14,967.14,Bizum,DE,Valencia,Entregado,2023-11-19 02:00:00
1929.0,1499,Ana Sánchez,24,Samsung Galaxy,Tecnología,02/09/2023,1.0,1288.23,1288.23,PayPal,IT,Lyon,Pendiente,2023-09-02 02:00:00
1930.0,1371,ana sánchez,186,Silla Gaming,Hogar,09-16-2024,5.0,139.06,695.3,Bizum,IT,Valencia,Cancelado,2024-09-16 14:00:00
1931.0,1117,ana sánchez,32,iPhone 13,Tecnología,2024-11-26,3.0,1164.17,3823.997028408632,Tarjeta,DE,Berlín,Pendiente,2024-11-26 14:00:00
1932.0,1094,Carlos Ruiz,153,Monitor LG,Tecnología,2024-04-11,4.0,1127.35,4509.4,Transferencia,ES,Valencia,Pendiente,2024-04-11 00:00:00
1933.0,1070,Ana Sánchez,179,Monitor LG,Tecnología,08-06-2024,2.0,1125.71,2251.42,Tarjeta,Italy,Valencia,Pendiente,2024-08-06 13:00:00
1934.0,1400,David Gómez,115,AirPods,moda,03-17-2024,5.0,1210.94,6054.7,Transferencia,Germany,Hamburgo,Pendiente,2024-03-17 14:00:00
1935.0,1420,Lucía Fernández,7,iPhone 13,Tecnología,13/05/2023,4.0,"1356,17",0.0,Transferencia,ES,Madrid,Cancelado,2023-05-13 22:00:00
1936.0,1344,María García,99,Bolso Gucci,Moda,14/05/2024,4.0,1611.93,6447.72,Transferencia,FR,Barcelona,Cancelado,2024-05-14 20:00:00
1937.0,1687,Juan Pérez,12,Bolso Gucci,Moda,13/08/2024,2.0,546.94,1093.88,Tarjeta,spain,Paris,Cancelado,2024-08-13 11:00:00
1938.0,1273,Pedro López,145,AirPods,Tecnología,2023-09-20,5.0,1651.85,8259.25,Transferencia,FR,Madrid,Cancelado,2023-09-20 09:00:00
1939.0,1936,Lucía Fernández,183,Aspiradora Dyson,Hogar,11-09-2024,3.0,1001.53,3004.59,Tarjeta,spain,Lyon,Entregado,2024-11-09 04:00:00
1940.0,1379,Pedro López,36,Samsung Galaxy,Tecnología,29/09/2024,4.0,163.35,653.4,Bizum,IT,Paris,Pendiente,2024-09-29 02:00:00
1941.0,1125,Juan Pérez,66,Cafetera Philips,Hogar,07-12-2024,3.0,126.52,379.56,Bizum,DE,Hamburgo,Cancelado,2024-07-12 02:00:00
1942.0,1862,David Gómez,36,MacBook Pro,Tecnología,05/10/2023,4.0,675.13,2700.52,Bizum,France,Roma,Cancelado,2023-10-05 13:00:00
1943.0,1295,Ana Sánchez,105,iPhone 13,Tecnología,2023-01-26,1.0,1571.94,1571.94,PayPal,IT,Roma,Pendiente,2023-01-26 18:00:00
1944.0,1887,María García,92,Reloj Casio,Accesorios,18/07/2023,5.0,1418.29,7091.45,Transferencia,DE,Valencia,Cancelado,2023-07-18 11:00:00
1945.0,1860,Lucía Fernández,127,Cafetera Philips,Hogar,2024-01-17,4.0,1579.34,6317.36,PayPal,Italy,Madrid,Pendiente,2024-01-17 16:00:00
1946.0,1605,María García,133,Mochila North Face,Accesorios,07-05-2024,3.0,1039.37,3118.11,Tarjeta,ES,Valencia,Pendiente,2024-07-05 15:00:00
1947.0,1511,Carlos Ruiz,150,Aspiradora Dyson,Hogar,09-04-2023,4.0,886.0,3544.0,PayPal,FR,Madrid,Entregado,2023-09-04 09:00:00
1948.0,1552,Ana Sánchez,110,Camiseta Adidas,Moda,14/02/2023,5.0,303.43,1517.15,Transferencia,Italy,Barcelona,Pendiente,2023-02-14 03:00:00
1949.0,1034,David Gómez,117,Silla Gaming,Moda,28/09/2024,5.0,663.1,3315.5,Tarjeta,DE,Valencia,Cancelado,2024-09-28 17:00:00
1950.0,1167,Pedro López,169,AirPods,Tecnología,2023-12-08,5.0,873.7,4592.075469480345,Transferencia,DE,Hamburgo,Entregado,2023-12-08 20:00:00
1951.0,1868,Laura Torres,180,AirPods,Tecnología,2024-09-24,2.0,186.31,372.62,Transferencia,DE,Lyon,Cancelado,2024-09-24 09:00:00
1952.0,1121,Pedro López,58,Aspiradora Dyson,Hogar,10-11-2024,3.0,449.02,1347.06,Tarjeta,España,Lyon,Pendiente,2024-10-11 08:00:00
1953.0,1049,Pedro López,21,Reloj Casio,Accesorios,21/07/2023,2.0,1200.47,2200.790714882384,Tarjeta,DE,Hamburgo,Cancelado,2023-07-21 19:00:00
1954.0,1783,Carlos Ruiz,106,iPhone 13,Tecnología,06-28-2023,3.0,1473.97,4421.91,Bizum,IT,Berlín,Cancelado,2023-06-28 22:00:00
1955.0,1654,Juan Pérez,199,Sony Headphones,Tecnología,2023-03-13,2.0,1996.71,3993.42,PayPal,España,Paris,Cancelado,2023-03-13 12:00:00
1956.0,1625,María García,133,iPhone 13,Tecnología,12/10/2023,2.0,1866.9,3733.8,Transferencia,FR,Roma,Pendiente,2023-10-12 02:00:00
1957.0,1375,David Gómez,75,Sony Headphones,moda,16/06/2024,5.0,1288.7,6443.5,PayPal,ES,Berlín,Cancelado,2024-06-16 08:00:00
1958.0,1459,David Gómez,88,Samsung Galaxy,Tecnología,2023-12-17,5.0,848.28,4241.4,Tarjeta,DE,Madrid,Cancelado,2023-12-17 11:00:00
1959.0,1359,Juan Pérez,145,Samsung Galaxy,Tecnología,2023-08-15,2.0,1275.99,2551.98,PayPal,spain,Hamburgo,Entregado,2023-08-15 22:00:00
1960.0,1804,Laura Torres,184,Sony Headphones,Tecnología,2024-08-13,2.0,1573.45,3146.9,Bizum,Germany,Berlín,Cancelado,2024-08-13 15:00:00
1961.0,1135,LUCÍA FERNÁNDEZ,161,Bolso Gucci,Moda,06-13-2023,3.0,245.49,736.47,Bizum,FR,Berlín,Cancelado,2023-06-13 01:00:00
1962.0,1764,Lucía Fernández,19,Zapatillas Nike,Moda,09/05/2024,2.0,825.71,1651.42,Tarjeta,IT,Berlín,Pendiente,2024-05-09 21:00:00
1963.0,1483,Juan Pérez,183,AirPods,Tecnología,2023-01-01,5.0,1681.21,8406.05,PayPal,DE,Barcelona,Cancelado,2023-01-01 21:00:00
1964.0,1418,David Gómez,18,iPhone 13,Tecnología,07-02-2023,4.0,773.83,3095.32,Tarjeta,France,Milán,Cancelado,2023-07-02 09:00:00
1965.0,1515,Carlos Ruiz,80,Zapatillas Nike,Moda,2023-10-15,4.0,1148.03,4592.12,PayPal,ES,Paris,Pendiente,2023-10-15 21:00:00
1966.0,1328,maría garcía,135,Reloj Casio,TECHNOLOGY,2024-09-11,4.0,$1179.66,,Transferencia,ES,Barcelona,Entregado,2024-09-11 20:00:00
1967.0,1700,Lucía Fernández,50,iPhone 13,Tecnología,06-25-2023,3.0,377.11,1131.33,PayPal,DE,Roma,Cancelado,2023-06-25 05:00:00
1968.0,1982,maría garcía,34,Aspiradora Dyson,Hogar,2023-03-08,1.0,730.85,730.85,Bizum,IT,Hamburgo,Entregado,2023-03-08 09:00:00
1969.0,1035,Ana Sánchez,113,iPhone 13,Tecnología,2023-02-23,5.0,"675,68",,Tarjeta,España,Lyon,Cancelado,2023-02-23 13:00:00
1970.0,1333,Lucía Fernández,73,Zapatillas Nike,Moda,2023-03-08,3.0,62.13,186.39,PayPal,FR,Roma,Cancelado,2023-03-08 08:00:00
1971.0,1885,LAURA TORRES,176,Silla Gaming,Hogar,06-29-2024,1.0,58.14,58.14,PayPal,France,Valencia,Pendiente,2024-06-29 02:00:00
1972.0,1942,Lucía Fernández,190,Mochila North Face,Accesorios,05-21-2023,1.0,"1665,08",0.0,PayPal,Italy,Madrid,Pendiente,2023-05-21 22:00:00
1973.0,1215,Pedro López,14,Monitor LG,Tecnología,07-12-2023,3.0,553.41,1660.23,Transferencia,France,Milán,Cancelado,2023-07-12 21:00:00
1974.0,1362,Ana Sánchez,140,Cafetera Philips,Hogar,2024-05-18,2.0,1040.98,2081.96,Transferencia,France,Berlín,Pendiente,2024-05-18 06:00:00
1975.0,1338,LUCÍA FERNÁNDEZ,19,Mochila North Face,Accesorios,10-10-2023,1.0,604.46,604.46,Transferencia,Germany,Berlín,Cancelado,2023-10-10 08:00:00
1976.0,1251,Juan Pérez,154,Cafetera Philips,Hogar,2024-02-13,2.0,1881.95,3375.9601208375816,Bizum,FR,Madrid,Pendiente,2024-02-13 15:00:00
1977.0,1707,JUAN PÉREZ,199,AirPods,Tecnología,06-20-2023,2.0,526.0,1052.0,Tarjeta,IT,Milán,Entregado,2023-06-20 16:00:00
1978.0,1454,LAURA TORRES,19,Monitor LG,tecnologia,02-24-2024,4.0,865.02,2868.0194198883323,Tarjeta,spain,Barcelona,Cancelado,2024-02-24 06:00:00
1979.0,1006,Laura Torres,6,Camiseta Adidas,Moda,2023-05-20,4.0,1746.73,6986.92,Transferencia,France,Roma,Entregado,2023-05-20 01:00:00
1980.0,1690,David Gómez,8,AirPods,Tecnología,2024-11-25,4.0,1685.45,6741.8,Tarjeta,España,Madrid,Cancelado,2024-11-25 15:00:00
1981.0,1296,Juan Pérez,85,iPhone 13,Tecnología,2024-03-28,2.0,$380.34,,Tarjeta,IT,Berlín,Pendiente,2024-03-28 00:00:00
1982.0,1555,Juan Pérez,49,Silla Gaming,tech,31/08/2023,3.0,1607.26,4821.78,Bizum,DE,Milán,Pendiente,2023-08-31 22:00:00
1983.0,1050,Laura Torres,23,Sony Headphones,Tecnología,22/02/2023,2.0,921.79,1694.28957759182,PayPal,ES,Milán,Cancelado,2023-02-22 02:00:00
1984.0,1782,María García,191,AirPods,Tecnología,01-29-2023,3.0,971.11,2913.33,Transferencia,IT,Berlín,Pendiente,2023-01-29 23:00:00
1985.0,1721,Pedro López,166,Reloj Casio,Moda,25/01/2023,3.0,275.63,826.89,PayPal,ES,Milán,Cancelado,2023-01-25 13:00:00
1986.0,1621,Pedro López,82,Reloj Casio,Accesorios,2023-07-30,1.0,170.4,170.4,Transferencia,FR,Roma,Entregado,2023-07-30 21:00:00
1987.0,1106,María García,48,Sony Headphones,hogar,2024-04-18,4.0,1458.6,5834.4,Transferencia,Italy,Madrid,Entregado,2024-04-18 02:00:00
1988.0,1012,Lucía Fernández,99,Cafetera Philips,Hogar,06-24-2023,4.0,997.96,3991.84,Transferencia,DE,Berlín,Pendiente,2023-06-24 09:00:00
1989.0,1993,Laura Torres,87,Teclado Logitech,Tecnología,01-28-2023,1.0,879.33,879.33,Transferencia,FR,Lyon,Entregado,2023-01-28 08:00:00
1990.0,1335,pedro lópez,192,Silla Gaming,Hogar,2023-03-03,2.0,1461.72,2923.44,PayPal,ES,Barcelona,Cancelado,2023-03-03 14:00:00
1991.0,1854,Laura Torres,165,Cafetera Philips,Hogar,01-19-2023,1.0,1533.37,1533.37,Tarjeta,France,Berlín,Pendiente,2023-01-19 08:00:00
1992.0,1794,Juan Pérez,84,iPhone 13,Tecnología,2023-10-15,3.0,326.23,978.69,Bizum,IT,Berlín,Cancelado,2023-10-15 00:00:00
1993.0,1310,David Gómez,185,Camiseta Adidas,Moda,03/05/2023,5.0,1224.35,6121.75,Tarjeta,DE,Barcelona,Cancelado,2023-05-03 18:00:00
1994.0,1202,Ana Sánchez,82,Bolso Gucci,Moda,04-12-2024,2.0,279.35,558.7,PayPal,Germany,Paris,Cancelado,2024-04-12 23:00:00
1995.0,1061,Laura Torres,68,Monitor LG,TECHNOLOGY,09-05-2024,1.0,1505.24,1505.24,Transferencia,España,Barcelona,Entregado,2024-09-05 01:00:00
1996.0,1246,Ana Sánchez,42,AirPods,Tecnología,10/06/2023,4.0,1317.34,5269.36,PayPal,spain,Hamburgo,Pendiente,2023-06-10 21:00:00
1997.0,1640,Laura Torres,148,Teclado Logitech,Tecnología,2023-07-30,5.0,1913.66,9568.3,Tarjeta,ES,Paris,Cancelado,2023-07-30 14:00:00
1998.0,1941,María García,72,Monitor LG,Tecnología,25/09/2024,5.0,147.23,736.15,Tarjeta,France,Paris,Cancelado,2024-09-25 19:00:00
1999.0,1857,Pedro López,160,iPhone 13,Tecnología,02-12-2024,2.0,123.54,247.08,PayPal,France,Madrid,Cancelado,2024-02-12 04:00:00
2000.0,1661,Juan Pérez,152,Zapatillas Nike,Moda,05-01-2023,1.0,571.55,571.55,Bizum,España,Milán,Entregado,2023-05-01 10:00:00
2001.0,1632,LUCÍA FERNÁNDEZ,55,Teclado Logitech,Tecnología,2024-07-05,1.0,530.79,530.79,Tarjeta,France,Roma,Cancelado,2024-07-05 20:00:00
2002.0,1998,lucía fernández,128,Zapatillas Nike,Moda,07-19-2024,5.0,501.49,2507.45,Transferencia,IT,Roma,Cancelado,2024-07-19 16:00:00
2003.0,1691,David Gómez,78,Bolso Gucci,Moda,2024-10-27,5.0,1813.45,9067.25,PayPal,DE,Milán,Cancelado,2024-10-27 23:00:00
2004.0,1702,david gómez,30,Sony Headphones,Tecnología,09-23-2024,5.0,506.6,2533.0,Transferencia,FR,Berlín,Cancelado,2024-09-23 20:00:00
2005.0,1220,Pedro López,81,iPhone 13,Tecnología,11-12-2024,2.0,551.18,1102.36,PayPal,IT,Hamburgo,Cancelado,2024-11-12 08:00:00
2006.0,1510,David Gómez,143,Monitor LG,Tecnología,10-03-2023,5.0,1521.2,7606.0,Transferencia,ES,Berlín,Cancelado,2023-10-03 08:00:00
2007.0,1629,Pedro López,2,Samsung Galaxy,Tecnología,10-26-2023,1.0,"904,98",,Tarjeta,DE,Valencia,Pendiente,2023-10-26 20:00:00
2008.0,1203,Juan Pérez,70,Samsung Galaxy,Tecnología,01-17-2023,,"1555,65",,Bizum,FR,Valencia,Pendiente,2023-01-17 11:00:00
2009.0,1746,Laura Torres,162,AirPods,Tecnología,03-14-2023,4.0,"140,08",,Tarjeta,France,Roma,Entregado,2023-03-14 07:00:00
2010.0,1504,Lucía Fernández,15,Silla Gaming,Hogar,16/02/2023,5.0,980.27,4901.35,Bizum,DE,Madrid,Pendiente,2023-02-16 15:00:00
2011.0,1572,DAVID GÓMEZ,75,Bolso Gucci,Moda,26/06/2024,1.0,76.89,76.89,Bizum,España,Valencia,Pendiente,2024-06-26 02:00:00
2012.0,1084,Carlos Ruiz,139,Mochila North Face,Accesorios,10-29-2023,1.0,134.68,134.68,Tarjeta,Germany,Paris,Entregado,2023-10-29 05:00:00
2013.0,1463,LAURA TORRES,132,iPhone 13,Tecnología,2024-01-11,4.0,1813.81,7255.24,PayPal,IT,Barcelona,Cancelado,2024-01-11 17:00:00
2014.0,1925,Carlos Ruiz,168,Cafetera Philips,Hogar,2023-02-19,5.0,287.1,1435.5,Tarjeta,France,Lyon,Entregado,2023-02-19 21:00:00
2015.0,1277,Ana Sánchez,196,iPhone 13,hogar,26/09/2023,2.0,$1069.52,,PayPal,ES,Valencia,Entregado,2023-09-26 14:00:00
2016.0,1227,David Gómez,55,MacBook Pro,Tecnología,04-10-2024,3.0,828.08,2484.24,Transferencia,spain,Berlín,Cancelado,2024-04-10 16:00:00
2017.0,1526,Ana Sánchez,49,Teclado Logitech,Tecnología,08/03/2023,1.0,701.21,701.21,PayPal,spain,Berlín,Entregado,2023-03-08 21:00:00
2018.0,1381,Pedro López,129,Samsung Galaxy,Tecnología,06-20-2023,1.0,1800.67,1800.67,Tarjeta,DE,Lyon,Entregado,2023-06-20 01:00:00
2019.0,1248,Pedro López,114,Bolso Gucci,Moda,11-01-2024,1.0,53.43,53.43,PayPal,FR,Madrid,Pendiente,2024-11-01 10:00:00
2020.0,1654,Lucía Fernández,80,Zapatillas Nike,Moda,23/10/2023,5.0,1330.94,6654.7,Tarjeta,FR,Valencia,Cancelado,2023-10-23 09:00:00
2021.0,1849,David Gómez,151,Aspiradora Dyson,Hogar,10-18-2023,2.0,1927.15,3854.3,PayPal,ES,Milán,Cancelado,2023-10-18 01:00:00
2022.0,1970,María García,169,Teclado Logitech,Tecnología,05/11/2023,2.0,1124.73,2249.46,PayPal,IT,Milán,Pendiente,2023-11-05 20:00:00
2023.0,1976,María García,36,Reloj Casio,Accesorios,05-18-2023,4.0,1874.28,7497.12,Transferencia,France,Milán,Pendiente,2023-05-18 23:00:00
2024.0,1691,Ana Sánchez,182,Mochila North Face,HOGAR,05/03/2023,,113.99,,Bizum,spain,Berlín,Pendiente,2023-03-05 02:00:00
2025.0,1880,Lucía Fernández,96,Reloj Casio,Accesorios,2024-08-06,3.0,"843,4",,Bizum,Germany,Valencia,Pendiente,2024-08-06 07:00:00
2026.0,1337,laura torres,127,Sony Headphones,Tecnología,2023-11-13,2.0,527.71,1055.42,PayPal,DE,Valencia,Cancelado,2023-11-13 10:00:00
2027.0,1413,Laura Torres,77,Mochila North Face,moda,2024-10-13,5.0,1464.33,7321.65,Bizum,Germany,Berlín,Entregado,2024-10-13 23:00:00
2028.0,1776,María García,101,MacBook Pro,Tecnología,01-26-2024,4.0,1962.78,7124.661931387559,Transferencia,spain,Berlín,Pendiente,2024-01-26 00:00:00
2029.0,1393,Pedro López,177,Sony Headphones,HOGAR,20/12/2023,5.0,520.49,2602.45,Bizum,ES,Roma,Entregado,2023-12-20 11:00:00
2030.0,1429,Juan Pérez,180,Cafetera Philips,Hogar,05/04/2024,1.0,1311.81,1311.81,Bizum,España,Madrid,Pendiente,2024-04-05 05:00:00
2031.0,1516,Lucía Fernández,75,Samsung Galaxy,Tecnología,04/11/2024,5.0,404.21,2021.05,Bizum,spain,Hamburgo,Entregado,2024-11-04 00:00:00
2032.0,1927,David Gómez,31,Sony Headphones,Tecnología,16/07/2024,5.0,1135.01,5675.05,Transferencia,FR,Lyon,Entregado,2024-07-16 01:00:00
2033.0,1511,ANA SÁNCHEZ,132,Monitor LG,Tecnología,2023-12-26,2.0,933.23,1866.46,PayPal,IT,Paris,Entregado,2023-12-26 07:00:00
2034.0,1529,Lucía Fernández,191,Cafetera Philips,Hogar,03-26-2023,5.0,1944.29,9721.45,PayPal,Germany,Hamburgo,Cancelado,2023-03-26 04:00:00
2035.0,1552,Juan Pérez,21,Cafetera Philips,Hogar,21/11/2024,2.0,1220.97,2441.94,Transferencia,España,Lyon,Entregado,2024-11-21 12:00:00
2036.0,1794,David Gómez,9,Cafetera Philips,Hogar,26/09/2024,1.0,705.52,705.52,Transferencia,DE,Hamburgo,Pendiente,2024-09-26 12:00:00
2037.0,1262,LAURA TORRES,14,Samsung Galaxy,Tecnología,10/10/2024,5.0,237.05,1185.25,PayPal,France,Barcelona,Cancelado,2024-10-10 08:00:00
2038.0,1979,Ana Sánchez,107,AirPods,Tecnología,08-20-2024,4.0,310.98,1243.92,PayPal,IT,Paris,Cancelado,2024-08-20 11:00:00
,1470,Ana Sánchez,50,Monitor LG,Tecnología,2024-09-20,1.0,458.38,458.38,PayPal,Italy,Milán,Cancelado,2024-09-20 06:00:00
2040.0,1931,Pedro López,12,Reloj Casio,Moda,2024-02-21,2.0,509.42,1018.84,Bizum,Germany,Lyon,Entregado,2024-02-21 03:00:00
2041.0,1992,LAURA TORRES,42,Bolso Gucci,Moda,12/01/2024,5.0,1702.73,8513.65,Bizum,IT,Barcelona,Pendiente,2024-01-12 16:00:00
2042.0,1738,Laura Torres,66,Samsung Galaxy,Tecnología,08-17-2023,3.0,1126.83,3380.49,Bizum,Germany,Valencia,Pendiente,2023-08-17 11:00:00
2043.0,1726,Ana Sánchez,13,Zapatillas Nike,Moda,15/04/2023,1.0,1051.55,1051.55,Transferencia,FR,Hamburgo,Entregado,2023-04-15 08:00:00
2044.0,1485,David Gómez,57,Bolso Gucci,Moda,09-01-2023,1.0,238.39,238.39,Bizum,ES,Valencia,Pendiente,2023-09-01 16:00:00
2045.0,1587,Pedro López,186,Teclado Logitech,Tecnología,08-26-2024,1.0,1721.68,1721.68,Bizum,Italy,Madrid,Pendiente,2024-08-26 19:00:00
2046.0,1551,María García,78,Monitor LG,Tecnología,13/05/2023,1.0,1448.4,1386.4385390419823,Bizum,Germany,Madrid,Pendiente,2023-05-13 06:00:00
2047.0,1351,David Gómez,95,Silla Gaming,Hogar,08-27-2024,4.0,144.66,578.64,Bizum,IT,Berlín,Pendiente,2024-08-27 01:00:00
2048.0,1270,Laura Torres,17,Silla Gaming,Hogar,20/04/2023,5.0,1418.59,7092.95,PayPal,France,Lyon,Pendiente,2023-04-20 03:00:00
2049.0,1876,Pedro López,191,MacBook Pro,Tecnología,11-06-2024,3.0,1091.64,3274.92,Transferencia,France,Valencia,Cancelado,2024-11-06 01:00:00
2050.0,1514,David Gómez,63,Zapatillas Nike,HOGAR,2023-02-21,3.0,172.63,517.89,Transferencia,spain,Lyon,Entregado,2023-02-21 20:00:00
2051.0,1435,LUCÍA FERNÁNDEZ,33,Aspiradora Dyson,Hogar,15/06/2024,2.0,922.02,1844.04,PayPal,spain,Paris,Pendiente,2024-06-15 05:00:00
2052.0,1485,DAVID GÓMEZ,148,Aspiradora Dyson,moda,06-24-2024,4.0,974.55,3816.764757127612,PayPal,IT,Paris,Pendiente,2024-06-24 09:00:00
2053.0,1561,Ana Sánchez,47,Camiseta Adidas,Moda,03-10-2024,4.0,339.89,1359.56,Tarjeta,Germany,Hamburgo,Cancelado,2024-03-10 09:00:00
2054.0,1593,David Gómez,185,Teclado Logitech,Tecnología,07/05/2023,1.0,1891.94,1891.94,Tarjeta,Italy,Milán,Cancelado,2023-05-07 02:00:00
2055.0,1525,María García,169,Monitor LG,Tecnología,18/10/2024,5.0,1701.45,8507.25,Transferencia,IT,Lyon,Entregado,2024-10-18 11:00:00
2056.0,1214,María García,194,Teclado Logitech,Tecnología,26/10/2024,4.0,1341.35,5365.4,Tarjeta,France,Paris,Entregado,2024-10-26 07:00:00
2057.0,1386,Juan Pérez,117,Monitor LG,Tecnología,13/06/2023,5.0,929.97,4649.85,Tarjeta,ES,Barcelona,Cancelado,2023-06-13 12:00:00
2058.0,1223,Ana Sánchez,162,Aspiradora Dyson,Hogar,10-01-2024,2.0,829.41,1658.82,Bizum,ES,Roma,Entregado,2024-10-01 22:00:00
2059.0,1836,María García,171,Aspiradora Dyson,Hogar,31/10/2024,2.0,1305.44,2610.88,Bizum,Germany,Valencia,Pendiente,2024-10-31 10:00:00
2060.0,1703,Juan Pérez,141,Samsung Galaxy,Tecnología,2023-01-18,4.0,1095.41,4381.64,Bizum,Italy,Berlín,Entregado,2023-01-18 04:00:00
2061.0,1278,Laura Torres,101,Teclado Logitech,Tecnología,11-18-2023,5.0,133.92,669.6,Tarjeta,Italy,Roma,Entregado,2023-11-18 19:00:00
2062.0,1355,María García,156,AirPods,Tecnología,2023-01-20,2.0,$1029.88,,Bizum,IT,Lyon,Pendiente,2023-01-20 01:00:00
2063.0,1980,Ana Sánchez,158,Cafetera Philips,Hogar,2023-01-21,4.0,1614.74,6458.96,Transferencia,FR,Berlín,Entregado,2023-01-21 01:00:00
2064.0,1853,Juan Pérez,44,Bolso Gucci,Moda,10/07/2023,3.0,923.89,2771.67,Tarjeta,ES,Valencia,Pendiente,2023-07-10 13:00:00
2065.0,1527,Juan Pérez,118,AirPods,Tecnología,2023-09-13,5.0,"113,39",,PayPal,FR,Lyon,Entregado,2023-09-13 13:00:00
2066.0,1411,Carlos Ruiz,140,AirPods,Tecnología,23/02/2023,4.0,1574.69,6298.76,Bizum,France,Lyon,Entregado,2023-02-23 15:00:00
2067.0,1916,Ana Sánchez,57,MacBook Pro,Tecnología,06-05-2024,1.0,410.71,410.71,Bizum,Italy,Paris,Entregado,2024-06-05 04:00:00
2068.0,1544,María García,106,AirPods,Tecnología,29/11/2024,2.0,524.66,1049.32,Bizum,Germany,Lyon,Pendiente,2024-11-29 18:00:00
2069.0,1776,juan pérez,35,MacBook Pro,Tecnología,2023-02-24,3.0,337.77,1013.31,Tarjeta,FR,Valencia,Cancelado,2023-02-24 01:00:00
2070.0,1951,Ana Sánchez,184,Bolso Gucci,Moda,18/08/2024,4.0,"667,13",,Bizum,Italy,Paris,Entregado,2024-08-18 20:00:00
2071.0,1225,María García,172,AirPods,TECHNOLOGY,04-13-2023,3.0,1515.94,4547.82,Tarjeta,Germany,Hamburgo,Pendiente,2023-04-13 02:00:00
2072.0,1966,Ana Sánchez,160,Mochila North Face,TECHNOLOGY,2024-04-02,1.0,1043.58,1043.58,Tarjeta,spain,Valencia,Cancelado,2024-04-02 13:00:00
2073.0,1919,Pedro López,99,AirPods,Tecnología,24/10/2024,1.0,417.71,417.71,Bizum,spain,Lyon,Cancelado,2024-10-24 14:00:00
2074.0,1552,Pedro López,109,Teclado Logitech,Tecnología,10/01/2023,5.0,1756.88,8784.4,Tarjeta,Germany,Roma,Entregado,2023-01-10 22:00:00
2075.0,1648,Juan Pérez,27,Sony Headphones,Tecnología,01-07-2024,4.0,1760.37,7041.48,PayPal,spain,Madrid,Entregado,2024-01-07 08:00:00
2076.0,1908,Lucía Fernández,192,MacBook Pro,Tecnología,2024-10-06,4.0,1742.45,6969.8,Tarjeta,Italy,Valencia,Pendiente,2024-10-06 13:00:00
2077.0,1639,Juan Pérez,65,iPhone 13,TECHNOLOGY,03-13-2024,1.0,485.2,539.014389488467,Tarjeta,IT,Roma,Entregado,2024-03-13 08:00:00
2078.0,1859,maría garcía,108,AirPods,Tecnología,2023-01-09,1.0,907.97,907.97,Bizum,FR,Valencia,Pendiente,2023-01-09 09:00:00
2079.0,1947,MARÍA GARCÍA,67,Samsung Galaxy,Tecnología,02-20-2023,4.0,1970.13,7880.52,Tarjeta,FR,Barcelona,Cancelado,2023-02-20 06:00:00
2080.0,1026,Pedro López,123,iPhone 13,Tecnología,28/11/2024,4.0,"1546,3",,PayPal,Germany,Hamburgo,Cancelado,2024-11-28 07:00:00
2081.0,1990,pedro lópez,93,Samsung Galaxy,HOGAR,05-17-2023,4.0,64.06,256.24,Bizum,DE,Lyon,Pendiente,2023-05-17 21:00:00
2082.0,1831,laura torres,80,Samsung Galaxy,hogar,2024-06-27,1.0,139.76,139.76,Transferencia,France,Valencia,Entregado,2024-06-27 13:00:00
2083.0,1623,Pedro López,156,Cafetera Philips,HOGAR,20/11/2024,1.0,933.22,955.1252912752319,PayPal,Germany,Hamburgo,Entregado,2024-11-20 09:00:00
2084.0,1942,Lucía Fernández,163,Bolso Gucci,Moda,2023-09-17,4.0,1819.35,7277.4,Transferencia,IT,Hamburgo,Entregado,2023-09-17 09:00:00
2085.0,1942,Juan Pérez,67,Camiseta Adidas,Moda,01-21-2024,3.0,1082.02,3246.06,Tarjeta,ES,Madrid,Cancelado,2024-01-21 02:00:00
2086.0,1089,Lucía Fernández,71,Bolso Gucci,Moda,2024-06-12,4.0,1000.65,4002.6,Transferencia,Germany,Berlín,Cancelado,2024-06-12 23:00:00
2087.0,1305,Pedro López,94,MacBook Pro,Tecnología,08-06-2023,5.0,219.89,1099.45,Transferencia,Germany,Hamburgo,Pendiente,2023-08-06 08:00:00
2088.0,1739,DAVID GÓMEZ,85,MacBook Pro,Tecnología,2023-07-25,3.0,1316.99,3950.97,Bizum,Italy,Madrid,Entregado,2023-07-25 05:00:00
2089.0,1006,David Gómez,3,MacBook Pro,Tecnología,24/10/2024,5.0,1645.99,8229.95,Bizum,IT,Valencia,Entregado,2024-10-24 04:00:00
2090.0,1261,Carlos Ruiz,107,MacBook Pro,Tecnología,03-21-2023,5.0,767.04,3835.2,PayPal,FR,Hamburgo,Entregado,2023-03-21 12:00:00
2091.0,1280,Laura Torres,102,Bolso Gucci,Moda,23/09/2024,3.0,1553.47,4660.41,PayPal,España,Valencia,Entregado,2024-09-23 08:00:00
2092.0,1471,Pedro López,34,MacBook Pro,Tecnología,10/08/2024,1.0,1929.31,1929.31,Transferencia,España,Hamburgo,Pendiente,2024-08-10 05:00:00
2093.0,1438,Ana Sánchez,151,Zapatillas Nike,Moda,05-31-2023,5.0,415.5,2077.5,Bizum,France,Berlín,Pendiente,2023-05-31 20:00:00
2094.0,1138,Lucía Fernández,54,Teclado Logitech,Tecnología,29/11/2024,4.0,1051.43,4205.72,Tarjeta,DE,Milán,Pendiente,2024-11-29 07:00:00
2095.0,1966,pedro lópez,11,Cafetera Philips,Hogar,06/08/2023,1.0,581.4,581.4,Bizum,FR,Lyon,Pendiente,2023-08-06 22:00:00
2096.0,1952,Lucía Fernández,200,Silla Gaming,Hogar,01-15-2023,2.0,1587.78,3175.56,Transferencia,spain,Barcelona,Cancelado,2023-01-15 04:00:00
2097.0,1706,Pedro López,111,Aspiradora Dyson,Hogar,27/07/2024,3.0,1159.41,4165.881916674512,Bizum,IT,Milán,Entregado,2024-07-27 09:00:00
2098.0,1797,Juan Pérez,184,Aspiradora Dyson,Hogar,11-29-2023,5.0,1272.82,6923.057487603997,Transferencia,DE,Paris,Entregado,2023-11-29 22:00:00
2099.0,1283,PEDRO LÓPEZ,43,Sony Headphones,Tecnología,2023-12-27,4.0,1597.85,6391.4,PayPal,IT,Berlín,Pendiente,2023-12-27 06:00:00
2100.0,1665,Laura Torres,179,Mochila North Face,Accesorios,11-10-2023,3.0,797.98,2393.94,Tarjeta,IT,Milán,Cancelado,2023-11-10 21:00:00
2101.0,1728,Laura Torres,113,Sony Headphones,Tecnología,03-15-2023,1.0,1831.03,1831.03,PayPal,Germany,Hamburgo,Entregado,2023-03-15 16:00:00
2102.0,1522,LUCÍA FERNÁNDEZ,65,Reloj Casio,Accesorios,2024-11-16,4.0,1070.73,4282.92,Bizum,FR,Roma,Cancelado,2024-11-16 01:00:00
2103.0,1614,Ana Sánchez,146,Zapatillas Nike,Moda,01-26-2024,5.0,324.33,1621.65,Transferencia,Italy,Berlín,Cancelado,2024-01-26 19:00:00
2104.0,1512,Carlos Ruiz,199,AirPods,moda,2024-08-12,2.0,1394.84,2789.68,Tarjeta,ES,Valencia,Pendiente,2024-08-12 00:00:00
2105.0,1761,Carlos Ruiz,184,Mochila North Face,Accesorios,2023-12-07,4.0,1588.59,6354.36,PayPal,Germany,Paris,Cancelado,2023-12-07 17:00:00
2106.0,1769,Carlos Ruiz,20,Bolso Gucci,HOGAR,21/06/2024,4.0,640.36,2561.44,Transferencia,Germany,Roma,Cancelado,2024-06-21 05:00:00
2107.0,1804,Pedro López,98,Zapatillas Nike,Moda,2023-06-19,3.0,1715.79,5147.37,Bizum,Germany,Berlín,Entregado,2023-06-19 11:00:00
2108.0,1697,LUCÍA FERNÁNDEZ,100,MacBook Pro,Tecnología,21/05/2024,2.0,1813.23,3626.46,Transferencia,IT,Lyon,Pendiente,2024-05-21 13:00:00
2109.0,1103,Juan Pérez,108,Mochila North Face,Accesorios,03-30-2023,1.0,561.04,639.1317142706926,Bizum,España,Barcelona,Entregado,2023-03-30 22:00:00
2110.0,1006,Juan Pérez,102,Camiseta Adidas,Moda,16/01/2023,1.0,1967.21,1967.21,PayPal,IT,Roma,Cancelado,2023-01-16 09:00:00
2111.0,1076,PEDRO LÓPEZ,187,Silla Gaming,Hogar,2023-10-28,1.0,290.02,290.02,Bizum,DE,Lyon,Cancelado,2023-10-28 10:00:00
2112.0,1913,JUAN PÉREZ,137,Sony Headphones,Tecnología,2024-03-30,2.0,412.01,824.02,PayPal,Italy,Madrid,Pendiente,2024-03-30 05:00:00
2113.0,1554,David Gómez,137,Camiseta Adidas,Moda,07-09-2023,1.0,376.61,376.61,Bizum,España,Roma,Pendiente,2023-07-09 08:00:00
2114.0,1132,Pedro López,140,AirPods,Tecnología,2023-03-14,3.0,1789.04,5367.12,Transferencia,France,Hamburgo,Cancelado,2023-03-14 05:00:00
2115.0,1641,Carlos Ruiz,62,Sony Headphones,Tecnología,12/07/2023,2.0,1312.04,2624.08,PayPal,France,Lyon,Entregado,2023-07-12 22:00:00
2116.0,1988,Pedro López,34,Camiseta Adidas,Moda,10/05/2023,4.0,312.69,1250.76,PayPal,Italy,Roma,Cancelado,2023-05-10 17:00:00
2117.0,1908,Pedro López,182,MacBook Pro,Tecnología,09/09/2023,4.0,886.24,3544.96,Transferencia,DE,Milán,Cancelado,2023-09-09 20:00:00
2118.0,1532,Lucía Fernández,71,Reloj Casio,Accesorios,2023-10-17,1.0,1234.44,1234.44,PayPal,ES,Hamburgo,Entregado,2023-10-17 00:00:00
2119.0,1191,Juan Pérez,96,Reloj Casio,Accesorios,01-14-2023,1.0,176.09,176.09,Transferencia,DE,Milán,Cancelado,2023-01-14 11:00:00
2120.0,1930,Ana Sánchez,59,Cafetera Philips,Hogar,2024-06-17,5.0,1766.01,8830.05,Transferencia,DE,Madrid,Entregado,2024-06-17 10:00:00
2121.0,1891,DAVID GÓMEZ,97,Cafetera Philips,Hogar,2024-05-14,3.0,1609.17,5211.05548440236,Transferencia,ES,Madrid,Cancelado,2024-05-14 19:00:00
2122.0,1029,María García,119,MacBook Pro,Moda,12-15-2023,3.0,1015.36,3046.08,Tarjeta,España,Lyon,Cancelado,2023-12-15 18:00:00
2123.0,1657,Carlos Ruiz,138,Teclado Logitech,Tecnología,10-31-2024,1.0,1934.58,1934.58,Bizum,Germany,Paris,Pendiente,2024-10-31 01:00:00
,1785,laura torres,146,Cafetera Philips,Hogar,12-17-2023,2.0,841.34,1682.68,PayPal,IT,Paris,Pendiente,2023-12-17 23:00:00
2125.0,1329,María García,148,Silla Gaming,Hogar,2023-04-11,,1968.38,,Transferencia,España,Valencia,Pendiente,2023-04-11 23:00:00
2126.0,1139,Laura Torres,167,Cafetera Philips,Hogar,25/10/2023,4.0,1339.16,5356.64,Tarjeta,spain,Lyon,Pendiente,2023-10-25 07:00:00
2127.0,1909,Juan Pérez,107,Monitor LG,Tecnología,05-26-2024,4.0,1273.0,5092.0,Bizum,IT,Hamburgo,Entregado,2024-05-26 03:00:00
2128.0,1653,laura torres,29,Mochila North Face,Accesorios,09-12-2023,5.0,340.25,1701.25,Bizum,FR,Berlín,Entregado,2023-09-12 23:00:00
2129.0,1448,Pedro López,28,Silla Gaming,Hogar,15/02/2024,1.0,1765.04,1765.04,Bizum,España,Roma,Entregado,2024-02-15 08:00:00
2130.0,1242,Laura Torres,128,Teclado Logitech,Tecnología,10-08-2023,4.0,860.7,3442.8,PayPal,DE,Roma,Cancelado,2023-10-08 13:00:00
2131.0,1385,Laura Torres,87,Teclado Logitech,Tecnología,01-27-2024,3.0,$332.84,,PayPal,spain,Roma,Pendiente,2024-01-27 01:00:00
2132.0,1972,Laura Torres,6,Bolso Gucci,Moda,01-06-2023,2.0,35.09,66.41607591128418,PayPal,DE,Paris,Entregado,2023-01-06 08:00:00
2133.0,1976,ANA SÁNCHEZ,142,Zapatillas Nike,Moda,2024-07-18,1.0,1123.91,1123.91,Tarjeta,IT,Barcelona,Entregado,2024-07-18 16:00:00
2134.0,1459,Carlos Ruiz,188,Teclado Logitech,Tecnología,08/04/2024,5.0,1059.53,5297.65,Bizum,España,Milán,Entregado,2024-04-08 22:00:00
2135.0,1458,LAURA TORRES,175,Zapatillas Nike,Moda,03-31-2023,1.0,"1441,51",,Tarjeta,ES,Madrid,Entregado,2023-03-31 15:00:00
2136.0,1513,Ana Sánchez,190,Camiseta Adidas,Moda,11-29-2023,3.0,1781.61,4955.308986018533,Bizum,spain,Berlín,Pendiente,2023-11-29 15:00:00
2137.0,1531,Lucía Fernández,76,Mochila North Face,Moda,20/10/2023,4.0,168.02,672.08,Bizum,France,Roma,Cancelado,2023-10-20 05:00:00
2138.0,1909,Carlos Ruiz,173,Reloj Casio,Accesorios,2024-05-04,4.0,"1465,68",,Bizum,DE,Roma,Entregado,2024-05-04 05:00:00
2139.0,1273,Laura Torres,37,iPhone 13,Tecnología,12-27-2023,1.0,382.95,382.95,Bizum,France,Barcelona,Entregado,2023-12-27 15:00:00
2140.0,1546,Laura Torres,100,AirPods,tecnologia,17/05/2024,3.0,1717.77,5153.31,PayPal,spain,Roma,Entregado,2024-05-17 06:00:00
2141.0,1893,DAVID GÓMEZ,31,MacBook Pro,Tecnología,2023-03-27,2.0,1639.94,3279.88,PayPal,IT,Valencia,Entregado,2023-03-27 16:00:00
2142.0,1691,María García,196,AirPods,Tecnología,2023-07-18,3.0,1086.18,3258.54,PayPal,Italy,Barcelona,Cancelado,2023-07-18 23:00:00
2143.0,1813,Pedro López,31,Bolso Gucci,Moda,21/12/2023,4.0,1423.38,5693.52,Tarjeta,FR,Milán,Pendiente,2023-12-21 02:00:00
2144.0,1150,María García,159,Aspiradora Dyson,Hogar,01-11-2024,2.0,$635.56,,Bizum,España,Madrid,Pendiente,2024-01-11 07:00:00
2145.0,1266,LUCÍA FERNÁNDEZ,157,MacBook Pro,Tecnología,28/10/2024,5.0,947.62,4738.1,PayPal,España,Roma,Pendiente,2024-10-28 10:00:00
2146.0,1758,pedro lópez,25,Cafetera Philips,Hogar,11-04-2023,1.0,1645.06,1645.06,Bizum,FR,Hamburgo,Entregado,2023-11-04 17:00:00
2147.0,1211,Pedro López,185,AirPods,Tecnología,2024-05-16,5.0,923.94,4619.7,Bizum,France,Berlín,Cancelado,2024-05-16 08:00:00
2148.0,1752,Lucía Fernández,90,iPhone 13,Tecnología,2024-09-15,4.0,722.02,2888.08,PayPal,France,Lyon,Pendiente,2024-09-15 04:00:00
2149.0,1019,Laura Torres,55,Camiseta Adidas,Moda,02-15-2024,4.0,993.48,3973.92,PayPal,IT,Madrid,Entregado,2024-02-15 04:00:00
2150.0,1676,Juan Pérez,97,Reloj Casio,Accesorios,2023-02-18,1.0,$1658.22,,Bizum,IT,Berlín,Cancelado,2023-02-18 06:00:00
2151.0,1430,Laura Torres,174,Reloj Casio,Accesorios,09-11-2024,1.0,677.06,677.06,Tarjeta,España,Madrid,Pendiente,2024-09-11 20:00:00
2152.0,1384,LUCÍA FERNÁNDEZ,46,Silla Gaming,Hogar,2023-08-30,2.0,"355,79",,Transferencia,FR,Valencia,Pendiente,2023-08-30 02:00:00
2153.0,1337,Ana Sánchez,4,MacBook Pro,Tecnología,09/05/2023,4.0,1426.91,5707.64,Transferencia,spain,Barcelona,Pendiente,2023-05-09 04:00:00
2154.0,1034,María García,185,Silla Gaming,Hogar,2023-11-27,1.0,1653.7,1653.7,Bizum,France,Roma,Cancelado,2023-11-27 20:00:00
2155.0,1758,David Gómez,55,Monitor LG,Tecnología,19/09/2024,4.0,"210,27",,Tarjeta,FR,Milán,Entregado,2024-09-19 16:00:00
2156.0,1949,María García,144,Sony Headphones,Tecnología,2023-04-19,1.0,487.35,487.35,Tarjeta,DE,Berlín,Pendiente,2023-04-19 18:00:00
2157.0,1947,María García,93,Aspiradora Dyson,Hogar,01/11/2023,2.0,292.52,585.04,Tarjeta,IT,Lyon,Entregado,2023-11-01 17:00:00
2158.0,1750,Pedro López,107,MacBook Pro,Tecnología,2024-08-13,2.0,702.4,1404.8,PayPal,Italy,Milán,Cancelado,2024-08-13 03:00:00
2159.0,1319,Carlos Ruiz,81,Reloj Casio,Accesorios,2024-08-20,5.0,906.2,4531.0,PayPal,ES,Madrid,Entregado,2024-08-20 03:00:00
2160.0,1223,Carlos Ruiz,172,Cafetera Philips,Hogar,2023-05-26,5.0,1500.16,7500.8,PayPal,FR,Hamburgo,Cancelado,2023-05-26 05:00:00
2161.0,1393,Carlos Ruiz,149,AirPods,Tecnología,2024-10-23,2.0,1305.78,2611.56,Tarjeta,France,Berlín,Cancelado,2024-10-23 20:00:00
2162.0,1455,Pedro López,58,Mochila North Face,Accesorios,05-28-2024,5.0,1245.65,5971.066274416586,PayPal,spain,Barcelona,Cancelado,2024-05-28 09:00:00
2163.0,1183,Juan Pérez,30,Aspiradora Dyson,TECHNOLOGY,06-12-2023,4.0,711.23,2844.92,Bizum,España,Barcelona,Cancelado,2023-06-12 18:00:00
2164.0,1510,JUAN PÉREZ,141,Reloj Casio,Accesorios,2023-02-16,5.0,1684.48,8422.4,Transferencia,España,Berlín,Cancelado,2023-02-16 10:00:00
2165.0,1718,Carlos Ruiz,36,Samsung Galaxy,Tecnología,2024-05-12,4.0,947.86,3791.44,Tarjeta,spain,Berlín,Entregado,2024-05-12 01:00:00
2166.0,1907,Juan Pérez,21,Bolso Gucci,Moda,11-20-2023,1.0,1958.42,1958.42,Tarjeta,spain,Lyon,Entregado,2023-11-20 19:00:00
2167.0,1621,Juan Pérez,131,Cafetera Philips,Hogar,16/05/2024,1.0,1271.94,1291.7563825292611,Bizum,IT,Barcelona,Cancelado,2024-05-16 22:00:00
2168.0,1174,juan pérez,108,Silla Gaming,Hogar,2023-11-08,1.0,261.27,307.77509510140777,Bizum,FR,Barcelona,Cancelado,2023-11-08 08:00:00
2169.0,1233,Juan Pérez,52,Bolso Gucci,Moda,03-22-2024,4.0,1355.59,5422.36,PayPal,Germany,Valencia,Cancelado,2024-03-22 19:00:00
2170.0,1266,María García,102,Zapatillas Nike,Moda,2024-08-11,4.0,656.96,2627.84,Transferencia,IT,Milán,Entregado,2024-08-11 10:00:00
2171.0,1003,María García,51,AirPods,Tecnología,2023-03-29,5.0,1375.79,6878.95,Bizum,España,Madrid,Entregado,2023-03-29 08:00:00
2172.0,1310,Laura Torres,20,AirPods,Tecnología,17/05/2024,3.0,148.59,445.77,Bizum,ES,Roma,Pendiente,2024-05-17 01:00:00
2173.0,1763,Ana Sánchez,24,Zapatillas Nike,Moda,19/06/2024,3.0,358.01,1074.03,Tarjeta,France,Lyon,Pendiente,2024-06-19 14:00:00
2174.0,1905,Pedro López,106,Samsung Galaxy,Tecnología,26/01/2023,5.0,1712.92,8564.6,Bizum,Germany,Barcelona,Entregado,2023-01-26 03:00:00
2175.0,1737,CARLOS RUIZ,84,Silla Gaming,Hogar,05/09/2024,1.0,462.09,462.09,Transferencia,FR,Roma,Pendiente,2024-09-05 06:00:00
2176.0,1981,Ana Sánchez,79,Monitor LG,Tecnología,18/02/2024,3.0,1675.71,5027.13,Transferencia,spain,Lyon,Pendiente,2024-02-18 11:00:00
2177.0,1060,María García,65,Silla Gaming,Hogar,02-05-2024,3.0,565.76,1697.28,Tarjeta,Germany,Madrid,Entregado,2024-02-05 22:00:00
2178.0,1189,David Gómez,21,Silla Gaming,Hogar,03/03/2023,2.0,1289.34,2578.68,Transferencia,spain,Lyon,Pendiente,2023-03-03 00:00:00
2179.0,1872,María García,109,Mochila North Face,Accesorios,17/01/2024,5.0,1391.36,6956.8,Transferencia,DE,Berlín,Entregado,2024-01-17 04:00:00
2180.0,1350,Lucía Fernández,65,Aspiradora Dyson,Hogar,2023-12-10,4.0,1030.18,4798.183450978228,Bizum,Germany,Berlín,Cancelado,2023-12-10 09:00:00
2181.0,1291,carlos ruiz,174,Monitor LG,Tecnología,30/09/2024,1.0,617.57,617.57,Tarjeta,France,Hamburgo,Pendiente,2024-09-30 16:00:00
2182.0,1629,CARLOS RUIZ,113,Zapatillas Nike,Moda,18/08/2023,2.0,433.16,866.32,PayPal,ES,Berlín,Pendiente,2023-08-18 08:00:00
2183.0,1432,Laura Torres,121,iPhone 13,Tecnología,01/03/2023,4.0,76.05,304.2,Bizum,España,Barcelona,Pendiente,2023-03-01 14:00:00
2184.0,1898,carlos ruiz,111,Silla Gaming,Hogar,2024-01-16,4.0,$614.85,0.0,Transferencia,ES,Milán,Entregado,2024-01-16 04:00:00
2185.0,1338,Carlos Ruiz,49,Mochila North Face,Accesorios,09-04-2023,5.0,1309.79,6548.95,Bizum,IT,Hamburgo,Cancelado,2023-09-04 18:00:00
2186.0,1446,Carlos Ruiz,135,Reloj Casio,Accesorios,17/07/2024,1.0,1877.23,1877.23,Transferencia,DE,Barcelona,Cancelado,2024-07-17 17:00:00
2187.0,1198,Laura Torres,168,Teclado Logitech,Tecnología,15/12/2023,4.0,1743.7,6974.8,PayPal,Germany,Paris,Cancelado,2023-12-15 18:00:00
2188.0,1857,Ana Sánchez,187,Zapatillas Nike,Moda,01-21-2023,1.0,1534.47,1534.47,Transferencia,IT,Lyon,Cancelado,2023-01-21 04:00:00
2189.0,1599,David Gómez,108,Camiseta Adidas,Moda,2024-01-02,2.0,"1579,01",,PayPal,Germany,Roma,Pendiente,2024-01-02 20:00:00
2190.0,1919,Carlos Ruiz,181,Reloj Casio,Accesorios,09/01/2024,4.0,1333.32,5893.206861882993,PayPal,Italy,Lyon,Cancelado,2024-01-09 16:00:00
2191.0,1803,David Gómez,49,Cafetera Philips,Hogar,2023-08-15,4.0,527.97,2111.88,Transferencia,Italy,Barcelona,Entregado,2023-08-15 09:00:00
2192.0,1602,JUAN PÉREZ,188,Aspiradora Dyson,Hogar,29/06/2023,4.0,1815.32,6021.65021759121,Transferencia,Italy,Paris,Cancelado,2023-06-29 16:00:00
2193.0,1790,Juan Pérez,49,Sony Headphones,Tecnología,31/03/2023,2.0,1344.76,2689.52,Tarjeta,IT,Hamburgo,Entregado,2023-03-31 09:00:00
2194.0,1569,Juan Pérez,11,Bolso Gucci,Moda,13/06/2023,4.0,1125.28,4501.12,Transferencia,Italy,Valencia,Cancelado,2023-06-13 07:00:00
2195.0,1101,Lucía Fernández,122,Cafetera Philips,tech,02-01-2024,2.0,230.87,461.74,Transferencia,DE,Roma,Pendiente,2024-02-01 11:00:00
2196.0,1229,Laura Torres,176,MacBook Pro,Tecnología,2023-12-12,2.0,899.64,1799.28,Tarjeta,IT,Lyon,Pendiente,2023-12-12 19:00:00
2197.0,1764,María García,52,Cafetera Philips,Hogar,12/05/2024,4.0,926.11,3371.9773550912064,Transferencia,ES,Barcelona,Entregado,2024-05-12 10:00:00
2198.0,1395,Pedro López,30,Zapatillas Nike,Moda,10/08/2024,3.0,1730.48,5191.44,Tarjeta,ES,Berlín,Cancelado,2024-08-10 12:00:00
2199.0,1132,juan pérez,67,Mochila North Face,Accesorios,2024-04-23,1.0,1097.83,1097.83,PayPal,DE,Paris,Cancelado,2024-04-23 11:00:00
2200.0,1646,Pedro López,138,Cafetera Philips,Hogar,05-22-2024,4.0,767.0,3068.0,Bizum,DE,Lyon,Entregado,2024-05-22 17:00:00
2201.0,1234,Laura Torres,102,Zapatillas Nike,Moda,07-20-2023,2.0,1953.83,3907.66,Bizum,Germany,Roma,Entregado,2023-07-20 17:00:00
2202.0,1362,Juan Pérez,11,Sony Headphones,Tecnología,10/11/2023,2.0,230.33,460.66,Bizum,IT,Barcelona,Pendiente,2023-11-10 19:00:00
2203.0,1856,Lucía Fernández,197,MacBook Pro,Tecnología,07-26-2024,3.0,850.87,2552.61,Transferencia,Germany,Paris,Entregado,2024-07-26 21:00:00
2204.0,1367,Laura Torres,4,MacBook Pro,Tecnología,11-19-2024,1.0,93.63,93.63,Bizum,Germany,Valencia,Entregado,2024-11-19 16:00:00
2205.0,1373,David Gómez,190,Zapatillas Nike,Moda,07/06/2024,5.0,"1482,41",,PayPal,Germany,Madrid,Cancelado,2024-06-07 14:00:00
2206.0,1424,Laura Torres,86,Silla Gaming,Hogar,2023-12-17,1.0,1836.97,1836.97,Bizum,DE,Hamburgo,Pendiente,2023-12-17 00:00:00
2207.0,1849,Ana Sánchez,147,Silla Gaming,Hogar,01/07/2024,5.0,567.27,2836.35,Tarjeta,ES,Paris,Pendiente,2024-07-01 09:00:00
,1411,MARÍA GARCÍA,144,MacBook Pro,Tecnología,2024-09-15,4.0,1718.1,6872.4,Transferencia,Germany,Barcelona,Cancelado,2024-09-15 00:00:00
2209.0,1984,Pedro López,46,Teclado Logitech,Tecnología,04-08-2024,5.0,591.51,2957.55,Bizum,Germany,Roma,Entregado,2024-04-08 07:00:00
2210.0,1679,Ana Sánchez,135,AirPods,Tecnología,06-03-2023,5.0,1822.43,9112.15,PayPal,Germany,Berlín,Pendiente,2023-06-03 05:00:00
2211.0,1537,Carlos Ruiz,90,Sony Headphones,Tecnología,08-03-2023,2.0,1510.38,3020.76,PayPal,IT,Roma,Entregado,2023-08-03 05:00:00
2212.0,1956,Juan Pérez,177,Aspiradora Dyson,Hogar,2024-07-01,4.0,1611.76,6447.04,Bizum,France,Barcelona,Entregado,2024-07-01 07:00:00
2213.0,1414,Lucía Fernández,43,Cafetera Philips,Hogar,10-28-2024,5.0,45.83,229.15,Transferencia,ES,Lyon,Cancelado,2024-10-28 14:00:00
2214.0,1168,Lucía Fernández,177,Sony Headphones,Tecnología,2023-10-09,4.0,$1925.99,,Tarjeta,IT,Roma,Entregado,2023-10-09 14:00:00
2215.0,1262,LAURA TORRES,171,MacBook Pro,Tecnología,13/05/2024,5.0,1456.08,7280.4,Transferencia,Italy,Madrid,Cancelado,2024-05-13 10:00:00
2216.0,1248,Ana Sánchez,183,MacBook Pro,Tecnología,18/05/2024,1.0,616.45,616.45,Bizum,DE,Barcelona,Cancelado,2024-05-18 18:00:00
2217.0,1080,CARLOS RUIZ,36,Silla Gaming,Hogar,06-30-2023,1.0,1660.5,1660.5,Bizum,France,Hamburgo,Entregado,2023-06-30 08:00:00
2218.0,1993,Pedro López,88,iPhone 13,Tecnología,01-21-2024,5.0,570.23,2851.15,Tarjeta,IT,Milán,Entregado,2024-01-21 22:00:00
2219.0,1049,Lucía Fernández,153,Reloj Casio,Accesorios,25/03/2024,1.0,1746.78,1746.78,Transferencia,Germany,Roma,Entregado,2024-03-25 02:00:00
2220.0,1374,Ana Sánchez,103,Zapatillas Nike,Moda,2023-04-25,2.0,234.03,468.06,Tarjeta,FR,Berlín,Pendiente,2023-04-25 14:00:00
2221.0,1035,LAURA TORRES,108,Teclado Logitech,Tecnología,07-08-2023,2.0,1410.34,2820.68,PayPal,Italy,Roma,Cancelado,2023-07-08 23:00:00
2222.0,1192,Pedro López,95,Camiseta Adidas,tech,2023-04-10,3.0,1085.99,3520.8571046489974,PayPal,DE,Barcelona,Cancelado,2023-04-10 07:00:00
2223.0,1042,David Gómez,191,Monitor LG,Tecnología,2024-12-01,3.0,202.1,606.3,Tarjeta,España,Milán,Entregado,2024-12-01 21:00:00
2224.0,1698,Ana Sánchez,92,iPhone 13,Tecnología,01-11-2023,4.0,491.37,1965.48,PayPal,ES,Paris,Pendiente,2023-01-11 07:00:00
2225.0,1528,Juan Pérez,69,Mochila North Face,Accesorios,2023-11-23,4.0,34.68,138.72,Bizum,Italy,Milán,Pendiente,2023-11-23 01:00:00
2226.0,1682,Laura Torres,65,iPhone 13,Tecnología,21/07/2023,1.0,942.85,1001.5116410880157,PayPal,France,Lyon,Cancelado,2023-07-21 00:00:00
2227.0,1818,Pedro López,150,Teclado Logitech,TECHNOLOGY,25/02/2023,5.0,609.52,3047.6,Bizum,ES,Valencia,Entregado,2023-02-25 05:00:00
2228.0,1210,Carlos Ruiz,157,Mochila North Face,Accesorios,19/10/2023,5.0,1200.73,6003.65,Bizum,DE,Roma,Entregado,2023-10-19 11:00:00
2229.0,1054,JUAN PÉREZ,148,Teclado Logitech,Tecnología,29/09/2024,3.0,601.5,1804.5,Tarjeta,Germany,Lyon,Entregado,2024-09-29 13:00:00
2230.0,1338,Juan Pérez,146,Bolso Gucci,Moda,2023-09-15,5.0,606.84,3034.2,PayPal,España,Barcelona,Pendiente,2023-09-15 21:00:00
2231.0,1841,Pedro López,151,Camiseta Adidas,Moda,05-20-2024,3.0,1488.95,4466.85,PayPal,España,Paris,Entregado,2024-05-20 11:00:00
2232.0,1937,Ana Sánchez,130,AirPods,Tecnología,11-06-2024,2.0,105.8,211.6,Transferencia,España,Valencia,Entregado,2024-11-06 09:00:00
2233.0,1981,JUAN PÉREZ,51,Zapatillas Nike,Moda,2023-05-09,5.0,1806.76,9033.8,Transferencia,FR,Valencia,Entregado,2023-05-09 02:00:00
2234.0,1056,Ana Sánchez,127,Mochila North Face,Accesorios,11-12-2023,1.0,1706.01,1706.01,Tarjeta,IT,Milán,Cancelado,2023-11-12 00:00:00
2235.0,1290,María García,82,AirPods,Tecnología,06/11/2024,1.0,1338.93,1338.93,PayPal,spain,Barcelona,Entregado,2024-11-06 14:00:00
2236.0,1239,juan pérez,192,Mochila North Face,Accesorios,05/08/2024,3.0,1190.51,4275.9524827198775,Bizum,Italy,Madrid,Entregado,2024-08-05 08:00:00
2237.0,1871,Ana Sánchez,109,Zapatillas Nike,Moda,23/06/2023,3.0,1785.68,4445.179799533952,Bizum,España,Milán,Pendiente,2023-06-23 10:00:00
2238.0,1321,María García,79,iPhone 13,tecnologia,2023-06-30,4.0,378.81,1515.24,Tarjeta,FR,Barcelona,Cancelado,2023-06-30 21:00:00
2239.0,1224,Ana Sánchez,13,MacBook Pro,Tecnología,01-17-2023,1.0,167.15,167.15,PayPal,France,Valencia,Pendiente,2023-01-17 08:00:00
2240.0,1124,Laura Torres,186,Bolso Gucci,Moda,09-23-2023,2.0,486.63,973.26,Tarjeta,España,Paris,Cancelado,2023-09-23 01:00:00
2241.0,1546,david gómez,49,Bolso Gucci,Moda,2024-10-14,2.0,$1591.21,,PayPal,spain,Barcelona,Cancelado,2024-10-14 16:00:00
2242.0,1181,María García,47,Sony Headphones,Tecnología,29/07/2024,1.0,78.99,78.99,Transferencia,spain,Valencia,Pendiente,2024-07-29 00:00:00
2243.0,1542,JUAN PÉREZ,21,MacBook Pro,TECHNOLOGY,10-10-2024,5.0,1169.79,5848.95,Bizum,spain,Madrid,Entregado,2024-10-10 04:00:00
2244.0,1067,María García,111,Samsung Galaxy,Tecnología,2024-06-05,1.0,1990.92,2289.8998065982523,PayPal,Italy,Milán,Entregado,2024-06-05 06:00:00
2245.0,1346,María García,130,Teclado Logitech,Tecnología,2024-11-13,1.0,1712.84,1712.84,Bizum,DE,Berlín,Entregado,2024-11-13 08:00:00
2246.0,1171,Laura Torres,17,MacBook Pro,Tecnología,13/09/2023,4.0,1047.68,4190.72,PayPal,Germany,Roma,Entregado,2023-09-13 06:00:00
2247.0,1126,Juan Pérez,153,Cafetera Philips,Hogar,08/11/2024,4.0,136.65,546.6,PayPal,España,Paris,Cancelado,2024-11-08 07:00:00
2248.0,1674,Pedro López,172,MacBook Pro,Tecnología,2023-03-25,4.0,1664.43,6657.72,Tarjeta,ES,Berlín,Pendiente,2023-03-25 15:00:00
2249.0,1069,Pedro López,32,Reloj Casio,Accesorios,25/03/2023,1.0,1201.97,1201.97,Tarjeta,ES,Hamburgo,Pendiente,2023-03-25 20:00:00
2250.0,1171,david gómez,131,Bolso Gucci,Moda,03-08-2023,2.0,238.72,477.44,Tarjeta,IT,Milán,Pendiente,2023-03-08 15:00:00
2251.0,1783,Lucía Fernández,199,AirPods,Tecnología,19/10/2023,1.0,"196,78",,PayPal,FR,Roma,Cancelado,2023-10-19 13:00:00
2252.0,1153,LAURA TORRES,10,Camiseta Adidas,Moda,14/07/2023,2.0,1820.16,3640.32,Transferencia,IT,Valencia,Cancelado,2023-07-14 08:00:00
2253.0,1940,Lucía Fernández,28,Teclado Logitech,Tecnología,03-09-2023,2.0,1341.71,2683.42,PayPal,DE,Roma,Pendiente,2023-03-09 00:00:00
2254.0,1152,David Gómez,166,Monitor LG,Tecnología,2023-06-08,5.0,1660.28,8301.4,Bizum,Germany,Hamburgo,Cancelado,2023-06-08 03:00:00
2255.0,1637,Pedro López,149,Bolso Gucci,Moda,06-03-2024,1.0,1759.17,1759.17,Tarjeta,spain,Barcelona,Cancelado,2024-06-03 21:00:00
2256.0,1022,Laura Torres,64,iPhone 13,Tecnología,25/07/2024,4.0,1147.83,4591.32,Bizum,IT,Roma,Pendiente,2024-07-25 01:00:00
2257.0,1768,Ana Sánchez,118,Bolso Gucci,Moda,21/05/2024,3.0,1039.72,3119.16,Bizum,España,Barcelona,Pendiente,2024-05-21 22:00:00
2258.0,1313,María García,95,AirPods,Tecnología,2024-07-28,5.0,866.55,4332.75,Bizum,France,Madrid,Cancelado,2024-07-28 00:00:00
2259.0,1755,Pedro López,127,iPhone 13,Tecnología,2024-11-12,3.0,"640,72",,Transferencia,España,Lyon,Pendiente,2024-11-12 19:00:00
2260.0,1579,María García,51,Monitor LG,Tecnología,29/01/2023,4.0,874.85,3499.4,Transferencia,FR,Barcelona,Entregado,2023-01-29 12:00:00
2261.0,1782,David Gómez,5,Cafetera Philips,Hogar,02-15-2024,3.0,1550.02,4650.06,PayPal,Italy,Paris,Cancelado,2024-02-15 10:00:00
2262.0,1801,Juan Pérez,84,Aspiradora Dyson,Hogar,20/09/2024,5.0,1207.83,6039.15,PayPal,France,Barcelona,Cancelado,2024-09-20 09:00:00
2263.0,1012,María García,141,Mochila North Face,Accesorios,06-23-2023,3.0,1786.12,5358.36,Bizum,Italy,Barcelona,Pendiente,2023-06-23 02:00:00
2264.0,1109,Carlos Ruiz,143,AirPods,Tecnología,2023-02-28,2.0,892.33,1784.66,Bizum,DE,Madrid,Pendiente,2023-02-28 23:00:00
2265.0,1211,maría garcía,182,Aspiradora Dyson,Hogar,01-27-2023,1.0,1218.11,1218.11,PayPal,France,Barcelona,Cancelado,2023-01-27 03:00:00
2266.0,1565,Ana Sánchez,160,Monitor LG,Tecnología,2023-06-01,3.0,1266.3,3798.9,Transferencia,France,Paris,Cancelado,2023-06-01 20:00:00
2267.0,1675,David Gómez,58,Aspiradora Dyson,Hogar,01-25-2023,4.0,1187.48,4749.92,Transferencia,ES,Madrid,Cancelado,2023-01-25 01:00:00
2268.0,1807,Carlos Ruiz,19,Aspiradora Dyson,Hogar,16/08/2024,1.0,$1408.24,,Transferencia,DE,Hamburgo,Entregado,2024-08-16 15:00:00
2269.0,1360,Pedro López,78,Silla Gaming,Hogar,04/03/2024,5.0,482.49,2412.45,Transferencia,DE,Lyon,Pendiente,2024-03-04 13:00:00
2270.0,1939,Ana Sánchez,85,iPhone 13,Tecnología,26/01/2023,5.0,1029.6,5148.0,Bizum,spain,Berlín,Entregado,2023-01-26 06:00:00
2271.0,1850,LAURA TORRES,20,Zapatillas Nike,Moda,09-11-2023,1.0,217.41,217.41,Transferencia,ES,Berlín,Cancelado,2023-09-11 01:00:00
2272.0,1212,Ana Sánchez,102,MacBook Pro,Tecnología,28/10/2023,1.0,775.18,775.18,Bizum,France,Milán,Pendiente,2023-10-28 12:00:00
2273.0,1884,David Gómez,138,MacBook Pro,Tecnología,2023-03-25,2.0,980.46,1960.92,Bizum,France,Valencia,Pendiente,2023-03-25 15:00:00
2274.0,1217,Carlos Ruiz,7,Zapatillas Nike,Moda,2023-01-23,4.0,1307.93,5231.72,Bizum,spain,Lyon,Entregado,2023-01-23 17:00:00
2275.0,1688,Lucía Fernández,174,AirPods,Tecnología,07-11-2024,1.0,$1901.56,,Bizum,FR,Valencia,Cancelado,2024-07-11 08:00:00
2276.0,1836,Lucía Fernández,92,Mochila North Face,Accesorios,20/06/2024,5.0,1205.3,6026.5,Bizum,España,Lyon,Entregado,2024-06-20 09:00:00
2277.0,1353,Ana Sánchez,80,MacBook Pro,Tecnología,05-08-2023,4.0,1489.75,5959.0,Tarjeta,DE,Lyon,Entregado,2023-05-08 10:00:00
2278.0,1346,David Gómez,72,Samsung Galaxy,Tecnología,2023-01-21,5.0,1017.47,5686.637333047286,Transferencia,DE,Hamburgo,Entregado,2023-01-21 19:00:00
2279.0,1598,lucía fernández,184,Zapatillas Nike,Moda,2024-07-22,4.0,$1271.87,,PayPal,España,Paris,Entregado,2024-07-22 14:00:00
2280.0,1240,Laura Torres,77,MacBook Pro,Tecnología,02-20-2024,2.0,151.16,302.32,PayPal,ES,Berlín,Entregado,2024-02-20 07:00:00
2281.0,1622,ana sánchez,127,Teclado Logitech,Tecnología,11-08-2024,4.0,516.24,2064.96,PayPal,spain,Milán,Pendiente,2024-11-08 04:00:00
2282.0,1365,LUCÍA FERNÁNDEZ,15,Reloj Casio,HOGAR,26/05/2024,1.0,730.09,730.09,Tarjeta,FR,Valencia,Pendiente,2024-05-26 06:00:00
2283.0,1324,Pedro López,175,Camiseta Adidas,Moda,2023-09-16,1.0,950.26,950.26,Tarjeta,France,Madrid,Pendiente,2023-09-16 14:00:00
2284.0,1192,María García,169,Zapatillas Nike,Moda,02-18-2024,4.0,100.84,373.0875838205806,Bizum,ES,Lyon,Cancelado,2024-02-18 12:00:00
2285.0,1987,María García,57,Teclado Logitech,tech,2023-09-08,3.0,$288.65,,Transferencia,IT,Paris,Entregado,2023-09-08 16:00:00
2286.0,1149,Ana Sánchez,10,Monitor LG,Tecnología,11-07-2023,3.0,560.86,1843.2874552956166,Transferencia,IT,Hamburgo,Entregado,2023-11-07 15:00:00
2287.0,1817,María García,157,Monitor LG,Tecnología,2023-02-04,1.0,1943.35,1943.35,Tarjeta,IT,Paris,Cancelado,2023-02-04 01:00:00
2288.0,1247,Juan Pérez,35,Teclado Logitech,Tecnología,04/04/2023,3.0,669.38,2008.14,Transferencia,FR,Hamburgo,Entregado,2023-04-04 10:00:00
2289.0,1909,David Gómez,184,Bolso Gucci,Moda,30/08/2023,5.0,969.26,4846.3,Tarjeta,FR,Berlín,Pendiente,2023-08-30 00:00:00
2290.0,1261,JUAN PÉREZ,139,Bolso Gucci,Moda,02-10-2023,3.0,400.23,1200.69,Bizum,DE,Berlín,Entregado,2023-02-10 12:00:00
2291.0,1206,Ana Sánchez,105,iPhone 13,Tecnología,05/07/2023,1.0,1225.45,1399.7924157253842,Transferencia,FR,Paris,Entregado,2023-07-05 09:00:00
2292.0,1722,JUAN PÉREZ,10,Camiseta Adidas,Moda,10-19-2023,1.0,568.56,568.56,Transferencia,spain,Paris,Pendiente,2023-10-19 10:00:00
2293.0,1266,Pedro López,110,Monitor LG,Tecnología,22/02/2023,3.0,421.92,1265.76,PayPal,FR,Madrid,Cancelado,2023-02-22 19:00:00
2294.0,1865,ana sánchez,6,AirPods,Tecnología,19/07/2024,1.0,1037.98,1037.98,PayPal,FR,Hamburgo,Entregado,2024-07-19 22:00:00
2295.0,1852,Laura Torres,180,MacBook Pro,Tecnología,28/12/2023,5.0,20.96,104.8,PayPal,IT,Barcelona,Pendiente,2023-12-28 07:00:00
2296.0,1617,Pedro López,111,Samsung Galaxy,Tecnología,2023-04-08,2.0,"25,25",,Tarjeta,España,Roma,Pendiente,2023-04-08 20:00:00
2297.0,1523,David Gómez,88,Reloj Casio,Accesorios,2023-08-09,1.0,445.95,445.95,Bizum,France,Valencia,Cancelado,2023-08-09 00:00:00
2298.0,1616,David Gómez,13,AirPods,Tecnología,15/04/2023,5.0,83.08,415.4,PayPal,DE,Milán,Cancelado,2023-04-15 01:00:00
2299.0,1756,carlos ruiz,40,Monitor LG,Tecnología,02/05/2023,1.0,224.97,224.97,Tarjeta,Italy,Lyon,Entregado,2023-05-02 09:00:00
2300.0,1549,MARÍA GARCÍA,28,Silla Gaming,moda,01/11/2023,5.0,684.33,3421.65,PayPal,ES,Berlín,Cancelado,2023-11-01 08:00:00
2301.0,1578,David Gómez,21,Bolso Gucci,Moda,07/02/2023,3.0,1607.15,4821.45,PayPal,FR,Paris,Entregado,2023-02-07 21:00:00
2302.0,1781,Ana Sánchez,98,Samsung Galaxy,Tecnología,04-15-2024,3.0,1148.38,3445.14,Tarjeta,España,Madrid,Pendiente,2024-04-15 10:00:00
2303.0,1846,Carlos Ruiz,100,Bolso Gucci,Moda,06-30-2023,5.0,1030.21,5151.05,Tarjeta,Italy,Roma,Pendiente,2023-06-30 05:00:00
2304.0,1600,Laura Torres,77,Cafetera Philips,Hogar,04/08/2023,2.0,594.04,1188.08,PayPal,España,Valencia,Entregado,2023-08-04 20:00:00
2305.0,1576,Juan Pérez,44,Aspiradora Dyson,Hogar,28/11/2024,5.0,1864.19,9320.95,Tarjeta,ES,Berlín,Entregado,2024-11-28 10:00:00
2306.0,1724,Pedro López,57,AirPods,Tecnología,02-23-2023,2.0,800.06,1600.12,PayPal,FR,Berlín,Pendiente,2023-02-23 12:00:00
2307.0,1226,Lucía Fernández,9,AirPods,Tecnología,2023-02-07,3.0,$183.31,,PayPal,FR,Paris,Pendiente,2023-02-07 11:00:00
2308.0,1104,juan pérez,75,Samsung Galaxy,Tecnología,2024-02-24,4.0,1237.96,4951.84,Transferencia,France,Madrid,Pendiente,2024-02-24 06:00:00
2309.0,1810,maría garcía,175,Monitor LG,Tecnología,2023-11-13,4.0,236.54,946.16,Bizum,FR,Roma,Entregado,2023-11-13 05:00:00
2310.0,1628,Lucía Fernández,59,Monitor LG,Tecnología,02-06-2024,1.0,696.99,696.99,PayPal,Italy,Hamburgo,Entregado,2024-02-06 01:00:00
2311.0,1289,María García,52,Monitor LG,Tecnología,2023-06-19,1.0,1019.75,1019.75,PayPal,Italy,Lyon,Cancelado,2023-06-19 12:00:00
2312.0,1202,maría garcía,99,Silla Gaming,Hogar,2024-08-22,4.0,1749.7,6998.8,PayPal,France,Milán,Cancelado,2024-08-22 06:00:00
2313.0,1135,Laura Torres,161,MacBook Pro,Tecnología,04/08/2023,1.0,992.16,992.16,Transferencia,DE,Valencia,Pendiente,2023-08-04 22:00:00
2314.0,1360,Lucía Fernández,194,MacBook Pro,Tecnología,10-31-2024,4.0,1407.49,5062.389981472185,Tarjeta,DE,Paris,Cancelado,2024-10-31 20:00:00
2315.0,1642,Carlos Ruiz,25,MacBook Pro,Tecnología,23/07/2024,3.0,1985.71,5957.13,PayPal,spain,Hamburgo,Pendiente,2024-07-23 00:00:00
2316.0,1309,Juan Pérez,115,Mochila North Face,moda,30/04/2024,2.0,$271.66,0.0,Bizum,ES,Valencia,Cancelado,2024-04-30 02:00:00
2317.0,1577,Carlos Ruiz,21,Aspiradora Dyson,Hogar,10-11-2024,4.0,556.72,2226.88,PayPal,Italy,Berlín,Cancelado,2024-10-11 03:00:00
2318.0,1868,David Gómez,148,Cafetera Philips,Hogar,08/10/2023,3.0,795.21,2385.63,PayPal,Italy,Berlín,Cancelado,2023-10-08 01:00:00
2319.0,1033,Pedro López,5,Reloj Casio,Accesorios,08/02/2024,2.0,849.44,1698.88,Tarjeta,Germany,Roma,Cancelado,2024-02-08 16:00:00
2320.0,1497,Lucía Fernández,151,Silla Gaming,Hogar,11-16-2023,1.0,827.93,827.93,Transferencia,spain,Milán,Entregado,2023-11-16 11:00:00
2321.0,1076,Laura Torres,3,iPhone 13,Tecnología,16/11/2024,3.0,1816.15,5448.45,PayPal,España,Milán,Pendiente,2024-11-16 01:00:00
2322.0,1335,David Gómez,41,Reloj Casio,Accesorios,2023-12-13,5.0,1430.92,7154.6,Tarjeta,spain,Hamburgo,Pendiente,2023-12-13 19:00:00
2323.0,1999,Ana Sánchez,105,Bolso Gucci,Moda,22/01/2023,1.0,1219.73,1219.73,Transferencia,España,Paris,Entregado,2023-01-22 08:00:00
2324.0,1348,Laura Torres,96,Cafetera Philips,Hogar,09-20-2023,3.0,625.65,1876.95,PayPal,España,Lyon,Pendiente,2023-09-20 06:00:00
2325.0,1497,María García,20,Silla Gaming,Hogar,03-05-2023,3.0,1649.34,4948.02,Tarjeta,IT,Hamburgo,Cancelado,2023-03-05 21:00:00
2326.0,1210,Ana Sánchez,7,Aspiradora Dyson,Hogar,22/09/2024,2.0,1910.57,3821.14,Tarjeta,España,Milán,Pendiente,2024-09-22 01:00:00
2327.0,1213,Pedro López,189,Camiseta Adidas,Moda,07/01/2024,2.0,1644.18,3288.36,Tarjeta,Germany,Madrid,Pendiente,2024-01-07 17:00:00
2328.0,1465,Laura Torres,45,Bolso Gucci,Moda,31/05/2024,4.0,13.11,52.44,Transferencia,Germany,Lyon,Cancelado,2024-05-31 21:00:00
2329.0,1695,Carlos Ruiz,164,AirPods,Tecnología,10-05-2023,3.0,1276.44,3829.32,Tarjeta,spain,Paris,Cancelado,2023-10-05 10:00:00
2330.0,1034,Lucía Fernández,120,Bolso Gucci,Moda,2023-08-20,,111.76,,Transferencia,IT,Milán,Entregado,2023-08-20 08:00:00
2331.0,1430,María García,128,Bolso Gucci,hogar,26/10/2024,3.0,522.64,1567.92,PayPal,Italy,Barcelona,Entregado,2024-10-26 21:00:00
2332.0,1826,Lucía Fernández,34,Cafetera Philips,Hogar,02/10/2024,2.0,128.45,256.9,Transferencia,Italy,Valencia,Entregado,2024-10-02 12:00:00
2333.0,1721,Lucía Fernández,143,Reloj Casio,Accesorios,2024-11-14,5.0,"1211,55",0.0,Tarjeta,Italy,Roma,Cancelado,2024-11-14 18:00:00
2334.0,1070,David Gómez,74,Bolso Gucci,Moda,05-19-2023,5.0,1376.31,6881.55,Bizum,spain,Milán,Entregado,2023-05-19 11:00:00
2335.0,1923,María García,88,Zapatillas Nike,Moda,2024-10-11,5.0,"237,83",,Bizum,DE,Valencia,Entregado,2024-10-11 17:00:00
2336.0,1764,María García,186,Silla Gaming,Hogar,07-27-2023,5.0,773.84,3869.2,Tarjeta,Germany,Lyon,Cancelado,2023-07-27 16:00:00
2337.0,1413,Carlos Ruiz,63,Zapatillas Nike,Moda,25/10/2023,4.0,$917.91,,PayPal,Italy,Lyon,Cancelado,2023-10-25 19:00:00
2338.0,1687,María García,57,Camiseta Adidas,Moda,04/04/2024,5.0,744.42,3722.1,PayPal,DE,Barcelona,Cancelado,2024-04-04 17:00:00
2339.0,1606,Pedro López,68,Teclado Logitech,Tecnología,06-02-2024,2.0,250.84,501.68,PayPal,Italy,Milán,Pendiente,2024-06-02 23:00:00
2340.0,1959,David Gómez,151,Sony Headphones,Moda,30/08/2024,4.0,843.71,3374.84,Bizum,spain,Roma,Entregado,2024-08-30 15:00:00
2341.0,1478,María García,24,MacBook Pro,Tecnología,10-17-2023,4.0,1504.84,6019.36,Bizum,France,Berlín,Entregado,2023-10-17 07:00:00
2342.0,1438,Lucía Fernández,9,Bolso Gucci,Moda,09/12/2023,3.0,"151,31",,Tarjeta,Italy,Milán,Pendiente,2023-12-09 05:00:00
2343.0,1237,DAVID GÓMEZ,116,Silla Gaming,Hogar,2023-05-25,1.0,169.56,169.56,Tarjeta,ES,Lyon,Cancelado,2023-05-25 08:00:00
2344.0,1269,juan pérez,138,iPhone 13,Tecnología,2024-05-04,5.0,715.99,3579.95,Bizum,Germany,Barcelona,Entregado,2024-05-04 11:00:00
2345.0,1030,María García,46,Mochila North Face,Accesorios,04-08-2023,1.0,1884.03,1884.03,Transferencia,spain,Berlín,Entregado,2023-04-08 10:00:00
2346.0,1916,Juan Pérez,174,iPhone 13,Tecnología,2023-01-31,,1340.46,,Bizum,FR,Lyon,Cancelado,2023-01-31 21:00:00
2347.0,1266,ana sánchez,107,Silla Gaming,Hogar,01-21-2024,1.0,1360.55,1360.55,PayPal,DE,Roma,Entregado,2024-01-21 19:00:00
2348.0,1961,Laura Torres,54,Samsung Galaxy,Tecnología,15/09/2024,2.0,730.22,1460.44,Bizum,spain,Milán,Cancelado,2024-09-15 17:00:00
2349.0,1078,Lucía Fernández,14,Bolso Gucci,Moda,18/09/2023,3.0,$1191.38,,Tarjeta,spain,Valencia,Entregado,2023-09-18 13:00:00
2350.0,1865,Carlos Ruiz,5,AirPods,Tecnología,26/03/2023,1.0,30.16,30.16,Tarjeta,spain,Barcelona,Cancelado,2023-03-26 07:00:00
2351.0,1979,Laura Torres,161,Mochila North Face,Accesorios,19/08/2023,1.0,1275.83,1275.83,Tarjeta,France,Lyon,Cancelado,2023-08-19 06:00:00
2352.0,1186,LAURA TORRES,117,Aspiradora Dyson,Hogar,08-09-2023,3.0,$1827.44,,PayPal,Germany,Roma,Cancelado,2023-08-09 21:00:00
2353.0,1804,Lucía Fernández,180,Silla Gaming,Hogar,23/02/2023,3.0,1229.02,3687.06,PayPal,FR,Madrid,Pendiente,2023-02-23 05:00:00
2354.0,1149,Juan Pérez,75,Samsung Galaxy,Tecnología,2023-04-15,4.0,1748.66,6826.80874087756,PayPal,France,Roma,Pendiente,2023-04-15 05:00:00
2355.0,1809,Ana Sánchez,188,iPhone 13,Tecnología,12/02/2024,3.0,1450.71,4352.13,Bizum,FR,Madrid,Cancelado,2024-02-12 11:00:00
2356.0,1663,Pedro López,150,Camiseta Adidas,Moda,06/12/2023,5.0,249.91,1249.55,Tarjeta,Italy,Madrid,Cancelado,2023-12-06 01:00:00
2357.0,1013,ana sánchez,134,Zapatillas Nike,Moda,01/06/2024,4.0,1805.88,7223.52,Bizum,France,Paris,Entregado,2024-06-01 13:00:00
2358.0,1612,David Gómez,107,iPhone 13,Tecnología,20/11/2024,4.0,142.22,568.88,PayPal,Italy,Milán,Cancelado,2024-11-20 03:00:00
2359.0,1205,María García,81,Bolso Gucci,Moda,31/12/2023,4.0,1072.6,4290.4,Tarjeta,France,Valencia,Pendiente,2023-12-31 19:00:00
2360.0,1441,Juan Pérez,51,Samsung Galaxy,Moda,07-30-2023,2.0,292.85,585.7,Tarjeta,Italy,Hamburgo,Pendiente,2023-07-30 04:00:00
2361.0,1728,Lucía Fernández,164,Camiseta Adidas,Moda,2024-06-02,1.0,33.3,33.3,Tarjeta,España,Hamburgo,Cancelado,2024-06-02 06:00:00
2362.0,1197,Lucía Fernández,172,Sony Headphones,Tecnología,2024-01-23,5.0,849.85,4249.25,Transferencia,Germany,Barcelona,Pendiente,2024-01-23 03:00:00
2363.0,1833,María García,145,MacBook Pro,Tecnología,29/04/2023,2.0,597.13,1194.26,Tarjeta,España,Barcelona,Cancelado,2023-04-29 00:00:00
2364.0,1015,Juan Pérez,126,Bolso Gucci,tecnologia,22/07/2023,5.0,977.14,4885.7,Transferencia,FR,Valencia,Pendiente,2023-07-22 09:00:00
2365.0,1623,Juan Pérez,116,Cafetera Philips,Hogar,05-09-2024,2.0,1158.63,2317.26,Tarjeta,IT,Berlín,Entregado,2024-05-09 16:00:00
2366.0,1516,Juan Pérez,136,Teclado Logitech,Tecnología,2024-10-22,5.0,97.04,485.2,PayPal,DE,Valencia,Pendiente,2024-10-22 00:00:00
2367.0,1714,Laura Torres,57,Zapatillas Nike,Moda,11/05/2024,3.0,254.78,764.34,Bizum,France,Roma,Pendiente,2024-05-11 06:00:00
2368.0,1735,Carlos Ruiz,191,Mochila North Face,Accesorios,07-08-2024,3.0,1121.7,3365.1,Bizum,France,Madrid,Pendiente,2024-07-08 02:00:00
2369.0,1513,Laura Torres,33,MacBook Pro,moda,10/07/2024,3.0,692.9,2404.9362614847105,PayPal,Italy,Roma,Entregado,2024-07-10 19:00:00
2370.0,1886,Laura Torres,24,Cafetera Philips,Hogar,01-19-2024,1.0,1461.06,1461.06,Bizum,Germany,Paris,Cancelado,2024-01-19 15:00:00
2371.0,1940,CARLOS RUIZ,132,MacBook Pro,Tecnología,2024-06-30,2.0,1308.06,3045.343123182484,Transferencia,FR,Hamburgo,Cancelado,2024-06-30 22:00:00
2372.0,1529,Pedro López,15,Sony Headphones,hogar,2024-07-23,5.0,1692.75,7653.648919657491,Tarjeta,Italy,Milán,Cancelado,2024-07-23 01:00:00
2373.0,1106,Ana Sánchez,188,Cafetera Philips,Hogar,2023-06-08,3.0,1388.06,4164.18,PayPal,spain,Madrid,Pendiente,2023-06-08 16:00:00
2374.0,1848,Juan Pérez,65,Zapatillas Nike,Moda,08-03-2024,4.0,865.56,3462.24,Tarjeta,Germany,Milán,Pendiente,2024-08-03 08:00:00
2375.0,1809,María García,120,AirPods,Tecnología,2023-09-24,3.0,1349.2,4047.6,PayPal,Germany,Barcelona,Cancelado,2023-09-24 09:00:00
2376.0,1208,laura torres,35,iPhone 13,HOGAR,11-02-2024,4.0,558.01,2232.04,Bizum,IT,Madrid,Cancelado,2024-11-02 09:00:00
2377.0,1347,María García,73,iPhone 13,hogar,07-25-2023,4.0,619.56,2478.24,Transferencia,España,Roma,Cancelado,2023-07-25 18:00:00
2378.0,1929,Ana Sánchez,76,iPhone 13,Tecnología,01-02-2023,4.0,1580.08,6320.32,PayPal,España,Paris,Pendiente,2023-01-02 00:00:00
2379.0,1361,Lucía Fernández,55,Monitor LG,Tecnología,07-18-2024,2.0,898.37,1796.74,Tarjeta,IT,Madrid,Entregado,2024-07-18 22:00:00
2380.0,1656,Pedro López,22,Sony Headphones,Tecnología,14/09/2023,1.0,1598.78,1598.78,Transferencia,ES,Berlín,Cancelado,2023-09-14 19:00:00
2381.0,1540,Lucía Fernández,78,Reloj Casio,Accesorios,03/06/2024,4.0,1646.62,6586.48,Transferencia,spain,Paris,Cancelado,2024-06-03 21:00:00
2382.0,1247,lucía fernández,66,MacBook Pro,Tecnología,27/01/2024,4.0,1716.55,6866.2,PayPal,DE,Berlín,Pendiente,2024-01-27 18:00:00
2383.0,1300,David Gómez,126,Camiseta Adidas,Moda,27/09/2024,3.0,1834.1,5502.3,Transferencia,DE,Roma,Pendiente,2024-09-27 18:00:00
2384.0,1844,Juan Pérez,93,Cafetera Philips,Hogar,09-01-2024,5.0,867.66,4338.3,Transferencia,IT,Valencia,Entregado,2024-09-01 20:00:00
2385.0,1931,Ana Sánchez,123,Reloj Casio,Accesorios,2023-07-28,3.0,644.54,1933.62,Transferencia,ES,Berlín,Pendiente,2023-07-28 06:00:00
2386.0,1361,María García,162,Aspiradora Dyson,Hogar,01-27-2023,3.0,"1168,58",,Transferencia,España,Madrid,Pendiente,2023-01-27 04:00:00
2387.0,1020,Carlos Ruiz,125,Cafetera Philips,Hogar,03-24-2023,2.0,748.63,1497.26,Bizum,spain,Roma,Pendiente,2023-03-24 17:00:00
2388.0,1226,Carlos Ruiz,51,Teclado Logitech,Tecnología,10/03/2024,3.0,1206.14,3618.42,Bizum,FR,Lyon,Pendiente,2024-03-10 22:00:00
2389.0,1816,María García,15,Camiseta Adidas,Moda,10-02-2024,3.0,1414.12,4242.36,Transferencia,ES,Roma,Cancelado,2024-10-02 13:00:00
2390.0,1368,Carlos Ruiz,110,Silla Gaming,Hogar,2023-06-13,1.0,1379.93,1379.93,Tarjeta,FR,Madrid,Cancelado,2023-06-13 21:00:00
2391.0,1645,CARLOS RUIZ,166,Reloj Casio,Accesorios,12/12/2023,5.0,755.36,3776.8,PayPal,IT,Paris,Entregado,2023-12-12 02:00:00
2392.0,1283,María García,118,AirPods,Tecnología,25/07/2024,5.0,342.05,1728.6757868324444,PayPal,Germany,Paris,Cancelado,2024-07-25 02:00:00
2393.0,1605,Laura Torres,128,Aspiradora Dyson,Hogar,09/06/2023,3.0,866.75,2600.25,Bizum,IT,Madrid,Entregado,2023-06-09 20:00:00
2394.0,1038,pedro lópez,91,Silla Gaming,Hogar,30/10/2024,3.0,293.76,881.28,PayPal,Germany,Milán,Entregado,2024-10-30 08:00:00
2395.0,1782,JUAN PÉREZ,72,Camiseta Adidas,Moda,19/05/2023,2.0,1781.29,3562.58,Bizum,IT,Berlín,Entregado,2023-05-19 11:00:00
2396.0,1574,David Gómez,30,Cafetera Philips,Hogar,27/09/2023,5.0,698.3,3491.5,Bizum,IT,Hamburgo,Entregado,2023-09-27 16:00:00
2397.0,1757,LAURA TORRES,110,Silla Gaming,Hogar,2023-10-30,5.0,317.37,1586.85,Transferencia,France,Valencia,Pendiente,2023-10-30 10:00:00
2398.0,1421,Pedro López,117,MacBook Pro,Tecnología,08-27-2024,4.0,"60,64",0.0,Transferencia,ES,Milán,Pendiente,2024-08-27 06:00:00
2399.0,1392,Juan Pérez,142,Aspiradora Dyson,Hogar,2024-11-30,5.0,1295.19,6475.95,Bizum,DE,Madrid,Pendiente,2024-11-30 15:00:00
2400.0,1781,Pedro López,87,Aspiradora Dyson,Hogar,2024-08-03,2.0,1277.44,2554.88,Transferencia,France,Barcelona,Cancelado,2024-08-03 16:00:00
2401.0,1756,CARLOS RUIZ,60,Teclado Logitech,Tecnología,2024-05-24,2.0,687.8,1375.6,Tarjeta,France,Milán,Cancelado,2024-05-24 09:00:00
2402.0,1689,laura torres,115,Sony Headphones,Tecnología,27/10/2024,3.0,152.71,458.13,Tarjeta,Italy,Valencia,Cancelado,2024-10-27 09:00:00
2403.0,1967,David Gómez,3,AirPods,Tecnología,11-24-2023,1.0,$825.16,,Tarjeta,Germany,Lyon,Pendiente,2023-11-24 23:00:00
2404.0,1469,Juan Pérez,10,Teclado Logitech,Tecnología,2023-10-31,5.0,629.32,3146.6,Tarjeta,IT,Paris,Entregado,2023-10-31 15:00:00
2405.0,1813,Juan Pérez,199,Silla Gaming,Hogar,2024-08-14,3.0,1357.47,4072.41,Bizum,DE,Milán,Cancelado,2024-08-14 14:00:00
2406.0,1985,Pedro López,164,MacBook Pro,Tecnología,2023-06-10,1.0,1215.5,1215.5,PayPal,France,Hamburgo,Cancelado,2023-06-10 02:00:00
2407.0,1552,Lucía Fernández,145,Silla Gaming,Hogar,07-26-2023,4.0,735.54,2942.16,PayPal,spain,Lyon,Entregado,2023-07-26 20:00:00
2408.0,1657,Carlos Ruiz,81,Silla Gaming,Hogar,29/11/2024,2.0,443.61,887.22,PayPal,ES,Berlín,Cancelado,2024-11-29 07:00:00
2409.0,1158,Lucía Fernández,62,iPhone 13,hogar,11/02/2024,2.0,1976.19,3952.38,Transferencia,Germany,Berlín,Pendiente,2024-02-11 22:00:00
2410.0,1108,Laura Torres,126,iPhone 13,Tecnología,27/04/2024,5.0,913.46,4427.639431582827,Transferencia,Germany,Madrid,Entregado,2024-04-27 18:00:00
2411.0,1163,maría garcía,55,Silla Gaming,Hogar,05/09/2024,5.0,1379.67,6898.35,PayPal,IT,Roma,Cancelado,2024-09-05 20:00:00
2412.0,1455,María García,188,Cafetera Philips,Hogar,10-16-2024,2.0,289.7,579.4,Bizum,IT,Barcelona,Cancelado,2024-10-16 00:00:00
2413.0,1076,Carlos Ruiz,192,Sony Headphones,Tecnología,16/10/2024,4.0,976.32,3905.28,PayPal,ES,Milán,Pendiente,2024-10-16 17:00:00
2414.0,1913,Lucía Fernández,80,Teclado Logitech,Tecnología,2024-08-17,1.0,$64.8,,Transferencia,DE,Paris,Cancelado,2024-08-17 15:00:00
2415.0,1061,David Gómez,200,Teclado Logitech,Tecnología,09/08/2024,5.0,1015.86,5079.3,Tarjeta,Germany,Lyon,Entregado,2024-08-09 06:00:00
2416.0,1502,pedro lópez,58,Teclado Logitech,Tecnología,03-18-2023,2.0,1928.39,3856.78,Tarjeta,España,Paris,Pendiente,2023-03-18 05:00:00
2417.0,1288,PEDRO LÓPEZ,186,Sony Headphones,Tecnología,05/03/2024,2.0,774.57,1649.3353701639085,Transferencia,IT,Valencia,Entregado,2024-03-05 03:00:00
2418.0,1419,Pedro López,18,Reloj Casio,Accesorios,03-15-2023,4.0,87.6,350.4,Bizum,Germany,Berlín,Cancelado,2023-03-15 06:00:00
2419.0,1539,Lucía Fernández,125,Bolso Gucci,Moda,11/11/2023,3.0,71.6,214.8,PayPal,IT,Lyon,Entregado,2023-11-11 01:00:00
2420.0,1961,juan pérez,98,iPhone 13,Tecnología,11-18-2023,3.0,782.09,2346.27,Tarjeta,Italy,Lyon,Cancelado,2023-11-18 02:00:00
2421.0,1452,LAURA TORRES,196,Sony Headphones,Tecnología,03-14-2024,5.0,328.45,1642.25,Transferencia,spain,Madrid,Cancelado,2024-03-14 14:00:00
2422.0,1356,DAVID GÓMEZ,55,Bolso Gucci,Moda,2024-03-20,5.0,56.47,282.35,Tarjeta,France,Roma,Pendiente,2024-03-20 16:00:00
2423.0,1293,DAVID GÓMEZ,193,Reloj Casio,Accesorios,06-08-2024,5.0,1514.87,7574.35,Transferencia,ES,Milán,Cancelado,2024-06-08 09:00:00
2424.0,1734,lucía fernández,139,iPhone 13,Tecnología,2023-08-08,5.0,922.46,4678.154474580512,Transferencia,FR,Paris,Entregado,2023-08-08 21:00:00
2425.0,1124,Laura Torres,75,AirPods,Tecnología,01/02/2023,5.0,585.6,2928.0,PayPal,Italy,Milán,Entregado,2023-02-01 16:00:00
2426.0,1577,Carlos Ruiz,49,Camiseta Adidas,Moda,2023-06-10,5.0,1801.17,9005.85,PayPal,spain,Roma,Pendiente,2023-06-10 12:00:00
2427.0,1282,Ana Sánchez,55,Bolso Gucci,Moda,26/11/2023,1.0,241.12,241.12,PayPal,Germany,Valencia,Pendiente,2023-11-26 12:00:00
2428.0,1340,Carlos Ruiz,47,Silla Gaming,Hogar,07-27-2023,3.0,1912.28,5736.84,Bizum,spain,Barcelona,Entregado,2023-07-27 05:00:00
2429.0,1775,Carlos Ruiz,118,Monitor LG,Tecnología,2024-06-01,3.0,634.79,1904.37,Transferencia,DE,Berlín,Entregado,2024-06-01 05:00:00
2430.0,1075,Lucía Fernández,87,Bolso Gucci,Moda,2023-05-08,1.0,1777.92,1777.92,Tarjeta,DE,Valencia,Cancelado,2023-05-08 13:00:00
2431.0,1529,Laura Torres,130,MacBook Pro,Tecnología,31/03/2024,5.0,"1209,86",,Bizum,FR,Hamburgo,Cancelado,2024-03-31 05:00:00
2432.0,1874,Pedro López,70,Zapatillas Nike,Moda,01-19-2024,2.0,$1655.15,,Tarjeta,spain,Berlín,Entregado,2024-01-19 21:00:00
2433.0,1300,Lucía Fernández,22,AirPods,Tecnología,2023-12-12,3.0,1968.19,5904.57,Bizum,Germany,Berlín,Cancelado,2023-12-12 19:00:00
2434.0,1573,laura torres,63,AirPods,Tecnología,19/02/2023,3.0,583.93,1751.79,Tarjeta,DE,Madrid,Entregado,2023-02-19 12:00:00
2435.0,1892,Lucía Fernández,70,Mochila North Face,Accesorios,08-13-2024,4.0,1922.66,7690.64,PayPal,Italy,Roma,Cancelado,2024-08-13 23:00:00
2436.0,1918,ANA SÁNCHEZ,5,Sony Headphones,TECHNOLOGY,01-13-2023,3.0,785.07,2355.21,Transferencia,España,Barcelona,Cancelado,2023-01-13 19:00:00
2437.0,1311,Lucía Fernández,16,MacBook Pro,Tecnología,07-08-2023,3.0,777.17,2331.51,Tarjeta,FR,Roma,Entregado,2023-07-08 16:00:00
2438.0,1142,María García,24,AirPods,Tecnología,11/06/2024,5.0,$687.37,,Bizum,FR,Valencia,Entregado,2024-06-11 13:00:00
2439.0,1758,María García,175,Bolso Gucci,Moda,04-04-2023,2.0,$1087.4,,Transferencia,FR,Valencia,Cancelado,2023-04-04 05:00:00
2440.0,1807,Lucía Fernández,178,Sony Headphones,Tecnología,2024-08-17,4.0,316.75,1102.265779992683,Tarjeta,spain,Roma,Entregado,2024-08-17 21:00:00
2441.0,1663,Pedro López,49,AirPods,TECHNOLOGY,18/07/2023,2.0,1111.89,2223.78,Transferencia,España,Valencia,Cancelado,2023-07-18 09:00:00
2442.0,1446,Carlos Ruiz,90,Silla Gaming,Hogar,19/02/2023,4.0,1087.99,4351.96,PayPal,IT,Valencia,Pendiente,2023-02-19 03:00:00
2443.0,1416,David Gómez,66,Reloj Casio,Accesorios,10/07/2023,1.0,1526.18,1526.18,Tarjeta,France,Milán,Cancelado,2023-07-10 08:00:00
2444.0,1327,David Gómez,192,Samsung Galaxy,Tecnología,09-01-2023,1.0,1668.96,1523.597845422801,Tarjeta,FR,Valencia,Entregado,2023-09-01 02:00:00
2445.0,1912,Lucía Fernández,119,Sony Headphones,Tecnología,06-26-2024,5.0,886.48,4432.4,PayPal,Italy,Lyon,Entregado,2024-06-26 12:00:00
2446.0,1060,ana sánchez,123,Monitor LG,Tecnología,09-09-2024,4.0,611.64,2446.56,Bizum,IT,Roma,Cancelado,2024-09-09 08:00:00
,1421,Laura Torres,37,Bolso Gucci,Moda,2024-10-06,1.0,526.08,526.08,Transferencia,France,Milán,Entregado,2024-10-06 02:00:00
2448.0,1520,Pedro López,190,Sony Headphones,Tecnología,2023-12-02,5.0,397.3,1986.5,Tarjeta,ES,Valencia,Entregado,2023-12-02 04:00:00
2449.0,1839,David Gómez,173,MacBook Pro,Tecnología,2023-02-16,5.0,$124.72,,Transferencia,FR,Barcelona,Pendiente,2023-02-16 04:00:00
2450.0,1804,Ana Sánchez,47,Monitor LG,Tecnología,03-18-2023,2.0,691.47,1382.94,PayPal,DE,Milán,Cancelado,2023-03-18 05:00:00
2451.0,1753,María García,181,Mochila North Face,Accesorios,25/03/2024,3.0,547.79,1643.37,PayPal,FR,Berlín,Entregado,2024-03-25 12:00:00
2452.0,1569,Lucía Fernández,148,Aspiradora Dyson,Hogar,27/11/2023,3.0,"1933,17",,Tarjeta,IT,Madrid,Cancelado,2023-11-27 17:00:00
2453.0,1796,Laura Torres,166,Sony Headphones,Tecnología,03/02/2024,2.0,1119.84,2239.68,PayPal,France,Roma,Cancelado,2024-02-03 20:00:00
2454.0,1356,Lucía Fernández,75,Bolso Gucci,Moda,2023-04-03,5.0,701.08,3505.4,Tarjeta,France,Hamburgo,Pendiente,2023-04-03 22:00:00
2455.0,1093,Pedro López,129,Silla Gaming,Hogar,08-04-2024,1.0,1165.13,1165.13,Transferencia,FR,Barcelona,Pendiente,2024-08-04 08:00:00
2456.0,1759,Ana Sánchez,86,Monitor LG,Tecnología,2024-02-16,1.0,287.0,287.0,Tarjeta,FR,Milán,Pendiente,2024-02-16 02:00:00
2457.0,1733,Juan Pérez,59,Reloj Casio,Accesorios,06-10-2024,5.0,893.65,4468.25,Transferencia,España,Madrid,Cancelado,2024-06-10 23:00:00
2458.0,1867,Laura Torres,141,Aspiradora Dyson,Hogar,2024-09-28,2.0,1256.21,2512.42,Transferencia,France,Hamburgo,Entregado,2024-09-28 06:00:00
2459.0,1705,Carlos Ruiz,181,Mochila North Face,hogar,08-14-2023,1.0,982.91,982.91,Transferencia,España,Madrid,Cancelado,2023-08-14 22:00:00
2460.0,1303,Lucía Fernández,71,Teclado Logitech,Tecnología,2023-08-08,2.0,$809.54,,Tarjeta,IT,Milán,Entregado,2023-08-08 13:00:00
2461.0,1263,MARÍA GARCÍA,31,Silla Gaming,Hogar,2024-05-18,2.0,1987.76,3975.52,Transferencia,España,Berlín,Pendiente,2024-05-18 07:00:00
2462.0,1675,maría garcía,179,Mochila North Face,Accesorios,2024-07-14,2.0,1761.83,3523.66,Bizum,spain,Milán,Cancelado,2024-07-14 04:00:00
2463.0,1450,Lucía Fernández,22,Silla Gaming,HOGAR,04-21-2023,3.0,1250.58,3751.74,Bizum,España,Hamburgo,Pendiente,2023-04-21 22:00:00
2464.0,1930,Pedro López,171,Silla Gaming,Hogar,03/04/2024,5.0,1143.06,6165.588868091787,Bizum,FR,Milán,Pendiente,2024-04-03 05:00:00
2465.0,1738,Lucía Fernández,6,Aspiradora Dyson,Hogar,08-03-2023,3.0,1245.11,3735.33,PayPal,France,Madrid,Cancelado,2023-08-03 07:00:00
2466.0,1006,JUAN PÉREZ,161,Camiseta Adidas,Moda,2023-08-24,5.0,410.61,2053.05,Tarjeta,Italy,Lyon,Pendiente,2023-08-24 15:00:00
2467.0,1277,Carlos Ruiz,109,Cafetera Philips,Hogar,09-03-2024,1.0,796.32,872.528994261566,Tarjeta,FR,Hamburgo,Entregado,2024-09-03 23:00:00
2468.0,1158,María García,72,Mochila North Face,Accesorios,2024-07-17,5.0,88.52,442.6,PayPal,FR,Hamburgo,Pendiente,2024-07-17 20:00:00
2469.0,1024,Carlos Ruiz,175,Zapatillas Nike,Moda,2023-11-01,5.0,956.34,4781.7,Transferencia,España,Hamburgo,Entregado,2023-11-01 23:00:00
2470.0,1023,Pedro López,159,Monitor LG,Tecnología,2024-03-05,1.0,1090.62,1090.62,PayPal,ES,Roma,Pendiente,2024-03-05 09:00:00
2471.0,1589,Laura Torres,156,Cafetera Philips,Hogar,30/10/2024,3.0,463.22,1186.3165721204064,PayPal,IT,Valencia,Pendiente,2024-10-30 01:00:00
2472.0,1677,Juan Pérez,43,Sony Headphones,Tecnología,2024-04-17,3.0,1928.42,5785.26,Tarjeta,ES,Roma,Cancelado,2024-04-17 10:00:00
2473.0,1880,Carlos Ruiz,149,Mochila North Face,Accesorios,2023-05-03,2.0,1819.81,3639.62,PayPal,France,Barcelona,Cancelado,2023-05-03 07:00:00
2474.0,1643,Ana Sánchez,75,Monitor LG,Tecnología,2023-10-14,3.0,1447.07,4341.21,PayPal,Italy,Madrid,Entregado,2023-10-14 04:00:00
2475.0,1579,David Gómez,28,Zapatillas Nike,Moda,06-20-2024,5.0,1071.44,5357.2,PayPal,ES,Valencia,Cancelado,2024-06-20 06:00:00
2476.0,1408,David Gómez,104,Bolso Gucci,Moda,2024-07-15,1.0,1741.24,1741.24,Tarjeta,Germany,Lyon,Entregado,2024-07-15 12:00:00
2477.0,1972,Juan Pérez,37,Cafetera Philips,Hogar,04-05-2024,5.0,270.0,1599.0763101950756,Tarjeta,Italy,Barcelona,Cancelado,2024-04-05 10:00:00
2478.0,1069,Carlos Ruiz,194,Zapatillas Nike,Moda,03-21-2023,,1583.11,,Transferencia,Italy,Barcelona,Pendiente,2023-03-21 09:00:00
2479.0,1527,Lucía Fernández,188,iPhone 13,Tecnología,2023-11-02,4.0,$258.39,,PayPal,España,Madrid,Cancelado,2023-11-02 08:00:00
2480.0,1239,JUAN PÉREZ,12,Monitor LG,hogar,14/01/2024,2.0,1590.48,3180.96,PayPal,DE,Lyon,Pendiente,2024-01-14 09:00:00
2481.0,1020,Ana Sánchez,95,Mochila North Face,Accesorios,04-14-2023,1.0,558.78,607.8369094543791,Bizum,France,Paris,Pendiente,2023-04-14 16:00:00
2482.0,1940,Laura Torres,92,AirPods,Tecnología,03-22-2023,3.0,1755.41,5266.23,PayPal,Germany,Valencia,Cancelado,2023-03-22 13:00:00
2483.0,1629,Carlos Ruiz,199,Bolso Gucci,Moda,2023-01-20,5.0,1888.64,9443.2,Bizum,ES,Roma,Pendiente,2023-01-20 13:00:00
2484.0,1687,LUCÍA FERNÁNDEZ,179,Camiseta Adidas,Moda,2024-08-27,2.0,306.1,612.2,Tarjeta,spain,Madrid,Pendiente,2024-08-27 18:00:00
2485.0,1318,carlos ruiz,30,Mochila North Face,Accesorios,2024-02-07,3.0,930.72,2792.16,Bizum,Italy,Paris,Cancelado,2024-02-07 01:00:00
2486.0,1063,Carlos Ruiz,94,MacBook Pro,Tecnología,12/09/2023,3.0,1962.16,5886.48,Bizum,FR,Paris,Pendiente,2023-09-12 18:00:00
2487.0,1419,Carlos Ruiz,67,AirPods,Moda,02-25-2024,4.0,$971.98,,Tarjeta,FR,Hamburgo,Cancelado,2024-02-25 04:00:00
2488.0,1307,Carlos Ruiz,160,Sony Headphones,Tecnología,2023-05-13,4.0,1728.46,6913.84,Transferencia,ES,Milán,Entregado,2023-05-13 16:00:00
2489.0,1386,Carlos Ruiz,174,Zapatillas Nike,Moda,22/02/2023,3.0,1181.58,3544.74,Bizum,France,Berlín,Entregado,2023-02-22 23:00:00
2490.0,1993,Ana Sánchez,43,AirPods,Tecnología,2023-09-21,1.0,756.91,756.91,Tarjeta,Italy,Berlín,Entregado,2023-09-21 08:00:00
2491.0,1602,DAVID GÓMEZ,20,Samsung Galaxy,Tecnología,08-20-2024,1.0,578.71,578.71,Tarjeta,FR,Madrid,Entregado,2024-08-20 14:00:00
2492.0,1990,María García,156,Aspiradora Dyson,Hogar,07-24-2023,2.0,414.41,828.82,Transferencia,FR,Hamburgo,Entregado,2023-07-24 08:00:00
2493.0,1168,David Gómez,19,Zapatillas Nike,Moda,11-06-2023,1.0,$1525.98,,PayPal,Germany,Barcelona,Pendiente,2023-11-06 23:00:00
2494.0,1465,Ana Sánchez,132,Samsung Galaxy,hogar,21/11/2024,2.0,779.22,1710.3762744601197,Transferencia,ES,Berlín,Pendiente,2024-11-21 09:00:00
2495.0,1697,Carlos Ruiz,168,Sony Headphones,Tecnología,2023-10-11,4.0,1027.44,4109.76,Tarjeta,Germany,Roma,Entregado,2023-10-11 15:00:00
2496.0,1368,Carlos Ruiz,105,AirPods,Tecnología,2024-02-20,2.0,989.73,1979.46,PayPal,IT,Berlín,Pendiente,2024-02-20 16:00:00
2497.0,1563,carlos ruiz,192,Reloj Casio,Accesorios,15/02/2024,3.0,1158.79,3476.37,Tarjeta,ES,Valencia,Pendiente,2024-02-15 15:00:00
2498.0,1555,Laura Torres,66,Aspiradora Dyson,Hogar,10-01-2024,3.0,1732.5,5197.5,Transferencia,spain,Valencia,Entregado,2024-10-01 17:00:00
2499.0,1662,Pedro López,16,Teclado Logitech,Tecnología,08/08/2023,3.0,1961.67,5885.01,PayPal,ES,Hamburgo,Cancelado,2023-08-08 18:00:00
2500.0,1092,David Gómez,122,Mochila North Face,Accesorios,06-14-2024,2.0,821.09,1642.18,Transferencia,España,Paris,Entregado,2024-06-14 23:00:00
2501.0,1732,David Gómez,52,Mochila North Face,Accesorios,12/04/2023,1.0,1656.76,1656.76,Bizum,IT,Barcelona,Entregado,2023-04-12 21:00:00
2502.0,1210,maría garcía,13,Aspiradora Dyson,Hogar,03/09/2023,4.0,1531.41,6125.64,Bizum,España,Berlín,Entregado,2023-09-03 16:00:00
2503.0,1275,Juan Pérez,156,Samsung Galaxy,Tecnología,24/01/2023,3.0,1151.32,3453.96,Tarjeta,España,Madrid,Cancelado,2023-01-24 20:00:00
2504.0,1739,Ana Sánchez,100,Zapatillas Nike,Moda,2023-10-16,4.0,1912.53,7650.12,PayPal,Germany,Valencia,Entregado,2023-10-16 04:00:00
2505.0,1107,David Gómez,32,Silla Gaming,Hogar,10-23-2023,3.0,408.94,1226.82,Transferencia,ES,Milán,Cancelado,2023-10-23 03:00:00
2506.0,1181,David Gómez,136,Bolso Gucci,Moda,2023-05-10,5.0,227.44,1137.2,Transferencia,DE,Lyon,Pendiente,2023-05-10 15:00:00
2507.0,1775,Ana Sánchez,1,Silla Gaming,Hogar,2023-09-03,1.0,1709.38,1709.38,Bizum,DE,Paris,Cancelado,2023-09-03 12:00:00
2508.0,1845,LUCÍA FERNÁNDEZ,54,Zapatillas Nike,Moda,04-29-2023,5.0,883.91,4544.030298393707,Bizum,España,Barcelona,Pendiente,2023-04-29 07:00:00
2509.0,1896,María García,123,Zapatillas Nike,Moda,14/03/2023,4.0,1695.47,6781.88,Transferencia,ES,Lyon,Pendiente,2023-03-14 02:00:00
2510.0,1934,María García,187,Monitor LG,Tecnología,28/07/2023,1.0,1787.25,1787.25,Bizum,DE,Hamburgo,Entregado,2023-07-28 10:00:00
2511.0,1812,Lucía Fernández,106,Camiseta Adidas,Moda,2023-08-21,3.0,134.29,402.87,Bizum,FR,Madrid,Cancelado,2023-08-21 09:00:00
2512.0,1634,Pedro López,168,iPhone 13,Tecnología,08-14-2023,1.0,1768.09,1768.09,PayPal,France,Madrid,Entregado,2023-08-14 02:00:00
2513.0,1851,Pedro López,62,Aspiradora Dyson,Hogar,08/01/2023,3.0,902.15,2706.45,PayPal,España,Madrid,Cancelado,2023-01-08 21:00:00
2514.0,1571,Juan Pérez,168,Silla Gaming,Hogar,2024-04-09,4.0,1025.76,4103.04,Tarjeta,IT,Valencia,Cancelado,2024-04-09 01:00:00
2515.0,1482,María García,25,Aspiradora Dyson,Hogar,01/10/2023,1.0,1256.92,1256.92,PayPal,DE,Berlín,Cancelado,2023-10-01 07:00:00
2516.0,1760,Pedro López,165,Sony Headphones,Tecnología,11-05-2023,5.0,1853.5,9267.5,Transferencia,Germany,Berlín,Pendiente,2023-11-05 13:00:00
2517.0,1087,maría garcía,197,Reloj Casio,Accesorios,03-04-2024,2.0,48.04,96.08,Tarjeta,IT,Berlín,Entregado,2024-03-04 08:00:00
2518.0,1012,David Gómez,51,Sony Headphones,moda,16/06/2024,1.0,958.92,958.92,Bizum,DE,Valencia,Entregado,2024-06-16 02:00:00
2519.0,1422,Juan Pérez,12,Mochila North Face,Accesorios,2023-04-04,1.0,$1378.57,,Transferencia,DE,Valencia,Pendiente,2023-04-04 16:00:00
2520.0,1396,pedro lópez,146,Teclado Logitech,Tecnología,14/11/2024,3.0,1448.19,4344.57,PayPal,Italy,Lyon,Cancelado,2024-11-14 01:00:00
2521.0,1943,DAVID GÓMEZ,99,Monitor LG,Tecnología,03/07/2023,5.0,1388.14,6940.7,Transferencia,spain,Milán,Pendiente,2023-07-03 08:00:00
2522.0,1513,lucía fernández,15,Bolso Gucci,Moda,26/09/2023,3.0,277.53,832.59,Tarjeta,Germany,Hamburgo,Entregado,2023-09-26 07:00:00
2523.0,1388,Laura Torres,175,Reloj Casio,Accesorios,05-24-2023,4.0,605.8,2281.6353985716773,Tarjeta,FR,Barcelona,Entregado,2023-05-24 03:00:00
2524.0,1063,carlos ruiz,131,Mochila North Face,Accesorios,2023-06-29,2.0,723.84,1447.68,PayPal,IT,Barcelona,Pendiente,2023-06-29 14:00:00
2525.0,1753,David Gómez,51,Teclado Logitech,Tecnología,09/07/2024,1.0,1610.83,1610.83,Transferencia,FR,Roma,Entregado,2024-07-09 22:00:00
2526.0,1115,Pedro López,14,Aspiradora Dyson,Hogar,08-29-2023,3.0,564.73,1694.19,Bizum,France,Roma,Entregado,2023-08-29 09:00:00
2527.0,1325,Juan Pérez,138,MacBook Pro,Tecnología,02-15-2024,1.0,$429.3,,Transferencia,ES,Milán,Cancelado,2024-02-15 02:00:00
2528.0,1607,Ana Sánchez,78,Zapatillas Nike,Moda,2024-02-02,2.0,1915.32,3830.64,Tarjeta,IT,Madrid,Entregado,2024-02-02 06:00:00
2529.0,1438,Laura Torres,122,Monitor LG,Tecnología,01-16-2024,3.0,27.64,82.92,Transferencia,IT,Madrid,Entregado,2024-01-16 06:00:00
2530.0,1923,Pedro López,83,Cafetera Philips,Hogar,09/03/2023,1.0,1995.66,1995.66,PayPal,spain,Milán,Entregado,2023-03-09 21:00:00
2531.0,1047,Carlos Ruiz,166,Mochila North Face,Accesorios,04-08-2024,4.0,1356.87,5427.48,Transferencia,DE,Berlín,Pendiente,2024-04-08 17:00:00
2532.0,1415,PEDRO LÓPEZ,109,AirPods,Tecnología,2023-08-05,5.0,1658.65,8293.25,Bizum,France,Roma,Entregado,2023-08-05 09:00:00
2533.0,1503,Pedro López,76,Monitor LG,Tecnología,2023-05-07,5.0,596.29,2981.45,Bizum,España,Paris,Entregado,2023-05-07 21:00:00
2534.0,1200,Carlos Ruiz,90,Aspiradora Dyson,Hogar,08/02/2024,5.0,38.49,192.45,Tarjeta,ES,Roma,Cancelado,2024-02-08 23:00:00
2535.0,1083,David Gómez,6,Zapatillas Nike,tech,2023-02-17,5.0,$1478.36,,Bizum,ES,Hamburgo,Pendiente,2023-02-17 11:00:00
,1162,David Gómez,66,Monitor LG,Tecnología,2024-09-16,1.0,1669.95,1669.95,Transferencia,IT,Madrid,Pendiente,2024-09-16 19:00:00
2537.0,1720,Laura Torres,76,Sony Headphones,Tecnología,02-16-2024,5.0,1483.55,7417.75,Bizum,spain,Hamburgo,Pendiente,2024-02-16 08:00:00
2538.0,1054,Juan Pérez,163,AirPods,tech,11-12-2023,4.0,294.27,1177.08,PayPal,ES,Madrid,Cancelado,2023-11-12 21:00:00
2539.0,1360,maría garcía,97,Camiseta Adidas,Moda,03/06/2023,2.0,"1509,32",,Tarjeta,DE,Berlín,Cancelado,2023-06-03 12:00:00
2540.0,1982,María García,22,Bolso Gucci,TECHNOLOGY,04/02/2024,5.0,1540.16,7700.8,Bizum,España,Madrid,Entregado,2024-02-04 13:00:00
2541.0,1080,Lucía Fernández,194,Samsung Galaxy,Tecnología,05-17-2023,2.0,1320.5,2641.0,PayPal,spain,Madrid,Cancelado,2023-05-17 17:00:00
2542.0,1287,ANA SÁNCHEZ,140,Cafetera Philips,Hogar,08-15-2023,5.0,1534.57,8883.44976389167,Bizum,España,Barcelona,Pendiente,2023-08-15 19:00:00
2543.0,1756,Ana Sánchez,5,Bolso Gucci,Moda,26/10/2023,5.0,1693.38,8318.821541148276,Bizum,France,Madrid,Entregado,2023-10-26 17:00:00
2544.0,1709,Laura Torres,73,AirPods,tech,2024-03-27,,1231.07,,Transferencia,Germany,Roma,Pendiente,2024-03-27 16:00:00
2545.0,1306,CARLOS RUIZ,36,Silla Gaming,Hogar,21/04/2024,5.0,186.32,931.6,Tarjeta,Germany,Valencia,Entregado,2024-04-21 16:00:00
2546.0,1062,María García,40,Teclado Logitech,Tecnología,09-29-2024,5.0,980.38,4901.9,PayPal,France,Madrid,Pendiente,2024-09-29 04:00:00
2547.0,1011,ANA SÁNCHEZ,135,iPhone 13,Tecnología,2024-04-22,4.0,164.52,658.08,Bizum,DE,Milán,Pendiente,2024-04-22 04:00:00
2548.0,1683,PEDRO LÓPEZ,22,Teclado Logitech,Tecnología,07-28-2024,2.0,821.01,1642.02,Bizum,France,Paris,Entregado,2024-07-28 07:00:00
2549.0,1753,Juan Pérez,98,Bolso Gucci,Moda,01/06/2024,3.0,820.14,2460.42,Tarjeta,IT,Madrid,Entregado,2024-06-01 08:00:00
2550.0,1438,David Gómez,112,Reloj Casio,Accesorios,08-30-2023,3.0,141.36,424.08,Tarjeta,Germany,Roma,Entregado,2023-08-30 08:00:00
2551.0,1507,CARLOS RUIZ,33,Zapatillas Nike,Moda,27/09/2024,3.0,704.15,2112.45,PayPal,IT,Hamburgo,Pendiente,2024-09-27 17:00:00
2552.0,1503,Laura Torres,191,MacBook Pro,Tecnología,2024-03-24,4.0,230.89,1016.0381486565095,PayPal,España,Madrid,Cancelado,2024-03-24 20:00:00
2553.0,1969,Ana Sánchez,168,MacBook Pro,Tecnología,29/09/2023,5.0,1618.39,8091.95,Transferencia,Germany,Berlín,Cancelado,2023-09-29 11:00:00
2554.0,1320,María García,71,Aspiradora Dyson,Hogar,01-10-2023,3.0,1895.9,5687.7,PayPal,Germany,Lyon,Entregado,2023-01-10 17:00:00
2555.0,1988,Laura Torres,23,Sony Headphones,Tecnología,08-13-2023,2.0,153.91,307.82,PayPal,spain,Madrid,Pendiente,2023-08-13 11:00:00
2556.0,1640,Ana Sánchez,100,Cafetera Philips,Hogar,01/12/2024,3.0,$1910.68,,Tarjeta,Italy,Valencia,Cancelado,2024-12-01 06:00:00
2557.0,1066,maría garcía,114,MacBook Pro,Tecnología,2023-11-01,4.0,1049.93,4199.72,Bizum,ES,Hamburgo,Cancelado,2023-11-01 15:00:00
2558.0,1568,Ana Sánchez,66,Teclado Logitech,Tecnología,2024-09-17,4.0,606.14,2424.56,Bizum,spain,Hamburgo,Cancelado,2024-09-17 07:00:00
2559.0,1193,David Gómez,38,Samsung Galaxy,Tecnología,03/01/2024,1.0,"162,96",,Tarjeta,FR,Roma,Cancelado,2024-01-03 03:00:00
2560.0,1747,MARÍA GARCÍA,23,iPhone 13,Tecnología,11/03/2023,3.0,1006.24,3018.72,Transferencia,France,Lyon,Pendiente,2023-03-11 07:00:00
2561.0,1573,David Gómez,171,Aspiradora Dyson,Hogar,04-19-2023,4.0,1591.09,6364.36,Transferencia,spain,Hamburgo,Pendiente,2023-04-19 13:00:00
2562.0,1427,Carlos Ruiz,83,MacBook Pro,Tecnología,2024-04-05,5.0,1417.1,7085.5,Transferencia,ES,Milán,Cancelado,2024-04-05 06:00:00
2563.0,1792,Laura Torres,171,Silla Gaming,Moda,25/04/2024,4.0,109.95,439.8,PayPal,France,Berlín,Cancelado,2024-04-25 12:00:00
2564.0,1001,Laura Torres,180,Samsung Galaxy,TECHNOLOGY,16/01/2023,3.0,155.07,465.21,Tarjeta,España,Berlín,Entregado,2023-01-16 18:00:00
2565.0,1636,Carlos Ruiz,191,Aspiradora Dyson,Hogar,01-09-2024,2.0,811.72,1623.44,Transferencia,España,Barcelona,Cancelado,2024-01-09 00:00:00
2566.0,1547,Carlos Ruiz,121,Silla Gaming,Hogar,2023-06-05,3.0,597.63,1792.89,Tarjeta,IT,Roma,Cancelado,2023-06-05 18:00:00
2567.0,1793,María García,61,Monitor LG,Tecnología,07-28-2023,1.0,472.44,472.44,Bizum,IT,Berlín,Cancelado,2023-07-28 04:00:00
2568.0,1167,Lucía Fernández,42,Sony Headphones,Tecnología,2023-11-01,2.0,"569,2",,Tarjeta,spain,Roma,Pendiente,2023-11-01 05:00:00
2569.0,1016,Lucía Fernández,170,iPhone 13,Tecnología,2023-08-07,2.0,1608.93,3217.86,PayPal,DE,Milán,Pendiente,2023-08-07 00:00:00
2570.0,1193,Ana Sánchez,60,Sony Headphones,Tecnología,08-07-2024,5.0,1859.16,8463.576729909952,Bizum,spain,Milán,Entregado,2024-08-07 10:00:00
2571.0,1880,laura torres,77,Bolso Gucci,Moda,15/05/2023,3.0,816.15,2448.45,Bizum,DE,Berlín,Pendiente,2023-05-15 17:00:00
2572.0,1053,Ana Sánchez,191,Monitor LG,Tecnología,30/05/2023,1.0,1813.16,1813.16,PayPal,DE,Roma,Pendiente,2023-05-30 07:00:00
2573.0,1752,Lucía Fernández,1,Aspiradora Dyson,Hogar,12-23-2023,2.0,649.78,1299.56,Bizum,España,Berlín,Cancelado,2023-12-23 22:00:00
2574.0,1144,maría garcía,94,AirPods,Tecnología,04-01-2023,1.0,958.11,958.11,Bizum,spain,Madrid,Pendiente,2023-04-01 12:00:00
2575.0,1505,Lucía Fernández,2,Mochila North Face,Accesorios,08-12-2024,5.0,459.8,2299.0,Transferencia,FR,Milán,Entregado,2024-08-12 21:00:00
2576.0,1851,Juan Pérez,118,Teclado Logitech,Tecnología,13/06/2023,4.0,1284.55,5138.2,Transferencia,DE,Roma,Entregado,2023-06-13 15:00:00
2577.0,1298,Ana Sánchez,92,AirPods,Tecnología,2023-07-18,2.0,1958.17,3916.34,Bizum,Italy,Paris,Cancelado,2023-07-18 17:00:00
2578.0,1129,María García,105,Bolso Gucci,Moda,03-25-2023,1.0,1210.95,1210.95,Tarjeta,FR,Berlín,Cancelado,2023-03-25 22:00:00
2579.0,1870,David Gómez,90,Bolso Gucci,Moda,07-06-2023,4.0,722.05,2888.2,Tarjeta,France,Berlín,Entregado,2023-07-06 21:00:00
2580.0,1916,Carlos Ruiz,40,Camiseta Adidas,moda,08-15-2023,5.0,1299.16,6495.8,Tarjeta,FR,Lyon,Entregado,2023-08-15 18:00:00
2581.0,1365,ana sánchez,145,Camiseta Adidas,Moda,23/02/2024,4.0,254.61,1018.44,Transferencia,FR,Roma,Pendiente,2024-02-23 15:00:00
2582.0,1811,Carlos Ruiz,184,Teclado Logitech,HOGAR,26/07/2023,3.0,1778.43,5335.29,Transferencia,Italy,Barcelona,Pendiente,2023-07-26 04:00:00
2583.0,1842,Lucía Fernández,148,Camiseta Adidas,Moda,2023-03-30,1.0,1011.14,1011.14,Transferencia,Germany,Lyon,Cancelado,2023-03-30 12:00:00
2584.0,1060,Ana Sánchez,60,Zapatillas Nike,Moda,07-10-2024,3.0,904.21,2712.63,PayPal,DE,Valencia,Entregado,2024-07-10 00:00:00
2585.0,1625,Ana Sánchez,194,Reloj Casio,Accesorios,22/12/2023,1.0,1175.87,1175.87,PayPal,Germany,Barcelona,Pendiente,2023-12-22 17:00:00
2586.0,1796,Lucía Fernández,168,Zapatillas Nike,Moda,2023-10-24,4.0,1253.32,5013.28,Tarjeta,ES,Madrid,Entregado,2023-10-24 22:00:00
2587.0,1362,Laura Torres,51,Cafetera Philips,Hogar,2024-02-23,3.0,152.83,442.8513983392664,PayPal,Germany,Roma,Entregado,2024-02-23 08:00:00
2588.0,1292,Juan Pérez,150,Zapatillas Nike,Moda,2023-11-11,1.0,1368.41,1368.41,Tarjeta,FR,Hamburgo,Entregado,2023-11-11 23:00:00
2589.0,1254,ana sánchez,95,iPhone 13,Tecnología,2024-03-30,1.0,491.44,491.44,PayPal,ES,Hamburgo,Cancelado,2024-03-30 12:00:00
2590.0,1918,Laura Torres,113,AirPods,Tecnología,08/11/2023,1.0,1430.77,1430.77,Tarjeta,España,Paris,Pendiente,2023-11-08 13:00:00
2591.0,1720,LUCÍA FERNÁNDEZ,157,Monitor LG,Tecnología,11/02/2024,5.0,1646.84,8234.2,Tarjeta,FR,Paris,Entregado,2024-02-11 09:00:00
2592.0,1966,Carlos Ruiz,94,Silla Gaming,Hogar,2024-01-29,3.0,1609.88,4829.64,Transferencia,IT,Barcelona,Pendiente,2024-01-29 12:00:00
2593.0,1958,Laura Torres,160,Cafetera Philips,Hogar,2024-01-17,5.0,1109.48,5547.4,Tarjeta,FR,Berlín,Cancelado,2024-01-17 15:00:00
2594.0,1136,María García,135,Reloj Casio,tecnologia,10-07-2024,3.0,1045.14,3135.42,Tarjeta,España,Valencia,Cancelado,2024-10-07 02:00:00
2595.0,1168,María García,82,MacBook Pro,hogar,04-29-2023,5.0,294.32,1471.6,PayPal,FR,Valencia,Cancelado,2023-04-29 13:00:00
2596.0,1759,Ana Sánchez,126,Mochila North Face,Accesorios,12-08-2023,4.0,1552.94,6211.76,Tarjeta,FR,Madrid,Entregado,2023-12-08 04:00:00
,1413,Pedro López,17,Monitor LG,Tecnología,05-28-2023,4.0,550.1,2200.4,PayPal,España,Valencia,Pendiente,2023-05-28 10:00:00
2598.0,1158,Carlos Ruiz,112,Camiseta Adidas,Moda,2024-05-10,4.0,998.42,3993.68,Tarjeta,España,Paris,Cancelado,2024-05-10 21:00:00
2599.0,1983,Laura Torres,104,Teclado Logitech,Tecnología,2024-09-15,4.0,575.71,2302.84,Bizum,DE,Hamburgo,Cancelado,2024-09-15 13:00:00
2600.0,1600,Juan Pérez,20,Aspiradora Dyson,Hogar,24/10/2024,3.0,276.32,828.96,Tarjeta,Italy,Paris,Entregado,2024-10-24 21:00:00
2601.0,1088,Pedro López,198,Reloj Casio,Accesorios,2024-11-28,4.0,1262.82,5051.28,Tarjeta,FR,Barcelona,Entregado,2024-11-28 20:00:00
2602.0,1142,Ana Sánchez,33,Aspiradora Dyson,Moda,08-26-2024,4.0,$118.12,,PayPal,DE,Lyon,Pendiente,2024-08-26 11:00:00
2603.0,1492,LUCÍA FERNÁNDEZ,158,Samsung Galaxy,Tecnología,10-30-2024,3.0,1499.8,4878.370062373254,PayPal,ES,Lyon,Cancelado,2024-10-30 21:00:00
,1204,María García,141,AirPods,Tecnología,2024-08-29,4.0,642.0,2568.0,Transferencia,France,Roma,Cancelado,2024-08-29 03:00:00
2605.0,1003,Carlos Ruiz,133,MacBook Pro,Tecnología,16/06/2023,1.0,10.27,10.27,Bizum,ES,Milán,Cancelado,2023-06-16 22:00:00
2606.0,1013,David Gómez,60,Silla Gaming,Hogar,02-06-2023,3.0,1027.15,3081.45,Tarjeta,España,Paris,Cancelado,2023-02-06 00:00:00
2607.0,1867,Juan Pérez,124,Zapatillas Nike,HOGAR,2023-07-30,5.0,103.24,516.2,Bizum,Germany,Roma,Cancelado,2023-07-30 05:00:00
2608.0,1364,Laura Torres,164,Teclado Logitech,Tecnología,22/02/2024,4.0,559.58,2238.32,Transferencia,Italy,Roma,Cancelado,2024-02-22 03:00:00
2609.0,1379,Laura Torres,149,Samsung Galaxy,Tecnología,15/03/2023,5.0,1416.88,7084.4,Transferencia,DE,Berlín,Pendiente,2023-03-15 23:00:00
2610.0,1780,María García,163,Bolso Gucci,Moda,28/06/2024,3.0,134.75,404.25,Transferencia,IT,Hamburgo,Pendiente,2024-06-28 04:00:00
2611.0,1003,Carlos Ruiz,88,Aspiradora Dyson,Hogar,07-16-2023,5.0,$1680.28,,Transferencia,ES,Hamburgo,Pendiente,2023-07-16 02:00:00
2612.0,1531,Pedro López,199,Zapatillas Nike,Moda,2023-02-04,1.0,17.6,17.6,Bizum,IT,Milán,Entregado,2023-02-04 14:00:00
2613.0,1770,María García,79,Mochila North Face,Accesorios,2024-02-18,5.0,501.18,2505.9,PayPal,DE,Berlín,Pendiente,2024-02-18 19:00:00
2614.0,1456,MARÍA GARCÍA,50,Mochila North Face,Accesorios,10-15-2023,3.0,1484.4,4453.2,PayPal,DE,Berlín,Cancelado,2023-10-15 18:00:00
2615.0,1482,Lucía Fernández,35,Teclado Logitech,Tecnología,2023-08-21,4.0,639.38,2557.52,Tarjeta,FR,Paris,Cancelado,2023-08-21 13:00:00
2616.0,1977,Lucía Fernández,135,Aspiradora Dyson,Hogar,10/07/2024,5.0,212.77,1063.85,Bizum,spain,Milán,Entregado,2024-07-10 10:00:00
2617.0,1764,Laura Torres,30,MacBook Pro,TECHNOLOGY,2023-05-01,2.0,726.87,1453.74,Transferencia,Italy,Valencia,Pendiente,2023-05-01 17:00:00
2618.0,1041,Carlos Ruiz,155,iPhone 13,Tecnología,06/04/2023,3.0,548.08,1644.24,Transferencia,ES,Hamburgo,Cancelado,2023-04-06 06:00:00
2619.0,1378,juan pérez,13,Zapatillas Nike,moda,07/11/2024,4.0,1687.0,6748.0,PayPal,Germany,Madrid,Entregado,2024-11-07 06:00:00
2620.0,1484,Laura Torres,107,MacBook Pro,Tecnología,01/07/2023,3.0,"633,56",,Transferencia,spain,Barcelona,Cancelado,2023-07-01 12:00:00
2621.0,1324,lucía fernández,102,MacBook Pro,Tecnología,10-02-2023,2.0,1579.98,3159.96,Tarjeta,Germany,Madrid,Entregado,2023-10-02 10:00:00
2622.0,1923,Laura Torres,90,Camiseta Adidas,Moda,31/10/2024,2.0,1784.83,3569.66,PayPal,spain,Valencia,Entregado,2024-10-31 23:00:00
2623.0,1564,Lucía Fernández,5,Zapatillas Nike,Moda,10-29-2023,3.0,"873,3",,PayPal,España,Roma,Pendiente,2023-10-29 01:00:00
2624.0,1674,Carlos Ruiz,51,Aspiradora Dyson,Hogar,10-30-2024,5.0,"1820,79",,Bizum,spain,Hamburgo,Cancelado,2024-10-30 02:00:00
2625.0,1649,David Gómez,123,Monitor LG,Tecnología,22/03/2023,4.0,760.86,3043.44,Transferencia,France,Milán,Cancelado,2023-03-22 00:00:00
2626.0,1621,Pedro López,4,Reloj Casio,Accesorios,14/06/2023,3.0,1928.52,5785.56,Transferencia,IT,Berlín,Cancelado,2023-06-14 16:00:00
2627.0,1182,Juan Pérez,58,Reloj Casio,Accesorios,02-13-2024,2.0,187.69,367.2450607702325,PayPal,Italy,Madrid,Cancelado,2024-02-13 18:00:00
2628.0,1882,Laura Torres,7,iPhone 13,Tecnología,2023-06-12,3.0,1377.17,4131.51,Transferencia,spain,Lyon,Cancelado,2023-06-12 15:00:00
2629.0,1653,PEDRO LÓPEZ,197,Zapatillas Nike,Moda,08-06-2023,5.0,992.69,4963.45,Tarjeta,Germany,Lyon,Pendiente,2023-08-06 17:00:00
2630.0,1736,Ana Sánchez,155,Samsung Galaxy,Tecnología,2023-10-30,4.0,781.42,2566.9278311957187,Bizum,IT,Valencia,Cancelado,2023-10-30 15:00:00
2631.0,1274,LUCÍA FERNÁNDEZ,86,Cafetera Philips,Hogar,16/08/2024,1.0,1269.1,1269.1,Tarjeta,France,Madrid,Pendiente,2024-08-16 15:00:00
2632.0,1166,Pedro López,35,Sony Headphones,Tecnología,19/02/2023,3.0,1410.68,4232.04,Tarjeta,Italy,Roma,Entregado,2023-02-19 16:00:00
2633.0,1328,laura torres,162,Samsung Galaxy,Tecnología,01/09/2023,1.0,18.68,18.68,Tarjeta,spain,Paris,Cancelado,2023-09-01 18:00:00
2634.0,1112,Pedro López,133,iPhone 13,Tecnología,03-29-2023,1.0,342.24,342.24,Tarjeta,IT,Valencia,Entregado,2023-03-29 15:00:00
2635.0,1025,Pedro López,77,iPhone 13,Tecnología,01-26-2023,4.0,$1428.96,,Transferencia,DE,Valencia,Pendiente,2023-01-26 14:00:00
2636.0,1000,Lucía Fernández,138,AirPods,Tecnología,08-31-2024,4.0,1336.11,5344.44,Bizum,spain,Madrid,Cancelado,2024-08-31 19:00:00
2637.0,1974,Ana Sánchez,155,Zapatillas Nike,Moda,26/12/2023,4.0,1932.43,7729.72,PayPal,FR,Milán,Cancelado,2023-12-26 11:00:00
2638.0,1005,Lucía Fernández,118,Mochila North Face,Accesorios,2023-05-28,2.0,1524.47,3048.94,Bizum,FR,Barcelona,Pendiente,2023-05-28 09:00:00
2639.0,1392,LAURA TORRES,149,Monitor LG,Tecnología,2023-04-18,3.0,1902.04,5706.12,PayPal,FR,Barcelona,Entregado,2023-04-18 22:00:00
2640.0,1928,María García,129,Reloj Casio,Accesorios,17/07/2024,4.0,1408.06,5632.24,Transferencia,ES,Barcelona,Entregado,2024-07-17 08:00:00
2641.0,1180,maría garcía,97,Reloj Casio,Accesorios,2023-10-14,4.0,603.12,2412.48,Bizum,FR,Lyon,Cancelado,2023-10-14 02:00:00
2642.0,1084,Juan Pérez,22,Zapatillas Nike,Moda,04/12/2023,3.0,219.68,659.04,Transferencia,France,Valencia,Pendiente,2023-12-04 13:00:00
2643.0,1350,pedro lópez,171,Teclado Logitech,Tecnología,07-16-2024,4.0,$1565.83,,Tarjeta,FR,Roma,Entregado,2024-07-16 20:00:00
2644.0,1730,Pedro López,119,AirPods,Tecnología,04-28-2024,1.0,$1291.86,,Bizum,France,Madrid,Pendiente,2024-04-28 21:00:00
2645.0,1654,MARÍA GARCÍA,35,iPhone 13,Tecnología,18/05/2024,2.0,105.89,211.78,Bizum,Germany,Hamburgo,Pendiente,2024-05-18 17:00:00
2646.0,1530,Pedro López,80,Reloj Casio,Accesorios,2024-10-04,3.0,726.5,2179.5,Bizum,España,Madrid,Entregado,2024-10-04 20:00:00
2647.0,1319,Lucía Fernández,167,Bolso Gucci,Moda,01-23-2023,4.0,$1914.03,,Transferencia,spain,Madrid,Entregado,2023-01-23 07:00:00
2648.0,1250,David Gómez,9,AirPods,Tecnología,04-20-2023,2.0,1005.8,2011.6,Bizum,España,Berlín,Pendiente,2023-04-20 03:00:00
2649.0,1315,Juan Pérez,17,Camiseta Adidas,HOGAR,2023-04-24,5.0,871.13,4355.65,Transferencia,France,Hamburgo,Cancelado,2023-04-24 21:00:00
2650.0,1029,Pedro López,155,Bolso Gucci,Moda,04-24-2024,3.0,920.82,2762.46,Transferencia,Italy,Madrid,Entregado,2024-04-24 20:00:00
2651.0,1577,Pedro López,45,Zapatillas Nike,Moda,22/04/2024,1.0,425.68,425.68,PayPal,France,Madrid,Entregado,2024-04-22 16:00:00
2652.0,1519,David Gómez,65,Bolso Gucci,Moda,2023-01-28,1.0,$743.73,,Tarjeta,Italy,Madrid,Entregado,2023-01-28 00:00:00
2653.0,1394,Carlos Ruiz,184,Monitor LG,Tecnología,29/01/2024,4.0,745.93,2859.2524958971117,Transferencia,FR,Paris,Pendiente,2024-01-29 13:00:00
2654.0,1228,Juan Pérez,120,AirPods,Tecnología,2023-02-26,1.0,114.19,114.19,Tarjeta,FR,Lyon,Entregado,2023-02-26 22:00:00
2655.0,1716,María García,178,Bolso Gucci,Moda,04/09/2023,2.0,1537.46,3074.92,Tarjeta,DE,Valencia,Cancelado,2023-09-04 05:00:00
2656.0,1258,DAVID GÓMEZ,25,Teclado Logitech,Tecnología,06-22-2024,4.0,838.84,3355.36,Transferencia,DE,Hamburgo,Entregado,2024-06-22 15:00:00
2657.0,1022,María García,11,iPhone 13,Tecnología,09/09/2024,4.0,1646.14,6584.56,Bizum,France,Barcelona,Cancelado,2024-09-09 22:00:00
2658.0,1182,David Gómez,170,Monitor LG,Tecnología,08-08-2023,3.0,1702.19,5106.57,PayPal,Germany,Berlín,Pendiente,2023-08-08 10:00:00
2659.0,1246,Carlos Ruiz,167,Teclado Logitech,Tecnología,19/03/2023,5.0,431.87,2248.5139961179057,Bizum,Italy,Barcelona,Entregado,2023-03-19 12:00:00
2660.0,1572,Laura Torres,152,Sony Headphones,Tecnología,07-23-2023,3.0,1318.13,3954.39,Bizum,Italy,Hamburgo,Entregado,2023-07-23 19:00:00
2661.0,1601,Lucía Fernández,184,Cafetera Philips,Hogar,26/08/2024,5.0,949.84,3975.9149530938985,Transferencia,FR,Hamburgo,Cancelado,2024-08-26 17:00:00
2662.0,1676,María García,56,Cafetera Philips,Hogar,2024-06-21,2.0,1761.51,3523.02,Transferencia,FR,Milán,Pendiente,2024-06-21 06:00:00
2663.0,1880,Carlos Ruiz,84,Camiseta Adidas,Moda,20/10/2024,5.0,"439,32",,Bizum,FR,Barcelona,Pendiente,2024-10-20 10:00:00
2664.0,1176,David Gómez,67,Sony Headphones,Tecnología,08/01/2024,4.0,1358.85,5435.4,Tarjeta,ES,Milán,Entregado,2024-01-08 07:00:00
2665.0,1508,JUAN PÉREZ,121,Mochila North Face,Accesorios,2024-03-29,1.0,1219.43,1219.43,Tarjeta,FR,Milán,Cancelado,2024-03-29 14:00:00
2666.0,1382,Juan Pérez,28,Teclado Logitech,Tecnología,2023-08-16,3.0,597.65,1792.95,Transferencia,Germany,Madrid,Entregado,2023-08-16 00:00:00
2667.0,1463,Carlos Ruiz,107,MacBook Pro,Tecnología,2023-05-25,1.0,281.84,281.84,Bizum,spain,Lyon,Entregado,2023-05-25 03:00:00
2668.0,1708,laura torres,37,Sony Headphones,Tecnología,28/11/2024,4.0,1306.76,5227.04,Bizum,ES,Milán,Entregado,2024-11-28 18:00:00
2669.0,1916,Laura Torres,58,Aspiradora Dyson,Hogar,2024-10-24,1.0,1479.81,1479.81,Transferencia,FR,Madrid,Entregado,2024-10-24 07:00:00
2670.0,1579,Carlos Ruiz,127,Silla Gaming,Hogar,2023-08-26,1.0,638.1,638.1,Tarjeta,ES,Valencia,Pendiente,2023-08-26 22:00:00
2671.0,1396,Ana Sánchez,93,iPhone 13,Tecnología,11-05-2023,2.0,1293.22,2586.44,PayPal,DE,Berlín,Pendiente,2023-11-05 16:00:00
2672.0,1205,María García,45,Monitor LG,Tecnología,30/09/2024,5.0,796.31,3981.55,PayPal,France,Roma,Pendiente,2024-09-30 07:00:00
2673.0,1149,Ana Sánchez,43,Silla Gaming,Hogar,2023-05-01,5.0,1429.28,7146.4,Bizum,ES,Paris,Pendiente,2023-05-01 11:00:00
2674.0,1622,PEDRO LÓPEZ,16,Cafetera Philips,Hogar,2024-05-23,2.0,406.44,812.88,PayPal,France,Barcelona,Pendiente,2024-05-23 20:00:00
2675.0,1689,David Gómez,53,Bolso Gucci,Moda,02/04/2024,5.0,1781.53,8907.65,Transferencia,DE,Milán,Cancelado,2024-04-02 12:00:00
2676.0,1755,Lucía Fernández,2,iPhone 13,Tecnología,2023-02-12,4.0,581.95,2327.8,PayPal,DE,Madrid,Entregado,2023-02-12 19:00:00
2677.0,1119,LAURA TORRES,15,Teclado Logitech,Tecnología,06-15-2023,5.0,741.89,3709.45,Transferencia,ES,Milán,Entregado,2023-06-15 16:00:00
2678.0,1327,David Gómez,83,Cafetera Philips,HOGAR,31/01/2024,5.0,125.6,628.0,Tarjeta,FR,Paris,Pendiente,2024-01-31 01:00:00
2679.0,1510,Laura Torres,37,iPhone 13,Tecnología,2024-02-11,3.0,231.91,695.73,PayPal,ES,Lyon,Entregado,2024-02-11 17:00:00
2680.0,1049,pedro lópez,15,Bolso Gucci,tecnologia,06-20-2024,2.0,1036.57,2073.14,Transferencia,IT,Berlín,Pendiente,2024-06-20 02:00:00
2681.0,1730,Laura Torres,64,Teclado Logitech,Tecnología,01/01/2024,2.0,542.51,1085.02,Transferencia,España,Roma,Entregado,2024-01-01 19:00:00
2682.0,1361,Lucía Fernández,69,Samsung Galaxy,Tecnología,30/08/2023,4.0,1672.61,6558.077910302116,Bizum,IT,Valencia,Cancelado,2023-08-30 20:00:00
2683.0,1742,Ana Sánchez,155,Camiseta Adidas,Moda,01-26-2023,5.0,39.24,196.2,Tarjeta,España,Valencia,Cancelado,2023-01-26 19:00:00
2684.0,1530,laura torres,50,Bolso Gucci,Moda,2023-09-18,1.0,764.4,764.4,PayPal,France,Hamburgo,Entregado,2023-09-18 14:00:00
2685.0,1712,Carlos Ruiz,194,iPhone 13,Tecnología,18/10/2024,5.0,681.32,3406.6,Transferencia,DE,Paris,Cancelado,2024-10-18 10:00:00
2686.0,1241,Ana Sánchez,26,MacBook Pro,Tecnología,22/04/2023,3.0,48.46,145.38,PayPal,spain,Madrid,Cancelado,2023-04-22 04:00:00
2687.0,1575,pedro lópez,13,Sony Headphones,Tecnología,13/02/2024,2.0,257.49,514.98,Bizum,Italy,Paris,Cancelado,2024-02-13 23:00:00
2688.0,1930,Ana Sánchez,19,Teclado Logitech,HOGAR,03-08-2024,4.0,833.15,3332.6,Transferencia,spain,Hamburgo,Entregado,2024-03-08 08:00:00
2689.0,1904,Lucía Fernández,108,Samsung Galaxy,Moda,14/06/2024,4.0,990.8,3963.2,Tarjeta,Germany,Paris,Entregado,2024-06-14 03:00:00
2690.0,1532,maría garcía,127,Monitor LG,Tecnología,19/09/2024,1.0,814.54,814.54,Bizum,France,Valencia,Cancelado,2024-09-19 18:00:00
2691.0,1433,Pedro López,130,Teclado Logitech,Tecnología,2023-12-09,4.0,1066.57,4266.28,Bizum,Germany,Roma,Pendiente,2023-12-09 04:00:00
2692.0,1611,Lucía Fernández,184,AirPods,hogar,2023-03-12,4.0,1194.31,4639.721332587127,Transferencia,ES,Hamburgo,Pendiente,2023-03-12 00:00:00
2693.0,1972,laura torres,32,Camiseta Adidas,Moda,2024-01-19,3.0,29.75,89.25,Transferencia,FR,Milán,Pendiente,2024-01-19 00:00:00
2694.0,1467,Carlos Ruiz,167,Sony Headphones,Tecnología,2024-04-05,1.0,$933.55,,PayPal,ES,Berlín,Pendiente,2024-04-05 22:00:00
2695.0,1295,LAURA TORRES,187,AirPods,Tecnología,28/09/2023,5.0,1927.36,9636.8,PayPal,FR,Berlín,Entregado,2023-09-28 17:00:00
2696.0,1463,Ana Sánchez,52,Aspiradora Dyson,Hogar,03-12-2023,3.0,"1042,87",,Transferencia,spain,Valencia,Cancelado,2023-03-12 18:00:00
2697.0,1723,María García,37,Aspiradora Dyson,TECHNOLOGY,05-21-2023,4.0,1358.31,5433.24,Bizum,spain,Paris,Pendiente,2023-05-21 02:00:00
2698.0,1001,María García,32,Monitor LG,Tecnología,06/11/2024,,"630,61",,PayPal,DE,Valencia,Cancelado,2024-11-06 10:00:00
2699.0,1211,LUCÍA FERNÁNDEZ,15,Cafetera Philips,Hogar,2024-02-04,2.0,1550.24,3100.48,Bizum,Italy,Lyon,Pendiente,2024-02-04 02:00:00
2700.0,1303,Laura Torres,187,Teclado Logitech,Tecnología,03/05/2024,2.0,"1548,11",,Transferencia,ES,Berlín,Pendiente,2024-05-03 05:00:00
2701.0,1864,Lucía Fernández,178,Samsung Galaxy,Tecnología,2023-04-19,1.0,1047.38,1047.38,Bizum,Germany,Berlín,Cancelado,2023-04-19 08:00:00
2702.0,1128,lucía fernández,160,MacBook Pro,Tecnología,20/02/2024,2.0,1952.27,3904.54,Tarjeta,Italy,Milán,Entregado,2024-02-20 12:00:00
2703.0,1366,JUAN PÉREZ,36,Mochila North Face,Accesorios,20/11/2024,5.0,259.84,1299.2,Transferencia,ES,Barcelona,Cancelado,2024-11-20 03:00:00
2704.0,1537,David Gómez,94,Sony Headphones,Tecnología,2023-01-31,5.0,43.73,218.65,Bizum,DE,Madrid,Pendiente,2023-01-31 08:00:00
2705.0,1642,Carlos Ruiz,183,AirPods,Tecnología,15/02/2024,4.0,1542.61,6170.44,Transferencia,Germany,Milán,Entregado,2024-02-15 07:00:00
2706.0,1700,Lucía Fernández,136,Camiseta Adidas,Moda,29/01/2023,4.0,"1616,24",,PayPal,España,Hamburgo,Cancelado,2023-01-29 08:00:00
2707.0,1890,David Gómez,11,Sony Headphones,Tecnología,2023-06-12,5.0,249.21,1246.05,PayPal,ES,Roma,Cancelado,2023-06-12 04:00:00
2708.0,1723,Pedro López,99,AirPods,Tecnología,11/07/2024,1.0,538.51,538.51,Transferencia,Italy,Paris,Cancelado,2024-07-11 13:00:00
2709.0,1989,David Gómez,144,Camiseta Adidas,Moda,2023-12-22,2.0,44.93,81.95229148335412,Bizum,France,Berlín,Entregado,2023-12-22 16:00:00
2710.0,1282,Laura Torres,114,iPhone 13,Tecnología,02-09-2024,1.0,593.68,593.68,PayPal,IT,Roma,Cancelado,2024-02-09 16:00:00
2711.0,1774,David Gómez,119,Zapatillas Nike,hogar,02/04/2024,4.0,1548.55,6194.2,Bizum,spain,Madrid,Pendiente,2024-04-02 19:00:00
2712.0,1187,Laura Torres,30,AirPods,Tecnología,11-12-2024,2.0,1040.74,2151.65677354098,PayPal,FR,Barcelona,Pendiente,2024-11-12 10:00:00
2713.0,1194,ana sánchez,103,AirPods,HOGAR,09-19-2023,3.0,702.71,2108.13,Transferencia,Italy,Valencia,Entregado,2023-09-19 05:00:00
2714.0,1144,Ana Sánchez,88,Sony Headphones,Tecnología,19/07/2023,2.0,"749,76",,PayPal,España,Lyon,Entregado,2023-07-19 22:00:00
2715.0,1732,Ana Sánchez,27,Monitor LG,Tecnología,04-21-2023,3.0,12.69,38.07,PayPal,DE,Berlín,Cancelado,2023-04-21 01:00:00
2716.0,1913,Carlos Ruiz,78,Samsung Galaxy,Tecnología,27/01/2024,5.0,606.6,3033.0,Bizum,spain,Valencia,Cancelado,2024-01-27 16:00:00
2717.0,1786,carlos ruiz,107,Reloj Casio,Accesorios,05-29-2024,3.0,$1296.45,,Tarjeta,España,Valencia,Pendiente,2024-05-29 14:00:00
2718.0,1693,María García,152,Camiseta Adidas,Moda,2023-10-24,1.0,1948.65,1948.65,PayPal,France,Berlín,Cancelado,2023-10-24 09:00:00
2719.0,1189,Juan Pérez,112,AirPods,TECHNOLOGY,28/09/2024,1.0,1695.65,1695.65,PayPal,France,Barcelona,Entregado,2024-09-28 04:00:00
2720.0,1488,Lucía Fernández,61,Bolso Gucci,Moda,03/08/2024,5.0,56.95,284.75,PayPal,España,Madrid,Pendiente,2024-08-03 12:00:00
2721.0,1154,Pedro López,87,iPhone 13,Tecnología,05-23-2023,3.0,"1798,14",,PayPal,Germany,Madrid,Cancelado,2023-05-23 20:00:00
2722.0,1978,María García,73,Samsung Galaxy,HOGAR,09-19-2024,3.0,1568.56,4705.68,PayPal,spain,Madrid,Cancelado,2024-09-19 02:00:00
2723.0,1631,Lucía Fernández,52,Reloj Casio,Accesorios,07-25-2024,4.0,1562.95,6933.302225197751,Transferencia,Italy,Lyon,Cancelado,2024-07-25 12:00:00
2724.0,1666,Laura Torres,157,Mochila North Face,Accesorios,2024-05-19,2.0,921.41,1842.82,Transferencia,DE,Milán,Pendiente,2024-05-19 05:00:00
2725.0,1263,Carlos Ruiz,35,Bolso Gucci,Moda,23/01/2024,1.0,802.03,802.03,Transferencia,Germany,Hamburgo,Cancelado,2024-01-23 16:00:00
2726.0,1942,Lucía Fernández,196,Teclado Logitech,Tecnología,2023-10-23,1.0,612.8,612.8,Transferencia,Italy,Roma,Entregado,2023-10-23 09:00:00
2727.0,1090,David Gómez,164,iPhone 13,Tecnología,08/07/2024,4.0,140.73,562.92,Transferencia,DE,Milán,Entregado,2024-07-08 10:00:00
2728.0,1128,pedro lópez,152,AirPods,Tecnología,06/05/2024,5.0,464.19,2320.95,Tarjeta,Italy,Berlín,Cancelado,2024-05-06 20:00:00
2729.0,1044,ANA SÁNCHEZ,138,iPhone 13,Tecnología,2023-10-09,1.0,500.74,500.74,Bizum,DE,Barcelona,Cancelado,2023-10-09 06:00:00
2730.0,1724,Laura Torres,5,Bolso Gucci,Moda,2024-09-25,3.0,973.31,2919.93,Transferencia,Italy,Madrid,Entregado,2024-09-25 09:00:00
2731.0,1923,Ana Sánchez,108,Reloj Casio,Accesorios,2023-05-26,1.0,1497.41,1497.41,Tarjeta,IT,Roma,Entregado,2023-05-26 01:00:00
2732.0,1020,Juan Pérez,197,Teclado Logitech,Tecnología,01/03/2023,4.0,952.88,3811.52,Bizum,España,Valencia,Entregado,2023-03-01 21:00:00
2733.0,1074,Juan Pérez,34,Monitor LG,Tecnología,06-26-2023,5.0,125.11,625.55,Tarjeta,FR,Paris,Entregado,2023-06-26 15:00:00
2734.0,1205,ana sánchez,99,iPhone 13,Tecnología,2023-12-06,2.0,1916.0,3832.0,Transferencia,España,Barcelona,Entregado,2023-12-06 00:00:00
2735.0,1701,Ana Sánchez,125,iPhone 13,Tecnología,2023-03-12,2.0,1886.02,3772.04,Transferencia,spain,Roma,Pendiente,2023-03-12 19:00:00
2736.0,1852,david gómez,140,Mochila North Face,Accesorios,01/03/2024,1.0,"1572,53",0.0,Tarjeta,Germany,Berlín,Pendiente,2024-03-01 18:00:00
2737.0,1448,PEDRO LÓPEZ,12,Monitor LG,Tecnología,2023-08-17,4.0,1982.74,7930.96,Bizum,DE,Berlín,Cancelado,2023-08-17 10:00:00
2738.0,1109,Lucía Fernández,106,iPhone 13,Tecnología,06-21-2023,4.0,1093.52,4374.08,PayPal,IT,Valencia,Entregado,2023-06-21 14:00:00
2739.0,1328,Carlos Ruiz,116,AirPods,Tecnología,2023-12-15,1.0,1925.91,1925.91,PayPal,Germany,Paris,Cancelado,2023-12-15 11:00:00
2740.0,1640,ANA SÁNCHEZ,175,Bolso Gucci,Moda,28/10/2023,3.0,160.45,481.35,PayPal,FR,Valencia,Cancelado,2023-10-28 06:00:00
2741.0,1546,Carlos Ruiz,12,Zapatillas Nike,Moda,05-08-2024,4.0,737.7,2950.8,Tarjeta,Italy,Hamburgo,Pendiente,2024-05-08 05:00:00
2742.0,1882,Juan Pérez,73,Silla Gaming,Hogar,2023-06-15,5.0,458.51,2292.55,PayPal,Italy,Lyon,Pendiente,2023-06-15 02:00:00
2743.0,1475,Pedro López,147,Silla Gaming,Hogar,04/02/2023,5.0,399.71,1998.55,Transferencia,IT,Barcelona,Cancelado,2023-02-04 09:00:00
2744.0,1345,Juan Pérez,49,iPhone 13,Tecnología,2023-05-08,1.0,290.2,290.2,PayPal,FR,Lyon,Entregado,2023-05-08 13:00:00
2745.0,1436,Pedro López,82,Silla Gaming,Hogar,01/04/2023,4.0,1248.6,4994.4,Tarjeta,España,Roma,Pendiente,2023-04-01 04:00:00
2746.0,1774,Lucía Fernández,45,Sony Headphones,Tecnología,05/09/2023,2.0,1564.83,3129.66,Transferencia,DE,Paris,Entregado,2023-09-05 19:00:00
2747.0,1549,Ana Sánchez,119,Samsung Galaxy,Tecnología,2023-06-25,3.0,1160.81,3482.43,Tarjeta,Italy,Hamburgo,Entregado,2023-06-25 07:00:00
2748.0,1945,CARLOS RUIZ,65,Samsung Galaxy,Tecnología,2023-10-21,3.0,302.46,907.38,Tarjeta,FR,Berlín,Cancelado,2023-10-21 08:00:00
2749.0,1940,Pedro López,177,Monitor LG,Tecnología,28/10/2023,4.0,1624.14,6496.56,Bizum,España,Barcelona,Entregado,2023-10-28 16:00:00
2750.0,1604,María García,124,Mochila North Face,Accesorios,08-16-2023,4.0,1275.55,5102.2,Tarjeta,spain,Lyon,Entregado,2023-08-16 08:00:00
2751.0,1787,Pedro López,111,MacBook Pro,tecnologia,2024-03-03,2.0,782.45,1564.9,Bizum,spain,Barcelona,Pendiente,2024-03-03 09:00:00
2752.0,1818,Laura Torres,30,AirPods,Tecnología,10-13-2024,5.0,1351.52,6757.6,PayPal,spain,Lyon,Cancelado,2024-10-13 06:00:00
2753.0,1428,Pedro López,115,MacBook Pro,Tecnología,02-10-2023,1.0,527.21,527.21,Transferencia,España,Madrid,Pendiente,2023-02-10 15:00:00
2754.0,1885,Carlos Ruiz,120,iPhone 13,Tecnología,11/08/2023,1.0,696.93,696.93,Bizum,IT,Berlín,Entregado,2023-08-11 10:00:00
2755.0,1313,Laura Torres,3,Bolso Gucci,Moda,28/01/2024,3.0,1835.8,5507.4,Transferencia,spain,Paris,Cancelado,2024-01-28 07:00:00
2756.0,1005,Laura Torres,198,AirPods,Tecnología,15/03/2024,2.0,588.1,1176.2,PayPal,Italy,Madrid,Pendiente,2024-03-15 01:00:00
2757.0,1976,Laura Torres,176,Sony Headphones,Tecnología,02-12-2023,3.0,945.28,2719.199882293269,Bizum,Italy,Berlín,Entregado,2023-02-12 12:00:00
2758.0,1956,Lucía Fernández,107,Zapatillas Nike,HOGAR,14/03/2023,2.0,1781.38,3562.76,PayPal,FR,Berlín,Entregado,2023-03-14 00:00:00
2759.0,1275,Juan Pérez,190,AirPods,Tecnología,06-16-2024,3.0,1418.37,4255.11,Transferencia,DE,Madrid,Pendiente,2024-06-16 20:00:00
2760.0,1612,PEDRO LÓPEZ,51,Camiseta Adidas,Moda,07-02-2023,4.0,133.78,535.12,Bizum,IT,Madrid,Cancelado,2023-07-02 11:00:00
2761.0,1333,Juan Pérez,4,Cafetera Philips,tech,12/02/2023,2.0,303.13,606.26,Transferencia,DE,Barcelona,Entregado,2023-02-12 07:00:00
2762.0,1923,Ana Sánchez,164,Camiseta Adidas,moda,04/05/2023,4.0,25.6,102.4,Tarjeta,France,Valencia,Entregado,2023-05-04 06:00:00
2763.0,1884,David Gómez,106,Sony Headphones,Tecnología,08-06-2024,4.0,1265.53,5062.12,Tarjeta,Italy,Milán,Entregado,2024-08-06 07:00:00
2764.0,1741,María García,61,Samsung Galaxy,Tecnología,2023-05-30,1.0,900.87,900.87,Bizum,IT,Milán,Entregado,2023-05-30 23:00:00
2765.0,1404,Laura Torres,175,Teclado Logitech,Tecnología,16/06/2024,5.0,$277.21,0.0,PayPal,IT,Hamburgo,Pendiente,2024-06-16 13:00:00
2766.0,1331,David Gómez,88,Camiseta Adidas,Moda,25/08/2024,1.0,1916.29,1662.3110018111613,Bizum,ES,Valencia,Pendiente,2024-08-25 03:00:00
2767.0,1775,María García,1,Bolso Gucci,Moda,05/01/2024,3.0,1064.02,3192.06,Tarjeta,ES,Lyon,Cancelado,2024-01-05 21:00:00
2768.0,1907,Pedro López,88,Silla Gaming,Hogar,10-27-2023,1.0,491.37,491.37,Transferencia,FR,Valencia,Cancelado,2023-10-27 11:00:00
2769.0,1224,Laura Torres,142,Zapatillas Nike,Moda,02/04/2024,1.0,1006.2,1006.2,Tarjeta,France,Hamburgo,Cancelado,2024-04-02 03:00:00
2770.0,1916,LAURA TORRES,35,Samsung Galaxy,HOGAR,01-15-2024,2.0,1362.44,2811.399167659512,Bizum,France,Milán,Entregado,2024-01-15 00:00:00
2771.0,1010,David Gómez,90,Monitor LG,Tecnología,23/07/2023,5.0,161.72,808.6,Bizum,spain,Madrid,Cancelado,2023-07-23 14:00:00
2772.0,1565,pedro lópez,120,Mochila North Face,Accesorios,2023-03-11,2.0,556.66,1113.32,Bizum,Italy,Valencia,Cancelado,2023-03-11 12:00:00
2773.0,1079,carlos ruiz,76,Aspiradora Dyson,TECHNOLOGY,01/10/2024,4.0,$1615.86,,PayPal,Italy,Berlín,Cancelado,2024-10-01 17:00:00
2774.0,1654,María García,132,Teclado Logitech,tech,2023-01-13,2.0,924.73,1849.46,Bizum,France,Barcelona,Pendiente,2023-01-13 19:00:00
2775.0,1548,Pedro López,112,Cafetera Philips,tecnologia,2023-10-24,3.0,1097.69,3293.07,Tarjeta,FR,Hamburgo,Entregado,2023-10-24 22:00:00
2776.0,1266,Pedro López,107,AirPods,Tecnología,03/10/2023,4.0,"871,3",,PayPal,ES,Roma,Cancelado,2023-10-03 01:00:00
2777.0,1902,Laura Torres,123,Sony Headphones,Tecnología,2024-08-25,5.0,97.36,481.551585029832,Tarjeta,IT,Lyon,Entregado,2024-08-25 17:00:00
2778.0,1190,Juan Pérez,151,Teclado Logitech,Tecnología,07-17-2023,4.0,339.84,1359.36,PayPal,France,Berlín,Cancelado,2023-07-17 04:00:00
2779.0,1530,Pedro López,59,Sony Headphones,tech,2023-04-18,1.0,896.63,896.63,Bizum,IT,Hamburgo,Cancelado,2023-04-18 21:00:00
2780.0,1178,Carlos Ruiz,30,Camiseta Adidas,Moda,2023-01-03,1.0,426.28,426.28,Tarjeta,DE,Berlín,Entregado,2023-01-03 14:00:00
2781.0,1942,CARLOS RUIZ,182,Samsung Galaxy,Tecnología,2024-08-17,5.0,109.46,547.3,Transferencia,España,Madrid,Entregado,2024-08-17 18:00:00
2782.0,1546,Laura Torres,128,Aspiradora Dyson,Hogar,2023-01-23,4.0,1688.86,6755.44,PayPal,France,Milán,Pendiente,2023-01-23 20:00:00
2783.0,1857,María García,182,Camiseta Adidas,Moda,07-18-2023,4.0,$1962.57,,PayPal,ES,Berlín,Entregado,2023-07-18 18:00:00
2784.0,1111,LUCÍA FERNÁNDEZ,134,AirPods,Tecnología,10-21-2024,3.0,1588.35,4765.05,Bizum,DE,Paris,Entregado,2024-10-21 23:00:00
2785.0,1038,ANA SÁNCHEZ,150,iPhone 13,Tecnología,2023-09-16,3.0,1709.03,5127.09,Tarjeta,Germany,Lyon,Pendiente,2023-09-16 00:00:00
2786.0,1028,LUCÍA FERNÁNDEZ,46,MacBook Pro,Tecnología,15/10/2024,4.0,491.53,1966.12,PayPal,DE,Valencia,Entregado,2024-10-15 01:00:00
2787.0,1797,Lucía Fernández,133,Teclado Logitech,Tecnología,02/07/2023,5.0,1921.65,9608.25,Tarjeta,IT,Berlín,Cancelado,2023-07-02 23:00:00
2788.0,1902,Ana Sánchez,130,iPhone 13,Tecnología,29/02/2024,2.0,401.88,803.76,Transferencia,IT,Roma,Pendiente,2024-02-29 15:00:00
2789.0,1580,ANA SÁNCHEZ,96,AirPods,Tecnología,03-25-2023,2.0,1903.35,3806.7,PayPal,FR,Valencia,Entregado,2023-03-25 07:00:00
2790.0,1006,María García,77,Teclado Logitech,Tecnología,06/12/2023,2.0,1989.69,3979.38,PayPal,spain,Lyon,Pendiente,2023-12-06 21:00:00
2791.0,1939,David Gómez,161,iPhone 13,Tecnología,26/08/2023,5.0,1426.33,7131.65,Tarjeta,DE,Lyon,Entregado,2023-08-26 19:00:00
2792.0,1844,Ana Sánchez,15,Bolso Gucci,Moda,05/06/2023,5.0,1962.48,9812.4,Tarjeta,ES,Paris,Pendiente,2023-06-05 08:00:00
2793.0,1357,Juan Pérez,109,Mochila North Face,tech,12/12/2023,4.0,"1143,38",,Transferencia,Germany,Milán,Pendiente,2023-12-12 04:00:00
2794.0,1209,juan pérez,150,AirPods,Tecnología,05-22-2024,5.0,526.49,2632.45,PayPal,France,Madrid,Entregado,2024-05-22 07:00:00
2795.0,1014,Lucía Fernández,181,Aspiradora Dyson,Hogar,2023-02-10,,879.62,,Bizum,FR,Lyon,Entregado,2023-02-10 04:00:00
2796.0,1074,Pedro López,64,Monitor LG,Tecnología,2023-07-10,1.0,1191.19,1191.19,Transferencia,spain,Berlín,Cancelado,2023-07-10 05:00:00
2797.0,1526,lucía fernández,135,Aspiradora Dyson,Moda,09/09/2024,4.0,155.43,621.72,Bizum,Germany,Lyon,Pendiente,2024-09-09 15:00:00
2798.0,1824,David Gómez,78,Camiseta Adidas,Moda,08-30-2024,2.0,1248.46,2496.92,Tarjeta,Germany,Barcelona,Cancelado,2024-08-30 12:00:00
2799.0,1323,Laura Torres,99,Zapatillas Nike,Moda,03-15-2023,2.0,1962.54,3925.08,Bizum,France,Milán,Cancelado,2023-03-15 03:00:00
2800.0,1876,CARLOS RUIZ,73,Bolso Gucci,Moda,03-29-2024,3.0,388.31,1164.93,Tarjeta,DE,Milán,Entregado,2024-03-29 08:00:00
2801.0,1396,María García,42,Teclado Logitech,Tecnología,29/12/2023,4.0,$1587.26,,PayPal,France,Milán,Entregado,2023-12-29 05:00:00
2802.0,1356,Lucía Fernández,114,Silla Gaming,Hogar,2024-08-09,5.0,1816.72,9083.6,Tarjeta,DE,Milán,Pendiente,2024-08-09 10:00:00
2803.0,1524,Ana Sánchez,50,Zapatillas Nike,Moda,03/06/2024,2.0,1887.97,3775.94,Tarjeta,IT,Valencia,Pendiente,2024-06-03 19:00:00
2804.0,1419,Lucía Fernández,157,Mochila North Face,Accesorios,2024-07-21,2.0,1920.67,3841.34,PayPal,ES,Lyon,Cancelado,2024-07-21 14:00:00
2805.0,1059,Carlos Ruiz,61,MacBook Pro,Tecnología,07/06/2024,3.0,1047.7,3143.1,Tarjeta,Germany,Valencia,Pendiente,2024-06-07 00:00:00
2806.0,1228,Lucía Fernández,4,Reloj Casio,Accesorios,2023-01-06,3.0,1954.84,5864.52,PayPal,ES,Milán,Cancelado,2023-01-06 18:00:00
2807.0,1519,ANA SÁNCHEZ,15,AirPods,Tecnología,2023-06-12,4.0,$1517.05,,Bizum,España,Milán,Pendiente,2023-06-12 21:00:00
2808.0,1441,Ana Sánchez,23,Silla Gaming,Hogar,2023-11-08,2.0,331.73,663.46,Bizum,IT,Berlín,Cancelado,2023-11-08 00:00:00
2809.0,1035,Ana Sánchez,172,Samsung Galaxy,Tecnología,04-29-2023,4.0,959.03,3836.12,PayPal,FR,Barcelona,Entregado,2023-04-29 02:00:00
2810.0,1956,Pedro López,183,AirPods,Tecnología,2024-04-13,1.0,1439.48,1439.48,PayPal,spain,Valencia,Entregado,2024-04-13 08:00:00
2811.0,1990,Pedro López,193,Monitor LG,Tecnología,21/04/2024,5.0,502.21,2511.05,PayPal,Germany,Berlín,Entregado,2024-04-21 06:00:00
2812.0,1613,DAVID GÓMEZ,73,Monitor LG,HOGAR,18/11/2024,5.0,1284.82,6424.1,Transferencia,IT,Valencia,Pendiente,2024-11-18 14:00:00
2813.0,1178,Pedro López,95,Sony Headphones,Tecnología,2024-04-11,4.0,1336.53,6392.193874859337,Tarjeta,DE,Milán,Pendiente,2024-04-11 17:00:00
2814.0,1464,juan pérez,192,Mochila North Face,Accesorios,12/02/2023,2.0,333.77,667.54,PayPal,Germany,Paris,Cancelado,2023-02-12 23:00:00
2815.0,1922,Juan Pérez,116,Samsung Galaxy,Tecnología,29/02/2024,3.0,1134.52,3403.56,Tarjeta,Italy,Hamburgo,Cancelado,2024-02-29 06:00:00
2816.0,1890,david gómez,175,Reloj Casio,HOGAR,16/06/2024,1.0,1545.54,1545.54,Transferencia,France,Paris,Entregado,2024-06-16 19:00:00
2817.0,1424,maría garcía,44,Sony Headphones,Tecnología,03-26-2023,3.0,1002.8,3008.4,Bizum,ES,Paris,Cancelado,2023-03-26 15:00:00
2818.0,1884,maría garcía,21,iPhone 13,Tecnología,2024-01-03,1.0,34.09,34.09,Bizum,Germany,Lyon,Cancelado,2024-01-03 11:00:00
2819.0,1290,Carlos Ruiz,66,Aspiradora Dyson,Hogar,2023-09-03,5.0,27.99,139.95,Transferencia,Italy,Barcelona,Entregado,2023-09-03 03:00:00
2820.0,1509,PEDRO LÓPEZ,176,iPhone 13,Tecnología,2023-06-18,5.0,720.49,3602.45,PayPal,IT,Lyon,Pendiente,2023-06-18 16:00:00
2821.0,1839,Lucía Fernández,117,Reloj Casio,Accesorios,24/11/2023,3.0,1853.13,5559.39,Bizum,IT,Berlín,Cancelado,2023-11-24 00:00:00
2822.0,1956,David Gómez,197,Cafetera Philips,Hogar,2024-06-11,5.0,"465,07",,Transferencia,France,Valencia,Cancelado,2024-06-11 16:00:00
2823.0,1661,María García,81,Camiseta Adidas,Moda,30/06/2024,3.0,1272.38,3817.14,PayPal,IT,Berlín,Cancelado,2024-06-30 04:00:00
2824.0,1986,Juan Pérez,112,Reloj Casio,Accesorios,2024-06-03,5.0,$451.93,,PayPal,España,Madrid,Entregado,2024-06-03 11:00:00
2825.0,1596,María García,93,Sony Headphones,Tecnología,01-12-2023,4.0,650.12,2600.48,Transferencia,IT,Berlín,Pendiente,2023-01-12 17:00:00
2826.0,1769,María García,14,Reloj Casio,Accesorios,02-10-2023,5.0,1697.6,9362.171608723635,Bizum,ES,Valencia,Entregado,2023-02-10 19:00:00
2827.0,1376,Laura Torres,92,Teclado Logitech,Tecnología,2024-10-28,3.0,1460.43,4381.29,Tarjeta,DE,Berlín,Entregado,2024-10-28 14:00:00
2828.0,1539,David Gómez,62,Samsung Galaxy,Tecnología,02/10/2023,2.0,199.84,399.68,Bizum,Italy,Paris,Pendiente,2023-10-02 15:00:00
2829.0,1840,María García,111,Samsung Galaxy,Tecnología,11-06-2023,5.0,863.12,4315.6,Tarjeta,spain,Roma,Cancelado,2023-11-06 04:00:00
2830.0,1952,Pedro López,56,Teclado Logitech,Tecnología,2024-11-10,2.0,68.05,161.4151006528191,PayPal,Italy,Paris,Pendiente,2024-11-10 01:00:00
2831.0,1436,María García,48,Bolso Gucci,tech,2024-01-08,4.0,966.97,3867.88,Transferencia,IT,Milán,Entregado,2024-01-08 03:00:00
2832.0,1419,Lucía Fernández,15,Cafetera Philips,Hogar,2024-08-25,1.0,1328.24,1328.24,Transferencia,IT,Paris,Entregado,2024-08-25 07:00:00
2833.0,1536,Carlos Ruiz,52,Reloj Casio,Accesorios,12/10/2023,5.0,245.82,1229.1,Transferencia,spain,Valencia,Pendiente,2023-10-12 06:00:00
2834.0,1115,Laura Torres,88,Samsung Galaxy,TECHNOLOGY,04-25-2023,3.0,$584.88,,Bizum,Italy,Berlín,Pendiente,2023-04-25 14:00:00
2835.0,1007,Ana Sánchez,58,AirPods,Tecnología,2024-09-10,3.0,801.69,2790.1801999373074,PayPal,Germany,Barcelona,Cancelado,2024-09-10 09:00:00
2836.0,1478,maría garcía,134,Cafetera Philips,Hogar,2024-02-25,5.0,1839.87,9199.35,Transferencia,France,Roma,Entregado,2024-02-25 20:00:00
2837.0,1564,Pedro López,85,Monitor LG,Tecnología,10-23-2024,5.0,1986.58,9932.9,Transferencia,Germany,Valencia,Pendiente,2024-10-23 10:00:00
2838.0,1790,Carlos Ruiz,76,iPhone 13,Tecnología,19/05/2023,1.0,99.37,99.37,Transferencia,DE,Barcelona,Entregado,2023-05-19 11:00:00
2839.0,1450,Pedro López,38,Samsung Galaxy,Tecnología,10/03/2024,2.0,1524.41,3048.82,Tarjeta,spain,Berlín,Entregado,2024-03-10 08:00:00
2840.0,1832,juan pérez,60,Monitor LG,Tecnología,29/06/2023,4.0,749.73,2998.92,PayPal,Germany,Hamburgo,Cancelado,2023-06-29 08:00:00
2841.0,1636,Pedro López,27,AirPods,Tecnología,2023-05-16,3.0,790.99,2372.97,Tarjeta,ES,Valencia,Entregado,2023-05-16 18:00:00
2842.0,1310,Juan Pérez,90,Bolso Gucci,Moda,2023-02-26,3.0,1510.99,4342.3852714341,Bizum,Italy,Madrid,Pendiente,2023-02-26 20:00:00
2843.0,1834,Laura Torres,23,Teclado Logitech,tech,29/08/2024,2.0,1837.67,3675.34,Bizum,Germany,Berlín,Entregado,2024-08-29 14:00:00
2844.0,1670,DAVID GÓMEZ,167,Reloj Casio,Accesorios,07-19-2023,2.0,1902.35,3804.7,PayPal,IT,Paris,Pendiente,2023-07-19 06:00:00
2845.0,1161,Lucía Fernández,110,Samsung Galaxy,Tecnología,2023-08-05,4.0,1158.47,4633.88,Bizum,ES,Valencia,Pendiente,2023-08-05 18:00:00
2846.0,1195,laura torres,134,AirPods,Tecnología,10/01/2024,2.0,$720.67,,PayPal,FR,Barcelona,Entregado,2024-01-10 13:00:00
2847.0,1089,Carlos Ruiz,97,Mochila North Face,Accesorios,13/07/2023,3.0,1577.22,4731.66,PayPal,Germany,Berlín,Entregado,2023-07-13 15:00:00
2848.0,1431,Carlos Ruiz,77,Zapatillas Nike,Moda,04-30-2023,4.0,509.49,2037.96,Bizum,DE,Roma,Pendiente,2023-04-30 21:00:00
2849.0,1558,Laura Torres,2,Silla Gaming,Hogar,2023-03-14,3.0,1132.51,3104.948571824473,PayPal,FR,Valencia,Entregado,2023-03-14 18:00:00
2850.0,1615,Carlos Ruiz,61,Monitor LG,Tecnología,09-11-2024,2.0,723.57,1447.14,Bizum,Italy,Milán,Cancelado,2024-09-11 12:00:00
2851.0,1259,David Gómez,19,Aspiradora Dyson,Hogar,2023-12-03,5.0,1316.7,6583.5,Transferencia,Italy,Milán,Cancelado,2023-12-03 15:00:00
2852.0,1236,LUCÍA FERNÁNDEZ,6,Teclado Logitech,Tecnología,01-18-2024,2.0,488.39,976.78,Tarjeta,Italy,Valencia,Cancelado,2024-01-18 08:00:00
2853.0,1829,Laura Torres,43,Silla Gaming,Hogar,11-15-2024,2.0,391.27,782.54,PayPal,ES,Roma,Entregado,2024-11-15 16:00:00
2854.0,1508,Pedro López,66,Sony Headphones,Tecnología,2023-10-28,4.0,1837.3,5984.654394393123,Tarjeta,ES,Valencia,Cancelado,2023-10-28 21:00:00
2855.0,1122,Laura Torres,12,Teclado Logitech,TECHNOLOGY,2024-08-22,1.0,212.59,212.59,Tarjeta,España,Milán,Pendiente,2024-08-22 04:00:00
2856.0,1435,Pedro López,108,Aspiradora Dyson,Hogar,13/07/2023,5.0,1016.86,5084.3,Tarjeta,Germany,Roma,Cancelado,2023-07-13 22:00:00
2857.0,1136,Lucía Fernández,129,Zapatillas Nike,Moda,03-06-2023,4.0,449.5,1798.0,Transferencia,DE,Milán,Cancelado,2023-03-06 07:00:00
2858.0,1563,David Gómez,158,MacBook Pro,Tecnología,03/07/2023,5.0,87.47,455.09336745207054,Bizum,IT,Valencia,Pendiente,2023-07-03 12:00:00
2859.0,1987,lucía fernández,184,MacBook Pro,Tecnología,09-08-2023,5.0,81.68,408.4,Bizum,Italy,Roma,Cancelado,2023-09-08 14:00:00
2860.0,1368,Juan Pérez,110,Aspiradora Dyson,tecnologia,18/11/2024,5.0,358.69,1793.45,PayPal,Germany,Roma,Cancelado,2024-11-18 16:00:00
2861.0,1798,Carlos Ruiz,64,Teclado Logitech,Tecnología,2024-07-20,4.0,1734.87,6939.48,Bizum,Germany,Paris,Entregado,2024-07-20 19:00:00
2862.0,1057,Lucía Fernández,105,Bolso Gucci,Moda,01-02-2023,1.0,572.13,572.13,Transferencia,Italy,Lyon,Cancelado,2023-01-02 00:00:00
2863.0,1081,Pedro López,149,Monitor LG,Tecnología,07-05-2023,3.0,1901.41,5704.23,Tarjeta,Italy,Paris,Pendiente,2023-07-05 01:00:00
2864.0,1961,Ana Sánchez,119,Mochila North Face,Accesorios,06-07-2023,3.0,1167.43,3502.29,Bizum,Italy,Hamburgo,Entregado,2023-06-07 10:00:00
2865.0,1970,Pedro López,87,Silla Gaming,Hogar,05-27-2024,3.0,878.86,3115.0627334433875,Tarjeta,España,Hamburgo,Cancelado,2024-05-27 17:00:00
2866.0,1730,ANA SÁNCHEZ,180,Monitor LG,Tecnología,2024-07-27,4.0,1164.38,4657.52,Bizum,Italy,Berlín,Cancelado,2024-07-27 18:00:00
2867.0,1406,María García,108,Samsung Galaxy,Tecnología,2023-04-26,5.0,1038.23,5191.15,Tarjeta,Germany,Milán,Cancelado,2023-04-26 15:00:00
2868.0,1049,Carlos Ruiz,37,Sony Headphones,Tecnología,10-20-2023,4.0,1519.96,6079.84,PayPal,ES,Barcelona,Pendiente,2023-10-20 08:00:00
2869.0,1420,Pedro López,176,Aspiradora Dyson,Hogar,2024-02-01,5.0,572.17,2860.85,Tarjeta,France,Hamburgo,Cancelado,2024-02-01 02:00:00
2870.0,1328,Lucía Fernández,77,Teclado Logitech,Tecnología,13/05/2023,1.0,712.57,712.57,Tarjeta,IT,Lyon,Pendiente,2023-05-13 17:00:00
2871.0,1274,Ana Sánchez,5,AirPods,Tecnología,2024-10-05,3.0,1789.25,5367.75,Transferencia,FR,Lyon,Pendiente,2024-10-05 11:00:00
2872.0,1923,María García,123,Bolso Gucci,Moda,2023-08-31,2.0,1893.45,3786.9,Bizum,spain,Berlín,Cancelado,2023-08-31 23:00:00
2873.0,1637,Juan Pérez,170,Sony Headphones,Tecnología,27/08/2024,3.0,"1786,19",,Bizum,ES,Madrid,Entregado,2024-08-27 14:00:00
2874.0,1996,Pedro López,89,AirPods,Tecnología,2024-08-11,4.0,844.7,3378.8,Bizum,ES,Hamburgo,Entregado,2024-08-11 00:00:00
2875.0,1885,Juan Pérez,88,Camiseta Adidas,Moda,2024-05-18,1.0,1562.93,1562.93,Transferencia,France,Hamburgo,Entregado,2024-05-18 22:00:00
2876.0,1433,lucía fernández,75,Teclado Logitech,Tecnología,15/03/2024,2.0,957.91,1915.82,Bizum,España,Roma,Cancelado,2024-03-15 19:00:00
2877.0,1204,maría garcía,112,Sony Headphones,Tecnología,11-25-2023,5.0,1000.1,5000.5,PayPal,ES,Paris,Pendiente,2023-11-25 06:00:00
2878.0,1936,Pedro López,195,Cafetera Philips,Hogar,2024-08-19,3.0,417.31,1251.93,Bizum,España,Berlín,Pendiente,2024-08-19 16:00:00
2879.0,1081,Carlos Ruiz,138,Camiseta Adidas,Moda,10-04-2023,4.0,"1186,35",,Transferencia,Germany,Berlín,Entregado,2023-10-04 12:00:00
2880.0,1208,María García,188,Cafetera Philips,Hogar,11/11/2024,1.0,380.41,380.41,PayPal,Germany,Hamburgo,Pendiente,2024-11-11 14:00:00
2881.0,1405,Juan Pérez,140,Reloj Casio,Accesorios,12/03/2024,2.0,669.81,1339.62,Bizum,Italy,Hamburgo,Pendiente,2024-03-12 23:00:00
2882.0,1021,David Gómez,189,AirPods,Tecnología,25/01/2024,2.0,1711.51,3423.02,Transferencia,ES,Milán,Pendiente,2024-01-25 23:00:00
2883.0,1953,Lucía Fernández,99,Samsung Galaxy,tecnologia,08/03/2023,3.0,422.08,1266.24,Transferencia,France,Valencia,Entregado,2023-03-08 20:00:00
2884.0,1526,Lucía Fernández,114,Cafetera Philips,Hogar,02-27-2023,4.0,151.6,606.4,PayPal,FR,Valencia,Pendiente,2023-02-27 01:00:00
2885.0,1883,Laura Torres,114,Cafetera Philips,Hogar,2023-12-26,5.0,"147,33",,Bizum,Italy,Barcelona,Cancelado,2023-12-26 08:00:00
2886.0,1997,Pedro López,169,Aspiradora Dyson,Hogar,2024-10-03,1.0,1882.16,1882.16,Transferencia,Germany,Berlín,Pendiente,2024-10-03 13:00:00
2887.0,1998,ANA SÁNCHEZ,100,Samsung Galaxy,Tecnología,31/05/2023,3.0,1018.77,3056.31,Transferencia,España,Roma,Pendiente,2023-05-31 09:00:00
2888.0,1249,Juan Pérez,109,MacBook Pro,TECHNOLOGY,2023-02-21,2.0,824.73,1649.46,Transferencia,Germany,Barcelona,Cancelado,2023-02-21 19:00:00
2889.0,1544,Juan Pérez,140,Sony Headphones,Moda,09-10-2024,4.0,1623.65,6494.6,PayPal,Germany,Milán,Entregado,2024-09-10 22:00:00
2890.0,1977,Laura Torres,191,Monitor LG,Tecnología,2023-08-14,1.0,1673.29,1413.6681242693887,Transferencia,Italy,Hamburgo,Pendiente,2023-08-14 18:00:00
2891.0,1348,LUCÍA FERNÁNDEZ,92,Mochila North Face,moda,2024-06-02,4.0,671.06,2684.24,Transferencia,Germany,Valencia,Cancelado,2024-06-02 00:00:00
2892.0,1058,Ana Sánchez,25,Sony Headphones,Tecnología,06-18-2023,2.0,$1390.3,,Bizum,DE,Lyon,Cancelado,2023-06-18 11:00:00
2893.0,1547,ANA SÁNCHEZ,164,Cafetera Philips,Hogar,2023-05-31,3.0,1544.53,4633.59,Transferencia,DE,Barcelona,Entregado,2023-05-31 00:00:00
2894.0,1515,Juan Pérez,59,MacBook Pro,Tecnología,29/01/2023,4.0,1312.75,5251.0,Tarjeta,Italy,Paris,Cancelado,2023-01-29 03:00:00
2895.0,1530,Lucía Fernández,117,Mochila North Face,Accesorios,01-19-2023,2.0,311.67,623.34,Bizum,DE,Paris,Cancelado,2023-01-19 20:00:00
2896.0,1503,María García,143,Samsung Galaxy,Tecnología,28/02/2024,3.0,1753.01,4505.011612530299,Bizum,spain,Paris,Cancelado,2024-02-28 09:00:00
2897.0,1978,Lucía Fernández,112,AirPods,Tecnología,2023-08-06,4.0,$1082.8,,PayPal,spain,Roma,Entregado,2023-08-06 11:00:00
2898.0,1365,David Gómez,92,iPhone 13,Tecnología,14/11/2023,3.0,572.12,1716.36,PayPal,spain,Paris,Cancelado,2023-11-14 16:00:00
2899.0,1475,Pedro López,23,Bolso Gucci,Moda,07/03/2023,1.0,856.2,856.2,Transferencia,spain,Valencia,Cancelado,2023-03-07 09:00:00
2900.0,1557,Lucía Fernández,40,Aspiradora Dyson,Hogar,2024-05-01,5.0,84.77,423.85,Bizum,Italy,Berlín,Entregado,2024-05-01 18:00:00
2901.0,1175,David Gómez,140,Cafetera Philips,Hogar,10-24-2024,1.0,264.45,264.45,PayPal,ES,Barcelona,Cancelado,2024-10-24 21:00:00
2902.0,1162,maría garcía,143,Mochila North Face,Accesorios,2024-01-06,5.0,1533.44,7667.2,Transferencia,ES,Valencia,Pendiente,2024-01-06 03:00:00
2903.0,1444,David Gómez,99,Teclado Logitech,Tecnología,2024-04-21,3.0,"10,02",,Tarjeta,FR,Milán,Cancelado,2024-04-21 09:00:00
2904.0,1760,Juan Pérez,106,Zapatillas Nike,Moda,2024-03-03,1.0,838.97,838.97,Bizum,FR,Madrid,Entregado,2024-03-03 08:00:00
2905.0,1601,Laura Torres,8,Camiseta Adidas,Moda,11-07-2023,2.0,1049.8,2099.6,Transferencia,DE,Valencia,Cancelado,2023-11-07 01:00:00
2906.0,1803,Lucía Fernández,111,Sony Headphones,Tecnología,31/07/2024,4.0,118.72,474.88,Transferencia,IT,Milán,Entregado,2024-07-31 01:00:00
2907.0,1642,MARÍA GARCÍA,4,Reloj Casio,Accesorios,13/11/2024,4.0,1946.43,6407.890145655203,Transferencia,FR,Roma,Entregado,2024-11-13 10:00:00
2908.0,1458,Laura Torres,33,Bolso Gucci,Moda,02-01-2023,4.0,459.99,1839.96,Bizum,España,Roma,Cancelado,2023-02-01 16:00:00
2909.0,1648,Carlos Ruiz,177,Zapatillas Nike,Moda,29/12/2023,3.0,615.36,1846.08,Transferencia,spain,Valencia,Cancelado,2023-12-29 10:00:00
2910.0,1057,Laura Torres,37,Reloj Casio,Accesorios,2024-08-08,2.0,614.85,1229.7,Tarjeta,DE,Paris,Cancelado,2024-08-08 10:00:00
2911.0,1935,Laura Torres,47,Cafetera Philips,Hogar,03-02-2023,1.0,468.53,468.53,PayPal,España,Milán,Cancelado,2023-03-02 08:00:00
2912.0,1832,Juan Pérez,187,Cafetera Philips,Hogar,2023-02-11,2.0,12.93,25.86,PayPal,spain,Milán,Entregado,2023-02-11 16:00:00
2913.0,1758,Lucía Fernández,43,Bolso Gucci,Moda,19/12/2023,,1461.4,,Transferencia,España,Berlín,Cancelado,2023-12-19 12:00:00
2914.0,1138,Laura Torres,167,AirPods,Tecnología,19/02/2023,1.0,1934.02,1934.02,Tarjeta,France,Valencia,Entregado,2023-02-19 11:00:00
2915.0,1707,LAURA TORRES,74,Monitor LG,Tecnología,2024-08-11,1.0,456.34,456.34,Tarjeta,DE,Lyon,Pendiente,2024-08-11 08:00:00
2916.0,1168,Carlos Ruiz,129,iPhone 13,Tecnología,04-17-2024,1.0,1329.46,1329.46,Transferencia,ES,Berlín,Cancelado,2024-04-17 00:00:00
2917.0,1463,María García,54,AirPods,Tecnología,23/02/2024,4.0,1486.37,5945.48,Bizum,IT,Roma,Pendiente,2024-02-23 04:00:00
2918.0,1055,CARLOS RUIZ,189,Mochila North Face,Accesorios,22/10/2023,1.0,1698.37,1950.5969418587451,Bizum,IT,Berlín,Entregado,2023-10-22 08:00:00
2919.0,1759,David Gómez,111,Cafetera Philips,Hogar,19/07/2023,1.0,851.03,851.03,Transferencia,Germany,Paris,Cancelado,2023-07-19 12:00:00
2920.0,1889,María García,114,Sony Headphones,Tecnología,22/01/2023,4.0,612.83,2451.32,Transferencia,spain,Paris,Entregado,2023-01-22 20:00:00
2921.0,1176,laura torres,97,Cafetera Philips,Hogar,2024-09-20,3.0,657.34,1972.02,Tarjeta,spain,Barcelona,Pendiente,2024-09-20 17:00:00
2922.0,1532,Carlos Ruiz,179,Camiseta Adidas,Moda,28/03/2024,5.0,1428.12,7140.6,Transferencia,ES,Lyon,Cancelado,2024-03-28 21:00:00
2923.0,1640,Juan Pérez,15,Cafetera Philips,Hogar,16/04/2023,3.0,1635.39,4906.17,PayPal,ES,Barcelona,Entregado,2023-04-16 22:00:00
2924.0,1862,Laura Torres,43,Monitor LG,Tecnología,28/06/2024,2.0,371.41,742.82,Tarjeta,España,Milán,Pendiente,2024-06-28 07:00:00
2925.0,1520,Carlos Ruiz,180,Silla Gaming,Hogar,2024-03-23,3.0,748.17,2244.51,PayPal,France,Hamburgo,Cancelado,2024-03-23 21:00:00
2926.0,1645,maría garcía,6,AirPods,Tecnología,2023-06-13,3.0,1804.86,5414.58,Bizum,ES,Madrid,Pendiente,2023-06-13 01:00:00
2927.0,1483,Ana Sánchez,73,AirPods,Tecnología,2024-08-11,5.0,1615.32,8076.6,Bizum,España,Madrid,Pendiente,2024-08-11 08:00:00
2928.0,1191,María García,124,iPhone 13,Tecnología,2024-09-23,5.0,$1969.87,,PayPal,spain,Lyon,Pendiente,2024-09-23 15:00:00
2929.0,1090,María García,82,AirPods,Tecnología,06-22-2024,1.0,1510.95,1510.95,Bizum,Italy,Roma,Cancelado,2024-06-22 19:00:00
2930.0,1521,Ana Sánchez,107,Bolso Gucci,Moda,2024-05-22,2.0,792.46,1584.92,Transferencia,España,Berlín,Pendiente,2024-05-22 10:00:00
2931.0,1440,Juan Pérez,149,Bolso Gucci,Moda,2024-11-06,1.0,1185.37,1185.37,Bizum,spain,Paris,Cancelado,2024-11-06 15:00:00
2932.0,1335,David Gómez,2,Samsung Galaxy,Tecnología,2024-05-23,5.0,1325.42,6627.1,Bizum,ES,Hamburgo,Cancelado,2024-05-23 17:00:00
2933.0,1773,Carlos Ruiz,59,MacBook Pro,Tecnología,11/03/2023,5.0,166.13,830.65,Transferencia,España,Lyon,Entregado,2023-03-11 19:00:00
2934.0,1639,david gómez,187,Teclado Logitech,Tecnología,2024-04-18,1.0,1093.55,1093.55,Bizum,spain,Madrid,Pendiente,2024-04-18 20:00:00
2935.0,1134,lucía fernández,46,MacBook Pro,Tecnología,2024-09-26,5.0,1421.55,7685.523861707003,PayPal,FR,Hamburgo,Cancelado,2024-09-26 09:00:00
2936.0,1584,Lucía Fernández,110,Mochila North Face,Accesorios,2023-11-03,3.0,342.97,1028.91,Tarjeta,FR,Hamburgo,Entregado,2023-11-03 06:00:00
2937.0,1248,Ana Sánchez,120,Bolso Gucci,Moda,08/01/2023,2.0,1563.46,3126.92,Bizum,DE,Berlín,Cancelado,2023-01-08 14:00:00
2938.0,1148,ana sánchez,149,Cafetera Philips,Hogar,16/09/2024,3.0,1171.71,3515.13,PayPal,España,Valencia,Pendiente,2024-09-16 19:00:00
2939.0,1740,DAVID GÓMEZ,176,Silla Gaming,Hogar,06/10/2023,1.0,$1904.92,,Bizum,España,Berlín,Pendiente,2023-10-06 09:00:00
2940.0,1831,LAURA TORRES,87,iPhone 13,Tecnología,2023-07-12,5.0,94.42,472.1,Bizum,España,Milán,Entregado,2023-07-12 20:00:00
2941.0,1861,Juan Pérez,110,Reloj Casio,Accesorios,05-23-2023,3.0,538.0,1614.0,Tarjeta,ES,Paris,Pendiente,2023-05-23 16:00:00
2942.0,1145,Carlos Ruiz,49,iPhone 13,Tecnología,28/05/2024,1.0,1207.09,1207.09,Transferencia,spain,Hamburgo,Entregado,2024-05-28 06:00:00
2943.0,1455,David Gómez,11,Silla Gaming,Hogar,11-14-2023,,600.15,,PayPal,France,Milán,Pendiente,2023-11-14 13:00:00
2944.0,1030,Juan Pérez,150,Teclado Logitech,Tecnología,04-27-2024,5.0,1431.7,7644.572081318243,Bizum,France,Valencia,Cancelado,2024-04-27 13:00:00
2945.0,1214,Carlos Ruiz,27,Teclado Logitech,Tecnología,2024-06-12,1.0,1520.42,1520.42,Tarjeta,IT,Hamburgo,Entregado,2024-06-12 18:00:00
2946.0,1115,María García,90,Silla Gaming,Hogar,17/03/2024,5.0,214.01,1070.05,Tarjeta,Germany,Milán,Entregado,2024-03-17 18:00:00
2947.0,1418,laura torres,56,Aspiradora Dyson,TECHNOLOGY,2023-11-02,4.0,1032.57,4130.28,Bizum,IT,Roma,Entregado,2023-11-02 13:00:00
2948.0,1191,JUAN PÉREZ,48,Teclado Logitech,Tecnología,04-24-2024,5.0,1022.69,5113.45,PayPal,DE,Berlín,Entregado,2024-04-24 16:00:00
2949.0,1163,Carlos Ruiz,144,Camiseta Adidas,Moda,2024-01-07,3.0,744.87,2234.61,PayPal,ES,Berlín,Entregado,2024-01-07 02:00:00
2950.0,1466,Pedro López,190,Sony Headphones,Tecnología,31/05/2023,5.0,1866.52,9332.6,PayPal,FR,Madrid,Pendiente,2023-05-31 09:00:00
2951.0,1235,Laura Torres,117,Monitor LG,Tecnología,10/07/2024,1.0,1656.74,1656.74,PayPal,España,Milán,Entregado,2024-07-10 18:00:00
2952.0,1313,María García,186,Sony Headphones,Tecnología,2024-03-24,5.0,1397.45,6987.25,Bizum,spain,Milán,Pendiente,2024-03-24 08:00:00
2953.0,1628,Laura Torres,192,Aspiradora Dyson,Hogar,12/06/2023,1.0,1431.51,1431.51,Bizum,Germany,Paris,Cancelado,2023-06-12 04:00:00
2954.0,1106,Laura Torres,82,Aspiradora Dyson,Hogar,04-20-2023,2.0,928.82,1857.64,Tarjeta,FR,Hamburgo,Entregado,2023-04-20 23:00:00
2955.0,1484,Carlos Ruiz,106,Bolso Gucci,Moda,31/03/2024,2.0,1842.78,3685.56,Bizum,FR,Milán,Cancelado,2024-03-31 07:00:00
2956.0,1295,lucía fernández,93,Sony Headphones,Tecnología,04/08/2023,2.0,1392.24,3322.204596362911,PayPal,IT,Berlín,Pendiente,2023-08-04 22:00:00
2957.0,1726,Juan Pérez,92,Reloj Casio,Accesorios,13/03/2023,5.0,1460.67,7311.157036154947,Tarjeta,IT,Milán,Cancelado,2023-03-13 13:00:00
2958.0,1691,Laura Torres,106,Mochila North Face,Accesorios,03-03-2023,4.0,1724.76,6899.04,Bizum,spain,Paris,Entregado,2023-03-03 19:00:00
2959.0,1286,Ana Sánchez,152,MacBook Pro,Tecnología,05-30-2023,3.0,555.4,1666.2,Tarjeta,IT,Hamburgo,Entregado,2023-05-30 05:00:00
2960.0,1929,Ana Sánchez,75,Bolso Gucci,tech,04-11-2024,3.0,1616.07,4848.21,Tarjeta,España,Milán,Cancelado,2024-04-11 21:00:00
2961.0,1856,Lucía Fernández,24,Silla Gaming,Hogar,06-22-2024,1.0,398.53,398.53,Tarjeta,spain,Madrid,Pendiente,2024-06-22 07:00:00
2962.0,1270,David Gómez,142,Camiseta Adidas,hogar,05-26-2023,3.0,697.23,2091.69,Tarjeta,FR,Milán,Entregado,2023-05-26 06:00:00
2963.0,1263,Carlos Ruiz,134,Samsung Galaxy,Tecnología,11-26-2024,4.0,677.86,2711.44,Transferencia,España,Berlín,Cancelado,2024-11-26 14:00:00
2964.0,1832,Ana Sánchez,61,Silla Gaming,Hogar,26/07/2024,4.0,1957.27,8418.237299640186,Transferencia,DE,Lyon,Cancelado,2024-07-26 00:00:00
2965.0,1577,juan pérez,194,Cafetera Philips,Hogar,2023-07-24,3.0,1714.51,5143.53,PayPal,FR,Lyon,Cancelado,2023-07-24 16:00:00
2966.0,1482,carlos ruiz,14,Teclado Logitech,Tecnología,2024-02-22,2.0,1405.33,2810.66,Tarjeta,Germany,Milán,Entregado,2024-02-22 16:00:00
2967.0,1160,Juan Pérez,198,Teclado Logitech,moda,19/03/2023,3.0,1456.84,4355.701938620265,Bizum,France,Valencia,Pendiente,2023-03-19 13:00:00
,1139,Carlos Ruiz,161,Teclado Logitech,moda,2024-01-01,4.0,$1128.52,,Transferencia,France,Hamburgo,Pendiente,2024-01-01 07:00:00
2969.0,1124,Ana Sánchez,111,MacBook Pro,Tecnología,2024-08-09,1.0,1894.71,1894.71,PayPal,España,Paris,Entregado,2024-08-09 23:00:00
2970.0,1181,LUCÍA FERNÁNDEZ,79,Samsung Galaxy,Tecnología,11/03/2024,2.0,997.55,1995.1,Tarjeta,España,Hamburgo,Entregado,2024-03-11 01:00:00
2971.0,1944,Lucía Fernández,12,Mochila North Face,Accesorios,10/03/2024,1.0,767.23,767.23,Tarjeta,Italy,Valencia,Pendiente,2024-03-10 02:00:00
2972.0,1276,Juan Pérez,25,Bolso Gucci,Moda,03/08/2024,2.0,334.44,668.88,Bizum,FR,Madrid,Entregado,2024-08-03 02:00:00
2973.0,1098,Juan Pérez,113,Zapatillas Nike,Moda,01-10-2023,2.0,1574.55,2606.421367170013,Bizum,España,Madrid,Cancelado,2023-01-10 12:00:00
2974.0,1226,DAVID GÓMEZ,62,AirPods,Tecnología,12-20-2023,2.0,1471.54,2943.08,PayPal,spain,Paris,Pendiente,2023-12-20 11:00:00
2975.0,1249,David Gómez,169,iPhone 13,moda,03-09-2023,5.0,774.87,3874.35,Transferencia,FR,Milán,Entregado,2023-03-09 07:00:00
2976.0,1049,María García,97,Mochila North Face,Accesorios,10/02/2023,1.0,60.13,60.13,Bizum,FR,Paris,Cancelado,2023-02-10 10:00:00
2977.0,1510,Laura Torres,48,Bolso Gucci,Moda,29/01/2024,5.0,1679.6,8398.0,Tarjeta,España,Lyon,Cancelado,2024-01-29 15:00:00
2978.0,1686,Ana Sánchez,87,AirPods,TECHNOLOGY,01-03-2024,3.0,32.72,98.16,Transferencia,spain,Madrid,Cancelado,2024-01-03 09:00:00
2979.0,1026,Juan Pérez,155,Mochila North Face,Accesorios,2023-10-22,1.0,1410.36,1410.36,Transferencia,ES,Hamburgo,Cancelado,2023-10-22 02:00:00
2980.0,1237,JUAN PÉREZ,82,Reloj Casio,Accesorios,2023-02-24,3.0,1940.81,5822.43,Bizum,spain,Lyon,Entregado,2023-02-24 18:00:00
2981.0,1844,laura torres,20,AirPods,Tecnología,01-14-2023,3.0,880.95,2642.85,Tarjeta,Italy,Berlín,Entregado,2023-01-14 06:00:00
2982.0,1476,David Gómez,22,Samsung Galaxy,Tecnología,10-17-2024,2.0,477.6,955.2,Tarjeta,Germany,Valencia,Cancelado,2024-10-17 17:00:00
2983.0,1825,María García,163,Teclado Logitech,Tecnología,05-13-2023,2.0,1412.69,2825.38,PayPal,DE,Valencia,Cancelado,2023-05-13 04:00:00
2984.0,1978,Carlos Ruiz,171,Silla Gaming,Hogar,06/10/2024,4.0,1636.09,6544.36,PayPal,Germany,Paris,Cancelado,2024-10-06 09:00:00
2985.0,1493,David Gómez,18,Mochila North Face,Accesorios,30/06/2024,3.0,1097.4,3292.2,Transferencia,FR,Barcelona,Pendiente,2024-06-30 22:00:00
2986.0,1273,Ana Sánchez,29,Sony Headphones,Tecnología,11/08/2023,4.0,1934.4,7737.6,Bizum,FR,Berlín,Entregado,2023-08-11 13:00:00
2987.0,1554,Lucía Fernández,116,MacBook Pro,Tecnología,14/04/2023,2.0,112.82,225.64,PayPal,France,Milán,Cancelado,2023-04-14 07:00:00
2988.0,1102,laura torres,193,Camiseta Adidas,Moda,04-30-2023,5.0,1014.54,5072.7,Tarjeta,IT,Roma,Entregado,2023-04-30 23:00:00
2989.0,1990,Pedro López,170,Bolso Gucci,Moda,06-17-2023,2.0,1439.72,2879.44,Bizum,Italy,Valencia,Entregado,2023-06-17 18:00:00
2990.0,1627,Laura Torres,132,Mochila North Face,Accesorios,07-16-2023,5.0,1726.65,8633.25,Tarjeta,IT,Paris,Pendiente,2023-07-16 03:00:00
2991.0,1485,Carlos Ruiz,150,iPhone 13,Tecnología,2023-03-30,4.0,366.72,1466.88,Bizum,France,Paris,Pendiente,2023-03-30 20:00:00
2992.0,1556,David Gómez,112,Camiseta Adidas,HOGAR,2023-03-25,2.0,1602.01,3204.02,Transferencia,Italy,Valencia,Entregado,2023-03-25 13:00:00
2993.0,1092,ana sánchez,180,Aspiradora Dyson,TECHNOLOGY,2024-08-19,5.0,1109.89,5549.45,Tarjeta,DE,Lyon,Cancelado,2024-08-19 13:00:00
2994.0,1175,Laura Torres,35,Teclado Logitech,Tecnología,2024-03-02,1.0,799.14,799.14,Bizum,Germany,Valencia,Entregado,2024-03-02 12:00:00
2995.0,1133,Pedro López,188,AirPods,Tecnología,01/01/2024,1.0,272.11,272.11,PayPal,France,Hamburgo,Pendiente,2024-01-01 07:00:00
2996.0,1102,David Gómez,50,MacBook Pro,Tecnología,11-05-2024,2.0,1731.94,3463.88,Tarjeta,Italy,Barcelona,Pendiente,2024-11-05 03:00:00
2997.0,1202,Laura Torres,107,Silla Gaming,Hogar,06-21-2024,4.0,$322.97,,Bizum,Germany,Madrid,Pendiente,2024-06-21 19:00:00
2998.0,1835,Pedro López,72,Zapatillas Nike,Moda,05/09/2023,3.0,626.48,1879.44,Transferencia,FR,Milán,Pendiente,2023-09-05 04:00:00
2999.0,1617,David Gómez,138,Teclado Logitech,Tecnología,12-01-2024,4.0,587.19,2348.76,Bizum,DE,Hamburgo,Cancelado,2024-12-01 19:00:00
3000.0,1059,Laura Torres,173,Aspiradora Dyson,Hogar,2023-09-20,2.0,1744.11,3488.22,Transferencia,FR,Madrid,Pendiente,2023-09-20 13:00:00
3001.0,1190,Juan Pérez,42,Samsung Galaxy,Tecnología,2024-01-08,2.0,$1348.68,,Tarjeta,Germany,Berlín,Cancelado,2024-01-08 09:00:00
3002.0,1399,David Gómez,145,Aspiradora Dyson,Hogar,25/10/2024,5.0,1595.4,7977.0,Bizum,FR,Hamburgo,Cancelado,2024-10-25 03:00:00
3003.0,1007,María García,78,Reloj Casio,Accesorios,02/11/2023,1.0,508.43,508.43,PayPal,DE,Paris,Cancelado,2023-11-02 00:00:00
,1473,María García,8,Samsung Galaxy,Tecnología,2023-10-30,2.0,1253.5,2507.0,Bizum,Italy,Madrid,Entregado,2023-10-30 15:00:00
3005.0,1519,Ana Sánchez,20,Mochila North Face,Accesorios,2023-10-09,4.0,1147.77,4591.08,PayPal,España,Barcelona,Entregado,2023-10-09 23:00:00
3006.0,1957,PEDRO LÓPEZ,61,Camiseta Adidas,Moda,04-12-2024,1.0,1667.33,1667.33,Tarjeta,IT,Paris,Cancelado,2024-04-12 12:00:00
3007.0,1103,Lucía Fernández,115,Cafetera Philips,Hogar,03-02-2024,3.0,1813.11,5439.33,Bizum,France,Milán,Pendiente,2024-03-02 13:00:00
3008.0,1131,Carlos Ruiz,59,Reloj Casio,Accesorios,22/12/2023,5.0,34.19,170.95,PayPal,Italy,Paris,Pendiente,2023-12-22 19:00:00
3009.0,1115,Laura Torres,138,Sony Headphones,Tecnología,2023-07-18,1.0,1351.3,1562.9240383020922,PayPal,DE,Hamburgo,Pendiente,2023-07-18 20:00:00
3010.0,1256,laura torres,164,Cafetera Philips,Hogar,28/01/2023,3.0,113.15,339.45,Transferencia,FR,Hamburgo,Cancelado,2023-01-28 21:00:00
3011.0,1792,David Gómez,135,Bolso Gucci,Moda,19/01/2023,1.0,1102.23,1102.23,PayPal,spain,Lyon,Pendiente,2023-01-19 01:00:00
3012.0,1394,Lucía Fernández,130,Mochila North Face,moda,09-08-2023,5.0,582.39,2911.95,PayPal,España,Paris,Pendiente,2023-09-08 15:00:00
3013.0,1398,ANA SÁNCHEZ,94,Camiseta Adidas,Moda,2023-11-24,3.0,620.49,1861.47,PayPal,Italy,Valencia,Pendiente,2023-11-24 10:00:00
3014.0,1786,Lucía Fernández,44,Aspiradora Dyson,HOGAR,30/10/2024,4.0,712.39,2849.56,Transferencia,DE,Lyon,Pendiente,2024-10-30 08:00:00
3015.0,1384,David Gómez,63,Sony Headphones,Tecnología,2024-10-25,2.0,1246.37,2492.74,Transferencia,France,Valencia,Pendiente,2024-10-25 16:00:00
3016.0,1569,Laura Torres,37,Camiseta Adidas,Moda,2024-10-15,2.0,674.76,1349.52,Tarjeta,France,Lyon,Pendiente,2024-10-15 15:00:00
3017.0,1012,Carlos Ruiz,104,Reloj Casio,Accesorios,05-09-2023,2.0,1468.07,2936.14,Tarjeta,DE,Lyon,Entregado,2023-05-09 19:00:00
3018.0,1573,Laura Torres,77,Teclado Logitech,Tecnología,12-17-2023,3.0,815.01,2445.03,Tarjeta,spain,Paris,Cancelado,2023-12-17 17:00:00
3019.0,1121,Lucía Fernández,31,MacBook Pro,Tecnología,03-17-2023,4.0,146.02,584.08,Transferencia,España,Lyon,Cancelado,2023-03-17 10:00:00
3020.0,1927,Ana Sánchez,29,Bolso Gucci,Moda,2023-01-14,1.0,1569.68,1569.68,Tarjeta,ES,Berlín,Pendiente,2023-01-14 07:00:00
3021.0,1045,LUCÍA FERNÁNDEZ,184,AirPods,Tecnología,2023-09-24,5.0,578.66,2912.934369887511,Transferencia,Italy,Lyon,Pendiente,2023-09-24 22:00:00
3022.0,1238,María García,41,Sony Headphones,Tecnología,2024-06-25,3.0,871.21,2617.650773201545,Tarjeta,Italy,Hamburgo,Pendiente,2024-06-25 02:00:00
3023.0,1533,Ana Sánchez,119,Monitor LG,Tecnología,2023-09-16,5.0,1374.03,7852.123395893555,Tarjeta,ES,Berlín,Pendiente,2023-09-16 12:00:00
3024.0,1939,Juan Pérez,196,Mochila North Face,Accesorios,07-06-2024,4.0,671.59,2686.36,PayPal,FR,Hamburgo,Entregado,2024-07-06 21:00:00
3025.0,1778,Pedro López,142,Monitor LG,Tecnología,02-25-2024,1.0,$122.61,,Transferencia,spain,Barcelona,Cancelado,2024-02-25 15:00:00
3026.0,1679,Pedro López,4,Cafetera Philips,Hogar,14/05/2024,3.0,754.1,2262.3,Bizum,ES,Milán,Cancelado,2024-05-14 00:00:00
3027.0,1814,Pedro López,30,Aspiradora Dyson,Hogar,2024-09-06,3.0,1889.45,5668.35,Bizum,DE,Roma,Pendiente,2024-09-06 07:00:00
3028.0,1729,Ana Sánchez,43,AirPods,Tecnología,10-11-2023,2.0,1287.05,2574.1,Bizum,FR,Valencia,Entregado,2023-10-11 10:00:00
3029.0,1901,CARLOS RUIZ,95,MacBook Pro,Tecnología,21/08/2024,5.0,1346.24,6731.2,Tarjeta,IT,Barcelona,Cancelado,2024-08-21 06:00:00
3030.0,1181,Lucía Fernández,164,Monitor LG,Tecnología,18/05/2024,1.0,1268.24,1268.24,Transferencia,Italy,Berlín,Cancelado,2024-05-18 22:00:00
3031.0,1545,Juan Pérez,16,Samsung Galaxy,Tecnología,24/05/2024,1.0,405.99,405.99,Tarjeta,DE,Valencia,Pendiente,2024-05-24 09:00:00
3032.0,1672,Ana Sánchez,69,Cafetera Philips,Hogar,06-13-2023,4.0,842.48,3369.92,Bizum,FR,Milán,Cancelado,2023-06-13 18:00:00
3033.0,1620,Laura Torres,70,iPhone 13,Tecnología,12/03/2024,2.0,"1504,37",,Bizum,DE,Valencia,Cancelado,2024-03-12 06:00:00
3034.0,1345,Laura Torres,113,Silla Gaming,Hogar,2024-04-23,4.0,211.73,846.92,Transferencia,FR,Madrid,Cancelado,2024-04-23 18:00:00
3035.0,1674,Pedro López,184,Zapatillas Nike,Moda,14/08/2024,4.0,562.93,2251.72,PayPal,España,Paris,Pendiente,2024-08-14 17:00:00
3036.0,1291,Ana Sánchez,78,Camiseta Adidas,Moda,2024-08-28,2.0,559.88,1119.76,Tarjeta,FR,Milán,Cancelado,2024-08-28 18:00:00
3037.0,1228,Pedro López,67,AirPods,Tecnología,02/07/2023,4.0,869.72,3478.88,Bizum,spain,Lyon,Cancelado,2023-07-02 14:00:00
3038.0,1757,Ana Sánchez,90,MacBook Pro,Tecnología,20/04/2024,3.0,1960.93,5882.79,PayPal,España,Barcelona,Entregado,2024-04-20 11:00:00
3039.0,1365,Pedro López,142,Mochila North Face,Accesorios,2024-10-29,1.0,144.33,144.33,PayPal,Germany,Milán,Pendiente,2024-10-29 10:00:00
3040.0,1231,Carlos Ruiz,149,Bolso Gucci,Moda,2023-04-18,2.0,1042.21,2084.42,Transferencia,ES,Lyon,Entregado,2023-04-18 21:00:00
3041.0,1083,Lucía Fernández,192,Camiseta Adidas,Moda,2023-04-06,1.0,366.94,366.94,Bizum,DE,Hamburgo,Entregado,2023-04-06 19:00:00
3042.0,1588,Laura Torres,193,Bolso Gucci,Moda,01-13-2023,4.0,1941.65,7766.6,Transferencia,España,Lyon,Pendiente,2023-01-13 09:00:00
3043.0,1425,Juan Pérez,5,MacBook Pro,Tecnología,21/07/2024,5.0,235.47,1177.35,Tarjeta,FR,Paris,Cancelado,2024-07-21 15:00:00
3044.0,1902,David Gómez,118,Sony Headphones,tecnologia,2023-06-11,5.0,813.17,4065.85,Bizum,Italy,Barcelona,Pendiente,2023-06-11 19:00:00
3045.0,1184,Lucía Fernández,175,Silla Gaming,Hogar,2023-09-08,2.0,1478.39,2956.78,PayPal,IT,Madrid,Cancelado,2023-09-08 22:00:00
3046.0,1681,María García,178,AirPods,Tecnología,25/05/2024,3.0,1412.06,4236.18,Transferencia,ES,Valencia,Entregado,2024-05-25 02:00:00
3047.0,1262,David Gómez,154,Teclado Logitech,Tecnología,12/12/2023,2.0,851.23,1702.46,Tarjeta,España,Paris,Pendiente,2023-12-12 05:00:00
3048.0,1645,Pedro López,160,MacBook Pro,Tecnología,07-12-2023,4.0,"699,58",,PayPal,España,Valencia,Cancelado,2023-07-12 03:00:00
3049.0,1388,Lucía Fernández,85,Bolso Gucci,Moda,14/06/2024,2.0,801.25,1602.5,Transferencia,España,Valencia,Cancelado,2024-06-14 02:00:00
3050.0,1809,María García,99,Bolso Gucci,Moda,07-16-2024,4.0,535.91,2143.64,PayPal,Italy,Milán,Cancelado,2024-07-16 04:00:00
3051.0,1113,Laura Torres,43,Cafetera Philips,Hogar,02/02/2024,4.0,418.61,1674.44,Bizum,FR,Valencia,Pendiente,2024-02-02 23:00:00
3052.0,1199,Ana Sánchez,98,iPhone 13,Tecnología,2024-08-28,5.0,971.25,4856.25,Bizum,spain,Paris,Cancelado,2024-08-28 15:00:00
3053.0,1596,Pedro López,44,Camiseta Adidas,Moda,08-17-2024,1.0,544.38,544.38,Transferencia,FR,Berlín,Entregado,2024-08-17 22:00:00
3054.0,1384,Carlos Ruiz,60,Teclado Logitech,Tecnología,02-15-2024,5.0,582.05,2910.25,Bizum,IT,Roma,Cancelado,2024-02-15 08:00:00
3055.0,1431,Juan Pérez,125,Monitor LG,Tecnología,08-29-2024,2.0,1316.94,2633.88,Tarjeta,ES,Madrid,Cancelado,2024-08-29 05:00:00
3056.0,1418,LAURA TORRES,65,MacBook Pro,Tecnología,2024-07-28,3.0,1937.39,5812.17,Bizum,France,Hamburgo,Pendiente,2024-07-28 09:00:00
3057.0,1505,Pedro López,119,Sony Headphones,Tecnología,21/07/2024,4.0,1211.24,4844.96,PayPal,ES,Madrid,Pendiente,2024-07-21 09:00:00
3058.0,1852,Lucía Fernández,134,iPhone 13,Tecnología,02/10/2024,2.0,163.19,326.38,Bizum,Italy,Paris,Cancelado,2024-10-02 11:00:00
3059.0,1523,ANA SÁNCHEZ,63,Samsung Galaxy,Tecnología,2024-05-18,3.0,160.41,481.23,PayPal,France,Barcelona,Pendiente,2024-05-18 05:00:00
3060.0,1875,maría garcía,2,Reloj Casio,moda,08-07-2023,4.0,1903.33,7613.32,Tarjeta,spain,Roma,Cancelado,2023-08-07 08:00:00
3061.0,1112,María García,178,MacBook Pro,Tecnología,2024-04-07,1.0,601.61,709.2118099489071,Transferencia,IT,Paris,Cancelado,2024-04-07 16:00:00
3062.0,1540,David Gómez,187,Camiseta Adidas,tech,05-08-2024,5.0,193.21,966.05,Tarjeta,Germany,Milán,Cancelado,2024-05-08 19:00:00
3063.0,1380,Lucía Fernández,75,Teclado Logitech,Tecnología,02-02-2024,2.0,1202.1,2404.2,Transferencia,ES,Roma,Pendiente,2024-02-02 23:00:00
3064.0,1949,Ana Sánchez,153,Samsung Galaxy,Tecnología,09-11-2023,3.0,1251.06,3753.18,Transferencia,DE,Hamburgo,Entregado,2023-09-11 19:00:00
3065.0,1777,Lucía Fernández,21,Bolso Gucci,Moda,2024-05-20,2.0,1300.52,2601.04,Bizum,ES,Berlín,Cancelado,2024-05-20 14:00:00
3066.0,1264,Pedro López,166,Monitor LG,Tecnología,2024-10-25,1.0,542.13,542.13,Bizum,spain,Barcelona,Cancelado,2024-10-25 13:00:00
3067.0,1109,Juan Pérez,182,Zapatillas Nike,Moda,11/01/2023,3.0,40.07,120.21,Transferencia,IT,Berlín,Cancelado,2023-01-11 19:00:00
3068.0,1013,Pedro López,157,iPhone 13,Tecnología,29/07/2024,4.0,1930.38,7721.52,Transferencia,Germany,Lyon,Entregado,2024-07-29 02:00:00
3069.0,1009,Lucía Fernández,34,AirPods,Tecnología,16/03/2023,5.0,$509.28,,PayPal,IT,Valencia,Cancelado,2023-03-16 08:00:00
3070.0,1564,Lucía Fernández,157,Monitor LG,Tecnología,26/08/2024,2.0,$1355.29,,PayPal,France,Hamburgo,Entregado,2024-08-26 18:00:00
3071.0,1184,Juan Pérez,134,Reloj Casio,Accesorios,05/03/2024,3.0,1416.19,4248.57,Transferencia,España,Lyon,Entregado,2024-03-05 09:00:00
3072.0,1130,María García,19,Cafetera Philips,Hogar,26/03/2024,4.0,1223.91,4895.64,Transferencia,Germany,Lyon,Cancelado,2024-03-26 07:00:00
3073.0,1745,David Gómez,120,Silla Gaming,Hogar,02/02/2023,5.0,632.69,3163.45,Bizum,DE,Roma,Pendiente,2023-02-02 20:00:00
3074.0,1654,ANA SÁNCHEZ,112,Aspiradora Dyson,Hogar,04-24-2023,4.0,549.48,2197.92,PayPal,FR,Valencia,Pendiente,2023-04-24 19:00:00
3075.0,1274,laura torres,115,Zapatillas Nike,Moda,2024-09-26,4.0,1199.36,4797.44,Transferencia,ES,Paris,Pendiente,2024-09-26 17:00:00
3076.0,1809,Pedro López,87,Samsung Galaxy,Tecnología,09-05-2023,4.0,1733.53,6934.12,PayPal,FR,Barcelona,Pendiente,2023-09-05 14:00:00
3077.0,1926,Carlos Ruiz,123,Cafetera Philips,TECHNOLOGY,23/06/2024,5.0,1894.0,9470.0,Transferencia,ES,Lyon,Entregado,2024-06-23 02:00:00
3078.0,1399,Laura Torres,193,Camiseta Adidas,Moda,25/04/2024,5.0,220.75,1103.75,Tarjeta,España,Paris,Cancelado,2024-04-25 19:00:00
3079.0,1677,Pedro López,102,Teclado Logitech,HOGAR,16/04/2023,5.0,318.11,1590.55,PayPal,IT,Madrid,Cancelado,2023-04-16 05:00:00
3080.0,1039,María García,105,Teclado Logitech,Tecnología,07-01-2023,2.0,1890.03,3639.8967524497184,Transferencia,DE,Milán,Cancelado,2023-07-01 17:00:00
3081.0,1383,Laura Torres,49,AirPods,tech,04/08/2024,2.0,1475.71,2951.42,Tarjeta,France,Hamburgo,Pendiente,2024-08-04 10:00:00
3082.0,1086,carlos ruiz,60,Cafetera Philips,Hogar,2024-07-05,5.0,1767.16,8835.8,PayPal,FR,Valencia,Entregado,2024-07-05 22:00:00
3083.0,1709,David Gómez,11,Zapatillas Nike,Moda,2023-03-02,4.0,"413,24",,Tarjeta,IT,Valencia,Entregado,2023-03-02 11:00:00
3084.0,1828,Pedro López,141,Aspiradora Dyson,Hogar,2024-03-22,3.0,1179.3,3537.9,Bizum,spain,Valencia,Entregado,2024-03-22 15:00:00
3085.0,1807,Lucía Fernández,166,iPhone 13,Tecnología,06-15-2023,5.0,1405.27,7026.35,Tarjeta,Germany,Madrid,Cancelado,2023-06-15 05:00:00
,1462,Laura Torres,58,Zapatillas Nike,Moda,01-04-2023,4.0,$1363.42,,PayPal,France,Milán,Pendiente,2023-01-04 13:00:00
3087.0,1574,Pedro López,146,Samsung Galaxy,HOGAR,06-09-2023,2.0,822.22,1644.44,PayPal,España,Valencia,Pendiente,2023-06-09 11:00:00
3088.0,1452,Carlos Ruiz,152,Mochila North Face,Accesorios,01-08-2023,3.0,40.64,121.92,PayPal,Italy,Barcelona,Pendiente,2023-01-08 12:00:00
3089.0,1954,María García,177,Bolso Gucci,moda,02/05/2024,1.0,1170.02,1170.02,Bizum,ES,Valencia,Pendiente,2024-05-02 07:00:00
3090.0,1267,Ana Sánchez,119,AirPods,tecnologia,2024-02-15,5.0,513.67,2568.35,PayPal,IT,Paris,Pendiente,2024-02-15 10:00:00
3091.0,1394,Juan Pérez,128,iPhone 13,Tecnología,03-19-2024,3.0,906.01,2718.03,Transferencia,Italy,Valencia,Entregado,2024-03-19 20:00:00
3092.0,1743,Carlos Ruiz,7,iPhone 13,Tecnología,2023-04-11,5.0,1915.59,9577.95,Bizum,FR,Paris,Pendiente,2023-04-11 01:00:00
3093.0,1306,Lucía Fernández,167,Cafetera Philips,Hogar,2023-04-12,4.0,804.08,3216.32,PayPal,ES,Paris,Entregado,2023-04-12 15:00:00
3094.0,1047,Ana Sánchez,57,Monitor LG,Tecnología,30/11/2024,4.0,1681.21,6724.84,Transferencia,spain,Paris,Cancelado,2024-11-30 16:00:00
3095.0,1645,Carlos Ruiz,41,Mochila North Face,Accesorios,03/10/2024,3.0,385.2,1155.6,Bizum,IT,Barcelona,Entregado,2024-10-03 19:00:00
3096.0,1103,María García,185,Silla Gaming,Hogar,2023-02-07,4.0,1348.2,5392.8,PayPal,Italy,Barcelona,Entregado,2023-02-07 00:00:00
3097.0,1768,Carlos Ruiz,47,Zapatillas Nike,Moda,01-31-2023,1.0,$1954.24,,PayPal,DE,Barcelona,Cancelado,2023-01-31 20:00:00
3098.0,1030,María García,154,Samsung Galaxy,Tecnología,2023-03-27,3.0,212.77,638.31,Transferencia,FR,Barcelona,Entregado,2023-03-27 11:00:00
3099.0,1409,Lucía Fernández,92,Sony Headphones,Tecnología,25/01/2023,5.0,26.56,132.8,Transferencia,spain,Valencia,Pendiente,2023-01-25 21:00:00
3100.0,1766,ana sánchez,188,Aspiradora Dyson,Hogar,04-13-2024,2.0,872.83,1836.026565132057,Bizum,España,Paris,Cancelado,2024-04-13 15:00:00
3101.0,1156,MARÍA GARCÍA,184,Reloj Casio,Accesorios,31/05/2023,3.0,194.32,582.96,Transferencia,FR,Lyon,Pendiente,2023-05-31 08:00:00
3102.0,1848,JUAN PÉREZ,66,Camiseta Adidas,Moda,17/09/2023,2.0,1499.28,2998.56,Transferencia,Germany,Barcelona,Pendiente,2023-09-17 12:00:00
3103.0,1078,david gómez,27,Mochila North Face,Accesorios,07-29-2024,4.0,1829.95,7319.8,Transferencia,DE,Hamburgo,Pendiente,2024-07-29 14:00:00
3104.0,1117,Carlos Ruiz,172,Camiseta Adidas,Moda,28/11/2023,1.0,"873,7",,Bizum,Italy,Barcelona,Pendiente,2023-11-28 23:00:00
3105.0,1421,Pedro López,151,Bolso Gucci,Moda,28/03/2024,4.0,524.84,2099.36,PayPal,ES,Valencia,Cancelado,2024-03-28 15:00:00
3106.0,1517,Juan Pérez,16,Monitor LG,Tecnología,2023-05-21,3.0,874.46,2623.38,Transferencia,France,Madrid,Pendiente,2023-05-21 05:00:00
3107.0,1446,lucía fernández,177,MacBook Pro,Tecnología,2024-11-17,,1449.66,,Transferencia,ES,Hamburgo,Pendiente,2024-11-17 11:00:00
3108.0,1848,Carlos Ruiz,87,Cafetera Philips,Hogar,17/07/2024,4.0,28.02,112.08,Tarjeta,ES,Valencia,Entregado,2024-07-17 09:00:00
3109.0,1857,DAVID GÓMEZ,64,Monitor LG,Tecnología,2024-09-01,2.0,1183.01,2366.02,Bizum,Germany,Madrid,Entregado,2024-09-01 03:00:00
3110.0,1964,María García,42,Silla Gaming,Hogar,2023-05-04,3.0,1230.45,3691.35,Transferencia,IT,Lyon,Cancelado,2023-05-04 20:00:00
3111.0,1379,Lucía Fernández,38,Camiseta Adidas,Moda,01-22-2024,1.0,1279.0,1221.7835080222917,Bizum,IT,Milán,Pendiente,2024-01-22 15:00:00
3112.0,1719,David Gómez,47,Samsung Galaxy,Tecnología,2024-02-01,4.0,491.62,1966.48,Tarjeta,DE,Paris,Cancelado,2024-02-01 03:00:00
3113.0,1936,DAVID GÓMEZ,192,Samsung Galaxy,Tecnología,2023-04-09,4.0,1430.96,5723.84,Transferencia,ES,Milán,Cancelado,2023-04-09 22:00:00
3114.0,1627,MARÍA GARCÍA,167,Mochila North Face,Accesorios,05/06/2024,1.0,191.87,191.87,PayPal,España,Barcelona,Pendiente,2024-06-05 17:00:00
3115.0,1340,David Gómez,46,Cafetera Philips,Hogar,11-08-2023,5.0,406.55,2032.75,PayPal,España,Milán,Cancelado,2023-11-08 17:00:00
3116.0,1932,María García,13,Teclado Logitech,Tecnología,01/02/2024,5.0,1756.17,8780.85,Transferencia,España,Milán,Entregado,2024-02-01 23:00:00
3117.0,1722,Lucía Fernández,169,Teclado Logitech,Tecnología,06/05/2023,2.0,1480.06,2960.12,Tarjeta,FR,Madrid,Entregado,2023-05-06 13:00:00
3118.0,1379,Lucía Fernández,157,AirPods,Tecnología,11-15-2024,1.0,37.35,36.91962372350758,Bizum,FR,Milán,Pendiente,2024-11-15 20:00:00
3119.0,1329,David Gómez,90,MacBook Pro,Tecnología,09-20-2024,5.0,504.27,2521.35,Tarjeta,France,Milán,Cancelado,2024-09-20 07:00:00
3120.0,1903,Lucía Fernández,49,Bolso Gucci,Moda,12/10/2024,5.0,436.67,2183.35,Transferencia,FR,Lyon,Cancelado,2024-10-12 01:00:00
3121.0,1686,Ana Sánchez,158,Samsung Galaxy,Tecnología,20/05/2024,5.0,548.9,2744.5,PayPal,France,Roma,Cancelado,2024-05-20 23:00:00
3122.0,1308,Lucía Fernández,40,Mochila North Face,Accesorios,06-29-2023,1.0,502.64,502.64,Bizum,FR,Valencia,Entregado,2023-06-29 02:00:00
3123.0,1984,David Gómez,129,Aspiradora Dyson,Hogar,10-08-2023,3.0,134.43,403.29,PayPal,Germany,Paris,Cancelado,2023-10-08 13:00:00
3124.0,1926,Laura Torres,186,Zapatillas Nike,Moda,26/10/2024,4.0,923.29,3165.686048276296,Tarjeta,spain,Berlín,Pendiente,2024-10-26 06:00:00
3125.0,1472,Ana Sánchez,187,Sony Headphones,Tecnología,2024-10-26,5.0,1468.14,7340.7,Tarjeta,spain,Hamburgo,Pendiente,2024-10-26 17:00:00
3126.0,1760,Pedro López,197,Cafetera Philips,Hogar,24/10/2023,4.0,"1217,4",,Tarjeta,Italy,Roma,Entregado,2023-10-24 08:00:00
3127.0,1396,Laura Torres,63,Teclado Logitech,Tecnología,05/10/2024,5.0,1349.01,6745.05,Bizum,FR,Lyon,Cancelado,2024-10-05 18:00:00
3128.0,1275,Laura Torres,99,Sony Headphones,Tecnología,2024-02-06,5.0,171.49,857.45,PayPal,España,Paris,Cancelado,2024-02-06 00:00:00
3129.0,1832,Lucía Fernández,177,MacBook Pro,Tecnología,2023-12-20,4.0,"1903,47",,Transferencia,ES,Lyon,Cancelado,2023-12-20 21:00:00
3130.0,1209,PEDRO LÓPEZ,200,Teclado Logitech,Tecnología,2023-06-22,3.0,1678.6,5035.8,Tarjeta,Italy,Paris,Pendiente,2023-06-22 06:00:00
3131.0,1943,MARÍA GARCÍA,110,MacBook Pro,Tecnología,2024-08-02,5.0,1612.13,9085.589963655199,Transferencia,ES,Berlín,Entregado,2024-08-02 01:00:00
3132.0,1793,Laura Torres,12,Aspiradora Dyson,Hogar,04-29-2024,4.0,1647.74,6590.96,PayPal,FR,Berlín,Cancelado,2024-04-29 05:00:00
3133.0,1331,JUAN PÉREZ,76,Camiseta Adidas,Moda,21/09/2023,3.0,1866.09,5598.27,Bizum,ES,Berlín,Cancelado,2023-09-21 15:00:00
3134.0,1967,María García,174,Zapatillas Nike,Moda,11/11/2023,5.0,1093.07,5465.35,Tarjeta,Germany,Valencia,Cancelado,2023-11-11 10:00:00
,1796,CARLOS RUIZ,40,Aspiradora Dyson,Hogar,2023-06-11,1.0,408.56,408.56,Tarjeta,France,Madrid,Cancelado,2023-06-11 02:00:00
3136.0,1492,María García,37,Samsung Galaxy,Tecnología,11-18-2023,3.0,1237.4,3712.2,Bizum,Germany,Lyon,Cancelado,2023-11-18 16:00:00
3137.0,1461,David Gómez,48,Zapatillas Nike,Moda,2023-03-05,2.0,1488.33,2976.66,Tarjeta,Italy,Paris,Entregado,2023-03-05 14:00:00
3138.0,1602,María García,91,iPhone 13,HOGAR,05-30-2024,3.0,1478.46,4435.38,Bizum,France,Berlín,Entregado,2024-05-30 00:00:00
3139.0,1114,Carlos Ruiz,198,Monitor LG,Tecnología,23/12/2023,3.0,1047.68,3143.04,PayPal,IT,Hamburgo,Entregado,2023-12-23 04:00:00
3140.0,1568,Laura Torres,198,iPhone 13,Tecnología,2023-11-26,4.0,146.23,584.92,Tarjeta,España,Barcelona,Entregado,2023-11-26 21:00:00
3141.0,1494,María García,143,Mochila North Face,Accesorios,2024-10-11,1.0,748.51,748.51,Bizum,España,Lyon,Cancelado,2024-10-11 09:00:00
3142.0,1875,Lucía Fernández,198,Samsung Galaxy,Tecnología,31/12/2023,4.0,1842.33,7369.32,Bizum,IT,Berlín,Cancelado,2023-12-31 13:00:00
3143.0,1866,Pedro López,190,Sony Headphones,Tecnología,2024-03-21,3.0,1173.05,3519.15,Bizum,IT,Madrid,Entregado,2024-03-21 13:00:00
3144.0,1748,ana sánchez,20,Mochila North Face,Accesorios,2023-01-16,3.0,1081.28,3243.84,Tarjeta,IT,Lyon,Cancelado,2023-01-16 00:00:00
3145.0,1506,Juan Pérez,44,Bolso Gucci,Moda,09-10-2023,1.0,"545,02",,Bizum,España,Berlín,Pendiente,2023-09-10 10:00:00
3146.0,1083,Carlos Ruiz,97,MacBook Pro,Tecnología,02-17-2023,4.0,743.21,2972.84,PayPal,FR,Hamburgo,Cancelado,2023-02-17 06:00:00
3147.0,1443,Juan Pérez,4,AirPods,Moda,08-08-2023,5.0,1791.74,8958.7,Tarjeta,France,Lyon,Entregado,2023-08-08 13:00:00
3148.0,1627,lucía fernández,157,Camiseta Adidas,Moda,2023-10-22,4.0,1336.26,5345.04,PayPal,France,Roma,Pendiente,2023-10-22 22:00:00
3149.0,1330,Laura Torres,18,Silla Gaming,Hogar,2023-08-09,5.0,1576.9,7884.5,Transferencia,Italy,Valencia,Cancelado,2023-08-09 15:00:00
3150.0,1827,david gómez,112,Cafetera Philips,Hogar,22/05/2023,3.0,914.15,2742.45,Tarjeta,España,Lyon,Cancelado,2023-05-22 20:00:00
3151.0,1708,ANA SÁNCHEZ,19,MacBook Pro,Tecnología,2024-09-09,3.0,1264.19,3792.57,PayPal,spain,Lyon,Pendiente,2024-09-09 08:00:00
3152.0,1205,María García,16,iPhone 13,Tecnología,29/08/2023,3.0,$504.28,,Transferencia,España,Madrid,Pendiente,2023-08-29 15:00:00
3153.0,1316,Pedro López,198,Zapatillas Nike,Moda,2023-10-27,4.0,1413.87,5655.48,Transferencia,spain,Roma,Entregado,2023-10-27 14:00:00
3154.0,1230,Laura Torres,195,Teclado Logitech,Tecnología,03-21-2024,2.0,860.93,1721.86,Bizum,DE,Barcelona,Pendiente,2024-03-21 15:00:00
3155.0,1539,david gómez,183,Camiseta Adidas,Moda,11-29-2023,4.0,890.67,3562.68,Transferencia,ES,Valencia,Pendiente,2023-11-29 07:00:00
3156.0,1386,david gómez,110,Silla Gaming,Hogar,07-20-2023,4.0,$1302.15,,PayPal,Italy,Barcelona,Cancelado,2023-07-20 13:00:00
3157.0,1635,Laura Torres,4,Teclado Logitech,Tecnología,03-10-2024,5.0,1873.2,9366.0,Transferencia,France,Milán,Cancelado,2024-03-10 22:00:00
3158.0,1759,Carlos Ruiz,185,Aspiradora Dyson,Hogar,2024-09-03,3.0,137.37,358.86813663312887,Transferencia,Italy,Lyon,Cancelado,2024-09-03 17:00:00
3159.0,1305,david gómez,4,Teclado Logitech,Tecnología,2024-06-10,2.0,1651.24,3302.48,Transferencia,España,Hamburgo,Cancelado,2024-06-10 14:00:00
3160.0,1008,LUCÍA FERNÁNDEZ,115,Camiseta Adidas,Moda,11-29-2024,5.0,"591,84",,Tarjeta,España,Roma,Entregado,2024-11-29 15:00:00
3161.0,1541,David Gómez,8,Cafetera Philips,Hogar,28/06/2023,4.0,893.4,3573.6,Bizum,France,Milán,Pendiente,2023-06-28 01:00:00
3162.0,1569,ana sánchez,118,AirPods,HOGAR,09/08/2024,2.0,53.61,110.86679639707867,Transferencia,France,Lyon,Pendiente,2024-08-09 19:00:00
3163.0,1972,David Gómez,115,Teclado Logitech,Tecnología,2024-06-29,1.0,609.08,609.08,Transferencia,DE,Valencia,Entregado,2024-06-29 23:00:00
3164.0,1540,Carlos Ruiz,87,MacBook Pro,Tecnología,02-06-2024,3.0,1010.24,3030.72,Bizum,Germany,Milán,Cancelado,2024-02-06 04:00:00
3165.0,1960,Juan Pérez,82,Cafetera Philips,Hogar,2023-02-01,3.0,121.79,365.37,Transferencia,France,Lyon,Cancelado,2023-02-01 07:00:00
3166.0,1334,Juan Pérez,179,MacBook Pro,Tecnología,11-17-2024,2.0,987.28,1974.56,Tarjeta,Germany,Valencia,Cancelado,2024-11-17 22:00:00
3167.0,1524,Laura Torres,116,Sony Headphones,moda,25/04/2024,4.0,1854.95,7419.8,Transferencia,Italy,Barcelona,Entregado,2024-04-25 13:00:00
3168.0,1894,Ana Sánchez,63,MacBook Pro,Tecnología,07-18-2023,3.0,219.73,659.19,PayPal,spain,Paris,Cancelado,2023-07-18 21:00:00
3169.0,1515,Pedro López,60,Cafetera Philips,Hogar,03/02/2024,1.0,1531.24,1531.24,PayPal,DE,Paris,Cancelado,2024-02-03 21:00:00
3170.0,1951,Lucía Fernández,42,Samsung Galaxy,Tecnología,25/02/2024,1.0,825.25,663.41387557624,PayPal,Italy,Hamburgo,Cancelado,2024-02-25 18:00:00
3171.0,1136,Lucía Fernández,71,Sony Headphones,Tecnología,06-27-2023,5.0,1313.8,6569.0,Transferencia,spain,Lyon,Entregado,2023-06-27 18:00:00
3172.0,1024,Ana Sánchez,139,Zapatillas Nike,Moda,05/06/2024,4.0,$527.87,,Transferencia,Italy,Berlín,Cancelado,2024-06-05 06:00:00
3173.0,1155,Carlos Ruiz,91,MacBook Pro,Tecnología,08-29-2024,3.0,327.39,1107.3166754244714,Transferencia,Germany,Lyon,Entregado,2024-08-29 21:00:00
3174.0,1861,Ana Sánchez,10,Sony Headphones,Tecnología,01-24-2023,2.0,329.32,658.64,Transferencia,France,Berlín,Entregado,2023-01-24 06:00:00
3175.0,1816,Ana Sánchez,128,Camiseta Adidas,Moda,08-07-2023,5.0,150.28,751.4,Transferencia,Germany,Valencia,Entregado,2023-08-07 21:00:00
3176.0,1772,David Gómez,113,Mochila North Face,Accesorios,05/11/2023,5.0,379.44,1897.2,PayPal,DE,Barcelona,Cancelado,2023-11-05 23:00:00
3177.0,1576,David Gómez,145,Teclado Logitech,Tecnología,2024-04-21,2.0,1331.8,2569.5633877393684,Transferencia,FR,Milán,Entregado,2024-04-21 09:00:00
3178.0,1229,Carlos Ruiz,187,Samsung Galaxy,Tecnología,03-22-2023,,1764.56,0.0,Transferencia,FR,Hamburgo,Pendiente,2023-03-22 03:00:00
3179.0,1337,María García,22,Samsung Galaxy,Tecnología,11/09/2023,1.0,1630.11,1630.11,Transferencia,Italy,Roma,Pendiente,2023-09-11 21:00:00
3180.0,1172,CARLOS RUIZ,42,Teclado Logitech,Moda,2024-02-20,4.0,1373.42,5493.68,Bizum,Italy,Lyon,Cancelado,2024-02-20 00:00:00
3181.0,1940,Juan Pérez,90,Mochila North Face,Accesorios,2024-11-22,4.0,229.76,919.04,Bizum,France,Lyon,Entregado,2024-11-22 10:00:00
3182.0,1347,David Gómez,16,Aspiradora Dyson,Hogar,10/01/2023,4.0,585.48,2341.92,Transferencia,ES,Barcelona,Cancelado,2023-01-10 05:00:00
3183.0,1518,Carlos Ruiz,95,Teclado Logitech,Tecnología,2024-01-18,1.0,626.52,626.52,Tarjeta,España,Barcelona,Entregado,2024-01-18 07:00:00
3184.0,1509,Ana Sánchez,94,Silla Gaming,moda,06-11-2023,5.0,507.41,2537.05,Bizum,France,Lyon,Entregado,2023-06-11 16:00:00
3185.0,1940,Carlos Ruiz,159,Cafetera Philips,Hogar,2023-11-19,2.0,1034.86,2069.72,Transferencia,España,Roma,Entregado,2023-11-19 21:00:00
3186.0,1762,María García,34,MacBook Pro,Tecnología,02-17-2024,2.0,1075.75,2151.5,PayPal,FR,Valencia,Cancelado,2024-02-17 20:00:00
3187.0,1709,Carlos Ruiz,81,Bolso Gucci,Moda,28/08/2024,1.0,$720.2,0.0,Tarjeta,Italy,Berlín,Entregado,2024-08-28 10:00:00
3188.0,1924,JUAN PÉREZ,146,Sony Headphones,Tecnología,2024-01-25,5.0,$714.04,,PayPal,France,Barcelona,Cancelado,2024-01-25 02:00:00
3189.0,1826,Pedro López,177,Zapatillas Nike,Moda,16/03/2024,5.0,1658.83,8294.15,Tarjeta,France,Valencia,Cancelado,2024-03-16 17:00:00
3190.0,1554,david gómez,134,Aspiradora Dyson,Hogar,05-27-2024,2.0,1580.69,3161.38,PayPal,ES,Valencia,Pendiente,2024-05-27 13:00:00
3191.0,1851,Carlos Ruiz,141,Camiseta Adidas,Moda,2024-07-11,1.0,622.51,678.9085817954237,Bizum,DE,Valencia,Entregado,2024-07-11 06:00:00
3192.0,1823,Carlos Ruiz,127,Bolso Gucci,Moda,13/07/2024,1.0,1828.44,1828.44,Transferencia,spain,Milán,Cancelado,2024-07-13 07:00:00
3193.0,1969,Laura Torres,127,Sony Headphones,Tecnología,03-31-2023,5.0,1906.1,9530.5,PayPal,spain,Milán,Pendiente,2023-03-31 09:00:00
3194.0,1943,Pedro López,153,Zapatillas Nike,Moda,08-08-2023,2.0,660.22,1320.44,Bizum,España,Barcelona,Pendiente,2023-08-08 01:00:00
3195.0,1860,laura torres,58,Reloj Casio,Accesorios,04-18-2023,3.0,715.31,2145.93,Transferencia,IT,Roma,Pendiente,2023-04-18 06:00:00
3196.0,1235,Juan Pérez,43,Reloj Casio,Accesorios,05-08-2024,1.0,1016.21,1016.21,PayPal,Italy,Berlín,Pendiente,2024-05-08 22:00:00
3197.0,1420,Ana Sánchez,184,Cafetera Philips,HOGAR,2024-01-06,5.0,1882.83,10962.671125971061,Transferencia,France,Milán,Entregado,2024-01-06 08:00:00
3198.0,1203,Pedro López,28,iPhone 13,Tecnología,11-11-2023,2.0,1753.88,3507.76,Bizum,Germany,Milán,Cancelado,2023-11-11 10:00:00
3199.0,1573,Ana Sánchez,11,Samsung Galaxy,Tecnología,09-23-2023,1.0,214.11,214.11,PayPal,spain,Milán,Cancelado,2023-09-23 05:00:00
3200.0,1870,Laura Torres,155,Teclado Logitech,Tecnología,2023-01-16,5.0,$791.53,,Bizum,ES,Hamburgo,Entregado,2023-01-16 02:00:00
3201.0,1363,Laura Torres,111,Silla Gaming,Hogar,01/03/2024,2.0,1111.21,2222.42,Tarjeta,FR,Paris,Entregado,2024-03-01 14:00:00
3202.0,1534,Carlos Ruiz,167,MacBook Pro,Tecnología,16/07/2023,1.0,1011.23,1011.23,Transferencia,IT,Valencia,Pendiente,2023-07-16 09:00:00
3203.0,1625,Carlos Ruiz,91,Monitor LG,Tecnología,01-18-2024,2.0,"395,79",,Tarjeta,spain,Paris,Entregado,2024-01-18 07:00:00
3204.0,1529,lucía fernández,31,Sony Headphones,Tecnología,12/08/2024,2.0,1719.05,3438.1,Transferencia,España,Hamburgo,Cancelado,2024-08-12 16:00:00
3205.0,1391,juan pérez,159,AirPods,Tecnología,2023-10-13,1.0,1357.11,1357.11,PayPal,IT,Berlín,Entregado,2023-10-13 17:00:00
3206.0,1094,David Gómez,50,Cafetera Philips,Hogar,27/09/2023,5.0,1677.44,8387.2,PayPal,Italy,Valencia,Cancelado,2023-09-27 15:00:00
3207.0,1095,Pedro López,28,Bolso Gucci,Moda,11-23-2023,2.0,1718.94,3437.88,Bizum,España,Berlín,Cancelado,2023-11-23 12:00:00
3208.0,1555,Lucía Fernández,33,Reloj Casio,tech,17/03/2023,5.0,1499.23,7496.15,Tarjeta,FR,Madrid,Entregado,2023-03-17 08:00:00
3209.0,1042,Laura Torres,166,Mochila North Face,Accesorios,01/05/2023,4.0,884.03,3536.12,PayPal,Italy,Berlín,Entregado,2023-05-01 18:00:00
3210.0,1772,David Gómez,153,Sony Headphones,Tecnología,22/07/2023,2.0,1224.99,2449.98,Tarjeta,France,Lyon,Entregado,2023-07-22 07:00:00
3211.0,1815,María García,10,Samsung Galaxy,Tecnología,04/10/2023,3.0,329.13,987.39,Transferencia,España,Paris,Cancelado,2023-10-04 02:00:00
3212.0,1598,David Gómez,77,Zapatillas Nike,Moda,2023-01-26,5.0,1350.55,6693.070786510611,Transferencia,DE,Hamburgo,Entregado,2023-01-26 17:00:00
3213.0,1463,María García,162,Mochila North Face,Accesorios,2023-05-12,1.0,366.71,366.71,Bizum,DE,Madrid,Entregado,2023-05-12 04:00:00
3214.0,1684,Lucía Fernández,166,Teclado Logitech,HOGAR,04-30-2023,2.0,1390.96,2781.92,Transferencia,IT,Paris,Entregado,2023-04-30 03:00:00
3215.0,1570,Ana Sánchez,28,MacBook Pro,Tecnología,03/04/2024,4.0,466.9,1867.6,PayPal,ES,Barcelona,Entregado,2024-04-03 21:00:00
3216.0,1690,David Gómez,139,Bolso Gucci,Moda,27/01/2023,4.0,243.93,975.72,Transferencia,Germany,Hamburgo,Pendiente,2023-01-27 07:00:00
3217.0,1166,Juan Pérez,81,MacBook Pro,Tecnología,10-06-2024,5.0,338.92,1694.6,Bizum,Italy,Berlín,Cancelado,2024-10-06 01:00:00
3218.0,1735,María García,82,Cafetera Philips,Hogar,10/11/2024,2.0,"13,96",,PayPal,Germany,Barcelona,Entregado,2024-11-10 18:00:00
3219.0,1047,LUCÍA FERNÁNDEZ,77,AirPods,Tecnología,2023-03-16,5.0,"1440,29",,PayPal,Italy,Lyon,Pendiente,2023-03-16 09:00:00
3220.0,1409,Laura Torres,136,Camiseta Adidas,Moda,02/06/2023,5.0,1467.48,7337.4,Tarjeta,ES,Lyon,Entregado,2023-06-02 17:00:00
3221.0,1335,Juan Pérez,92,AirPods,Tecnología,06-17-2024,,1034.72,,Bizum,FR,Barcelona,Pendiente,2024-06-17 19:00:00
3222.0,1591,Laura Torres,141,AirPods,Tecnología,03/11/2024,2.0,331.11,535.890468178201,Transferencia,Italy,Valencia,Cancelado,2024-11-03 14:00:00
3223.0,1722,Juan Pérez,70,iPhone 13,HOGAR,2024-03-11,2.0,176.27,418.86322811209766,Bizum,IT,Berlín,Entregado,2024-03-11 03:00:00
3224.0,1962,Lucía Fernández,28,Mochila North Face,Accesorios,02/04/2024,3.0,48.07,158.87621981886772,PayPal,España,Hamburgo,Cancelado,2024-04-02 15:00:00
3225.0,1872,Pedro López,126,iPhone 13,Tecnología,2023-04-26,5.0,$339.84,0.0,PayPal,spain,Madrid,Cancelado,2023-04-26 23:00:00
3226.0,1792,Lucía Fernández,4,AirPods,Tecnología,05-07-2023,4.0,1782.8,8384.760647787703,PayPal,DE,Barcelona,Cancelado,2023-05-07 00:00:00
3227.0,1166,Lucía Fernández,102,Bolso Gucci,Moda,12/08/2023,3.0,490.66,1471.98,PayPal,IT,Barcelona,Pendiente,2023-08-12 09:00:00
3228.0,1627,JUAN PÉREZ,159,MacBook Pro,Tecnología,18/03/2024,2.0,"715,0",,PayPal,España,Paris,Pendiente,2024-03-18 23:00:00
3229.0,1624,Lucía Fernández,8,Bolso Gucci,Moda,2023-08-04,4.0,219.64,878.56,Transferencia,ES,Madrid,Cancelado,2023-08-04 08:00:00
3230.0,1779,LAURA TORRES,152,Silla Gaming,Hogar,06-11-2023,3.0,452.5,1357.5,PayPal,IT,Madrid,Entregado,2023-06-11 14:00:00
3231.0,1309,Laura Torres,72,Mochila North Face,Accesorios,18/06/2023,5.0,1043.26,5216.3,Tarjeta,Italy,Madrid,Entregado,2023-06-18 00:00:00
3232.0,1213,Pedro López,189,Monitor LG,Tecnología,02-28-2023,1.0,$1219.43,0.0,Tarjeta,IT,Roma,Pendiente,2023-02-28 22:00:00
3233.0,1299,David Gómez,89,Bolso Gucci,Moda,2023-02-03,4.0,498.25,1993.0,PayPal,FR,Roma,Pendiente,2023-02-03 18:00:00
3234.0,1685,Laura Torres,104,Teclado Logitech,hogar,09-17-2023,3.0,124.89,374.67,Transferencia,ES,Lyon,Entregado,2023-09-17 22:00:00
3235.0,1076,Juan Pérez,162,MacBook Pro,TECHNOLOGY,07-03-2023,4.0,788.16,3152.64,Bizum,DE,Lyon,Cancelado,2023-07-03 01:00:00
3236.0,1389,Juan Pérez,108,iPhone 13,Tecnología,2024-06-04,1.0,476.06,476.06,Bizum,Germany,Lyon,Cancelado,2024-06-04 05:00:00
3237.0,1610,Carlos Ruiz,194,Monitor LG,Tecnología,25/02/2024,2.0,446.91,893.82,Bizum,IT,Hamburgo,Pendiente,2024-02-25 11:00:00
3238.0,1276,ANA SÁNCHEZ,31,AirPods,Tecnología,09-22-2024,5.0,$1920.13,,Bizum,Italy,Hamburgo,Cancelado,2024-09-22 10:00:00
3239.0,1570,maría garcía,41,AirPods,Tecnología,2023-12-29,2.0,1236.44,2472.88,PayPal,Germany,Madrid,Entregado,2023-12-29 06:00:00
3240.0,1896,MARÍA GARCÍA,151,Bolso Gucci,Moda,09-08-2024,5.0,1118.19,5590.95,Transferencia,Italy,Milán,Entregado,2024-09-08 03:00:00
3241.0,1418,Pedro López,72,Mochila North Face,Accesorios,2023-11-11,4.0,837.39,3349.56,Bizum,Italy,Madrid,Entregado,2023-11-11 00:00:00
3242.0,1940,Juan Pérez,64,iPhone 13,TECHNOLOGY,2023-10-24,1.0,863.6,863.6,PayPal,Italy,Berlín,Cancelado,2023-10-24 05:00:00
3243.0,1830,LAURA TORRES,38,iPhone 13,Tecnología,08-11-2024,5.0,1086.4,5432.0,PayPal,DE,Milán,Entregado,2024-08-11 11:00:00
3244.0,1248,Carlos Ruiz,194,Mochila North Face,Accesorios,03-01-2024,1.0,1395.9,1395.9,Tarjeta,IT,Berlín,Pendiente,2024-03-01 00:00:00
3245.0,1129,Juan Pérez,133,Silla Gaming,Hogar,08/06/2023,2.0,1407.27,2814.54,PayPal,France,Valencia,Entregado,2023-06-08 08:00:00
3246.0,1793,pedro lópez,89,iPhone 13,Tecnología,10-21-2023,4.0,351.67,1406.68,PayPal,France,Paris,Entregado,2023-10-21 07:00:00
3247.0,1398,Laura Torres,129,Teclado Logitech,Tecnología,27/06/2024,1.0,1005.22,1005.22,Bizum,spain,Lyon,Pendiente,2024-06-27 14:00:00
3248.0,1809,Juan Pérez,100,Reloj Casio,Accesorios,18/08/2024,1.0,829.8,829.8,Transferencia,Italy,Madrid,Cancelado,2024-08-18 15:00:00
3249.0,1566,María García,90,Cafetera Philips,Hogar,09-15-2023,5.0,1742.35,8711.75,Bizum,spain,Lyon,Entregado,2023-09-15 05:00:00
3250.0,1154,Ana Sánchez,60,Camiseta Adidas,Moda,2023-01-03,2.0,1266.52,2533.04,Tarjeta,Italy,Milán,Cancelado,2023-01-03 00:00:00
3251.0,1337,Laura Torres,64,Reloj Casio,Accesorios,03-23-2023,2.0,1069.68,2139.36,Transferencia,FR,Valencia,Entregado,2023-03-23 05:00:00
3252.0,1450,MARÍA GARCÍA,52,Camiseta Adidas,Moda,11-16-2024,4.0,239.64,958.56,Tarjeta,Germany,Barcelona,Pendiente,2024-11-16 10:00:00
3253.0,1616,Carlos Ruiz,73,Aspiradora Dyson,HOGAR,06-25-2024,4.0,1215.22,4860.88,PayPal,Germany,Milán,Pendiente,2024-06-25 11:00:00
3254.0,1823,Ana Sánchez,175,Bolso Gucci,Moda,18/04/2023,3.0,$243.24,,Transferencia,España,Valencia,Entregado,2023-04-18 11:00:00
3255.0,1189,Carlos Ruiz,105,Aspiradora Dyson,Hogar,11/11/2024,3.0,681.04,2043.12,Transferencia,FR,Lyon,Entregado,2024-11-11 16:00:00
3256.0,1419,Juan Pérez,188,iPhone 13,Tecnología,11-30-2023,1.0,294.26,294.26,PayPal,Italy,Paris,Pendiente,2023-11-30 21:00:00
3257.0,1186,María García,172,Samsung Galaxy,Tecnología,08-04-2023,5.0,1387.23,6936.15,Tarjeta,Germany,Barcelona,Cancelado,2023-08-04 02:00:00
3258.0,1383,David Gómez,149,Reloj Casio,Accesorios,04-04-2024,3.0,420.44,1261.32,Tarjeta,spain,Lyon,Cancelado,2024-04-04 19:00:00
3259.0,1515,Carlos Ruiz,138,Reloj Casio,Accesorios,22/02/2023,3.0,789.8,2369.4,PayPal,DE,Valencia,Entregado,2023-02-22 19:00:00
3260.0,1290,Lucía Fernández,108,MacBook Pro,Tecnología,2023-09-09,3.0,1792.39,5377.17,Bizum,France,Berlín,Entregado,2023-09-09 05:00:00
3261.0,1907,Carlos Ruiz,128,Mochila North Face,Accesorios,03/04/2024,4.0,416.59,1666.36,PayPal,Italy,Roma,Entregado,2024-04-03 23:00:00
3262.0,1748,Pedro López,131,Mochila North Face,Accesorios,21/03/2024,4.0,1020.53,3294.0763517602404,Transferencia,Germany,Madrid,Pendiente,2024-03-21 17:00:00
3263.0,1413,Pedro López,180,Cafetera Philips,Hogar,04-12-2023,2.0,844.35,1688.7,Bizum,Italy,Barcelona,Entregado,2023-04-12 03:00:00
3264.0,1781,Laura Torres,88,Samsung Galaxy,Tecnología,08/11/2024,2.0,46.07,92.14,PayPal,Germany,Barcelona,Cancelado,2024-11-08 23:00:00
3265.0,1960,DAVID GÓMEZ,140,MacBook Pro,Tecnología,2024-11-22,5.0,1587.59,7937.95,Tarjeta,DE,Hamburgo,Cancelado,2024-11-22 05:00:00
3266.0,1469,Laura Torres,20,MacBook Pro,Tecnología,11-23-2024,1.0,147.4,147.4,Transferencia,FR,Barcelona,Entregado,2024-11-23 12:00:00
3267.0,1647,CARLOS RUIZ,84,Zapatillas Nike,Moda,22/05/2024,4.0,953.77,3662.4262795353684,Bizum,Germany,Valencia,Entregado,2024-05-22 12:00:00
3268.0,1831,Carlos Ruiz,179,Silla Gaming,moda,05-20-2024,3.0,1125.75,3377.25,Tarjeta,spain,Milán,Pendiente,2024-05-20 04:00:00
3269.0,1083,David Gómez,105,Samsung Galaxy,hogar,2024-07-20,2.0,1260.57,2521.14,Bizum,ES,Lyon,Cancelado,2024-07-20 17:00:00
3270.0,1342,Pedro López,5,Bolso Gucci,Moda,01-20-2024,4.0,1380.38,5521.52,PayPal,spain,Barcelona,Pendiente,2024-01-20 22:00:00
3271.0,1369,Ana Sánchez,32,MacBook Pro,Tecnología,2023-09-06,1.0,514.01,514.01,Tarjeta,España,Hamburgo,Entregado,2023-09-06 23:00:00
3272.0,1803,Lucía Fernández,141,Teclado Logitech,Tecnología,10/05/2024,5.0,$29.86,,Bizum,ES,Barcelona,Cancelado,2024-05-10 22:00:00
3273.0,1933,LUCÍA FERNÁNDEZ,161,Sony Headphones,hogar,30/04/2024,3.0,$1449.65,0.0,PayPal,España,Roma,Entregado,2024-04-30 15:00:00
3274.0,1547,Laura Torres,150,Silla Gaming,Hogar,23/03/2023,4.0,1075.96,4563.413098433648,Transferencia,Italy,Madrid,Cancelado,2023-03-23 11:00:00
3275.0,1932,Lucía Fernández,19,iPhone 13,Tecnología,02-09-2023,2.0,1673.87,3347.74,Transferencia,DE,Lyon,Entregado,2023-02-09 10:00:00
3276.0,1725,David Gómez,37,Camiseta Adidas,Moda,19/06/2024,4.0,1644.56,6578.24,Tarjeta,IT,Milán,Cancelado,2024-06-19 18:00:00
3277.0,1822,Lucía Fernández,20,Bolso Gucci,Moda,15/01/2024,3.0,1688.22,5735.387155450364,Tarjeta,ES,Paris,Pendiente,2024-01-15 00:00:00
3278.0,1418,Ana Sánchez,115,Monitor LG,Tecnología,10-01-2023,3.0,975.34,2926.02,Bizum,FR,Paris,Entregado,2023-10-01 12:00:00
3279.0,1951,Laura Torres,136,Camiseta Adidas,Moda,22/04/2024,4.0,673.92,2695.68,Tarjeta,España,Valencia,Entregado,2024-04-22 16:00:00
3280.0,1175,Laura Torres,67,MacBook Pro,Tecnología,10-29-2023,1.0,1585.2,1585.2,Transferencia,spain,Barcelona,Cancelado,2023-10-29 03:00:00
3281.0,1929,David Gómez,61,iPhone 13,Tecnología,02-24-2024,2.0,908.08,1816.16,Transferencia,DE,Barcelona,Pendiente,2024-02-24 23:00:00
3282.0,1551,Pedro López,69,iPhone 13,Tecnología,07-09-2023,1.0,375.05,375.05,Tarjeta,Italy,Roma,Cancelado,2023-07-09 19:00:00
3283.0,1327,Lucía Fernández,185,Teclado Logitech,moda,07-06-2024,5.0,1711.4,8557.0,Transferencia,España,Berlín,Pendiente,2024-07-06 06:00:00
3284.0,1471,Carlos Ruiz,145,Cafetera Philips,Hogar,03-10-2023,4.0,1766.29,7529.364672466451,Bizum,Germany,Barcelona,Entregado,2023-03-10 16:00:00
3285.0,1387,Pedro López,184,Samsung Galaxy,tecnologia,04-02-2024,5.0,937.96,4689.8,Bizum,FR,Lyon,Pendiente,2024-04-02 05:00:00
3286.0,1297,Ana Sánchez,67,Reloj Casio,Accesorios,03/09/2023,2.0,160.64,321.28,Bizum,Germany,Barcelona,Cancelado,2023-09-03 00:00:00
3287.0,1594,Laura Torres,149,Zapatillas Nike,Moda,2023-12-21,5.0,781.77,3908.85,Bizum,Germany,Valencia,Pendiente,2023-12-21 06:00:00
3288.0,1259,David Gómez,181,Teclado Logitech,Tecnología,01-23-2024,2.0,1609.04,3218.08,Tarjeta,spain,Milán,Entregado,2024-01-23 07:00:00
3289.0,1298,Carlos Ruiz,15,Bolso Gucci,HOGAR,2023-10-12,5.0,1804.53,9022.65,PayPal,España,Hamburgo,Cancelado,2023-10-12 05:00:00
3290.0,1693,David Gómez,60,Samsung Galaxy,Tecnología,02-11-2024,4.0,414.91,1659.64,Tarjeta,spain,Roma,Entregado,2024-02-11 08:00:00
3291.0,1668,LAURA TORRES,71,Monitor LG,Tecnología,21/03/2024,5.0,143.28,716.4,Transferencia,France,Paris,Pendiente,2024-03-21 00:00:00
3292.0,1492,Laura Torres,74,AirPods,Tecnología,18/07/2024,5.0,1755.93,8779.65,Bizum,Germany,Valencia,Pendiente,2024-07-18 16:00:00
3293.0,1852,Carlos Ruiz,89,Monitor LG,Tecnología,2024-04-06,2.0,784.92,1569.84,Bizum,Italy,Madrid,Entregado,2024-04-06 00:00:00
3294.0,1600,Juan Pérez,177,Reloj Casio,Accesorios,01-05-2023,1.0,1088.1,1088.1,Bizum,France,Lyon,Cancelado,2023-01-05 06:00:00
3295.0,1992,Laura Torres,54,Cafetera Philips,Hogar,2023-05-23,5.0,1936.45,9682.25,PayPal,DE,Barcelona,Entregado,2023-05-23 15:00:00
3296.0,1959,pedro lópez,39,Reloj Casio,Accesorios,20/07/2024,3.0,142.46,361.9330999271826,Transferencia,Germany,Roma,Pendiente,2024-07-20 20:00:00
3297.0,1789,David Gómez,184,Reloj Casio,Accesorios,01-29-2024,5.0,1300.15,6500.75,Transferencia,Germany,Valencia,Entregado,2024-01-29 00:00:00
3298.0,1311,María García,97,AirPods,Tecnología,06/01/2023,3.0,157.47,472.41,Tarjeta,FR,Madrid,Cancelado,2023-01-06 17:00:00
3299.0,1408,Laura Torres,125,Sony Headphones,Tecnología,10/10/2024,4.0,757.18,3028.72,Bizum,FR,Hamburgo,Pendiente,2024-10-10 20:00:00
3300.0,1658,Ana Sánchez,100,Camiseta Adidas,Moda,26/06/2024,5.0,1609.59,8047.95,PayPal,spain,Paris,Pendiente,2024-06-26 17:00:00
3301.0,1050,ANA SÁNCHEZ,177,AirPods,Tecnología,2023-10-19,2.0,872.61,1745.22,Bizum,España,Hamburgo,Pendiente,2023-10-19 17:00:00
3302.0,1533,Ana Sánchez,173,Reloj Casio,Accesorios,04-17-2023,4.0,1994.39,7977.56,PayPal,spain,Roma,Entregado,2023-04-17 01:00:00
3303.0,1976,maría garcía,185,Mochila North Face,Accesorios,2024-02-17,5.0,1122.53,5612.65,Bizum,ES,Hamburgo,Pendiente,2024-02-17 02:00:00
3304.0,1886,David Gómez,193,Bolso Gucci,Moda,2023-01-19,4.0,649.11,2596.44,Bizum,France,Madrid,Cancelado,2023-01-19 13:00:00
3305.0,1747,Ana Sánchez,37,Camiseta Adidas,Moda,2024-11-12,3.0,448.02,1344.06,Tarjeta,IT,Berlín,Cancelado,2024-11-12 12:00:00
3306.0,1748,lucía fernández,106,Mochila North Face,tecnologia,04-04-2024,5.0,707.54,3537.7,Bizum,España,Milán,Cancelado,2024-04-04 19:00:00
3307.0,1428,Ana Sánchez,95,Silla Gaming,HOGAR,07/10/2023,4.0,$751.34,,PayPal,Germany,Paris,Cancelado,2023-10-07 14:00:00
3308.0,1089,Juan Pérez,147,Monitor LG,Tecnología,16/07/2024,2.0,146.74,293.48,PayPal,Germany,Barcelona,Cancelado,2024-07-16 22:00:00
3309.0,1986,laura torres,135,iPhone 13,Tecnología,13/02/2023,1.0,745.45,745.45,PayPal,FR,Barcelona,Pendiente,2023-02-13 03:00:00
3310.0,1590,ana sánchez,76,Camiseta Adidas,Moda,03-10-2024,1.0,933.83,757.3590954086598,Transferencia,Germany,Barcelona,Cancelado,2024-03-10 23:00:00
3311.0,1360,Carlos Ruiz,174,Monitor LG,Tecnología,2024-05-22,1.0,1448.25,1448.25,Bizum,España,Paris,Cancelado,2024-05-22 07:00:00
3312.0,1314,Laura Torres,199,MacBook Pro,Tecnología,06-25-2024,4.0,1316.89,5267.56,PayPal,España,Madrid,Pendiente,2024-06-25 08:00:00
3313.0,1433,Laura Torres,139,Teclado Logitech,Tecnología,2024-08-19,4.0,1420.44,5681.76,PayPal,France,Hamburgo,Entregado,2024-08-19 12:00:00
3314.0,1245,Pedro López,68,Reloj Casio,Accesorios,05/11/2023,1.0,26.64,26.64,Transferencia,Italy,Madrid,Pendiente,2023-11-05 04:00:00
3315.0,1220,Pedro López,47,Samsung Galaxy,Tecnología,01-14-2023,5.0,443.16,2215.8,Bizum,ES,Madrid,Entregado,2023-01-14 11:00:00
3316.0,1540,Juan Pérez,189,Cafetera Philips,Hogar,13/11/2024,5.0,"1326,75",,Tarjeta,spain,Hamburgo,Pendiente,2024-11-13 03:00:00
3317.0,1841,LAURA TORRES,99,Monitor LG,Tecnología,2024-06-08,2.0,$973.14,,Bizum,Germany,Hamburgo,Entregado,2024-06-08 08:00:00
3318.0,1843,Pedro López,170,Cafetera Philips,Hogar,27/09/2024,3.0,20.57,61.71,PayPal,France,Valencia,Pendiente,2024-09-27 02:00:00
3319.0,1156,Pedro López,196,Monitor LG,Tecnología,2023-01-13,4.0,1610.94,6443.76,PayPal,Germany,Lyon,Cancelado,2023-01-13 05:00:00
3320.0,1402,Ana Sánchez,186,Mochila North Face,Moda,07/10/2024,1.0,1547.89,1547.89,Tarjeta,spain,Hamburgo,Pendiente,2024-10-07 17:00:00
3321.0,1053,Carlos Ruiz,26,Mochila North Face,Accesorios,2023-03-21,2.0,1101.35,2202.7,Transferencia,spain,Paris,Cancelado,2023-03-21 14:00:00
3322.0,1833,Juan Pérez,61,Camiseta Adidas,Moda,2023-11-18,2.0,142.26,284.52,Transferencia,IT,Lyon,Entregado,2023-11-18 03:00:00
3323.0,1824,Juan Pérez,10,Bolso Gucci,Moda,2023-01-10,5.0,1535.36,7676.8,Tarjeta,España,Madrid,Pendiente,2023-01-10 19:00:00
3324.0,1541,Ana Sánchez,97,MacBook Pro,Tecnología,2024-08-24,2.0,1171.59,2343.18,Tarjeta,FR,Milán,Entregado,2024-08-24 19:00:00
3325.0,1266,David Gómez,182,Monitor LG,Tecnología,04-11-2024,2.0,$1566.1,,PayPal,IT,Madrid,Pendiente,2024-04-11 11:00:00
3326.0,1480,Laura Torres,55,Sony Headphones,Tecnología,03-31-2023,3.0,1505.98,4517.94,Transferencia,France,Madrid,Pendiente,2023-03-31 10:00:00
3327.0,1705,Laura Torres,78,Reloj Casio,Accesorios,24/05/2023,1.0,1607.97,1607.97,Bizum,DE,Madrid,Cancelado,2023-05-24 16:00:00
3328.0,1436,Juan Pérez,22,Camiseta Adidas,Moda,2024-03-08,2.0,1040.84,2081.68,Bizum,spain,Milán,Cancelado,2024-03-08 05:00:00
3329.0,1452,Pedro López,83,Zapatillas Nike,Moda,01-26-2023,2.0,289.25,578.5,Transferencia,España,Barcelona,Pendiente,2023-01-26 10:00:00
3330.0,1039,ana sánchez,10,iPhone 13,tech,2023-12-23,2.0,1345.6,2691.2,PayPal,Italy,Lyon,Entregado,2023-12-23 16:00:00
3331.0,1645,LUCÍA FERNÁNDEZ,174,Teclado Logitech,Tecnología,05-13-2024,5.0,1244.74,6223.7,Tarjeta,spain,Roma,Pendiente,2024-05-13 18:00:00
3332.0,1439,Lucía Fernández,114,iPhone 13,Tecnología,02-12-2024,2.0,1487.08,2974.16,Bizum,IT,Valencia,Entregado,2024-02-12 10:00:00
3333.0,1003,María García,106,Sony Headphones,Tecnología,01/01/2024,4.0,348.06,1392.24,Tarjeta,spain,Milán,Cancelado,2024-01-01 13:00:00
3334.0,1875,María García,93,Samsung Galaxy,Tecnología,04-20-2023,4.0,398.0,1742.5676735183683,PayPal,ES,Milán,Entregado,2023-04-20 11:00:00
3335.0,1385,María García,58,Teclado Logitech,Tecnología,08/09/2023,3.0,1781.91,5345.73,Transferencia,ES,Paris,Cancelado,2023-09-08 05:00:00
3336.0,1636,Juan Pérez,43,Monitor LG,Tecnología,15/11/2023,2.0,1502.46,3004.92,Tarjeta,España,Valencia,Pendiente,2023-11-15 00:00:00
3337.0,1063,María García,117,AirPods,Tecnología,2024-10-12,4.0,1817.37,7269.48,PayPal,spain,Madrid,Cancelado,2024-10-12 19:00:00
3338.0,1307,Carlos Ruiz,194,Aspiradora Dyson,Hogar,09-21-2024,5.0,1519.84,7599.2,Bizum,France,Paris,Cancelado,2024-09-21 21:00:00
3339.0,1288,Juan Pérez,40,MacBook Pro,Tecnología,05-17-2023,2.0,1198.34,2396.68,Tarjeta,España,Berlín,Cancelado,2023-05-17 03:00:00
3340.0,1307,Lucía Fernández,98,Aspiradora Dyson,Hogar,2023-10-15,5.0,"1311,72",,Bizum,Germany,Roma,Pendiente,2023-10-15 21:00:00
3341.0,1704,Lucía Fernández,180,Sony Headphones,hogar,19/09/2023,4.0,1779.36,7117.44,Bizum,DE,Hamburgo,Pendiente,2023-09-19 09:00:00
3342.0,1908,Ana Sánchez,54,Monitor LG,Tecnología,05-13-2024,2.0,$1161.83,,Tarjeta,FR,Berlín,Cancelado,2024-05-13 11:00:00
3343.0,1927,Ana Sánchez,47,Bolso Gucci,Moda,18/09/2023,4.0,1268.46,5073.84,PayPal,ES,Hamburgo,Pendiente,2023-09-18 01:00:00
3344.0,1359,Laura Torres,193,MacBook Pro,Tecnología,28/10/2023,5.0,321.39,1606.95,PayPal,FR,Paris,Pendiente,2023-10-28 08:00:00
3345.0,1676,DAVID GÓMEZ,139,iPhone 13,Tecnología,2024-05-31,2.0,953.1,1906.2,Transferencia,Germany,Berlín,Cancelado,2024-05-31 19:00:00
3346.0,1053,Pedro López,71,Aspiradora Dyson,Hogar,2024-02-25,3.0,1435.63,4306.89,PayPal,Italy,Roma,Pendiente,2024-02-25 11:00:00
3347.0,1422,David Gómez,179,AirPods,Tecnología,27/11/2023,3.0,549.18,1647.54,Bizum,DE,Milán,Cancelado,2023-11-27 06:00:00
3348.0,1813,María García,155,iPhone 13,Tecnología,19/08/2023,5.0,412.49,2062.45,Transferencia,Italy,Berlín,Entregado,2023-08-19 10:00:00
3349.0,1379,DAVID GÓMEZ,118,Samsung Galaxy,TECHNOLOGY,2024-08-09,4.0,634.52,2538.08,PayPal,DE,Lyon,Pendiente,2024-08-09 19:00:00
3350.0,1211,Pedro López,18,Samsung Galaxy,Tecnología,09/04/2023,2.0,"490,59",,PayPal,France,Roma,Entregado,2023-04-09 22:00:00
3351.0,1082,Laura Torres,69,Reloj Casio,hogar,06-29-2024,5.0,437.68,2188.4,Transferencia,IT,Valencia,Entregado,2024-06-29 11:00:00
3352.0,1469,Laura Torres,198,Zapatillas Nike,Moda,07-09-2024,2.0,855.45,1442.204631732664,Tarjeta,DE,Milán,Pendiente,2024-07-09 11:00:00
3353.0,1578,pedro lópez,153,iPhone 13,Tecnología,05-26-2024,1.0,1816.6,1816.6,Bizum,Germany,Paris,Entregado,2024-05-26 01:00:00
3354.0,1399,Ana Sánchez,159,Reloj Casio,Accesorios,2024-09-21,2.0,1019.05,2038.1,Tarjeta,IT,Paris,Entregado,2024-09-21 09:00:00
3355.0,1264,Laura Torres,88,Reloj Casio,Accesorios,10-24-2023,4.0,383.96,1535.84,Transferencia,FR,Madrid,Cancelado,2023-10-24 17:00:00
3356.0,1115,Laura Torres,57,Monitor LG,Tecnología,12/06/2023,4.0,163.17,652.68,Bizum,France,Madrid,Entregado,2023-06-12 02:00:00
3357.0,1993,Pedro López,96,Teclado Logitech,Tecnología,10-20-2024,4.0,1395.35,5581.4,Transferencia,FR,Madrid,Cancelado,2024-10-20 03:00:00
3358.0,1390,Carlos Ruiz,133,Bolso Gucci,Moda,2024-03-11,5.0,771.77,3858.85,Tarjeta,ES,Madrid,Cancelado,2024-03-11 18:00:00
3359.0,1242,María García,145,iPhone 13,Tecnología,24/07/2023,1.0,$1645.44,,Bizum,France,Lyon,Pendiente,2023-07-24 14:00:00
3360.0,1395,Lucía Fernández,31,Cafetera Philips,Hogar,09/03/2023,3.0,1322.43,3967.29,PayPal,France,Barcelona,Cancelado,2023-03-09 16:00:00
3361.0,1977,carlos ruiz,150,MacBook Pro,Tecnología,01-23-2024,5.0,1594.52,7972.6,PayPal,France,Barcelona,Entregado,2024-01-23 07:00:00
3362.0,1637,María García,117,Teclado Logitech,Tecnología,2024-09-30,5.0,551.17,2755.85,Transferencia,Italy,Valencia,Cancelado,2024-09-30 17:00:00
3363.0,1137,ana sánchez,151,Camiseta Adidas,Moda,04-30-2023,5.0,1387.79,6938.95,Tarjeta,France,Milán,Pendiente,2023-04-30 02:00:00
3364.0,1102,Juan Pérez,1,Zapatillas Nike,Moda,16/11/2023,5.0,535.48,2677.4,Tarjeta,Italy,Valencia,Cancelado,2023-11-16 07:00:00
3365.0,1993,Pedro López,190,Bolso Gucci,Moda,15/03/2024,1.0,$1878.75,,Tarjeta,DE,Madrid,Pendiente,2024-03-15 07:00:00
3366.0,1264,Juan Pérez,157,Reloj Casio,Accesorios,2023-03-31,4.0,1276.38,5105.52,Bizum,Germany,Roma,Entregado,2023-03-31 04:00:00
3367.0,1158,Laura Torres,58,Bolso Gucci,hogar,2024-06-17,3.0,655.78,1967.34,PayPal,spain,Milán,Cancelado,2024-06-17 05:00:00
3368.0,1791,María García,25,Zapatillas Nike,HOGAR,11-20-2024,5.0,546.33,2731.65,Bizum,España,Berlín,Cancelado,2024-11-20 22:00:00
3369.0,1323,Carlos Ruiz,184,AirPods,Tecnología,13/07/2023,2.0,389.94,779.88,Transferencia,spain,Milán,Cancelado,2023-07-13 14:00:00
3370.0,1981,Pedro López,46,Cafetera Philips,Hogar,09-12-2023,2.0,1392.34,2784.68,Transferencia,Italy,Hamburgo,Cancelado,2023-09-12 08:00:00
3371.0,1122,Ana Sánchez,14,Zapatillas Nike,Moda,2023-07-09,1.0,445.24,445.24,PayPal,Germany,Madrid,Cancelado,2023-07-09 15:00:00
3372.0,1147,María García,186,Teclado Logitech,Tecnología,2024-01-08,5.0,1194.65,5973.25,Tarjeta,España,Valencia,Cancelado,2024-01-08 22:00:00
3373.0,1899,carlos ruiz,194,Teclado Logitech,Tecnología,01-08-2024,4.0,536.62,2146.48,Tarjeta,France,Valencia,Cancelado,2024-01-08 02:00:00
3374.0,1007,Pedro López,73,Cafetera Philips,Moda,01/07/2023,5.0,1327.32,6636.6,Bizum,DE,Milán,Entregado,2023-07-01 18:00:00
3375.0,1501,María García,17,Camiseta Adidas,Moda,30/06/2023,3.0,1631.73,4895.19,Bizum,Italy,Hamburgo,Entregado,2023-06-30 06:00:00
3376.0,1964,Laura Torres,168,Monitor LG,Tecnología,16/06/2024,3.0,1558.27,3964.805541853082,Tarjeta,IT,Lyon,Entregado,2024-06-16 00:00:00
3377.0,1230,David Gómez,153,Monitor LG,Tecnología,20/04/2023,5.0,1524.09,8632.535145998338,Tarjeta,Germany,Roma,Entregado,2023-04-20 07:00:00
3378.0,1099,Carlos Ruiz,147,Teclado Logitech,Tecnología,07-28-2024,3.0,383.57,1150.71,PayPal,DE,Berlín,Pendiente,2024-07-28 08:00:00
3379.0,1648,Carlos Ruiz,136,Monitor LG,Tecnología,03-09-2024,4.0,$185.89,,Transferencia,FR,Valencia,Entregado,2024-03-09 10:00:00
3380.0,1393,David Gómez,11,Bolso Gucci,Moda,17/11/2024,2.0,1400.91,2801.82,Tarjeta,Italy,Paris,Cancelado,2024-11-17 08:00:00
3381.0,1546,maría garcía,89,iPhone 13,Tecnología,01/01/2024,1.0,743.01,743.01,Tarjeta,France,Milán,Cancelado,2024-01-01 08:00:00
3382.0,1120,María García,26,iPhone 13,Tecnología,2023-06-20,2.0,870.37,1740.74,Transferencia,DE,Madrid,Cancelado,2023-06-20 21:00:00
3383.0,1723,Juan Pérez,11,Aspiradora Dyson,Moda,2023-12-11,2.0,71.99,143.98,Bizum,Italy,Hamburgo,Cancelado,2023-12-11 16:00:00
3384.0,1892,Lucía Fernández,78,Bolso Gucci,Moda,11/01/2023,5.0,526.56,2632.8,PayPal,IT,Madrid,Pendiente,2023-01-11 23:00:00
3385.0,1249,juan pérez,2,MacBook Pro,Tecnología,2023-11-14,4.0,77.02,308.08,Bizum,France,Roma,Cancelado,2023-11-14 13:00:00
3386.0,1916,Juan Pérez,153,Teclado Logitech,tech,14/11/2023,2.0,1759.58,3519.16,Tarjeta,FR,Barcelona,Pendiente,2023-11-14 13:00:00
3387.0,1729,Lucía Fernández,162,iPhone 13,Tecnología,2024-08-27,4.0,494.36,1987.5453494214007,Transferencia,spain,Berlín,Cancelado,2024-08-27 15:00:00
3388.0,1246,Pedro López,25,Aspiradora Dyson,Hogar,02-10-2023,3.0,"1119,1",,Transferencia,spain,Barcelona,Cancelado,2023-02-10 06:00:00
3389.0,1250,Ana Sánchez,178,Monitor LG,Tecnología,18/01/2024,1.0,87.57,87.57,Transferencia,DE,Hamburgo,Cancelado,2024-01-18 10:00:00
3390.0,1802,laura torres,154,Silla Gaming,Hogar,08-31-2023,1.0,1337.03,1337.03,PayPal,DE,Milán,Pendiente,2023-08-31 07:00:00
3391.0,1930,juan pérez,26,AirPods,Tecnología,2024-10-25,5.0,652.82,3264.1,Transferencia,IT,Barcelona,Entregado,2024-10-25 08:00:00
3392.0,1304,PEDRO LÓPEZ,50,Samsung Galaxy,Tecnología,2023-10-05,5.0,1796.86,8984.3,Tarjeta,España,Paris,Cancelado,2023-10-05 23:00:00
3393.0,1247,María García,121,Teclado Logitech,Tecnología,2023-04-08,4.0,1777.36,7109.44,Bizum,Italy,Berlín,Cancelado,2023-04-08 01:00:00
3394.0,1495,María García,154,Mochila North Face,Accesorios,06-16-2024,5.0,657.33,3286.65,Transferencia,España,Berlín,Pendiente,2024-06-16 12:00:00
3395.0,1448,María García,85,iPhone 13,HOGAR,08/01/2024,3.0,1802.91,5408.73,Transferencia,Germany,Roma,Cancelado,2024-01-08 16:00:00
3396.0,1592,David Gómez,15,Samsung Galaxy,Tecnología,2024-05-29,5.0,1992.35,9961.75,Transferencia,Germany,Milán,Cancelado,2024-05-29 05:00:00
3397.0,1288,David Gómez,43,Aspiradora Dyson,Hogar,29/02/2024,4.0,1652.58,6610.32,PayPal,FR,Roma,Pendiente,2024-02-29 02:00:00
3398.0,1156,Pedro López,150,AirPods,Tecnología,2024-10-27,5.0,1691.29,8456.45,Transferencia,Germany,Berlín,Entregado,2024-10-27 22:00:00
3399.0,1519,Pedro López,120,Sony Headphones,Tecnología,17/02/2023,4.0,$505.53,,Tarjeta,ES,Barcelona,Entregado,2023-02-17 04:00:00
3400.0,1183,Ana Sánchez,8,Aspiradora Dyson,Hogar,08-21-2023,4.0,1157.64,4630.56,PayPal,IT,Roma,Pendiente,2023-08-21 23:00:00
3401.0,1150,Carlos Ruiz,27,Samsung Galaxy,tecnologia,07-19-2024,3.0,"143,84",0.0,Bizum,ES,Madrid,Entregado,2024-07-19 00:00:00
3402.0,1595,David Gómez,125,Zapatillas Nike,Moda,10-27-2023,5.0,198.89,994.45,Transferencia,FR,Paris,Pendiente,2023-10-27 17:00:00
3403.0,1185,Laura Torres,104,MacBook Pro,Tecnología,14/08/2023,3.0,1997.8,6843.103227475837,Bizum,DE,Milán,Cancelado,2023-08-14 22:00:00
3404.0,1572,David Gómez,159,Zapatillas Nike,hogar,02/04/2023,1.0,660.01,660.01,Transferencia,France,Valencia,Cancelado,2023-04-02 18:00:00
3405.0,1418,Lucía Fernández,161,Camiseta Adidas,Moda,2023-10-21,1.0,$1498.89,,Bizum,Italy,Milán,Pendiente,2023-10-21 16:00:00
3406.0,1900,Juan Pérez,22,AirPods,HOGAR,2023-04-05,2.0,1615.26,3230.52,Tarjeta,DE,Valencia,Pendiente,2023-04-05 09:00:00
3407.0,1342,maría garcía,137,MacBook Pro,Tecnología,2024-08-13,4.0,$1717.47,,Tarjeta,Italy,Madrid,Entregado,2024-08-13 11:00:00
3408.0,1374,ANA SÁNCHEZ,59,MacBook Pro,Tecnología,02-23-2024,2.0,1995.28,3990.56,Transferencia,IT,Valencia,Cancelado,2024-02-23 08:00:00
3409.0,1804,Carlos Ruiz,119,Cafetera Philips,Hogar,07-25-2024,4.0,490.58,1962.32,Bizum,Italy,Milán,Entregado,2024-07-25 10:00:00
3410.0,1163,Ana Sánchez,23,Samsung Galaxy,Tecnología,01-07-2023,5.0,90.3,451.5,Bizum,Italy,Hamburgo,Entregado,2023-01-07 23:00:00
3411.0,1350,ana sánchez,86,Mochila North Face,tecnologia,16/12/2023,1.0,828.27,828.27,Bizum,IT,Hamburgo,Pendiente,2023-12-16 23:00:00
3412.0,1430,Juan Pérez,159,Silla Gaming,Hogar,2023-12-16,4.0,268.86,1075.44,Tarjeta,IT,Lyon,Pendiente,2023-12-16 12:00:00
3413.0,1406,Laura Torres,105,Camiseta Adidas,Moda,27/11/2023,5.0,54.63,273.15,Transferencia,IT,Lyon,Cancelado,2023-11-27 17:00:00
3414.0,1694,Lucía Fernández,98,Sony Headphones,tech,04/04/2023,4.0,727.25,2909.0,Bizum,France,Barcelona,Entregado,2023-04-04 12:00:00
3415.0,1821,Lucía Fernández,151,Monitor LG,Tecnología,11/01/2023,4.0,$1569.64,,PayPal,DE,Paris,Entregado,2023-01-11 00:00:00
3416.0,1874,Lucía Fernández,82,Reloj Casio,Accesorios,08-02-2024,3.0,1136.7,3410.1,PayPal,spain,Lyon,Pendiente,2024-08-02 19:00:00
3417.0,1495,ana sánchez,9,Samsung Galaxy,Tecnología,23/01/2023,3.0,632.43,1897.29,PayPal,ES,Valencia,Cancelado,2023-01-23 15:00:00
3418.0,1007,Pedro López,4,Reloj Casio,hogar,2023-03-22,3.0,1312.14,3936.42,Transferencia,Germany,Milán,Pendiente,2023-03-22 21:00:00
3419.0,1451,Pedro López,80,Mochila North Face,Accesorios,11-05-2024,4.0,471.72,1886.88,Transferencia,France,Paris,Pendiente,2024-11-05 14:00:00
3420.0,1404,Juan Pérez,23,Mochila North Face,Accesorios,05-11-2024,3.0,38.62,115.86,PayPal,FR,Lyon,Cancelado,2024-05-11 21:00:00
3421.0,1300,Ana Sánchez,142,Silla Gaming,Hogar,09/05/2024,1.0,1531.06,1531.06,Transferencia,spain,Valencia,Entregado,2024-05-09 13:00:00
3422.0,1485,DAVID GÓMEZ,167,Zapatillas Nike,Moda,06-17-2024,3.0,1251.25,3753.75,PayPal,France,Barcelona,Entregado,2024-06-17 22:00:00
3423.0,1330,Carlos Ruiz,195,Sony Headphones,Tecnología,2023-12-26,4.0,1526.98,6107.92,Tarjeta,Italy,Madrid,Pendiente,2023-12-26 15:00:00
3424.0,1690,carlos ruiz,64,Samsung Galaxy,Tecnología,08/07/2023,3.0,87.49,262.47,Transferencia,IT,Madrid,Cancelado,2023-07-08 21:00:00
3425.0,1605,Juan Pérez,182,iPhone 13,Tecnología,27/02/2023,4.0,1675.87,6703.48,PayPal,ES,Paris,Cancelado,2023-02-27 00:00:00
3426.0,1091,Lucía Fernández,16,Sony Headphones,Tecnología,02-06-2024,4.0,1242.86,4971.44,Tarjeta,Germany,Berlín,Entregado,2024-02-06 10:00:00
3427.0,1498,Juan Pérez,127,Teclado Logitech,Tecnología,12-05-2023,3.0,"1131,16",0.0,Tarjeta,Germany,Madrid,Pendiente,2023-12-05 10:00:00
3428.0,1790,Juan Pérez,88,Teclado Logitech,Tecnología,2024-08-28,3.0,1252.98,3758.94,PayPal,DE,Barcelona,Pendiente,2024-08-28 15:00:00
3429.0,1762,PEDRO LÓPEZ,156,AirPods,Tecnología,19/04/2024,5.0,1730.22,8651.1,Bizum,Italy,Lyon,Pendiente,2024-04-19 03:00:00
3430.0,1753,Pedro López,182,Sony Headphones,Tecnología,14/09/2024,1.0,1178.0,1178.0,PayPal,France,Barcelona,Entregado,2024-09-14 19:00:00
3431.0,1689,Lucía Fernández,7,Bolso Gucci,Moda,07-21-2024,5.0,1166.09,5830.45,Transferencia,spain,Roma,Entregado,2024-07-21 12:00:00
3432.0,1153,Ana Sánchez,2,Zapatillas Nike,tech,2023-01-24,1.0,1981.45,1981.45,PayPal,spain,Hamburgo,Cancelado,2023-01-24 07:00:00
3433.0,1010,Laura Torres,55,Teclado Logitech,Tecnología,07-25-2023,2.0,1515.89,3031.78,PayPal,Italy,Roma,Pendiente,2023-07-25 07:00:00
3434.0,1287,lucía fernández,166,Bolso Gucci,Moda,10-07-2024,5.0,"890,16",,PayPal,FR,Berlín,Cancelado,2024-10-07 23:00:00
3435.0,1166,Juan Pérez,35,Teclado Logitech,Tecnología,01-12-2024,1.0,1417.72,1417.72,Bizum,ES,Berlín,Entregado,2024-01-12 22:00:00
3436.0,1180,maría garcía,181,MacBook Pro,Tecnología,2023-03-12,3.0,784.57,2353.71,Tarjeta,France,Berlín,Cancelado,2023-03-12 10:00:00
3437.0,1724,Pedro López,41,Monitor LG,Tecnología,2024-08-31,4.0,465.46,1861.84,Tarjeta,DE,Hamburgo,Entregado,2024-08-31 15:00:00
3438.0,1937,David Gómez,136,Teclado Logitech,Tecnología,2023-02-13,1.0,1197.74,1197.74,Bizum,IT,Paris,Entregado,2023-02-13 02:00:00
3439.0,1939,Pedro López,145,Silla Gaming,Hogar,07/05/2024,1.0,1857.08,1733.0429259459486,Bizum,Germany,Lyon,Cancelado,2024-05-07 17:00:00
3440.0,1807,Laura Torres,198,iPhone 13,Tecnología,28/02/2023,2.0,1858.99,3717.98,Bizum,DE,Berlín,Pendiente,2023-02-28 04:00:00
3441.0,1056,LAURA TORRES,70,Samsung Galaxy,Tecnología,2024-04-27,5.0,690.39,3451.95,Bizum,Italy,Hamburgo,Cancelado,2024-04-27 09:00:00
3442.0,1157,Lucía Fernández,198,Mochila North Face,Accesorios,14/05/2024,2.0,1060.08,2120.16,Transferencia,España,Paris,Entregado,2024-05-14 14:00:00
3443.0,1790,David Gómez,95,Monitor LG,Tecnología,2024-04-25,3.0,431.16,1293.48,Bizum,France,Lyon,Entregado,2024-04-25 15:00:00
3444.0,1421,Laura Torres,45,Cafetera Philips,Hogar,02-06-2023,2.0,1991.31,3982.62,Bizum,FR,Lyon,Entregado,2023-02-06 00:00:00
3445.0,1615,Laura Torres,60,Sony Headphones,Tecnología,07-30-2024,1.0,1962.42,1962.42,Bizum,France,Valencia,Pendiente,2024-07-30 13:00:00
3446.0,1133,María García,158,Aspiradora Dyson,Hogar,2024-05-21,1.0,1302.52,1302.52,Tarjeta,España,Milán,Pendiente,2024-05-21 20:00:00
3447.0,1563,Pedro López,42,Monitor LG,Tecnología,20/07/2023,4.0,1610.78,6107.66125240237,Bizum,spain,Roma,Cancelado,2023-07-20 21:00:00
3448.0,1838,Carlos Ruiz,168,Silla Gaming,Hogar,01-30-2024,4.0,1433.05,5732.2,PayPal,spain,Paris,Entregado,2024-01-30 07:00:00
3449.0,1252,Pedro López,108,Reloj Casio,Accesorios,05-05-2024,5.0,1190.38,5951.9,Bizum,Italy,Valencia,Entregado,2024-05-05 23:00:00
3450.0,1105,Pedro López,65,Silla Gaming,Hogar,2023-03-09,4.0,116.16,464.64,Bizum,Italy,Milán,Pendiente,2023-03-09 21:00:00
3451.0,1270,Ana Sánchez,33,Monitor LG,Tecnología,17/02/2024,1.0,914.98,914.98,Tarjeta,Italy,Paris,Cancelado,2024-02-17 11:00:00
3452.0,1958,juan pérez,18,iPhone 13,Tecnología,11/03/2023,,1352.82,,Tarjeta,ES,Lyon,Cancelado,2023-03-11 11:00:00
3453.0,1127,Ana Sánchez,17,Zapatillas Nike,Moda,08-10-2023,4.0,1358.29,5433.16,PayPal,FR,Madrid,Entregado,2023-08-10 03:00:00
3454.0,1223,carlos ruiz,36,Bolso Gucci,Moda,27/07/2023,1.0,752.51,752.51,Tarjeta,France,Hamburgo,Cancelado,2023-07-27 18:00:00
3455.0,1160,David Gómez,56,MacBook Pro,HOGAR,2024-05-09,5.0,1883.97,9419.85,PayPal,DE,Berlín,Entregado,2024-05-09 11:00:00
3456.0,1513,DAVID GÓMEZ,25,MacBook Pro,tech,2024-03-02,3.0,343.04,1029.12,Tarjeta,spain,Milán,Cancelado,2024-03-02 15:00:00
3457.0,1376,Juan Pérez,39,Sony Headphones,Tecnología,2024-09-22,2.0,1005.72,2011.44,PayPal,FR,Milán,Pendiente,2024-09-22 10:00:00
3458.0,1483,Laura Torres,133,AirPods,Tecnología,04-05-2024,4.0,1384.86,5539.44,PayPal,Germany,Madrid,Cancelado,2024-04-05 19:00:00
3459.0,1620,Ana Sánchez,157,AirPods,Tecnología,2023-08-15,4.0,$1397.3,,Bizum,IT,Paris,Pendiente,2023-08-15 05:00:00
3460.0,1465,PEDRO LÓPEZ,160,Samsung Galaxy,moda,01/04/2024,3.0,"1300,79",,Tarjeta,Italy,Roma,Entregado,2024-04-01 05:00:00
3461.0,1626,David Gómez,61,Aspiradora Dyson,Hogar,2024-09-18,1.0,557.82,557.82,Tarjeta,España,Hamburgo,Entregado,2024-09-18 12:00:00
3462.0,1882,Laura Torres,22,Mochila North Face,Accesorios,04-11-2023,5.0,320.85,1604.25,Tarjeta,ES,Berlín,Entregado,2023-04-11 07:00:00
3463.0,1803,Lucía Fernández,132,MacBook Pro,Tecnología,15/01/2023,5.0,1275.52,6377.6,Transferencia,ES,Lyon,Entregado,2023-01-15 07:00:00
3464.0,1776,Carlos Ruiz,151,Aspiradora Dyson,Hogar,25/03/2024,2.0,1202.61,2405.22,PayPal,Germany,Valencia,Entregado,2024-03-25 20:00:00
3465.0,1103,Pedro López,44,Mochila North Face,Accesorios,29/11/2023,1.0,"366,92",,Bizum,Italy,Berlín,Cancelado,2023-11-29 08:00:00
3466.0,1672,MARÍA GARCÍA,45,Silla Gaming,Hogar,09-11-2023,1.0,1413.23,1413.23,Bizum,DE,Berlín,Entregado,2023-09-11 01:00:00
3467.0,1334,Juan Pérez,180,Samsung Galaxy,Tecnología,08/01/2024,5.0,915.79,3831.860319827037,Tarjeta,France,Barcelona,Entregado,2024-01-08 13:00:00
3468.0,1477,Ana Sánchez,78,Silla Gaming,Hogar,05-09-2024,3.0,1338.84,4016.52,Transferencia,DE,Barcelona,Cancelado,2024-05-09 19:00:00
3469.0,1615,Lucía Fernández,77,Teclado Logitech,Tecnología,2023-05-01,2.0,1676.36,3429.3946077067408,PayPal,FR,Lyon,Entregado,2023-05-01 21:00:00
3470.0,1961,Ana Sánchez,10,AirPods,Tecnología,06/10/2023,3.0,347.76,1043.28,PayPal,DE,Roma,Entregado,2023-10-06 08:00:00
3471.0,1424,David Gómez,55,Mochila North Face,Accesorios,2024-03-24,4.0,48.1,192.4,Transferencia,Italy,Valencia,Entregado,2024-03-24 01:00:00
3472.0,1506,Lucía Fernández,107,Camiseta Adidas,Moda,2023-10-18,2.0,1560.41,2801.8620234309797,Bizum,IT,Berlín,Cancelado,2023-10-18 05:00:00
3473.0,1700,Juan Pérez,91,AirPods,Tecnología,16/03/2023,1.0,1223.3,1223.3,Tarjeta,España,Valencia,Pendiente,2023-03-16 12:00:00
3474.0,1796,Juan Pérez,144,Teclado Logitech,Tecnología,07-28-2024,2.0,1402.28,2804.56,Transferencia,España,Valencia,Entregado,2024-07-28 03:00:00
3475.0,1248,Pedro López,62,MacBook Pro,Tecnología,06-02-2023,3.0,$1677.93,,Bizum,IT,Valencia,Pendiente,2023-06-02 15:00:00
3476.0,1020,Pedro López,96,Teclado Logitech,Tecnología,22/12/2023,2.0,$1607.59,,Tarjeta,DE,Paris,Cancelado,2023-12-22 05:00:00
3477.0,1062,Laura Torres,124,Sony Headphones,Tecnología,28/04/2023,2.0,1922.23,3844.46,Transferencia,España,Barcelona,Cancelado,2023-04-28 02:00:00
3478.0,1550,juan pérez,149,iPhone 13,Moda,2023-05-31,4.0,1076.51,4306.04,Tarjeta,spain,Barcelona,Entregado,2023-05-31 16:00:00
,1931,David Gómez,120,Silla Gaming,Hogar,11-23-2024,5.0,$982.11,,Transferencia,IT,Milán,Entregado,2024-11-23 23:00:00
3480.0,1765,Laura Torres,122,Teclado Logitech,Tecnología,11/07/2023,4.0,809.76,3239.04,Transferencia,Germany,Valencia,Pendiente,2023-07-11 08:00:00
3481.0,1314,María García,95,Reloj Casio,Accesorios,01-19-2024,4.0,315.85,1263.4,Bizum,España,Madrid,Pendiente,2024-01-19 19:00:00
3482.0,1195,Pedro López,43,Zapatillas Nike,Moda,2024-09-03,1.0,1149.49,1149.49,Bizum,Italy,Valencia,Pendiente,2024-09-03 00:00:00
3483.0,1472,María García,159,Monitor LG,Tecnología,04-29-2023,3.0,561.25,1683.75,Tarjeta,Italy,Roma,Pendiente,2023-04-29 22:00:00
3484.0,1902,Juan Pérez,122,MacBook Pro,Tecnología,03-08-2024,3.0,1843.4,5530.2,PayPal,España,Valencia,Cancelado,2024-03-08 02:00:00
3485.0,1384,Pedro López,131,Aspiradora Dyson,Hogar,27/06/2023,2.0,1170.55,2341.1,PayPal,spain,Barcelona,Pendiente,2023-06-27 05:00:00
3486.0,1917,María García,104,Cafetera Philips,Hogar,2024-04-14,5.0,1189.75,5948.75,Bizum,Italy,Roma,Entregado,2024-04-14 08:00:00
3487.0,1598,David Gómez,131,Aspiradora Dyson,Hogar,20/04/2023,4.0,716.3,2865.2,Bizum,España,Milán,Entregado,2023-04-20 23:00:00
3488.0,1857,Laura Torres,52,Samsung Galaxy,Tecnología,09-27-2023,2.0,113.46,226.92,Tarjeta,DE,Paris,Entregado,2023-09-27 09:00:00
3489.0,1700,JUAN PÉREZ,139,Cafetera Philips,Hogar,07-10-2024,2.0,73.17,146.34,Bizum,Germany,Hamburgo,Entregado,2024-07-10 01:00:00
3490.0,1172,lucía fernández,14,Mochila North Face,Accesorios,10-19-2023,4.0,852.44,3409.76,Bizum,ES,Roma,Cancelado,2023-10-19 18:00:00
3491.0,1200,Lucía Fernández,108,Bolso Gucci,Moda,02-23-2024,5.0,178.29,891.45,Bizum,FR,Roma,Entregado,2024-02-23 08:00:00
3492.0,1177,Juan Pérez,137,Reloj Casio,Accesorios,02-21-2023,5.0,1217.63,5055.221040029269,Bizum,España,Barcelona,Pendiente,2023-02-21 02:00:00
3493.0,1641,David Gómez,11,Sony Headphones,Tecnología,2023-03-04,5.0,1763.14,8815.7,PayPal,DE,Milán,Cancelado,2023-03-04 23:00:00
3494.0,1357,Laura Torres,177,Sony Headphones,Tecnología,2023-06-10,2.0,1767.0,3534.0,Tarjeta,spain,Hamburgo,Pendiente,2023-06-10 21:00:00
3495.0,1162,David Gómez,49,Samsung Galaxy,Tecnología,01-17-2023,3.0,1321.5,3964.5,Bizum,France,Berlín,Cancelado,2023-01-17 08:00:00
3496.0,1961,Laura Torres,90,Zapatillas Nike,Moda,01-28-2024,5.0,430.35,2151.75,Tarjeta,France,Valencia,Cancelado,2024-01-28 03:00:00
3497.0,1175,Pedro López,194,MacBook Pro,HOGAR,02-09-2023,3.0,1727.36,4360.38362634271,Transferencia,ES,Berlín,Cancelado,2023-02-09 15:00:00
3498.0,1521,David Gómez,7,Camiseta Adidas,Moda,05-05-2023,3.0,1773.33,5319.99,Transferencia,Italy,Roma,Entregado,2023-05-05 06:00:00
3499.0,1361,laura torres,144,Silla Gaming,Hogar,2024-09-05,1.0,401.34,401.34,Tarjeta,DE,Lyon,Pendiente,2024-09-05 23:00:00
3500.0,1989,JUAN PÉREZ,4,Cafetera Philips,TECHNOLOGY,08/04/2024,4.0,"1477,48",,PayPal,DE,Roma,Entregado,2024-04-08 06:00:00
3501.0,1096,Pedro López,4,AirPods,Tecnología,2024-10-06,5.0,580.17,2900.85,Transferencia,IT,Roma,Cancelado,2024-10-06 13:00:00
3502.0,1198,Ana Sánchez,98,Silla Gaming,TECHNOLOGY,14/09/2023,3.0,1607.25,4821.75,Tarjeta,spain,Milán,Pendiente,2023-09-14 10:00:00
3503.0,1503,Lucía Fernández,184,iPhone 13,Tecnología,05-16-2023,2.0,1994.5,3989.0,PayPal,ES,Berlín,Cancelado,2023-05-16 08:00:00
3504.0,1604,Carlos Ruiz,58,Camiseta Adidas,Moda,2023-07-19,4.0,69.75,279.0,Transferencia,Germany,Valencia,Entregado,2023-07-19 09:00:00
3505.0,1402,Ana Sánchez,9,Silla Gaming,Hogar,20/03/2023,3.0,1795.76,5387.28,Bizum,France,Barcelona,Pendiente,2023-03-20 23:00:00
3506.0,1183,David Gómez,159,Reloj Casio,Accesorios,20/09/2023,5.0,1249.03,6245.15,PayPal,ES,Barcelona,Pendiente,2023-09-20 04:00:00
3507.0,1854,Pedro López,118,Mochila North Face,Accesorios,28/03/2023,4.0,1947.03,7788.12,Tarjeta,Italy,Roma,Pendiente,2023-03-28 09:00:00
3508.0,1492,ANA SÁNCHEZ,193,iPhone 13,Tecnología,16/02/2023,3.0,935.37,2806.11,Transferencia,Italy,Lyon,Cancelado,2023-02-16 23:00:00
3509.0,1069,Pedro López,134,Camiseta Adidas,Moda,2023-10-31,1.0,1696.3,1696.3,Bizum,ES,Paris,Pendiente,2023-10-31 14:00:00
3510.0,1211,Carlos Ruiz,75,Reloj Casio,Accesorios,04/01/2024,3.0,134.16,402.48,PayPal,Italy,Roma,Entregado,2024-01-04 05:00:00
3511.0,1557,Pedro López,91,Samsung Galaxy,Tecnología,01-17-2023,2.0,677.21,1354.42,Bizum,España,Hamburgo,Entregado,2023-01-17 16:00:00
3512.0,1302,Ana Sánchez,179,Teclado Logitech,Tecnología,11-19-2024,2.0,143.36,291.36900622152393,Tarjeta,Germany,Berlín,Cancelado,2024-11-19 14:00:00
3513.0,1966,Lucía Fernández,4,Bolso Gucci,hogar,22/02/2024,5.0,1950.93,9754.65,Transferencia,Italy,Roma,Cancelado,2024-02-22 02:00:00
3514.0,1865,Carlos Ruiz,109,iPhone 13,TECHNOLOGY,05-10-2024,1.0,1635.78,1635.78,PayPal,Italy,Berlín,Entregado,2024-05-10 07:00:00
3515.0,1925,Carlos Ruiz,38,Sony Headphones,Tecnología,15/11/2024,3.0,1706.57,6084.94891845765,Bizum,Germany,Milán,Pendiente,2024-11-15 07:00:00
3516.0,1146,DAVID GÓMEZ,84,Zapatillas Nike,Moda,07/03/2023,3.0,1876.55,5629.65,Tarjeta,IT,Milán,Entregado,2023-03-07 02:00:00
3517.0,1702,Pedro López,15,Cafetera Philips,Hogar,07/02/2024,1.0,179.36,179.36,Bizum,spain,Paris,Pendiente,2024-02-07 00:00:00
3518.0,1053,María García,42,Aspiradora Dyson,tecnologia,02-02-2024,4.0,777.34,3453.5143762752828,Bizum,IT,Paris,Cancelado,2024-02-02 10:00:00
3519.0,1151,María García,165,Sony Headphones,Tecnología,12-28-2023,3.0,151.36,454.08,Tarjeta,IT,Hamburgo,Cancelado,2023-12-28 07:00:00
3520.0,1621,David Gómez,145,Bolso Gucci,Moda,04-17-2024,3.0,429.48,1064.720472025745,Bizum,ES,Hamburgo,Cancelado,2024-04-17 14:00:00
3521.0,1564,Pedro López,168,Zapatillas Nike,tech,2024-06-21,2.0,466.44,932.88,Tarjeta,Italy,Roma,Pendiente,2024-06-21 03:00:00
3522.0,1830,Ana Sánchez,51,Mochila North Face,Accesorios,2024-07-03,2.0,943.52,1887.04,Tarjeta,España,Valencia,Entregado,2024-07-03 03:00:00
3523.0,1087,María García,83,Mochila North Face,Accesorios,2024-02-02,4.0,544.44,2177.76,Bizum,France,Roma,Entregado,2024-02-02 03:00:00
3524.0,1071,Lucía Fernández,6,Cafetera Philips,Hogar,01-21-2023,1.0,210.95,210.95,Transferencia,IT,Roma,Pendiente,2023-01-21 14:00:00
3525.0,1315,Carlos Ruiz,51,Samsung Galaxy,moda,09-16-2024,3.0,343.31,1029.93,Tarjeta,IT,Valencia,Entregado,2024-09-16 19:00:00
3526.0,1673,Carlos Ruiz,65,AirPods,Tecnología,20/01/2023,2.0,"303,08",,Transferencia,DE,Berlín,Pendiente,2023-01-20 05:00:00
3527.0,1555,Juan Pérez,52,Cafetera Philips,Hogar,17/11/2023,4.0,1946.42,7785.68,Tarjeta,France,Hamburgo,Entregado,2023-11-17 21:00:00
3528.0,1297,Lucía Fernández,123,Sony Headphones,Tecnología,2024-04-05,2.0,1520.99,3041.98,Tarjeta,ES,Lyon,Pendiente,2024-04-05 20:00:00
3529.0,1823,Ana Sánchez,114,Aspiradora Dyson,Hogar,03/11/2024,4.0,1935.85,7743.4,Bizum,España,Roma,Cancelado,2024-11-03 10:00:00
3530.0,1890,Carlos Ruiz,177,Sony Headphones,Tecnología,08-04-2024,2.0,885.08,1770.16,Transferencia,DE,Madrid,Cancelado,2024-08-04 04:00:00
3531.0,1818,ana sánchez,198,Teclado Logitech,HOGAR,15/08/2023,2.0,563.95,1127.9,PayPal,Germany,Milán,Entregado,2023-08-15 21:00:00
3532.0,1592,ANA SÁNCHEZ,147,Mochila North Face,Moda,08/03/2023,4.0,1598.6,6394.4,Bizum,spain,Paris,Entregado,2023-03-08 20:00:00
3533.0,1231,Pedro López,39,Samsung Galaxy,Tecnología,2024-07-18,1.0,$659.25,,Bizum,France,Berlín,Pendiente,2024-07-18 10:00:00
3534.0,1801,laura torres,186,Reloj Casio,Accesorios,01/09/2023,2.0,605.77,1211.54,Tarjeta,France,Madrid,Entregado,2023-09-01 18:00:00
3535.0,1371,carlos ruiz,103,Monitor LG,Tecnología,09-06-2024,1.0,472.69,472.69,PayPal,ES,Berlín,Entregado,2024-09-06 15:00:00
3536.0,1324,Juan Pérez,128,Cafetera Philips,Hogar,21/07/2023,1.0,268.06,268.06,Transferencia,France,Berlín,Cancelado,2023-07-21 10:00:00
3537.0,1946,ANA SÁNCHEZ,82,Reloj Casio,Accesorios,11-07-2024,1.0,520.36,520.36,Transferencia,spain,Hamburgo,Entregado,2024-11-07 09:00:00
3538.0,1045,Juan Pérez,159,AirPods,Tecnología,02-15-2023,1.0,717.09,717.09,PayPal,Italy,Hamburgo,Pendiente,2023-02-15 13:00:00
3539.0,1147,maría garcía,171,Camiseta Adidas,Moda,10/07/2023,1.0,1351.25,1351.25,Transferencia,ES,Barcelona,Entregado,2023-07-10 01:00:00
3540.0,1732,Juan Pérez,68,Cafetera Philips,HOGAR,06-28-2024,,134.5,,Transferencia,FR,Valencia,Cancelado,2024-06-28 17:00:00
3541.0,1738,ana sánchez,150,Camiseta Adidas,Moda,07-28-2023,5.0,428.91,2144.55,Transferencia,IT,Roma,Pendiente,2023-07-28 12:00:00
3542.0,1500,Juan Pérez,117,Zapatillas Nike,HOGAR,23/04/2023,2.0,1619.96,3239.92,Bizum,España,Hamburgo,Cancelado,2023-04-23 18:00:00
3543.0,1136,Laura Torres,85,Silla Gaming,Hogar,05-28-2023,1.0,302.37,302.37,PayPal,Italy,Lyon,Cancelado,2023-05-28 19:00:00
3544.0,1875,Laura Torres,133,iPhone 13,Tecnología,2024-09-13,2.0,691.86,1383.72,Transferencia,España,Valencia,Pendiente,2024-09-13 08:00:00
3545.0,1887,Carlos Ruiz,130,AirPods,Tecnología,08-12-2023,3.0,1730.67,5192.01,Tarjeta,España,Hamburgo,Cancelado,2023-08-12 09:00:00
3546.0,1930,Pedro López,24,Aspiradora Dyson,Hogar,08-10-2023,5.0,318.3,1591.5,Transferencia,Germany,Hamburgo,Entregado,2023-08-10 06:00:00
3547.0,1441,Ana Sánchez,91,AirPods,Tecnología,2023-08-19,5.0,174.65,873.25,Transferencia,Italy,Berlín,Pendiente,2023-08-19 14:00:00
3548.0,1353,Juan Pérez,132,Cafetera Philips,Hogar,03-02-2024,3.0,974.23,2922.69,Tarjeta,Italy,Berlín,Pendiente,2024-03-02 05:00:00
3549.0,1179,laura torres,66,Reloj Casio,Accesorios,22/02/2024,5.0,611.81,3059.05,Transferencia,France,Berlín,Pendiente,2024-02-22 06:00:00
3550.0,1349,Carlos Ruiz,63,Sony Headphones,Tecnología,31/10/2024,1.0,1131.18,1131.18,Bizum,ES,Madrid,Entregado,2024-10-31 22:00:00
3551.0,1751,Ana Sánchez,145,Teclado Logitech,Tecnología,2023-07-23,1.0,"1609,57",,Transferencia,DE,Paris,Entregado,2023-07-23 08:00:00
3552.0,1175,Juan Pérez,70,Samsung Galaxy,Tecnología,2024-07-31,2.0,$282.93,,Transferencia,España,Milán,Pendiente,2024-07-31 19:00:00
3553.0,1841,Juan Pérez,171,Teclado Logitech,Tecnología,08-04-2023,1.0,1165.59,1165.59,Bizum,France,Lyon,Entregado,2023-08-04 19:00:00
3554.0,1430,María García,59,Reloj Casio,Accesorios,2023-09-22,4.0,1015.96,4063.84,Tarjeta,France,Milán,Cancelado,2023-09-22 04:00:00
3555.0,1043,CARLOS RUIZ,184,iPhone 13,TECHNOLOGY,03-26-2024,1.0,296.72,296.72,PayPal,France,Milán,Entregado,2024-03-26 06:00:00
3556.0,1987,María García,53,Mochila North Face,hogar,02-12-2023,4.0,$1251.76,,Transferencia,FR,Hamburgo,Pendiente,2023-02-12 19:00:00
3557.0,1531,Juan Pérez,104,Teclado Logitech,Tecnología,22/11/2024,4.0,554.54,2218.16,Transferencia,spain,Lyon,Pendiente,2024-11-22 13:00:00
3558.0,1885,Pedro López,7,Aspiradora Dyson,Hogar,2024-07-03,3.0,980.79,2942.37,Bizum,Germany,Valencia,Pendiente,2024-07-03 06:00:00
3559.0,1533,Carlos Ruiz,180,Samsung Galaxy,Tecnología,08-21-2023,1.0,173.72,173.72,Tarjeta,Italy,Madrid,Entregado,2023-08-21 14:00:00
3560.0,1704,Lucía Fernández,126,Zapatillas Nike,Moda,2023-02-06,5.0,924.57,4622.85,Tarjeta,IT,Roma,Pendiente,2023-02-06 00:00:00
3561.0,1032,David Gómez,89,Sony Headphones,Tecnología,2023-01-04,5.0,619.86,2732.076301088331,Tarjeta,España,Berlín,Cancelado,2023-01-04 22:00:00
3562.0,1352,carlos ruiz,29,AirPods,Tecnología,04/09/2024,5.0,1646.54,8232.7,PayPal,ES,Madrid,Pendiente,2024-09-04 05:00:00
3563.0,1309,PEDRO LÓPEZ,20,Bolso Gucci,Moda,04-05-2024,5.0,123.39,616.95,Transferencia,España,Berlín,Cancelado,2024-04-05 03:00:00
3564.0,1244,María García,38,Samsung Galaxy,tecnologia,10-03-2023,5.0,843.03,4215.15,Transferencia,Italy,Paris,Cancelado,2023-10-03 00:00:00
3565.0,1833,Pedro López,100,Zapatillas Nike,Moda,2023-07-02,2.0,922.28,1844.56,PayPal,Germany,Paris,Cancelado,2023-07-02 08:00:00
3566.0,1194,Pedro López,123,AirPods,Tecnología,2024-04-18,3.0,1452.76,4358.28,Transferencia,FR,Valencia,Entregado,2024-04-18 14:00:00
3567.0,1871,Lucía Fernández,12,Samsung Galaxy,Tecnología,2023-06-02,5.0,1152.83,5764.15,PayPal,Germany,Valencia,Cancelado,2023-06-02 17:00:00
3568.0,1092,Ana Sánchez,157,Sony Headphones,Tecnología,2023-12-15,3.0,1337.75,4013.25,PayPal,ES,Valencia,Cancelado,2023-12-15 09:00:00
3569.0,1035,Juan Pérez,106,AirPods,Tecnología,02-20-2023,1.0,1556.33,1556.33,Tarjeta,Italy,Hamburgo,Entregado,2023-02-20 12:00:00
3570.0,1297,Pedro López,178,Monitor LG,Tecnología,07-23-2024,1.0,1725.78,1725.78,Transferencia,spain,Lyon,Cancelado,2024-07-23 18:00:00
3571.0,1384,Juan Pérez,154,Samsung Galaxy,Tecnología,12/03/2024,5.0,634.61,3173.05,PayPal,FR,Valencia,Pendiente,2024-03-12 07:00:00
3572.0,1924,Pedro López,173,iPhone 13,Tecnología,2023-07-13,5.0,1080.67,5403.35,Transferencia,DE,Hamburgo,Cancelado,2023-07-13 08:00:00
3573.0,1952,Pedro López,53,Zapatillas Nike,Moda,2024-02-03,2.0,1681.82,3363.64,Transferencia,France,Paris,Pendiente,2024-02-03 17:00:00
3574.0,1157,Carlos Ruiz,3,Teclado Logitech,Tecnología,10-19-2023,5.0,1979.01,9895.05,PayPal,spain,Milán,Cancelado,2023-10-19 18:00:00
3575.0,1313,david gómez,57,Reloj Casio,Accesorios,2023-08-14,4.0,"1780,14",,PayPal,FR,Lyon,Pendiente,2023-08-14 10:00:00
3576.0,1877,David Gómez,157,Samsung Galaxy,Tecnología,2023-06-29,2.0,749.22,1498.44,Transferencia,France,Berlín,Entregado,2023-06-29 02:00:00
3577.0,1844,laura torres,184,AirPods,Tecnología,05-05-2024,5.0,398.38,1991.9,Tarjeta,Germany,Paris,Entregado,2024-05-05 01:00:00
3578.0,1103,Lucía Fernández,146,Reloj Casio,Accesorios,08-17-2023,5.0,983.89,4919.45,Tarjeta,France,Berlín,Entregado,2023-08-17 16:00:00
3579.0,1058,ANA SÁNCHEZ,172,Bolso Gucci,Moda,03-22-2023,5.0,1485.87,7429.35,PayPal,France,Madrid,Cancelado,2023-03-22 05:00:00
3580.0,1005,Pedro López,42,MacBook Pro,Tecnología,08-27-2023,5.0,990.21,4951.05,Transferencia,Germany,Valencia,Pendiente,2023-08-27 02:00:00
3581.0,1179,Pedro López,40,Cafetera Philips,Hogar,2023-05-27,2.0,971.53,2242.0857581257465,Transferencia,Italy,Barcelona,Pendiente,2023-05-27 00:00:00
3582.0,1824,Ana Sánchez,191,Sony Headphones,Tecnología,2023-07-04,5.0,1678.08,8390.4,Transferencia,España,Milán,Cancelado,2023-07-04 07:00:00
3583.0,1494,Carlos Ruiz,192,Samsung Galaxy,Tecnología,10-14-2024,1.0,"729,19",,Bizum,ES,Valencia,Entregado,2024-10-14 02:00:00
3584.0,1465,Carlos Ruiz,107,Zapatillas Nike,Moda,14/02/2024,1.0,1720.99,1720.99,PayPal,Italy,Madrid,Cancelado,2024-02-14 19:00:00
3585.0,1210,Juan Pérez,11,Silla Gaming,Hogar,18/08/2023,2.0,819.54,1639.08,Bizum,DE,Berlín,Pendiente,2023-08-18 00:00:00
3586.0,1293,María García,87,iPhone 13,Tecnología,21/11/2023,4.0,663.18,2652.72,PayPal,España,Lyon,Entregado,2023-11-21 06:00:00
3587.0,1906,Lucía Fernández,91,Samsung Galaxy,Tecnología,2024-03-20,5.0,913.44,4567.2,Transferencia,FR,Lyon,Pendiente,2024-03-20 22:00:00
3588.0,1972,Juan Pérez,48,Camiseta Adidas,Moda,2023-03-18,2.0,1527.27,3054.54,PayPal,Germany,Paris,Entregado,2023-03-18 10:00:00
3589.0,1788,David Gómez,122,Cafetera Philips,Hogar,23/11/2024,5.0,"260,74",,Transferencia,España,Barcelona,Pendiente,2024-11-23 06:00:00
3590.0,1303,Carlos Ruiz,75,Sony Headphones,Tecnología,03-21-2023,2.0,$400.87,,Tarjeta,FR,Hamburgo,Entregado,2023-03-21 08:00:00
3591.0,1985,Juan Pérez,138,iPhone 13,Tecnología,2024-07-21,5.0,1903.38,9516.9,Transferencia,DE,Madrid,Pendiente,2024-07-21 23:00:00
3592.0,1480,ANA SÁNCHEZ,125,Teclado Logitech,Tecnología,03/05/2024,5.0,359.23,1962.3018520286648,Transferencia,Germany,Lyon,Pendiente,2024-05-03 21:00:00
3593.0,1793,María García,144,Silla Gaming,Hogar,03-25-2024,5.0,1139.78,5698.9,Transferencia,ES,Roma,Pendiente,2024-03-25 04:00:00
3594.0,1223,CARLOS RUIZ,120,Monitor LG,Tecnología,09-17-2023,3.0,1162.84,3488.52,Tarjeta,ES,Barcelona,Cancelado,2023-09-17 00:00:00
3595.0,1660,ana sánchez,85,iPhone 13,Tecnología,2024-08-28,3.0,984.35,2953.05,Tarjeta,France,Barcelona,Entregado,2024-08-28 12:00:00
3596.0,1484,Juan Pérez,128,Camiseta Adidas,Moda,08/08/2024,3.0,$1293.04,,Bizum,ES,Lyon,Pendiente,2024-08-08 17:00:00
3597.0,1669,Juan Pérez,25,Bolso Gucci,Moda,07-15-2024,5.0,467.36,2336.8,Transferencia,France,Valencia,Cancelado,2024-07-15 13:00:00
3598.0,1484,Carlos Ruiz,43,Aspiradora Dyson,Hogar,03/12/2023,1.0,$1109.8,,Tarjeta,France,Lyon,Pendiente,2023-12-03 23:00:00
3599.0,1355,Ana Sánchez,100,Camiseta Adidas,Moda,08-19-2023,2.0,750.62,1501.24,PayPal,DE,Valencia,Entregado,2023-08-19 00:00:00
3600.0,1664,Laura Torres,181,iPhone 13,Tecnología,2023-01-27,1.0,1326.72,1326.72,PayPal,IT,Paris,Pendiente,2023-01-27 19:00:00
3601.0,1290,Pedro López,146,Reloj Casio,Accesorios,13/07/2024,3.0,291.03,873.09,PayPal,spain,Barcelona,Entregado,2024-07-13 14:00:00
3602.0,1443,David Gómez,6,Silla Gaming,Hogar,2024-05-17,5.0,1146.05,5730.25,PayPal,Italy,Roma,Entregado,2024-05-17 12:00:00
3603.0,1823,David Gómez,191,Camiseta Adidas,Moda,2024-10-26,4.0,378.69,1514.76,PayPal,FR,Berlín,Entregado,2024-10-26 08:00:00
3604.0,1043,Pedro López,93,Zapatillas Nike,tecnologia,11-06-2023,1.0,564.5,564.5,Tarjeta,DE,Valencia,Entregado,2023-11-06 13:00:00
3605.0,1233,Carlos Ruiz,32,AirPods,Tecnología,25/02/2024,4.0,445.23,1469.5988296804267,Bizum,Italy,Roma,Entregado,2024-02-25 07:00:00
3606.0,1638,Laura Torres,54,AirPods,Tecnología,10-03-2023,1.0,373.85,373.85,Tarjeta,Italy,Hamburgo,Entregado,2023-10-03 02:00:00
3607.0,1882,lucía fernández,167,Mochila North Face,Accesorios,12-22-2023,5.0,1653.16,8265.8,Bizum,IT,Lyon,Entregado,2023-12-22 03:00:00
3608.0,1282,Ana Sánchez,197,Monitor LG,Tecnología,04-12-2023,4.0,578.56,2314.24,PayPal,spain,Barcelona,Pendiente,2023-04-12 20:00:00
3609.0,1146,Carlos Ruiz,38,AirPods,Tecnología,06/10/2023,4.0,1854.98,7419.92,Transferencia,España,Milán,Entregado,2023-10-06 23:00:00
3610.0,1521,Lucía Fernández,47,Aspiradora Dyson,Hogar,2023-07-12,2.0,1940.15,3880.3,Tarjeta,spain,Lyon,Cancelado,2023-07-12 12:00:00
3611.0,1321,María García,1,Bolso Gucci,Moda,06/07/2024,4.0,1146.81,4587.24,Tarjeta,Germany,Milán,Pendiente,2024-07-06 18:00:00
3612.0,1167,Lucía Fernández,75,Bolso Gucci,Moda,11/06/2024,5.0,294.57,1472.85,PayPal,DE,Madrid,Entregado,2024-06-11 03:00:00
3613.0,1884,David Gómez,195,iPhone 13,Tecnología,14/11/2023,4.0,755.35,3021.4,Bizum,Italy,Hamburgo,Entregado,2023-11-14 08:00:00
3614.0,1039,Carlos Ruiz,10,MacBook Pro,Tecnología,05-15-2023,1.0,1597.49,1597.49,Transferencia,ES,Madrid,Cancelado,2023-05-15 18:00:00
3615.0,1852,Juan Pérez,188,Mochila North Face,Accesorios,2024-01-05,1.0,741.11,741.11,PayPal,Italy,Valencia,Pendiente,2024-01-05 20:00:00
3616.0,1206,Juan Pérez,152,iPhone 13,Tecnología,12-01-2024,5.0,183.16,915.8,PayPal,France,Hamburgo,Entregado,2024-12-01 12:00:00
3617.0,1499,Juan Pérez,131,Monitor LG,Tecnología,25/12/2023,4.0,$1118.0,,Tarjeta,ES,Barcelona,Entregado,2023-12-25 04:00:00
3618.0,1269,Carlos Ruiz,2,Samsung Galaxy,Tecnología,11/05/2024,5.0,1691.79,8458.95,Transferencia,spain,Milán,Cancelado,2024-05-11 17:00:00
3619.0,1585,David Gómez,45,AirPods,Tecnología,2024-10-25,1.0,1593.89,1593.89,PayPal,ES,Madrid,Cancelado,2024-10-25 17:00:00
3620.0,1351,LAURA TORRES,77,AirPods,Tecnología,05-23-2023,4.0,358.5,1434.0,Tarjeta,DE,Paris,Entregado,2023-05-23 08:00:00
3621.0,1605,CARLOS RUIZ,137,Bolso Gucci,Moda,11-11-2024,1.0,$1348.8,0.0,PayPal,Germany,Valencia,Pendiente,2024-11-11 10:00:00
3622.0,1385,María García,67,Cafetera Philips,Hogar,10-13-2023,2.0,448.8,897.6,Tarjeta,DE,Roma,Entregado,2023-10-13 12:00:00
3623.0,1917,Juan Pérez,56,Aspiradora Dyson,Hogar,01-09-2024,3.0,444.23,1332.69,PayPal,FR,Paris,Entregado,2024-01-09 21:00:00
3624.0,1365,María García,171,AirPods,Tecnología,19/05/2024,5.0,1749.4,8747.0,Bizum,FR,Hamburgo,Entregado,2024-05-19 16:00:00
3625.0,1204,Carlos Ruiz,77,Mochila North Face,Accesorios,04-19-2023,1.0,506.84,537.2776455494513,Bizum,France,Paris,Cancelado,2023-04-19 10:00:00
3626.0,1747,Laura Torres,196,Aspiradora Dyson,Hogar,07-14-2023,3.0,533.86,1601.58,Tarjeta,España,Barcelona,Entregado,2023-07-14 07:00:00
3627.0,1428,Carlos Ruiz,124,Camiseta Adidas,Moda,14/07/2023,3.0,"11,3",,Transferencia,spain,Valencia,Entregado,2023-07-14 12:00:00
3628.0,1504,Laura Torres,178,Cafetera Philips,Hogar,03-24-2023,4.0,1742.63,6970.52,Tarjeta,ES,Hamburgo,Pendiente,2023-03-24 10:00:00
3629.0,1294,carlos ruiz,21,Teclado Logitech,HOGAR,08-24-2023,4.0,$1587.26,,Tarjeta,FR,Madrid,Cancelado,2023-08-24 02:00:00
3630.0,1895,Lucía Fernández,78,Mochila North Face,Accesorios,01/12/2023,1.0,1258.38,1258.38,Transferencia,España,Hamburgo,Pendiente,2023-12-01 22:00:00
3631.0,1836,Juan Pérez,62,Teclado Logitech,HOGAR,17/08/2024,3.0,"1503,03",0.0,Bizum,IT,Barcelona,Pendiente,2024-08-17 06:00:00
3632.0,1478,David Gómez,121,Mochila North Face,Accesorios,02-17-2024,3.0,312.58,937.74,Tarjeta,IT,Paris,Entregado,2024-02-17 19:00:00
3633.0,1770,Carlos Ruiz,121,Teclado Logitech,Tecnología,08-03-2023,2.0,922.06,1844.12,PayPal,Italy,Valencia,Cancelado,2023-08-03 22:00:00
3634.0,1780,Lucía Fernández,5,AirPods,Tecnología,2023-07-31,5.0,708.93,3544.65,Tarjeta,Italy,Milán,Cancelado,2023-07-31 19:00:00
3635.0,1882,Laura Torres,63,iPhone 13,Tecnología,17/04/2023,4.0,196.62,786.48,Bizum,ES,Paris,Entregado,2023-04-17 05:00:00
3636.0,1821,Carlos Ruiz,162,Cafetera Philips,Hogar,2023-03-08,5.0,$977.4,,Tarjeta,FR,Lyon,Entregado,2023-03-08 17:00:00
3637.0,1640,Juan Pérez,176,Mochila North Face,Accesorios,2023-07-01,1.0,1842.27,1842.27,Tarjeta,FR,Hamburgo,Entregado,2023-07-01 13:00:00
3638.0,1934,Juan Pérez,109,iPhone 13,Tecnología,10-04-2024,3.0,89.72,269.16,Bizum,FR,Barcelona,Cancelado,2024-10-04 17:00:00
3639.0,1077,Pedro López,12,Cafetera Philips,tech,2024-04-20,2.0,590.01,1180.02,Tarjeta,France,Roma,Cancelado,2024-04-20 06:00:00
3640.0,1964,Laura Torres,137,Sony Headphones,Tecnología,2023-05-03,5.0,423.01,2115.05,Transferencia,FR,Roma,Pendiente,2023-05-03 00:00:00
3641.0,1153,juan pérez,29,Teclado Logitech,Tecnología,01/11/2024,3.0,483.91,1451.73,Bizum,FR,Lyon,Pendiente,2024-11-01 20:00:00
3642.0,1457,Carlos Ruiz,7,Bolso Gucci,Moda,09-08-2023,1.0,1817.78,1817.78,PayPal,spain,Milán,Pendiente,2023-09-08 21:00:00
3643.0,1060,carlos ruiz,105,Mochila North Face,Moda,06/01/2024,1.0,941.46,941.46,PayPal,spain,Valencia,Cancelado,2024-01-06 03:00:00
3644.0,1687,Pedro López,12,Silla Gaming,Hogar,25/03/2024,5.0,937.94,4818.856725714713,Transferencia,España,Paris,Cancelado,2024-03-25 04:00:00
3645.0,1344,Laura Torres,151,Cafetera Philips,Hogar,2024-06-07,1.0,1523.55,1523.55,Transferencia,IT,Valencia,Pendiente,2024-06-07 02:00:00
3646.0,1024,David Gómez,172,Bolso Gucci,Moda,25/09/2024,4.0,317.44,1269.76,Bizum,France,Barcelona,Pendiente,2024-09-25 15:00:00
3647.0,1854,Carlos Ruiz,58,Samsung Galaxy,Tecnología,2024-01-25,2.0,979.66,1959.32,Bizum,Italy,Lyon,Entregado,2024-01-25 03:00:00
3648.0,1718,Carlos Ruiz,69,iPhone 13,Tecnología,2024-04-19,3.0,865.67,2597.01,Transferencia,Germany,Madrid,Pendiente,2024-04-19 06:00:00
3649.0,1872,LUCÍA FERNÁNDEZ,45,Cafetera Philips,Hogar,2024-02-12,1.0,1197.85,1197.85,Bizum,FR,Barcelona,Entregado,2024-02-12 14:00:00
3650.0,1189,Ana Sánchez,179,Sony Headphones,Tecnología,09-04-2024,3.0,1999.12,5997.36,Tarjeta,France,Paris,Entregado,2024-09-04 05:00:00
3651.0,1282,Carlos Ruiz,63,Reloj Casio,Accesorios,27/09/2024,2.0,1541.2,3082.4,Bizum,Germany,Barcelona,Pendiente,2024-09-27 17:00:00
3652.0,1008,Pedro López,116,MacBook Pro,Tecnología,2024-07-06,3.0,801.75,2405.25,Transferencia,France,Barcelona,Entregado,2024-07-06 15:00:00
3653.0,1690,Carlos Ruiz,180,Monitor LG,Tecnología,07-10-2023,5.0,1656.83,8284.15,PayPal,Germany,Madrid,Entregado,2023-07-10 11:00:00
3654.0,1263,María García,158,MacBook Pro,Tecnología,2024-03-10,1.0,349.71,349.71,Transferencia,IT,Barcelona,Entregado,2024-03-10 10:00:00
3655.0,1747,David Gómez,198,Zapatillas Nike,HOGAR,23/07/2023,4.0,70.62,282.48,PayPal,France,Valencia,Pendiente,2023-07-23 18:00:00
3656.0,1610,Juan Pérez,182,Zapatillas Nike,Moda,28/05/2023,5.0,$416.85,,Transferencia,France,Hamburgo,Pendiente,2023-05-28 03:00:00
,1178,Laura Torres,171,iPhone 13,Tecnología,2024-05-30,1.0,687.42,687.42,Tarjeta,DE,Milán,Entregado,2024-05-30 01:00:00
3658.0,1791,Lucía Fernández,166,MacBook Pro,Tecnología,09-06-2024,4.0,1026.06,4104.24,Tarjeta,Italy,Roma,Pendiente,2024-09-06 06:00:00
3659.0,1722,Pedro López,12,Reloj Casio,hogar,07-24-2023,4.0,1234.11,4936.44,PayPal,France,Hamburgo,Cancelado,2023-07-24 20:00:00
3660.0,1642,Pedro López,21,Zapatillas Nike,Moda,05-25-2023,2.0,1822.11,3644.22,Tarjeta,ES,Lyon,Cancelado,2023-05-25 04:00:00
3661.0,1479,Lucía Fernández,162,Sony Headphones,Tecnología,2024-08-02,5.0,1024.61,5123.05,Transferencia,España,Roma,Pendiente,2024-08-02 18:00:00
3662.0,1733,Pedro López,84,Teclado Logitech,Tecnología,2024-01-06,2.0,1007.54,2015.08,Bizum,DE,Milán,Entregado,2024-01-06 10:00:00
3663.0,1972,Lucía Fernández,158,Camiseta Adidas,Moda,10-30-2024,4.0,109.98,439.92,PayPal,DE,Madrid,Cancelado,2024-10-30 04:00:00
3664.0,1154,Carlos Ruiz,156,Camiseta Adidas,hogar,31/01/2023,3.0,79.47,238.41,PayPal,DE,Paris,Pendiente,2023-01-31 02:00:00
3665.0,1626,Lucía Fernández,132,Silla Gaming,Hogar,26/05/2023,1.0,$1106.81,0.0,Transferencia,España,Roma,Cancelado,2023-05-26 05:00:00
3666.0,1373,LUCÍA FERNÁNDEZ,60,Zapatillas Nike,Moda,2023-03-29,3.0,881.98,2645.94,Tarjeta,IT,Hamburgo,Cancelado,2023-03-29 11:00:00
3667.0,1054,Carlos Ruiz,113,MacBook Pro,Tecnología,29/03/2023,2.0,1679.97,3359.94,Bizum,spain,Hamburgo,Pendiente,2023-03-29 03:00:00
3668.0,1961,María García,41,Mochila North Face,Accesorios,2024-01-03,5.0,329.75,1648.75,Bizum,IT,Barcelona,Cancelado,2024-01-03 09:00:00
3669.0,1982,Ana Sánchez,4,Cafetera Philips,Hogar,01/05/2024,1.0,59.69,59.69,Tarjeta,ES,Hamburgo,Pendiente,2024-05-01 08:00:00
3670.0,1125,María García,199,Samsung Galaxy,Tecnología,18/08/2024,2.0,903.59,1807.18,Tarjeta,Italy,Lyon,Pendiente,2024-08-18 03:00:00
3671.0,1318,maría garcía,15,AirPods,Tecnología,03-07-2023,2.0,482.58,965.16,PayPal,Germany,Roma,Pendiente,2023-03-07 06:00:00
3672.0,1951,Laura Torres,9,Teclado Logitech,Tecnología,20/04/2024,2.0,108.73,209.4728505652733,Tarjeta,DE,Valencia,Entregado,2024-04-20 03:00:00
3673.0,1942,Carlos Ruiz,153,Monitor LG,Tecnología,07-18-2023,1.0,1451.95,1451.95,PayPal,España,Roma,Pendiente,2023-07-18 09:00:00
3674.0,1578,MARÍA GARCÍA,183,Monitor LG,Tecnología,2024-05-19,2.0,232.07,464.14,PayPal,Germany,Madrid,Entregado,2024-05-19 10:00:00
3675.0,1527,Carlos Ruiz,28,MacBook Pro,Tecnología,2023-10-27,1.0,1220.56,1220.56,PayPal,France,Roma,Entregado,2023-10-27 14:00:00
3676.0,1082,MARÍA GARCÍA,101,Monitor LG,Tecnología,2023-06-21,3.0,569.29,1707.87,Transferencia,España,Milán,Entregado,2023-06-21 23:00:00
3677.0,1439,ana sánchez,160,Sony Headphones,Tecnología,15/07/2024,2.0,355.26,710.52,Transferencia,IT,Hamburgo,Cancelado,2024-07-15 01:00:00
3678.0,1997,Laura Torres,69,Camiseta Adidas,Moda,03-15-2023,5.0,765.71,3828.55,Transferencia,DE,Hamburgo,Cancelado,2023-03-15 01:00:00
3679.0,1789,Carlos Ruiz,151,Cafetera Philips,Hogar,2024-04-30,1.0,1604.88,1604.88,PayPal,Germany,Berlín,Cancelado,2024-04-30 23:00:00
3680.0,1631,Ana Sánchez,79,Bolso Gucci,Moda,2023-12-27,3.0,790.27,2370.81,Bizum,France,Barcelona,Entregado,2023-12-27 12:00:00
3681.0,1080,Carlos Ruiz,140,Monitor LG,Tecnología,07-28-2024,2.0,1504.03,3117.5475271971045,Bizum,Germany,Berlín,Pendiente,2024-07-28 10:00:00
3682.0,1888,David Gómez,120,Zapatillas Nike,TECHNOLOGY,08-14-2024,2.0,259.72,519.44,PayPal,Italy,Roma,Pendiente,2024-08-14 12:00:00
3683.0,1551,Ana Sánchez,48,Camiseta Adidas,Moda,2023-07-01,5.0,1547.82,7739.1,PayPal,ES,Madrid,Cancelado,2023-07-01 23:00:00
3684.0,1996,Lucía Fernández,32,Zapatillas Nike,Moda,24/12/2023,2.0,$481.5,,PayPal,France,Barcelona,Cancelado,2023-12-24 03:00:00
3685.0,1676,PEDRO LÓPEZ,7,Sony Headphones,Tecnología,08-11-2023,3.0,1358.01,4074.03,Tarjeta,DE,Roma,Pendiente,2023-08-11 00:00:00
3686.0,1645,Carlos Ruiz,10,Aspiradora Dyson,Hogar,30/10/2023,5.0,1135.91,5679.55,Bizum,spain,Valencia,Entregado,2023-10-30 16:00:00
3687.0,1527,María García,6,Camiseta Adidas,Moda,01/01/2023,2.0,1859.0,3718.0,PayPal,Germany,Madrid,Entregado,2023-01-01 02:00:00
3688.0,1619,María García,106,Camiseta Adidas,Moda,02/04/2024,4.0,780.77,3123.08,Transferencia,France,Valencia,Pendiente,2024-04-02 13:00:00
3689.0,1247,Ana Sánchez,80,Sony Headphones,Tecnología,03-31-2024,3.0,141.67,425.01,Tarjeta,FR,Hamburgo,Entregado,2024-03-31 13:00:00
3690.0,1804,Pedro López,162,Monitor LG,hogar,08-13-2024,1.0,48.12,53.77092828508574,PayPal,España,Madrid,Cancelado,2024-08-13 10:00:00
3691.0,1006,Ana Sánchez,180,MacBook Pro,Tecnología,11/05/2023,5.0,1655.45,8277.25,Tarjeta,DE,Barcelona,Cancelado,2023-05-11 08:00:00
3692.0,1100,Lucía Fernández,174,Monitor LG,Tecnología,05-31-2024,3.0,1054.22,3162.66,PayPal,Italy,Roma,Pendiente,2024-05-31 08:00:00
3693.0,1240,Laura Torres,155,Silla Gaming,Hogar,2024-08-02,1.0,1552.74,1552.74,Tarjeta,FR,Madrid,Entregado,2024-08-02 19:00:00
3694.0,1337,CARLOS RUIZ,143,iPhone 13,Tecnología,2023-12-17,3.0,476.51,1429.53,PayPal,DE,Lyon,Entregado,2023-12-17 19:00:00
3695.0,1354,Lucía Fernández,15,Silla Gaming,Hogar,16/11/2023,3.0,696.72,2090.16,Tarjeta,Italy,Roma,Cancelado,2023-11-16 17:00:00
3696.0,1835,Pedro López,27,Camiseta Adidas,hogar,19/07/2024,4.0,69.91,279.64,Transferencia,DE,Roma,Cancelado,2024-07-19 22:00:00
3697.0,1479,Juan Pérez,89,Aspiradora Dyson,Hogar,09-18-2023,5.0,1923.37,9616.85,PayPal,España,Roma,Pendiente,2023-09-18 04:00:00
3698.0,1828,María García,4,iPhone 13,Tecnología,11-01-2023,5.0,$1339.06,,Bizum,ES,Valencia,Pendiente,2023-11-01 06:00:00
3699.0,1954,Lucía Fernández,96,Silla Gaming,Hogar,05/05/2024,1.0,"1867,08",0.0,Transferencia,Germany,Milán,Pendiente,2024-05-05 14:00:00
3700.0,1962,Juan Pérez,82,Cafetera Philips,Hogar,05-04-2024,3.0,538.34,1615.02,Transferencia,IT,Roma,Entregado,2024-05-04 00:00:00
3701.0,1049,David Gómez,2,MacBook Pro,Tecnología,30/09/2024,2.0,1226.81,2453.62,PayPal,Germany,Madrid,Pendiente,2024-09-30 15:00:00
3702.0,1659,PEDRO LÓPEZ,75,Bolso Gucci,Moda,18/08/2023,3.0,1360.21,4080.63,PayPal,France,Hamburgo,Pendiente,2023-08-18 23:00:00
3703.0,1924,María García,195,Monitor LG,Tecnología,11-05-2024,2.0,641.92,1283.84,Tarjeta,spain,Roma,Pendiente,2024-11-05 06:00:00
3704.0,1467,Juan Pérez,128,Zapatillas Nike,Moda,27/03/2024,1.0,1697.74,1697.74,Tarjeta,France,Barcelona,Pendiente,2024-03-27 08:00:00
3705.0,1674,Lucía Fernández,176,MacBook Pro,Tecnología,2023-08-26,5.0,1894.85,9474.25,Transferencia,DE,Paris,Cancelado,2023-08-26 20:00:00
3706.0,1523,laura torres,46,Reloj Casio,Accesorios,2023-08-27,4.0,1770.86,7083.44,PayPal,Italy,Madrid,Pendiente,2023-08-27 11:00:00
3707.0,1142,Laura Torres,52,Silla Gaming,Hogar,09-14-2023,4.0,1480.74,6294.323936747795,Bizum,spain,Roma,Pendiente,2023-09-14 17:00:00
3708.0,1326,Pedro López,27,Sony Headphones,Tecnología,13/02/2023,4.0,$562.15,,Bizum,spain,Paris,Entregado,2023-02-13 07:00:00
3709.0,1150,Juan Pérez,92,Silla Gaming,Hogar,27/10/2024,1.0,570.42,570.42,Bizum,France,Berlín,Cancelado,2024-10-27 02:00:00
3710.0,1153,maría garcía,109,Aspiradora Dyson,Hogar,2024-02-16,4.0,1927.09,7708.36,Bizum,IT,Berlín,Entregado,2024-02-16 15:00:00
3711.0,1564,Pedro López,87,Teclado Logitech,Tecnología,24/10/2024,5.0,30.47,152.35,Transferencia,España,Milán,Entregado,2024-10-24 23:00:00
3712.0,1730,Carlos Ruiz,103,Monitor LG,Tecnología,2023-11-30,4.0,1434.94,5739.76,Transferencia,DE,Berlín,Entregado,2023-11-30 23:00:00
3713.0,1826,Carlos Ruiz,178,Bolso Gucci,Moda,2024-08-11,4.0,1415.43,5661.72,Tarjeta,ES,Milán,Pendiente,2024-08-11 01:00:00
3714.0,1422,Juan Pérez,183,Reloj Casio,Accesorios,22/11/2024,4.0,$1249.15,,Tarjeta,FR,Roma,Cancelado,2024-11-22 11:00:00
3715.0,1563,juan pérez,104,Bolso Gucci,Moda,20/10/2023,1.0,1980.32,1980.32,Tarjeta,Italy,Berlín,Cancelado,2023-10-20 05:00:00
3716.0,1342,Carlos Ruiz,26,iPhone 13,Tecnología,09-08-2023,1.0,630.64,630.64,Transferencia,FR,Lyon,Pendiente,2023-09-08 10:00:00
3717.0,1051,pedro lópez,52,Camiseta Adidas,Moda,03-08-2023,5.0,686.54,3432.7,PayPal,Italy,Berlín,Entregado,2023-03-08 14:00:00
3718.0,1181,carlos ruiz,45,AirPods,Tecnología,22/02/2024,5.0,167.09,835.45,Bizum,France,Madrid,Cancelado,2024-02-22 17:00:00
3719.0,1359,ANA SÁNCHEZ,113,MacBook Pro,Tecnología,06-06-2024,3.0,$891.17,,Bizum,Germany,Milán,Pendiente,2024-06-06 10:00:00
3720.0,1886,Laura Torres,200,iPhone 13,Tecnología,21/05/2024,,529.49,,Tarjeta,FR,Berlín,Cancelado,2024-05-21 16:00:00
3721.0,1325,David Gómez,123,Monitor LG,Tecnología,18/12/2023,3.0,693.34,2080.02,Transferencia,ES,Berlín,Cancelado,2023-12-18 09:00:00
3722.0,1951,María García,88,Reloj Casio,Accesorios,2024-02-21,1.0,1670.8,1670.8,Bizum,ES,Madrid,Cancelado,2024-02-21 03:00:00
3723.0,1717,Laura Torres,97,Cafetera Philips,tech,04-05-2024,4.0,$1871.61,,PayPal,spain,Roma,Pendiente,2024-04-05 12:00:00
3724.0,1054,Juan Pérez,142,Silla Gaming,Hogar,12-05-2023,3.0,379.61,1145.212833914851,Tarjeta,France,Madrid,Entregado,2023-12-05 05:00:00
3725.0,1461,Laura Torres,23,Reloj Casio,Accesorios,10/03/2024,3.0,751.29,2253.87,Bizum,ES,Barcelona,Entregado,2024-03-10 12:00:00
3726.0,1788,Lucía Fernández,81,Reloj Casio,Accesorios,14/07/2023,1.0,$1857.97,,PayPal,ES,Milán,Pendiente,2023-07-14 00:00:00
3727.0,1383,Juan Pérez,32,iPhone 13,Tecnología,2024-09-09,5.0,"133,0",,Tarjeta,Germany,Roma,Entregado,2024-09-09 11:00:00
3728.0,1987,David Gómez,15,Silla Gaming,Hogar,07-22-2023,3.0,193.8,581.4,PayPal,France,Roma,Cancelado,2023-07-22 06:00:00
3729.0,1303,Pedro López,5,Aspiradora Dyson,Hogar,11-28-2024,3.0,333.95,1001.85,PayPal,DE,Madrid,Pendiente,2024-11-28 12:00:00
3730.0,1387,Carlos Ruiz,2,Aspiradora Dyson,Hogar,2024-06-21,4.0,$1194.47,,Transferencia,España,Milán,Entregado,2024-06-21 12:00:00
3731.0,1947,Ana Sánchez,110,Silla Gaming,Hogar,01-21-2024,1.0,309.44,309.44,Bizum,FR,Valencia,Entregado,2024-01-21 15:00:00
3732.0,1866,Pedro López,37,Zapatillas Nike,Moda,12/06/2024,3.0,1936.47,5809.41,Transferencia,IT,Berlín,Pendiente,2024-06-12 19:00:00
3733.0,1109,juan pérez,45,Cafetera Philips,Hogar,03-21-2024,1.0,898.96,898.96,Bizum,IT,Hamburgo,Cancelado,2024-03-21 13:00:00
3734.0,1145,Laura Torres,182,Bolso Gucci,Moda,2024-05-15,1.0,1008.02,1008.02,PayPal,IT,Milán,Entregado,2024-05-15 18:00:00
3735.0,1441,Juan Pérez,172,Camiseta Adidas,Moda,2024-03-18,5.0,500.85,2504.25,Transferencia,Germany,Milán,Entregado,2024-03-18 06:00:00
3736.0,1253,david gómez,150,MacBook Pro,Tecnología,07-26-2023,3.0,947.21,2841.63,PayPal,FR,Paris,Entregado,2023-07-26 12:00:00
3737.0,1971,Juan Pérez,36,iPhone 13,Tecnología,2023-08-19,1.0,1327.21,1327.21,Tarjeta,ES,Madrid,Entregado,2023-08-19 04:00:00
3738.0,1027,Lucía Fernández,142,Mochila North Face,Accesorios,12-18-2023,2.0,1504.84,3009.68,Transferencia,spain,Lyon,Pendiente,2023-12-18 21:00:00
3739.0,1732,Laura Torres,198,Monitor LG,Tecnología,11-05-2023,2.0,1510.2,3020.4,Transferencia,DE,Valencia,Cancelado,2023-11-05 01:00:00
3740.0,1980,Pedro López,132,AirPods,Tecnología,17/02/2023,2.0,1160.0,2320.0,Bizum,ES,Berlín,Entregado,2023-02-17 09:00:00
3741.0,1005,David Gómez,47,iPhone 13,Tecnología,13/04/2024,1.0,1809.68,1809.68,PayPal,ES,Hamburgo,Pendiente,2024-04-13 21:00:00
3742.0,1542,LAURA TORRES,181,Teclado Logitech,Tecnología,2024-11-06,1.0,1636.64,1636.64,Transferencia,ES,Berlín,Pendiente,2024-11-06 20:00:00
3743.0,1056,Carlos Ruiz,87,Sony Headphones,Tecnología,2023-01-06,1.0,1516.53,1516.53,PayPal,Germany,Hamburgo,Cancelado,2023-01-06 04:00:00
3744.0,1999,LUCÍA FERNÁNDEZ,67,Mochila North Face,Accesorios,11-26-2023,2.0,120.65,241.3,Tarjeta,FR,Milán,Pendiente,2023-11-26 19:00:00
3745.0,1916,Pedro López,44,MacBook Pro,Tecnología,11/11/2023,1.0,23.69,21.99273232893567,Tarjeta,Germany,Roma,Entregado,2023-11-11 20:00:00
3746.0,1182,Juan Pérez,198,iPhone 13,Tecnología,05/08/2023,3.0,432.77,1298.31,Tarjeta,España,Lyon,Cancelado,2023-08-05 17:00:00
3747.0,1944,Ana Sánchez,72,Aspiradora Dyson,hogar,2023-03-18,2.0,1330.41,2660.82,Tarjeta,IT,Lyon,Cancelado,2023-03-18 15:00:00
3748.0,1479,David Gómez,195,Aspiradora Dyson,tecnologia,02-01-2024,4.0,828.28,3313.12,PayPal,Italy,Barcelona,Cancelado,2024-02-01 11:00:00
3749.0,1810,Ana Sánchez,194,Sony Headphones,Tecnología,12-26-2023,5.0,$810.79,0.0,Transferencia,FR,Valencia,Pendiente,2023-12-26 15:00:00
3750.0,1826,David Gómez,1,Aspiradora Dyson,tech,2023-04-12,5.0,1770.33,8851.65,Tarjeta,IT,Lyon,Pendiente,2023-04-12 13:00:00
3751.0,1619,Ana Sánchez,136,Mochila North Face,Accesorios,09-02-2024,,1792.17,0.0,PayPal,España,Roma,Entregado,2024-09-02 19:00:00
3752.0,1257,Carlos Ruiz,65,Samsung Galaxy,Tecnología,03/12/2023,4.0,1819.26,7277.04,Bizum,Italy,Milán,Entregado,2023-12-03 00:00:00
3753.0,1519,Lucía Fernández,112,AirPods,Tecnología,01/11/2023,1.0,634.62,634.62,Bizum,France,Milán,Cancelado,2023-11-01 20:00:00
3754.0,1569,Carlos Ruiz,88,Sony Headphones,Tecnología,15/08/2023,5.0,1385.2,6926.0,Tarjeta,España,Hamburgo,Pendiente,2023-08-15 13:00:00
3755.0,1759,Ana Sánchez,63,MacBook Pro,Tecnología,06-20-2023,3.0,$550.55,,Tarjeta,FR,Roma,Pendiente,2023-06-20 07:00:00
3756.0,1925,Laura Torres,82,Silla Gaming,Hogar,04-23-2024,4.0,389.31,1557.24,Tarjeta,España,Barcelona,Cancelado,2024-04-23 17:00:00
3757.0,1870,David Gómez,57,Aspiradora Dyson,Hogar,02-15-2024,4.0,377.42,1509.68,Tarjeta,España,Roma,Cancelado,2024-02-15 14:00:00
3758.0,1113,Carlos Ruiz,84,Mochila North Face,Accesorios,22/12/2023,5.0,690.79,3453.95,Bizum,Germany,Roma,Cancelado,2023-12-22 12:00:00
3759.0,1555,Juan Pérez,69,Silla Gaming,tecnologia,13/02/2023,1.0,865.62,865.62,Bizum,Germany,Roma,Pendiente,2023-02-13 19:00:00
3760.0,1721,MARÍA GARCÍA,112,AirPods,Tecnología,04/05/2024,5.0,1663.59,8543.622322152392,Bizum,Germany,Paris,Entregado,2024-05-04 08:00:00
3761.0,1921,Lucía Fernández,31,Reloj Casio,Accesorios,05-26-2024,5.0,248.58,1242.9,Tarjeta,FR,Madrid,Pendiente,2024-05-26 12:00:00
3762.0,1199,Ana Sánchez,176,Bolso Gucci,Moda,25/03/2024,1.0,1472.5,1472.5,PayPal,DE,Barcelona,Pendiente,2024-03-25 11:00:00
3763.0,1620,carlos ruiz,130,Mochila North Face,Accesorios,05/09/2024,4.0,1067.6,4270.4,PayPal,FR,Hamburgo,Pendiente,2024-09-05 00:00:00
3764.0,1572,Laura Torres,145,Reloj Casio,Accesorios,02-18-2023,5.0,$583.01,,PayPal,FR,Barcelona,Pendiente,2023-02-18 04:00:00
3765.0,1307,Laura Torres,193,Reloj Casio,Accesorios,06/01/2024,2.0,990.71,1981.42,Transferencia,FR,Berlín,Pendiente,2024-01-06 08:00:00
3766.0,1689,Carlos Ruiz,52,Monitor LG,Tecnología,2023-01-26,2.0,606.88,1278.923910072302,PayPal,ES,Berlín,Pendiente,2023-01-26 13:00:00
3767.0,1543,Juan Pérez,42,Teclado Logitech,Tecnología,2023-07-05,3.0,1196.2,3588.6,Transferencia,FR,Paris,Pendiente,2023-07-05 23:00:00
3768.0,1311,Lucía Fernández,1,Aspiradora Dyson,Hogar,2023-12-27,5.0,873.35,4366.75,PayPal,France,Lyon,Pendiente,2023-12-27 22:00:00
3769.0,1177,David Gómez,76,Zapatillas Nike,Moda,09/01/2023,5.0,337.17,1685.85,Bizum,FR,Madrid,Cancelado,2023-01-09 10:00:00
3770.0,1868,Juan Pérez,44,Aspiradora Dyson,Hogar,20/06/2024,3.0,242.0,726.0,PayPal,Germany,Milán,Entregado,2024-06-20 23:00:00
3771.0,1317,Laura Torres,63,Monitor LG,Tecnología,09-28-2023,1.0,1097.92,1108.0501532259927,Bizum,ES,Valencia,Pendiente,2023-09-28 16:00:00
3772.0,1768,Ana Sánchez,124,Teclado Logitech,Tecnología,2024-02-13,5.0,1805.8,9029.0,Tarjeta,spain,Paris,Pendiente,2024-02-13 03:00:00
3773.0,1357,María García,59,Samsung Galaxy,Tecnología,2024-03-29,5.0,694.48,3472.4,Transferencia,Germany,Valencia,Entregado,2024-03-29 09:00:00
3774.0,1465,David Gómez,132,iPhone 13,Tecnología,2024-08-29,1.0,"1468,67",,Tarjeta,Italy,Valencia,Pendiente,2024-08-29 04:00:00
3775.0,1804,Pedro López,189,Teclado Logitech,Tecnología,2024-10-13,2.0,1320.74,2641.48,Transferencia,France,Hamburgo,Entregado,2024-10-13 00:00:00
3776.0,1216,CARLOS RUIZ,177,MacBook Pro,moda,30/01/2023,4.0,1863.79,7455.16,Bizum,IT,Barcelona,Pendiente,2023-01-30 05:00:00
3777.0,1624,Pedro López,160,Teclado Logitech,Tecnología,26/04/2024,2.0,1643.75,3287.5,Transferencia,ES,Barcelona,Pendiente,2024-04-26 10:00:00
3778.0,1129,María García,43,MacBook Pro,Tecnología,03/04/2024,4.0,1137.54,4550.16,PayPal,IT,Lyon,Pendiente,2024-04-03 09:00:00
3779.0,1293,Lucía Fernández,93,iPhone 13,Tecnología,2023-10-09,4.0,1317.49,5269.96,Transferencia,FR,Valencia,Pendiente,2023-10-09 12:00:00
3780.0,1717,carlos ruiz,2,Camiseta Adidas,Moda,06/04/2023,5.0,1797.79,9402.79346331833,Bizum,DE,Paris,Cancelado,2023-04-06 14:00:00
3781.0,1406,David Gómez,37,Teclado Logitech,Tecnología,01-15-2023,3.0,805.04,2723.4900815620526,Transferencia,DE,Berlín,Entregado,2023-01-15 15:00:00
3782.0,1764,maría garcía,28,Aspiradora Dyson,TECHNOLOGY,29/11/2023,3.0,660.32,1980.96,Tarjeta,FR,Berlín,Cancelado,2023-11-29 01:00:00
3783.0,1252,Pedro López,91,iPhone 13,Tecnología,2024-03-25,4.0,31.51,126.04,Bizum,FR,Berlín,Pendiente,2024-03-25 14:00:00
3784.0,1631,DAVID GÓMEZ,82,Reloj Casio,Accesorios,09-14-2024,2.0,1654.84,3822.330606816594,Bizum,FR,Barcelona,Entregado,2024-09-14 15:00:00
3785.0,1947,Lucía Fernández,192,Zapatillas Nike,Moda,11-10-2024,5.0,1603.95,8019.75,PayPal,España,Hamburgo,Pendiente,2024-11-10 17:00:00
3786.0,1672,María García,148,Silla Gaming,Hogar,09/11/2024,4.0,217.86,871.44,Bizum,spain,Milán,Pendiente,2024-11-09 01:00:00
3787.0,1572,Ana Sánchez,29,Monitor LG,Tecnología,2024-09-03,3.0,$1157.95,,Bizum,FR,Berlín,Pendiente,2024-09-03 04:00:00
3788.0,1405,Carlos Ruiz,16,AirPods,Tecnología,09-11-2023,5.0,933.32,4666.6,Bizum,Germany,Barcelona,Entregado,2023-09-11 08:00:00
3789.0,1760,David Gómez,75,Aspiradora Dyson,Hogar,2024-08-19,1.0,246.23,246.23,Bizum,ES,Lyon,Pendiente,2024-08-19 12:00:00
3790.0,1309,carlos ruiz,159,Zapatillas Nike,Moda,2023-11-30,1.0,1961.33,1961.33,PayPal,FR,Barcelona,Entregado,2023-11-30 00:00:00
3791.0,1097,Juan Pérez,74,Reloj Casio,Accesorios,10-15-2023,2.0,437.24,874.48,Bizum,IT,Milán,Pendiente,2023-10-15 18:00:00
3792.0,1781,Carlos Ruiz,160,Sony Headphones,Tecnología,2024-11-22,4.0,143.8,575.2,Bizum,FR,Barcelona,Cancelado,2024-11-22 07:00:00
3793.0,1502,Carlos Ruiz,89,Zapatillas Nike,Moda,2023-04-24,2.0,1193.75,2387.5,PayPal,España,Lyon,Entregado,2023-04-24 07:00:00
